user_input,retrieved_contexts,response,reference,context_precision,context_recall,faithfulness,answer_relevancy
What is the swath width of the Sentinel-2 SAR instrument?,"['Document: S2 Mission\nSection: S2 Mission > Overview of Sentinel-2 Mission\nContent:\nSentinel-2 is a European wide-swath, high-resolution, multi-spectral imaging mission. The full mission specification of the twin satellites flying in the same orbit but phased at 180°, is designed to give a high revisit frequency of 5 days at the Equator.\nEach of the satellites in the Sentinel-2 mission carries a single payload: the optical [Multi-Spectral Instrument](https://sentiwiki.copernicus.eu/web/s2-mission#S2-Mission-MSI-Instrument) (MSI) that samples 13 spectral bands: four bands at 10 m, six bands at 20 m and three bands at 60 m spatial resolution. The orbital swath width is 290 km.\n\n**Figure 1: The Twin-Satellite Sentinel-2 Orbital Configuration [Credits: Astrium GmbH]**\nThe Sentinel-2 twin satellites carry on the legacy of [SPOT](https://earth.esa.int/eogateway/missions/spot) and [LANDSAT](https://landsat.gsfc.nasa.gov/) by continuing to provide similar types of image data and contributing to ongoing multispectral observations. These satellites are used to support a variety of services and applications offered by [Copernicus](https://www.copernicus.eu/en), including land management, agriculture, forestry, disaster control, humanitarian relief operations, risk mapping, and security concerns.', 'Document: S2 Mission\nSection: S2 Mission > Acquisition Resolutions\nContent:\nThe resolutions of the Sentinel-2 Mission and its payload MSI instrument are:\n1. The **temporal resolution** of a satellite in orbit is the revisit frequency of the satellite to a...\n2. The **spatial resolution** of an instrument is the _at-ground_ representation of an individual...\n3. The [**spectral resolution**](https://sentiwiki.copernicus...\n4. The **radiometric resolution** of an instrument is a determination of the incremental level of...\n5. The **swath width** of Sentinel-2 is 290 km. In comparison, the swath width of Landsat 5 TM and...', ""Document: S2 Mission\nSection: S2 Mission > MSI Instrument\nContent:\n**Figure 9: VNIR Flight Focal Plane [Credits: Astrium SAS (France) and e2v Technologies (UK)]**\nThe design of the MSI on-board Sentinel-2 has been driven by the requirement for large swath high geometrical and spectral performance of the measurements.\nThe MSI measures the Earth's reflected radiance in 13 spectral bands from VNIR to SWIR (**Table 2**). All the details about the measured spectral responses for each band are given in the [Sentinel-2 Spectral Response Functions (S2-SRF)](https://sentiwiki.copernicus.eu/__attachments/1692737/COPE-GSEG-EOPG-TN-15-0007%20-%20Sentinel-2%20Spectral%20Response%20Functions%202024%20-%204.0.xlsx?inst-v=0b38ac37-4dd6-44ba-865b-d9854aa106d8) document.\nMore in details, the MSI consists of the following components:\n* A Three-Mirror Anastigmat (TMA) telescope with a pupil diameter equivalent to 150 mm, isostatically mounted on the platform to minimise thermo-elastic distortions. The optical design has been optimised to achieve state-of-the-art imaging quality across its very wide field of view. Its 290 km swath width is a larger swath than previous multi-spectral optical missions such as SPOT and LANDSAT. The telescope structure and the mirrors are made of silicon carbide, which provides a very high optical stability to mass ratio and minimises thermal deformation.\n* Two focal planes based on:\n* monolithic Complementary Metal Oxide Semiconductor (CMOS) detectors for VNIR\n* mercury-cadmium-telluride (MCT) detectors hybridised on a CMOS read-out circuit for SWIR (the SWIR focal plane is passively thermo-controlled at temperatures below 195 K).\n* A dichroic VNIR/SWIR beam splitter. Spectral separation in the various bands is provided by stripe filters mounted on top of the detectors.\n* Two distinct arrays of 12 detectors mounted on each focal plane covering VNIR and SWIR channels respectively. The 12 detectors on each focal plane are in a staggered configuration to cover the entire field of view."", 'Document: S2 Applications\nSection: S2 Applications > Overview of Sentinel-2 Applications\nContent:\n[Sentinel-2](https://sentiwiki.copernicus.eu/web/sentinel-2) is a European mission equipped with a wide-swath Multispectral Instrument (MSI) to ensure a high-revisit frequency and provide high-resolution imagery to support the Copernicus programme.\nSentinel-2 data products are made available systematically and free of charge to all users, providing data for the following priority service areas.\nTo start using the data visit [CDSE browser ](https://browser.dataspace.copernicus.eu/?zoom=5&lat=50.16282&lng=20.78613&themeId=DEFAULT-THEME&visualizationUrl=U2FsdGVkX1%2B4%2BV%2FOaiXMG%2FrmYxraCDY%2F...', 'Document: S2 Products\nSection: S2 Products > MSI Products Overview\nContent:\nThe continuous acquisition of Sentinel-2 image data in a given MSI mode is called a ""datatake"". The maximum length of an imaging datatake is 15,000 km (e.g. continuous observation from northern Russia to southern Africa). All products contain granules/tiles from a single datatake. A datatake is presented inside a product as a set of one or more datastrips (corresponding to acquisition segments downlinked to different ground stations, please see **Figure 1** below).\n\n**Figure 1: Sentinel-2 Datatake split in three Datastrips. [Credits: Exprivia]**\nThe products are elementary granules of fixed size, within a single orbit. A granule is the minimum indivisible partition of a product (containing all possible spectral bands).\nFor Level-1B granules are small images in sensor geometry sensed by each of the twelve MSI detectors and are 23 km x 25 Km large.\nFor Level-1C and Level-2A, the granules, also called tiles, are 110 km x 110 km ortho-images projected onto the Universal Transversal Mercator (UTM) spatial reference system, which divides Earth into 60 longitudinal zones. Each UTM zone has a vertical width of 6° of longitude and horizontal width of 8° of latitude (see **Figure 2**). Earth is subdivided on a predefined set of tiles, defined in UTM/WGS84 projection and using a 100 km step. However, each tile has a surface of 110 km x 110 km in order to provide large overlap with the neighbouring.\n\n**Figure 2: Level-1C product tiling**\nTiles can be fully or partially covered by image data. Partially covered tiles correspond to those at the edge or top/bottom of the Datastrip.\nDownload is available here: [Sentinel-2 tiling grid kml](https://sentiwiki.copernicus.eu/__attachments/1692737/S2A_OPER_GIP_TILPAR_MPC__20151209T095117_V20150622T000000_21000101T000000_B00.zip?inst-v=0b38ac37-4dd6-44ba-865b-d9854aa106d8).', ""Document: S2 Mission\nSection: S2 Mission > Overview of Sentinel-2 Mission > Geographical Coverage\nContent:\n![](https://sentiwiki.copernicus.eu/__attachments/1687033/figure-6...\n**Figure 6: Number of acquisitions for Sentinel-2A/B/C MSI in 20 days period**\nDuring the [Sentinel-2A extension campaign](https://sentinels.copernicus.eu/web/sentinel/-/sentinel-2a-extended-campaign-starting-march-13-2025), Sentinel-2A is located 36° away from Sentinel-2B, ensuring that Sentinel-2A and Sentinel-2B are acquiring neighbouring relative orbits, with a 10 min time difference, generating a 'virtual' extended swath (**Figure 7**).\n![](https://sentiwiki.copernicus.eu/__attachments/1687033/image-20250425-102415...\n**Figure 7: The generated pseudo ‘extended’ swath acquisition (A and B with a 10 min acquisition gap)**\nPlease refer to the [Sentinel-2 descending orbits](https://sentiwiki.copernicus.eu/__attachments/1673423/Sentinel-2%20Descending%20Orbits%20shape%20file.zip?inst-v=0b38ac37-4dd6-44ba-865b-d9854aa106d8)."", 'Document: S2 Mission\nSection: S2 Mission > Acquisition Resolutions > Spectral Resolution\nContent:\nSpectral resolution is defined as a measure of the ability of the instrument to distinguish features in the electromagnetic spectrum.\nThe 13 spectral bands of Sentinel-2 range from the Visible and Near Infra-Red (VNIR) to the Short-Wave Infra-Red (SWIR):\n* 4 x 10 metre Bands: the three classical RGB bands (Blue (~493nm), Green (560nm), and Red (~665nm)) and a Near Infra-Red (~833nm) band;\n* 6 x 20 metre Bands: 4 narrow Bands in the VNIR vegetation red edge spectral domain (~704nm,~740nm, ~783nm and ~865nm) and 2 wider SWIR bands (~1610nm and ~2190nm) for applications such as snow/ice/cloud detection, or vegetation moisture stress assessment;\n* 3 x 60 metre Bands mainly focused on cloud screening and atmospheric correction (~443nm for aerosols and ~945nm for water vapour) and cirrus detection (~1374nm).  \n**NOTE:** The Bandwidth (nm) in the Tables below is the values measured at Full Width Half Maximum (FWHM). The equivalent wavelength is the barycentre of the spectral response function, not considering the solar irradiance:', 'Document: S2 Mission\nSection: S2 Mission > Overview of Sentinel-2 Mission > Geographical Coverage\nContent:\nThe Sentinel-2 mission will provide systematic coverage over the following areas:\n* all continental land surfaces (including inland waters) between latitudes 56° South and 82.8° North\n* all coastal waters up to 20 km from the shore\n* all islands greater than 100 km2\n* all EU islands\n* the Mediterranean Sea\n* all closed seas (e.g. Caspian Sea).  \nIn addition, the Sentinel-2 observation scenario includes observations following member states or Copernicus Services requests (e.g. Antarctica, Baffin Bay).\n**Figures 4** illustrates the coverage foreseen for the baseline scenario of MSI acquisitions (two satellites in orbit).\n![Revisit scenario ](https://sentiwiki.copernicus.eu/__attachments/1687033/Revisit%20scenario%202025...\n**Figure 4: Coverage and revisit time for the baseline scenario of Sentinel-2 MSI acquisitions.**\nIn addition, the [Sentinel-2 extension campaign](https://sentinels.copernicus.eu/web/sentinel/-/sentinel-2a-extended-campaign-starting-march-13-2025) complements the nominal constellation operations, enhancing the revisit frequency over Europe and tropical regions of Africa and South America, frequently impacted by high cloud cover (**Figure 5**).\n![](https://sentiwiki.copernicus.eu/__attachments/1687033/figure-5...\n**Figure 5: Number of revisits for Sentinel-2A/B/C MSI in 20 days period**\nWith nominal two-satellites (Sentinel-2B/2C) operations configuration, all regular areas, indicated in green in **Figure 4** , will be revisited every five days under the same viewing conditions (i.e. viewing angles). The [Sentinel-2A extension campaign](https://sentinels.copernicus.eu/web/sentinel/-/sentinel-2a-extended-campaign-starting-march-13-2025) brings an improved revisit frequency for some areas. However, due to overlap between swaths from adjacent orbits, the revisit frequency is increased with different viewing conditions, as shown in **Figure 6**.\n![](https://sentiwiki.copernicus.eu/__attachments/1687033/figure-6...', 'Document: S2 Mission\nSection: S2 Mission > Overview of Sentinel-2 Mission > Satellite Description\nContent:\nThe two Sentinel-2 satellites in the nominal configuration operate simultaneously, phased at 180° to each other, in a sun-synchronous orbit at a mean altitude of 786 km. During the extension campaign, Sentinel-2A is located 36° away from Sentinel-2B. The position of each Sentinel-2 satellite in its orbit is measured by a dual-frequency Global Navigation Satellite System (GNSS) receiver. Orbital accuracy is maintained by a dedicated propulsion system.\nThe satellite lifespan is 7.25 years, which includes a 3 month in-orbit commissioning phase. Batteries and propellants have...\nThe Sentinel-2 satellite system was developed by an industrial consortium led by Astrium GmbH (Germany). Astrium SAS (France) is responsible for the MultiSpectral Instrument (MSI).\nThe [MSI](https://sentiwiki.copernicus.eu/web/s2-mission#S2-Mission-MSI-Instrument) works passively, by collecting sunlight reflected from the Earth. New data is acquired by the instrument as the satellite moves along its orbital path. The incoming light beam is split via a beam-splitter and focused onto two separate focal plane assemblies within the instrument; one for Visible and Near-Infra-Red (VNIR) bands and the other one for Short Wave Infra-Red (SWIR) bands. The spectral separation of each band into individual wavelengths is accomplished by stripe filters mounted on top of the detectors.', 'Document: S2 Processing\nSection: S2 Processing > L1B Algorithms > Geometric processing > Viewing model refining\nContent:\n**Figure 5: Overview of Sentinel-2 GRI images**\nProducts over Svalbard, isolated islands at high latitude and Antarctica are not covered by the GRI so are not refined. Moreover, several orbits covering Greenland and Northern Canada (Nunavut and Yukon territories) could not be completed. Please also note that orbit R109 is empty because it is almost totally located over sea.\nTo meet the last condition ensuring a high correlation between the compared images (similar geometry), resampling the two segments in a common virtual geometry is needed, because of Sentinel-2 specificities: the images are split in 12 detectors and the pointing precision is at worst 2 kms.\nThis viewing model of the common virtual geometry is computed by:\n* constructing an average regular datation model over the segment to refine\n* selecting the attitude and orbital data of the segment to refine\n* and by computing regular viewing directions, as if it were a push-broom sensor, composed of one single detector, covering the whole Sentinel-2 swath  \nThe two images are then resampled, using the resampling grids, an interpolation filter and the definition of interest area for each detector, as illustrated in **Figure 6.** Then the correlation is performed between two monolithic images composed of one single detector....']","The provided context does not contain any information about a Sentinel-2 SAR instrument. All the details given are about the Sentinel-2 optical Multispectral Instrument (MSI), which has a swath width of 290 km.

The context states:

""Each of the satellites in the Sentinel-2 mission carries a single payload: the optical [Multi-Spectral Instrument](https://sentiwiki.copernicus.eu/web/s2-mission#S2-Mission-MSI-Instrument) (MSI) that samples 13 spectral bands: four bands at 10 m, six bands at 20 m and three bands at 60 m spatial resolution. The orbital swath width is 290 km.""

There is no mention of a SAR instrument on Sentinel-2 in the provided documentation. The Sentinel-2 mission is equipped solely with the optical MSI payload, not a SAR instrument.

Therefore, based on the available context, I cannot provide any information about the swath width of a Sentinel-2 SAR instrument, as the Sentinel-2 satellites do not carry a SAR instrument.",Sentinel-2 does not carry a SAR instrument; it is an optical mission (MSI). Sentinel-1 is the SAR mission.,0.7986111110911459,1.0,1.0,0.0
Can Sentinel-1 detect vegetation health using the Red Edge band?,"['Document: S1 Applications\nSection: S1 Applications > Land Monitoring > Forestry\nContent:\nSentinel-1 can play an important role in sustainable forest management with clear-cut and partial-cut detection, forest type classification, biomass estimation and disturbance detection. For climate change, mapping of forest fire scars can be an important part of mapping the carbon history of a forest and plays a critical role in the estimation of carbon emissions. Land cover maps can be used to support forest management and the monitoring of illegal timber harvesting worldwide.\nFor this application the most suitable product is the Interferometric Wide with dual polarisation. In fact, the cross -polarisation VH is more sensitive to change in vegetation density and structure while the polarisation ratio VH/VV is an important index for vegetation phenology or water content (European Wide Forest Classification Based on Sentinel-1 Data).\n\n**Figure 1: Deforestation detection map over Laos, Cambodia and Vietnam from 2018 to 2020. Credits:** [EO Science for Society - ESA** _]_**', 'Document: S1 Applications\nSection: S1 Applications > Land Monitoring > Agriculture\nContent:\nMonitoring of crop conditions, soil properties and mapping tillage activities, help to assess land use, predict harvests, monitor seasonal changes and assist in implementing policy for sustainable development. Sentinel-1 can also be used for monitoring the changes of agricultural production and productivity of pastures caused by drought and monitoring the decline of land productivity and soil degradation due to excessive cultivation and pasturage and improper irrigation.\nAgricultural maps enable provision of independent and objective estimates of the extent of cultivation in a given country or growing season, which can be used to support efforts to ensure food security in vulnerable areas.\nBoth SLC and GRD products can be used for crop monitoring, depending on the parameter of interest. Typically, if the SAR intensity is preferred, then the GRD is the only product needed. However, if more information are necessary, polarimetric parameters are requested so SLC product should be selected.\nFor both product types, double polarisation shall be selected as cross-polarised VH backscatter is highly sensitive to changes in vegetation densities and structure and polarisation ratio VH/VV is sensitive to vegetation phenology or water content.\n\n**Figure 2: Monitoring of expansion of rubber plantation with Sentinel-2 / Sentinel-1. Contains modified Copernicus data [2015-2017], processed by SIRS.**\n\n**Figure 3: Land cover view, North East of Guyana, 2017. The image was acquired in IW mode, GRD level, VH poalrisation.[Credits:**[Mundialis | Ecosystem...\n\n**Figure 4: Rice fields in Mekong Delta, Vietnam (2020). Multi-temporal image combining three radar acquisitions taken around one month apart to show changes in crop and land conditions over time. [Credits: ESA**[Rice fields, Vietnam](https://www.esa.int/ESA_Multimedia/Images/2020/03/Rice_fields_Vietnam)**]**', 'Document: S1 Mission\nSection: S1 Mission > The Sentinel-1 mission is the European Radar Observatory for the Copernicus joint initiative of the European Commission (EC) and the European Space Agency (ESA). Copernicus is a European initiative for the implementation of information services dealing with environment and security. It is based on observation data received from Earth Observation satellites and ground-based information.\nContent:\nThe Sentinel-1 mission comprises a constellation of two sun-synchronous polar-orbiting satellites, sharing the same orbital plane with 180° orbital phasing difference, operating day and night performing C-band synthetic aperture radar imaging, enabling them to acquire imagery regardless of the weather. It operates in four exclusive imaging modes with different resolution (down to 5 m) and coverage (up to 400 km). It provides dual polarisation capability, very short revisit times and rapid product delivery. For each observation, precise measurements of spacecraft position and attitude are available.\nSentinel-1 works in a pre-programmed operation mode to avoid conflicts and to produce a consistent long-term data archive built for applications based on long time series.\nSentinel-1 is the first of the five missions that ESA developed for the Copernicus initiative. Its measurement domain covers landscape topography, multi-purpose imagery (land), multi-purpose imagery (ocean), ocean surface winds, ocean topography/currents, ocean wave height and spectrum, sea ice cover, edge and thickness, snow cover, edge and depth, soil moisture and vegetation.\nSentinel-1 main [**Mission Objectives and Applications**](https://sentiwiki.copernicus.eu/web/s1-applications) are:  \n**Media 1: Sentinel-1 Radar Mission [Credits: ESA]**\nFor mission planning information, see the [Observation and Production Scenario](https://sentiwiki.copernicus.eu/web/s1-mission#S1-Mission-Observation-and-Production-Scenarios).\n**Launch timeline**\nSentinel-1A was launched on 3 April 2014.\nSentinel-1B was launched on 25 April 2016. The spacecraft experienced an anomaly related to the...\nSentinel-1C was launched on 5 December 2024. Sentinel-1D launch was launched on 4 November 2025.', 'Document: S1 Applications\nSection: S1 Applications > Sentinel-1 delivers radar imagery for numerous applications. SAR images are the best way of tracking land subsidence and structural damage: systematic observations and enhanced interferometric capabilities make ground movement barely noticeable in everyday life detectable and closely monitorable. As well as being a valuable resource for urban planners, this kind of information is essential for monitoring shifts from earthquakes, landslides and volcanic uplift. Moreover it helps geohazard monitoring, mining, geology and city planning through subsidence risk assessment.\nContent:\nThe mission’s dual polarimetric products benefit users interested in agriculture, forestry and land cover classification.\nThe SAR ability to provide observation in all weather, and in day or night time conditions, makes it ideal for maritime and Arctic monitoring. Images acquired over the ocean are essential for generating timely maps of sea ice for safe passage, for detecting and tracking oil spills and offer key information on wind and waves in the open sea for shipping and wave-energy applications.\nFinally, Sentinel-1 is designed specifically to provide images for rapid response to disasters such as floods and earthquakes.\nThrough the products provided, security users can monitor major shipping routes to detect illegal activities, gather prosecution evidence in case of illegal discharges, detect unexpected building in remote areas, monitor deforestation and support search and rescue activities.\nThe mission’s main characteristics such as short revisit time and rapid data dissemination benefit emergency response users, such as the United Nations [The International Charter Space and Major Disasters](http://www.disasterscharter.org/), in emergency situations such as floods, earthquakes, volcanic eruptions and landslides.\nEach application can be better served by specific acquisition modes and product types as shown in the table below. The Interferometric Wide swath mode is the primary operation mode for most applications over land. Description of each product type and format is available: [Products](https://sentiwiki.copernicus.eu/web/s1-products).\nRefer to the [High-Level Operation Plan](https://sentiwiki.copernicus.eu/__attachments/1673407/COPE-S1OP-EOPG-PL-15-0020%20-%20Sentinel%20HLOP%202021%20-%203.1.pdf?inst-v=0b38ac37-4dd6-44ba-865b-d9854aa106d8) (HLOP) for a description of the acquisition...\n_Table 1: Mapping of most common mode and application type used based on the processing baseline_\n**Applications** | **Acquisition Mode** | **Product Type**\n---|---|---', ""Document: S1 Applications\nSection: S1 Applications > Emergency Management > Flood Monitoring\nContent:\nOver 75% of natural disasters that occur worldwide involve flooding. SAR's inherent capability to observe during cloud cover and Sentinel-1's frequent revisits makes it ideal for flood monitoring. It can be used to assess the extent of flooded areas and the impact on human, economic and environmental loss. Furthermore, high-resolution digital elevation models (DEMs) generated through Sentinel-1's interferometric modes can be used to conduct run-off and inundation analysis in areas previously lacking elevation data.\nCalm open water surfaces appear flat when being hit by C-band SAR radiation, and the radiation is scattered away from the satellite’s sensor. Consequently, the received energy (measured as backscatter) is low and shows high contrast to general land surfaces. Generally, the underlying principle of the SAR-based flood mapping methods is to identify low backscatter measurements where land is expected under normal conditions. Two SAR polarisations (VV and VH) are required to allow a detection of flooded vegetation.\n\n**Figure 20: Mapping of flooded areas in Bangladesh in 2016 from semi-automatic classification of Sentinel-1 data. Map generated as part of the**[Copernicus Emergency Management Service](http://emergency.copernicus.eu/) **[Credits: EMS/SIRS]**\n\n**Figure 21: Data captured from space on 30 August 2022 was used to map the extent of flooding propagating in Pakistan from August 10 to September 23, 2022. Credits: ESA**[Pakistan inundated**]**\n\n**Figure 22: Animation of flood devastating Bangladesh acquired on 4 May, 16 May, 28 May, 9 June and 21 June 2022. Ref: ESA**[Copernicus Sentinel-1 maps Bangladesh flood**]**"", 'Document: S1 Applications\nSection: S1 Applications > Sentinel-1 delivers radar imagery for numerous applications. SAR images are the best way of tracking land subsidence and structural damage: systematic observations and enhanced interferometric capabilities make ground movement barely noticeable in everyday life detectable and closely monitorable. As well as being a valuable resource for urban planners, this kind of information is essential for monitoring shifts from earthquakes, landslides and volcanic uplift. Moreover it helps geohazard monitoring, mining, geology and city planning through subsidence risk assessment.\nContent:\n_Table 1: Mapping of most common mode and application type used based on the processing baseline_\n**Applications** | **Acquisition Mode** | **Product Type**\n---|---|---\n**SM** | **IW** | **EW** | **WV** | **SLC** | **GRD** | **OCN**\n| **SH** | **SV** | **DH** | **DV** | **SH** | **SV** | **DH** | **DV** | **SH** | **SV** | **DH** | **DV** | **SH** | **SV**\n**Arctic Environment and Sea-Ice Zones Monitoring** |  |  |  |  | ✔️ |  | ✔️ |  | ✔️ |  | ✔️ |  |  |  | ✔️ | ✔️ |\n**Open Ocean Ship Surveillance** | ✔️ |  |  |  |  |  | ✔️ | ✔️ |  |  | ✔️ | ✔️ |  |  |  | ✔️ |\n**Oil Pollution Monitoring** |  |  |  |  |  |  | ✔️ | ✔️ |  |  | ✔️ | ✔️ |  |  |  | ✔️ |\n**Marine winds** |  |  |  |  | ✔️ | ✔️ |  |  | ✔️ | ✔️ |  |  |  | ✔️ |  | ✔️ | ✔️\n**Forestry** |  |  | ✔️ | ✔️ |  |  | ✔️ | ✔️ |  |  |  |  |  |  | ✔️ | ✔️ |\n**Agriculture** |  |  | ✔️ | ✔️ |  |  | ✔️ | ✔️ |  |  |  |  |  |  | ✔️ | ✔️ |\n**Urban deformation mapping** |  | ✔️ | ✔️ | ✔️ |  |  |  |  |  |  |  |  |  |  | ✔️ | ✔️ |\n**Flood monitoring** | ✔️ |  |  |  |  | ✔️ | ✔️ | ✔️ |  |  |  |  |  |  | ✔️ | ✔️ |\n**Earthquake analysis** | ✔️ |  |  | ✔️ |  |  |  |  |  |  |  |  |  |  | ✔️ |  |\n**Landslide and volcano monitoring** |  | ✔️ | ✔️ | ✔️ |  | ✔️ | ✔️ | ✔️ |  |  |  |  |  |  | ✔️ |  |\n_Note: for a number of small volcanic islands worldwide, from May 2015 onwards, the Stripmap mode (SM) is used for the regular coverage. This is implemented in the case a SM swath fully covers the island in one pass, and no maritime surveillance activities take place around the island. The SM mode features (at a comparable system resource consumption) a smaller swath w.r.t the IW mode (in the order of 80 km vs 250 km) but ensures a higher spatial resolution, of particular interest for volcano monitoring._', 'Document: S1 Applications\nSection: S1 Applications > Sentinel-1 delivers radar imagery for numerous applications. SAR images are the best way of tracking land subsidence and structural damage: systematic observations and enhanced interferometric capabilities make ground movement barely noticeable in everyday life detectable and closely monitorable. As well as being a valuable resource for urban planners, this kind of information is essential for monitoring shifts from earthquakes, landslides and volcanic uplift. Moreover it helps geohazard monitoring, mining, geology and city planning through subsidence risk assessment.\nContent:\nTo start using the data visit [CDSE browser ](https://browser.dataspace.copernicus.eu/?zoom=5&lat=50.16282&lng=20.78613&themeId=DEFAULT-THEME&visualizationUrl=U2FsdGVkX18q4LSvU%2Fo1%2FQ3Ki07yzwkfXSn2SQ...\nThe user is addressed to the page [Sentinels Toolboxes](https://sentiwiki.copernicus.eu/web/sentinels-toolboxes#Sentinel-1-Toolbox) to verify the available processing tools for the Sentinel 1 mission.', ""Document: S1 Mission\nSection: S1 Mission > SAR Instrument > Geophysical Measurements\nContent:\nCopernicus Sentinel-1's C-band SAR active sensor can observe the Earth's surface at any time of the day or night, regardless of weather and environmental conditions. SAR has the advantage of operating at wavelengths not impeded by cloud cover or lack of illumination.\nUnlike passive optical sensors that require the sun's illumination, an active SAR instrument transmits its own microwave signal to illuminate the Earth's surface at an angle. SAR actively transmits microwave signals towards the Earth and receives a portion of transmitted energy as backscatter from the ground. The returned backscatter echo of the scene is received by the instrument's antenna a short time later at a slightly different location, as the satellite travels along its orbit. The brightness amplitude of the returned signal, along with its phase information, is recorded to construct an image of the scene.\nThe SAR instrument provides radar backscatter measurements influenced by the terrain structure and surface roughness. Generally, the more roughness or structure on the ground, the greater the backscatter. Rough surfaces will scatter the energy and return a significant amount back to the antenna resulting in a bright feature. Flat surfaces reflect the signal away resulting in a dark feature. Likewise, more structurally complex targets such as forests will appear brighter as signal interaction with the leaves, branches and trunks will result in a higher proportion of the signal being transmitted back to the sensor.\nThe dielectric constant of the materials on the ground also play a factor in the measurements. In the microwave region of the spectrum, most natural materials have a dielectric constant in the range of 3 to 8 when dry, whereas water has a dielectric constant of approximately 80. The dielectric constant indicates the reflectivity and conductivity of materials. Therefore, the..."", 'Document: S1 Mission\nSection: S1 Mission > SAR Instrument > Polarimetry\nContent:\nCopernicus Sentinel-1 can collect several different images from the same series of pulses by using its antenna to receive specific polarisations simultaneously. Copernicus Sentinel-1 is a phase-preserving dual polarisation SAR system. It can transmit a signal in either horizontal (H) or vertical (V) polarisation, and then receive in both H and V polarisations. Dual polarisation Level-1 Single Look Complex (SLC) products contain complex values. In addition to the backscatter intensity that can be measured from each single polarisation, the inter-channel phase information allows to perform enhanced analysis of backscattering properties.\nTargets on the ground have distinctive polarisation signatures reflecting different polarisations with different intensities and converting one polarisation into another. For example, volume scatterers (e.g. forest canopy) have different polarisation properties than surface scatterers (e.g. sea surface). Polarimetric techniques such as polarimetric target decomposition (eigenvector-based, model-based, ...) allow the separation of different scattering contributions and can be used to extract information about the scattering process. Dedicated dual-Pol SAR classification techniques allow improved classification of point targets and distributed target areas.\nThe following RADARSAT-2 image of Flevoland in the Netherlands shows the difference in intensities from VH (left) and VV (centre). The composite RGB (colour) image on the right was created using the VV channel for red, VH channel for green and the ratio |VV| / |VH| for blue.\n\n**Figure 8: Intensities from different polarimetric channels [Credits: MDA and CSA]**', 'Document: S1 Products\nSection: S1 Products > Related Production > **Sentinel-1 Global Backscatter Model (S1GBM)**\nContent:\n**Figure 15: Mapping Earth\'s land surface with C-band Synthetic Aperture Radar (SAR)**\n**Description**\nThe Sentinel-1 Global Backscatter Model (S1GBM) describes the C-band radar cross section of the Earth\'s land surface for the period between 2016 and 2017, generated from 460,000 Copernicus Sentinel-1 IW GRDH (Ground-Range Detected High Resolution) backscatter measurements normalised to the reference incidence angle of 38°. This release of the S1GBM comprises two global mosaics describing the temporal mean of sigma nought backscatter s0(38, t) in VV- and VH-polarisation respectively.\nThe S1GBM supports the testing, design, and verification of upcoming radar sensors, related SAR-processor performance simulations, raw data compression optimisation, and visualisation purposes. It also presents a valuable environmental record for investigating the C-band VV/VH backscatter response over different land covers, and documenting the state of the land surface in 2016 and 2017.\n**Data Set Specifications**\nThe S1GBM VV and VH mosaics are georeferenced to the Equi7Grid and divided into six continental zones (Africa, Asia, Europe, North America, Oceania, South America), which are further divided into square tiles of 100 km extent (""T1""-tiles). The dataset is organised in 12 collections, one for each of the 6 continents and the 2 polarisations. In addition to the original data images, downsampled quicklook-files of same geographic extent are available for all tiles, allowing for a convenient preview of the data. With this setup, the S1GBM consists of 16,071 tiles over 6 continents, for VV and VH each, totalling to a data volume of 2.67 TB.\nThe tiles\' file-format is a LZW-compressed GeoTIFF holding 16-bit integer values, with tagged metadata on encoding and georeference. Compatibility with common geographic information systems, such as QGIS or ArcGIS, and geodata libraries, such as GDAL, is given.']","Based on the information provided in the context, Sentinel-1 does not have the capability to detect vegetation health using a Red Edge band.

The key points are:

1. Sentinel-1 is a Synthetic Aperture Radar (SAR) mission that operates in the C-band microwave spectrum. It does not have any optical/multispectral imaging capabilities.

2. The documentation does not mention Sentinel-1 having a Red Edge band, which is a key spectral band used for monitoring vegetation health and chlorophyll content. Red Edge bands are typically found on optical/multispectral sensors like Sentinel-2.

3. The applications of Sentinel-1 discussed in the context focus on using SAR backscatter and polarimetric information for applications like forestry, agriculture, and land cover classification. There is no indication that Sentinel-1 can directly measure vegetation health parameters like the Red Edge.

4. The context states that the cross-polarization VH backscatter and the VH/VV polarization ratio are more sensitive to vegetation structure and water content, but these are not the same as a dedicated Red Edge band.

In summary, Sentinel-1 does not have the capability to detect vegetation health using a Red Edge band, as it is a SAR mission without any optical/multispectral imaging sensors. The vegetation-related applications of Sentinel-1 rely on the analysis of SAR backscatter and polarimetric properties, rather than spectral information from Red Edge or other optical bands.",No. Sentinel-1 is a Radar (SAR) satellite. Vegetation health via Red Edge bands is monitored by the Optical satellite Sentinel-2.,0.62499999996875,0.0,1.0,0.9920103221639819
Does Sentinel-2 carry a Thermal Infrared (TIR) sensor?,"[""Document: S2 Mission\nSection: S2 Mission > MSI Instrument\nContent:\n**Figure 9: VNIR Flight Focal Plane [Credits: Astrium SAS (France) and e2v Technologies (UK)]**\nThe design of the MSI on-board Sentinel-2 has been driven by the requirement for large swath high geometrical and spectral performance of the measurements.\nThe MSI measures the Earth's reflected radiance in 13 spectral bands from VNIR to SWIR (**Table 2**). All the details about the measured spectral responses for each band are given in the [Sentinel-2 Spectral Response Functions (S2-SRF)](https://sentiwiki.copernicus.eu/__attachments/1692737/COPE-GSEG-EOPG-TN-15-0007%20-%20Sentinel-2%20Spectral%20Response%20Functions%202024%20-%204.0.xlsx?inst-v=0b38ac37-4dd6-44ba-865b-d9854aa106d8) document.\nMore in details, the MSI consists of the following components:\n* A Three-Mirror Anastigmat (TMA) telescope with a pupil diameter equivalent to 150 mm, isostatically mounted on the platform to minimise thermo-elastic distortions. The optical design has been optimised to achieve state-of-the-art imaging quality across its very wide field of view. Its 290 km swath width is a larger swath than previous multi-spectral optical missions such as SPOT and LANDSAT. The telescope structure and the mirrors are made of silicon carbide, which provides a very high optical stability to mass ratio and minimises thermal deformation.\n* Two focal planes based on:\n* monolithic Complementary Metal Oxide Semiconductor (CMOS) detectors for VNIR\n* mercury-cadmium-telluride (MCT) detectors hybridised on a CMOS read-out circuit for SWIR (the SWIR focal plane is passively thermo-controlled at temperatures below 195 K).\n* A dichroic VNIR/SWIR beam splitter. Spectral separation in the various bands is provided by stripe filters mounted on top of the detectors.\n* Two distinct arrays of 12 detectors mounted on each focal plane covering VNIR and SWIR channels respectively. The 12 detectors on each focal plane are in a staggered configuration to cover the entire field of view."", 'Document: S2 Mission\nSection: S2 Mission > Overview of Sentinel-2 Mission\nContent:\nSentinel-2 is a European wide-swath, high-resolution, multi-spectral imaging mission. The full mission specification of the twin satellites flying in the same orbit but phased at 180°, is designed to give a high revisit frequency of 5 days at the Equator.\nEach of the satellites in the Sentinel-2 mission carries a single payload: the optical [Multi-Spectral Instrument](https://sentiwiki.copernicus.eu/web/s2-mission#S2-Mission-MSI-Instrument) (MSI) that samples 13 spectral bands: four bands at 10 m, six bands at 20 m and three bands at 60 m spatial resolution. The orbital swath width is 290 km.\n\n**Figure 1: The Twin-Satellite Sentinel-2 Orbital Configuration [Credits: Astrium GmbH]**\nThe Sentinel-2 twin satellites carry on the legacy of [SPOT](https://earth.esa.int/eogateway/missions/spot) and [LANDSAT](https://landsat.gsfc.nasa.gov/) by continuing to provide similar types of image data and contributing to ongoing multispectral observations. These satellites are used to support a variety of services and applications offered by [Copernicus](https://www.copernicus.eu/en), including land management, agriculture, forestry, disaster control, humanitarian relief operations, risk mapping, and security concerns.', 'Document: S2 Mission\nSection: S2 Mission > Overview of Sentinel-2 Mission > Satellite Description\nContent:\nThe two Sentinel-2 satellites in the nominal configuration operate simultaneously, phased at 180° to each other, in a sun-synchronous orbit at a mean altitude of 786 km. During the extension campaign, Sentinel-2A is located 36° away from Sentinel-2B. The position of each Sentinel-2 satellite in its orbit is measured by a dual-frequency Global Navigation Satellite System (GNSS) receiver. Orbital accuracy is maintained by a dedicated propulsion system.\nThe satellite lifespan is 7.25 years, which includes a 3 month in-orbit commissioning phase. Batteries and propellants have...\nThe Sentinel-2 satellite system was developed by an industrial consortium led by Astrium GmbH (Germany). Astrium SAS (France) is responsible for the MultiSpectral Instrument (MSI).\nThe [MSI](https://sentiwiki.copernicus.eu/web/s2-mission#S2-Mission-MSI-Instrument) works passively, by collecting sunlight reflected from the Earth. New data is acquired by the instrument as the satellite moves along its orbital path. The incoming light beam is split via a beam-splitter and focused onto two separate focal plane assemblies within the instrument; one for Visible and Near-Infra-Red (VNIR) bands and the other one for Short Wave Infra-Red (SWIR) bands. The spectral separation of each band into individual wavelengths is accomplished by stripe filters mounted on top of the detectors.', 'Document: S2 Applications\nSection: S2 Applications > Overview of Sentinel-2 Applications > Sentinel-2 band combinations for specific applications\nContent:\n* **False Colour (urban):** This composite is used to visualise urbanized areas more clearly. Vegetation is visible in shades of green, while urbanised areas are represented by white, grey, or purple. Soils, sand, and minerals are shown in a variety of colours. Snow and ice appear as dark blue, and water as black or blue. Flooded areas are very dark blue and almost black. The composite is useful for detecting wildfires and calderas of volcanoes, as they are displayed in shades of red and yellow.\n* **Moisture Index:** The Normalised Difference Moisture Index (NDMI) is used to determine vegetation water content and monitor droughts\n* **SWIR:** Short Wave Infrared (SWIR) measurements can help scientists estimate how much water is present in plants and soil, as water absorbs SWIR wavelengths\n* **NDWI:** The Normalised Difference Water Index (NDWI) is most appropriate for water body mapping\n* **NDSI:** The Sentinel-2 Normalised Difference Snow Index (NDSI) can be used to differentiate between cloud and snow cover as snow absorbs in the short-wave infrared light, but reflects the visible light, whereas cloud is generally reflective in both wavelengths. Snow cover is represented in bright vivid blue.\n* **Scene classification:** Scene classification was developed to distinguish between cloudy pixels, clear pixels and water pixels of Sentinel-2 data and is a result of ESA’s Scene classification algorithm for Level-2A products only.', 'Document: S2 Applications\nSection: S2 Applications > Overview of Sentinel-2 Applications\nContent:\n[Sentinel-2](https://sentiwiki.copernicus.eu/web/sentinel-2) is a European mission equipped with a wide-swath Multispectral Instrument (MSI) to ensure a high-revisit frequency and provide high-resolution imagery to support the Copernicus programme.\nSentinel-2 data products are made available systematically and free of charge to all users, providing data for the following priority service areas.\nTo start using the data visit [CDSE browser ](https://browser.dataspace.copernicus.eu/?zoom=5&lat=50.16282&lng=20.78613&themeId=DEFAULT-THEME&visualizationUrl=U2FsdGVkX1%2B4%2BV%2FOaiXMG%2FrmYxraCDY%2F...', 'Document: S2 Mission\nSection: S2 Mission > Acquisition Resolutions > Spectral Resolution\nContent:\nSpectral resolution is defined as a measure of the ability of the instrument to distinguish features in the electromagnetic spectrum.\nThe 13 spectral bands of Sentinel-2 range from the Visible and Near Infra-Red (VNIR) to the Short-Wave Infra-Red (SWIR):\n* 4 x 10 metre Bands: the three classical RGB bands (Blue (~493nm), Green (560nm), and Red (~665nm)) and a Near Infra-Red (~833nm) band;\n* 6 x 20 metre Bands: 4 narrow Bands in the VNIR vegetation red edge spectral domain (~704nm,~740nm, ~783nm and ~865nm) and 2 wider SWIR bands (~1610nm and ~2190nm) for applications such as snow/ice/cloud detection, or vegetation moisture stress assessment;\n* 3 x 60 metre Bands mainly focused on cloud screening and atmospheric correction (~443nm for aerosols and ~945nm for water vapour) and cirrus detection (~1374nm).  \n**NOTE:** The Bandwidth (nm) in the Tables below is the values measured at Full Width Half Maximum (FWHM). The equivalent wavelength is the barycentre of the spectral response function, not considering the solar irradiance:', 'Document: S2 Mission\nSection: S2 Mission > Performance\nContent:\nSentinel-2 products respect stringent radiometric and geometric image quality requirements. For further information, please refer to the [monthly data quality and annual performance reports](https://sentiwiki.copernicus.eu/web/document-library#Library-S2-Performance-DQR) (including the [Sentinel-2 Annual Performance Report – Year 2024](https://sentiwiki.copernicus.eu/__attachments/1673423/OMPC.CS.APR.005%20-%20S2%20MSI%20Annual%20Performance%20Report%202024%20-%201.1.pdf?inst-v=0b38ac37-4dd6-44ba-865b-d9854aa106d8)).', 'Document: S2 Mission\nSection: S2 Mission > Overview of Sentinel-2 Mission > Satellite Description\nContent:\n**Figure 2: Schematic View of the Deployed Sentinel-2 Spacecraft [Credits: EADS Astrium]**\nThe optical design of the MSI telescope allows for a 290 km Field Of View (FOV).\nA shutter mechanism prevents the instrument from direct illumination by the sun in orbit and to avoid contamination during launch. The same mechanism functions as a calibration device by collecting the sunlight after reflection by a diffuser.', 'Document: S2 Applications\nSection: S2 Applications > Overview of Sentinel-2 Applications > Sentinel-2 band combinations for specific applications\nContent:\nThe table below reports the most common band combinations of Sentinel-2 products, which are used based on the different applications discussed above. Other possible bands combinations can be used in specific study cases. More information about the spectral characteristics and resolution of the Sentinel-2 Multispectral Instrument (MSI) is available on the [S2 Mission webpage](https://sentiwiki.copernicus.eu/web/s2-mission).\n**Table 1: Sentinel-2 band combinations**\n**Application** |  **Layers** **Band combination** | **Product type**\n---|---|---\n**True Colour** **(B4, B3, B2)** |  **False colour** (B8, B4, B3) |  **NDVI** (B8-B4) / (B8+B4) |  **False colour (urban)** (B12, B11, B4) |  **Moisture index** (B8A-B11) / (B8A+B11) |  **SWIR** (B12, B8A, B4) |  **NDWI** (B3-B8) / (B3+B8) |  **NDSI** (B3-B11) / (B3+B11) | **Scene classification (L2A only)** | **L1C** | **L2A**\nGeophysical  |  |  | ✔️ | ✔️ | ✔️ | ✔️ | ✔️ |  | ✔️ | ✔️ | ✔️\nLand Monitoring  | ✔️ | ✔️ | ✔️ | ✔️ |  |  |  |  | ✔️ | ✔️ | ✔️\nMaritime Monitoring | ✔️ |  |  | ✔️ | ✔️ |  | ✔️ |  |  | ✔️ | ✔️\nEmergency Management  | ✔️ | ✔️ | ✔️ | ✔️ | ✔️ | ✔️ |  | ✔️ |  | ✔️ | ✔️\nSecurity - SESA | ✔️ | ✔️ | ✔️ | ✔️ | ✔️ |  | ✔️ | ✔️ |  | ✔️ | ✔️\n* **True colour:** Product with natural colours that represents Earth as humans would naturally see it\n* **False colour:** The false colour composite is most commonly used to assess plant density and health, since plants reflect near infrared and green light, while they absorb red. Cities and exposed ground are grey or tan, and water appears blue or black.\n* **NDVI:** The Normalised Difference Vegetation Index (NDVI) is a simple, but effective index for quantifying green vegetation. It is a measure of the state of vegetation health based on how plants reflect light at certain wavelengths.', 'Document: S2 Mission\nSection: S2 Mission > Calibration and Validation Activities > Data products quality reports\nContent:\nThe Sentinel-2 OPT-MPC provides a monthly status of the quality of Sentinel-2 L1C and L2A products via respective Data Quality Reports (DQR). The DQRs provides information on the monitoring and measurement of L1C and L2A product performances against the proposed specification.\nPlease note that documents providing a summary of the annual end-to-end mission performance of Sentinel-2 are available [here ](https://sentiwiki.copernicus.eu/web/document-library#Library-S2-Performance-DQR)(including the report for the year 2024: [Sentinel-2 Annual Performance Report – Year 2024](https://sentiwiki.copernicus.eu/__attachments/1673423/OMPC.CS.APR.005%20-%20S2%20MSI%20Annual%20Performance%20Report%202024%20-%201.1.pdf?inst-v=0b38ac37-4dd6-44ba-865b-d9854aa106d8))']","Based on the information provided in the Sentinel-2 documentation, Sentinel-2 does not carry a Thermal Infrared (TIR) sensor.

The key evidence from the context is:

1. The Sentinel-2 Multispectral Instrument (MSI) is described as measuring the Earth's reflected radiance in 13 spectral bands from the Visible and Near Infrared (VNIR) to the Short-Wave Infrared (SWIR) wavelength regions. There is no mention of any Thermal Infrared bands.

2. The spectral band information provided in Document 6 lists the 13 Sentinel-2 MSI bands, which range from 443 nm to 2190 nm. This does not include any thermal infrared bands, which would typically be in the 8-14 μm wavelength region.

3. The applications and band combinations discussed in Document 9 also do not reference any Thermal Infrared bands or products from Sentinel-2.

Therefore, the context clearly indicates that the Sentinel-2 MSI instrument does not have Thermal Infrared imaging capabilities. For applications requiring Thermal Infrared data, users should refer to other Copernicus missions, such as Sentinel-3 SLSTR, which does carry a Thermal Infrared sensor.","No, Sentinel-2 does not carry a thermal infrared sensor. Land Surface Temperature monitoring is covered by Sentinel-3 and the future LSTM mission.",0.8833333333186111,1.0,1.0,0.9776340863184566
Is the Sentinel-1B satellite currently operational?,"['Document: S1 Mission\nSection: S1 Mission > The Sentinel-1 mission is the European Radar Observatory for the Copernicus joint initiative of the European Commission (EC) and the European Space Agency (ESA). Copernicus is a European initiative for the implementation of information services dealing with environment and security. It is based on observation data received from Earth Observation satellites and ground-based information. > Orbit\nContent:\nSentinel-1 is in a near-polar, sun-synchronous orbit with a 12 day repeat cycle and 175 orbits per cycle for a single satellite. Both Sentinel-1A and Sentinel-1B share the same orbit plane with a 180° orbital phasing difference. With both satellites operating, the repeat cycle is six days.\n\n**Figure 2: Sentinel-1 Constellation [Credits: ESA/ATG medialab]**\nIn particular for interferometry, Sentinel-1 requires stringent orbit control. Satellite positioning along the orbit must be accurate, with pointing and timing/synchronisation between interferometric pairs. Orbit positioning control for Sentinel-1 is defined using an orbital Earth fixed ""tube"", 60 m (RMS) wide in radius, around a nominal operational path. The satellite is kept inside this ""tube"" for most of its operational lifetime.\n\n**Figure 3: Sentinel-1 Orbit Tube [Credits: credit: ESA, TAS]**\nThe following table contains a summary of useful orbital information for Sentinel-1A and –1B.\n_Table 1: Orbital information for Sentinel-1A and –1B:_\n**Altitude** | **Inclination** | **Period** | **Cycle** | **Ref. tube deviation** | **Local Time at Ascending Node**\n---|---|---|---|---|---\n693 km | 98.18° | 98.6 minutes | 12 days | +- 120 m | 18:00 hours', 'Document: S2 Mission\nSection: S2 Mission > Overview of Sentinel-2 Mission > Satellite Description\nContent:\nThe Sentinel-2 mission baseline consists of two identical satellites operating together, today Sentinel-2B (launched in 2017) and Sentinel-2C (launched in 2024) that were launched using the European VEGA launcher. Each of these satellites weighs approximately 1.2 tonnes.\nAs Sentinel-2A (launched in 2015) nears the end of its operational life after a decade, the launch of Sentinel-2C was critical for continuing the Copernicus Sentinel-2 mission. Sentinel-2C was launched on September 5th, 2024, and joined the other two satellites, starting to operate alongside Sentinel-2A to ensure seamless calibration and uninterrupted data collection.\nSentinel-2C has replaced Sentinel-2A in operation on January 21st, 2025, as announced [here](https://sentinels.copernicus.eu/web/sentinel/-/precise-timing-of-transfer-of-duty-from-sentinel-2a-to-sentinel-2c-on-21-january), and Sentinel-2D will succeed Sentinel-2B. The mission will continue evolving with Sentinel-2 Next Generation, promising enhanced global measurements and continuity beyond 2035, securing essential Earth observation services.\nStarting in March 2025, Sentinel-2A is performing an [extension campaign](https://sentinels.copernicus.eu/web/sentinel/-/sentinel-2a-extended-campaign-starting-march-13-2025), exceptionally complementing the nominal two-satellites (Sentinel-2B/2C) mission constellation operations configuration. The campaign foresees the implementation of a tailored Sentinel-2A [operations scenario](https://sentiwiki.copernicus.eu/web/s2-mission#S2-Mission-Observation-Scenario).', 'Document: S1 Mission\nSection: S1 Mission > Observation and Production Scenarios > SAR Observation Scenario\nContent:\nAs a general principle, the polarisation scheme uses the following logic:\n* HH-HV or HH polarization for the monitoring of polar environments, sea-ice zones\n* VV-VH or VV polarization for all other observation zones (with an exception for the Baltic Sea observed partially in HH-HV with Sentinel-1B during northern winter)  \nPlease see the [Sentinel High Level Operations Plan (HLOP) ](https://omcs.atlassian.net/wiki/download/attachments/283246733/COPE-S1OP-EOPG-PL-15-0020%20-%20Sentinel%20HLOP%202021%20-%203.1.pdf?api=v2)document providing the top-level operations plan of the Sentinel missions, including...\nDetailed information on the planned Sentinel-1 observations in terms of Sentinel-1 acquisitions (SAR mode, date, start-stop times, polarization, etc.) are provided with KML files available [here](https://sentinels.copernicus.eu/web/sentinel/copernicus/sentinel-1/acquisition-plans).\n**Sentinel-1C was successfully launched on December 2024 and, it is fully operational since early May 2025 (end of the commissioning phase). Sentinel-1C allowed to re-establish the 2-satellite constellation configuration: Sentinel-1A and Sentinel-1C.**\n**The two maps below show an overview of the current observation plan in terms SAR mode, polarisation, observation geometry, revisit and coverage frequency. The Wave mode, continuously operated by default over open oceans, is not shown on these maps.**\n![Sentinel-1-Repeat-Coverage-Frequency-Geometry-2025_1.](https://sentiwiki.copernicus.eu/__attachments/1672913/Sentinel-1-Repeat-Coverage-Frequency-Ge...\n**Figure 18: Sentinel-1A Mission Observation Scenario: Repeat & Coverage Frequency**\n![Sentinel-1-Mode-Polarisation-Observation-Geometry-2025_1.](https://sentiwiki.copernicus.eu/__attachments/1672913/Sentinel-1-Mode-Polarisation-Observatio...\n**Figure 19: Sentinel-1A Mission Observation Scenario: Mode - Polarisation- Geometry**', 'Document: S1 Mission\nSection: S1 Mission > Observation and Production Scenarios > SAR Observation Scenario\nContent:\n**Figure 19: Sentinel-1A Mission Observation Scenario: Mode - Polarisation- Geometry**\n**Following an anomaly to the instrument electronics power supply on December 2021, the Sentinel-1B satellite was unable to deliver radar data.**\n**The end of mission was declared in July 2022 while disposal activities have been completed on September 2024. During the time frame September 2022 – April 2025, the Sentinel-1A observation scenario was...\nPlease see maps below.\n![](https://sentiwiki.copernicus.eu/__attachments/1672913/Sentinel-1-Repeat-Coverage-Frequency-Geom...\n**Figure 20: Sentinel-1 Constellation Observation Scenario: Repeat and Coverage Frequency**\n![](https://sentiwiki.copernicus.eu/__attachments/1672913/Sentinel-1-Mode-Polarisation-Geometry-202...\n**Figure 21: Sentinel-1 Constellation (Sentinel-1A + Sentinel-1B ) Observation Scenario: Mode - Polarisation- Geometry**\n**Past Sentinel-1 Mission acquisition plans (including operations ramp up phase) in KML format are available**[**here**](https://sentiwiki.copernicus.eu/web/document-library#DocumentLibrary-AcquisitionPlansLibrary-S1-Acquisition-Plans)\n**The Sentinel-1 ground segment operations implement a baseline pre-defined mission production scenario.**\nThis scenario foresees the systematic processing and online dissemination of all Sentinel-1 data acquired in **IW, EW and SM modes into Level-0 and Level-1 GRD products**.\nGRD products are generated in High Resolution (HR) and Medium Resolution (MR).\nThe resolution is dependent upon the amount of multi-looking performed. Level-1 GRD products are available in HR for IW and SM modes and in MR for EW mode.\nThis is complemented by the systematic processing and online dissemination of:\n* _Level-1 SLC products for all acquired Wave Mode data (active since October 2016 for Sentinel-1B and since May 2017 for Sentinel-1A)_', 'Document: S1 Mission\nSection: S1 Mission > The Sentinel-1 mission is the European Radar Observatory for the Copernicus joint initiative of the European Commission (EC) and the European Space Agency (ESA). Copernicus is a European initiative for the implementation of information services dealing with environment and security. It is based on observation data received from Earth Observation satellites and ground-based information.\nContent:\nThe Sentinel-1 mission comprises a constellation of two sun-synchronous polar-orbiting satellites, sharing the same orbital plane with 180° orbital phasing difference, operating day and night performing C-band synthetic aperture radar imaging, enabling them to acquire imagery regardless of the weather. It operates in four exclusive imaging modes with different resolution (down to 5 m) and coverage (up to 400 km). It provides dual polarisation capability, very short revisit times and rapid product delivery. For each observation, precise measurements of spacecraft position and attitude are available.\nSentinel-1 works in a pre-programmed operation mode to avoid conflicts and to produce a consistent long-term data archive built for applications based on long time series.\nSentinel-1 is the first of the five missions that ESA developed for the Copernicus initiative. Its measurement domain covers landscape topography, multi-purpose imagery (land), multi-purpose imagery (ocean), ocean surface winds, ocean topography/currents, ocean wave height and spectrum, sea ice cover, edge and thickness, snow cover, edge and depth, soil moisture and vegetation.\nSentinel-1 main [**Mission Objectives and Applications**](https://sentiwiki.copernicus.eu/web/s1-applications) are:  \n**Media 1: Sentinel-1 Radar Mission [Credits: ESA]**\nFor mission planning information, see the [Observation and Production Scenario](https://sentiwiki.copernicus.eu/web/s1-mission#S1-Mission-Observation-and-Production-Scenarios).\n**Launch timeline**\nSentinel-1A was launched on 3 April 2014.\nSentinel-1B was launched on 25 April 2016. The spacecraft experienced an anomaly related to the...\nSentinel-1C was launched on 5 December 2024. Sentinel-1D launch was launched on 4 November 2025.', 'Document: S3 Mission\nSection: S3 Mission > Overview of Sentinel-3 Mission > Satellite Description\nContent:\nSentinel-3 is a low Earth-orbit moderate size satellite compatible with small launchers including VEGA and ROCKOT. Sentinel-3 is designed for a 7 year operational lifetime with 120 kg of hydrazine propellant allowing up to 12 years of continuous operations, including de-orbiting at the end of mission. The satellite layout is driven by the need to provide a large face viewing cold-space for thermal control, a modular design for payload accommodation and simplified management of all on-board interfaces. The satellite mechanical configuration and its flight attitude have been optimised through intensive mission analysis studies and system trade-offs performed during the mission definition, resulting in significant improvements in comparison to ENVISAT.\nThe main subsystems of the satellite are:\n* Electrical Power System (EPS), comprising one solar array wing providing power to the spacecraft and payload.\n* Attitude and Orbit Control System (AOCS) composed of a coarse sun sensor, magnetometers, coarse rate sensors, star trackers, a GNSS receiver and control actuators including thrusters, magneto-torquers and reaction wheels.\n* Satellite management unit for satellite commanding and monitoring.\n* Data handling and mass memory unit for payload data handling.\n* Mass memory units for the satellite and its payload.\n* Satellite telecommunication subsystems including an S-band subsystem for both telecommand (TC) uplink and telemetry (TM) downlink, and a dedicated high volume X-band subsystem for mission data downlink.  \nThe main satellite platform characteristics are:\n* Gyroless, three-axis stabilised platform with three star tracker heads, four reaction wheels and magnetic off-loading.\n* Geodetic pointing and yaw steering.\n* Eight 1 N hydrazine thrusters for in-plane and out-plane manoeuvres.\n* Real-time on-board orbit accuracy determination of 3 m based on GPS and Kalman filtering.\n* Launch Mass: 1 250 kg (with maturity and system margins, and fuel).', 'Document: S1 Mission\nSection: S1 Mission > The Sentinel-1 mission is the European Radar Observatory for the Copernicus joint initiative of the European Commission (EC) and the European Space Agency (ESA). Copernicus is a European initiative for the implementation of information services dealing with environment and security. It is based on observation data received from Earth Observation satellites and ground-based information. > Geographical Coverage\nContent:\nThe Copernicus Sentinel-1 constellation offers an improvement in revisit time over ERS-1/2 and Envisat ASAR, and a continuity of wide area coverage with Envisat ASAR, but achieving higher resolution and potentially global dual polarisation coverage over landmasses.\nA single Sentinel-1 satellite is potentially able to map the entire world in the Interferometric Wide swath mode once every 12 days, with 175 orbits per cycle. The two-satellite constellation offers a 6 day exact repeat cycle.\n\n**Figure 4: Sentinel-1 IW potential world coverage.**\n**Note that this not reflect the operational baseline**\nSince the orbit track spacing varies with latitude, the revisit rate (ascending/descending) is significantly greater at higher latitudes than at the equator: less than 1 day at the Arctic and provides coverage over Europe and Canada, main shipping routes in 1-3 days and in 3 days at the equator. Radar data are delivered to Copernicus services within an hour of acquisition.\n\n**Figure 5: Revisit time for S-1A and S-1B in Days per Revisit**', 'Document: Copernicus Programme\nSection: Copernicus Programme > **Europe’s eyes on Earth: the EU’s Copernicus Programme**\nContent:\n**Figure 1: Earth observation missions developed by ESA. [Credits: ESA]**\nTo meet the operational needs of the Copernicus programme, ESA developed the family of Sentinel satellites.\nThese missions are underpinned by ESA’s Earth Observation Framework - Copernicus Space Component (EOF-CSC), which oversees satellite operations, as well as data acquisition, production and dissemination. At present, three complete two-satellite constellations are in orbit, along with one additional single satellite —Sentinel-5P.\nThe Sentinels provide a unique set of observations, starting with the all-weather, day and night radar images from the Sentinel-1 mission, launched in 2014, 2016, 2024, and 2025 respectively.\nSentinel-2, launched in 2015, 2017, and 2024 respectively, is designed to deliver high-resolution optical images for land services.\nThe two Sentinel-3 satellites, launched on 16 February 2016 and 25 April 2018, provide data for services relevant to the ocean and land. Sentinel-3 marine is operated by EUMETSAT and Sentinel-3 land operated by ESA.\nIn addition, a Sentinel-5 Precursor mission (also known as Sentinel-5P) was developed to reduce data gaps between Envisat, in particular the SCIAMACHY instrument, and the launch of Sentinel-5.\nLaunched on 13 October 2017, Sentinel-5P is the first Copernicus mission in orbit dedicated to...\nThe Space Component is managed by ESA and serves users with satellite data available through the Sentinels and the Copernicus Contributing Missions at national, European and international levels.\nThe Copernicus Operations, facilitating access to Sentinel and Contributing Mission data, completes the Copernicus Space Component. [Copernicus Operations](https://sentiwiki.copernicus.eu/web/copernicus-operations)\nThe Space Component forms the European contribution to the worldwide Global Earth Observation System of Systems (GEOSS).', 'Document: S1 Mission\nSection: S1 Mission > The Sentinel-1 mission is the European Radar Observatory for the Copernicus joint initiative of the European Commission (EC) and the European Space Agency (ESA). Copernicus is a European initiative for the implementation of information services dealing with environment and security. It is based on observation data received from Earth Observation satellites and ground-based information. > Satellite Description\nContent:\nThe satellite has been created by an industrial consortium led by Thales Alenia Space Italy as prime contractor, with Astrium Germany being responsible for the CSAR payload, incorporating the central radar electronics sub-system developed by Astrium UK.\n\n**Figure 1: Schematic View of the Deployed Sentinel-1 Spacecraft. [Credits: TAS-I]**\nThe spacecraft is a three-axis, stabilised satellite, yaw/pitch/roll steering (zero Doppler), characterised by sun, star, gyro and magnetic field sensors, a set of four reaction wheels dedicated to orbit and attitude control and three torque rods as actuators to provide steering capabilities on each axis. The satellite is equipped with two solar array wings capable of producing 5 900 W (at end of life) to be stored in a modular battery, the battery capacity is 324 Ah.\nThe satellite is based on the PRIMA (Piattaforma Italiana Multi Applicativa) bus, building on the experience gained from RADARSAT-2 and COSMO-SkyMed, which use the same bus. The bus provides highly accurate pointing knowledge (better than 0.004°) on each axis, high attitude accuracy (about 0.01° on each axis) and real-time orbit...\nThe reference orbit will be maintained within an Earth-fixed orbital tube of a diameter of 120 m (RMS) during normal operation.\nThe satellite platform provides features for the management of the attitude and orbit control systems, science data handling with storage capability of 1,410 Gb, propulsion, power, thermal control, spacecraft autonomy and failure detection identification and recovery, and communication with the ground via X-band data downlink and optical data link through EDRS for payload data at 520 Mbit/s; S-band 64 kbps uplink and 128 kbps / 2 Mbps downlink for TM/TC.\nThe total mass of the spacecraft at launch is approximately 2 300 kg (including 130 kg fuel).', 'Document: SentiWiki\nSection: SentiWiki > Sentinel-1\nContent:\nThe Sentinel-1 mission comprises a constellation of two polar-orbiting satellites, operating day and night performing C-band synthetic aperture\n![Sentinel- ](https://sentiwiki.copernicus.eu/__attachments/50561026/Sentinel-%202...']","Based on the information provided in the context, the Sentinel-1B satellite is no longer operational:

**Sentinel-1B Operational Status**
- According to Document 4, following an anomaly to the instrument electronics power supply on December 2021, the Sentinel-1B satellite was unable to deliver radar data.
- The end of mission for Sentinel-1B was declared in July 2022, and the disposal activities were completed in September 2024.

**Sentinel-1 Constellation Configuration**
- During the time frame from September 2022 to April 2025, the Sentinel-1 observation scenario was based solely on the Sentinel-1A satellite.
- Document 3 states that Sentinel-1C was successfully launched in December 2024 and became fully operational in early May 2025, re-establishing the 2-satellite Sentinel-1 constellation configuration with Sentinel-1A and Sentinel-1C.

In summary, the Sentinel-1B satellite is no longer operational. The Sentinel-1 constellation was reduced to a single satellite (Sentinel-1A) for a period from September 2022 to April 2025, until the launch and commissioning of the new Sentinel-1C satellite, which has now joined Sentinel-1A to restore the 2-satellite Sentinel-1 constellation.","No. The Sentinel-1B mission ended on August 3, 2022, following a power supply anomaly in December 2021.",0.7551587301461442,1.0,1.0,0.9749181796170636
"Has the Sentinel-4 mission been launched? If so, on which platform?","['Document: S2 Mission\nSection: S2 Mission > Overview of Sentinel-2 Mission > Satellite Description\nContent:\nThe Sentinel-2 mission baseline consists of two identical satellites operating together, today Sentinel-2B (launched in 2017) and Sentinel-2C (launched in 2024) that were launched using the European VEGA launcher. Each of these satellites weighs approximately 1.2 tonnes.\nAs Sentinel-2A (launched in 2015) nears the end of its operational life after a decade, the launch of Sentinel-2C was critical for continuing the Copernicus Sentinel-2 mission. Sentinel-2C was launched on September 5th, 2024, and joined the other two satellites, starting to operate alongside Sentinel-2A to ensure seamless calibration and uninterrupted data collection.\nSentinel-2C has replaced Sentinel-2A in operation on January 21st, 2025, as announced [here](https://sentinels.copernicus.eu/web/sentinel/-/precise-timing-of-transfer-of-duty-from-sentinel-2a-to-sentinel-2c-on-21-january), and Sentinel-2D will succeed Sentinel-2B. The mission will continue evolving with Sentinel-2 Next Generation, promising enhanced global measurements and continuity beyond 2035, securing essential Earth observation services.\nStarting in March 2025, Sentinel-2A is performing an [extension campaign](https://sentinels.copernicus.eu/web/sentinel/-/sentinel-2a-extended-campaign-starting-march-13-2025), exceptionally complementing the nominal two-satellites (Sentinel-2B/2C) mission constellation operations configuration. The campaign foresees the implementation of a tailored Sentinel-2A [operations scenario](https://sentiwiki.copernicus.eu/web/s2-mission#S2-Mission-Observation-Scenario).', ""Document: S5P Mission\nSection: S5P Mission > Overview of Sentinel-5P Mission > Satellite Description\nContent:\nSentinel-5P is a low Earth-orbit satellite compatible with small launchers, including VEGA and ROCKOT, with ROCKOT being the selected launch vehicle. Sentinel-5P is designed for a seven year operational lifetime with 80 kg of hydrazine propellant.\nThe mechanical platform consists of a hexagonal structure supporting the platform electrical units and the TROPOMI Instrument Control Unit (ICU), and interfacing to a standard launch vehicle interface ring.\n**The main subsystems of the satellite are:**\n* propulsion subsystem (including a hydrazine tank)\n* Electrical Power Subsystem (EPS), comprising three deployable solar arrays providing power to the spacecraft and payload\n* Thermal Control Subsystem (TCS), including heaters needed to maintain the thermal environment on the platform\n* Attitude and Orbit Control System (AOCS) composed of a three-head star tracker, GPS receivers, reaction wheels, magnetotorquers, a coarse Earth sensor and magnetometers\n* Data Handling Subsystem (DHS), comprising the on-board computer with a mass memory of 72 hours for satellite housekeeping data and command storage for at least 7 days of operation\n* S-band communication subsystem (TT&C), providing two redundant S-band transponders for reception of telecommands and transmission of satellite housekeeping data\n* Payload Data Handling and Transmission subsystem (PDHT), providing a mass memory capacity for storage of 'science' telemetry and two redundant X-band transmitters.  \n_Table 1: Main Satellite Platform Characteristics_\n**Characteristic** | **Detail**\n---|---\nBus | AstroBus L 250 M from Airbus Defence & Space\nAttitude control | Three-axis stabilised with optional yaw steering\nLaunch mass | 820 kg. (including 82 kg fuel and TROPOMI instrument 220 kg)\nPower | 1 500 W (EOL), 430 W average power consumption\nBattery capacity | 156 Ah"", 'Document: Ask Copernicus - AI data guide\nSection: Ask Copernicus - AI data guide\nContent:\n*  \n1. SentiWiki  \n  \nThe Copernicus programme has been in operation since 2011, and the Sentinel missions provide extensive information and observations of Earth.\nOver a decade since the launch of the first Sentinel satellite in 2014, a large amount of information and resources has been published on different websites.\nUtilising the latest advances in technology, the European Environment Agency developed an AI chatbot to help find, understand, and use Copernicus data products.\nCurrently in Beta, the Observia AI platform, known as Ask Copernicus, is designed to search for information on trusted Copernicus sources, providing a reliable and helpful service and reducing manual browsing and searching.\nIf you need help with finding and downloading products, [Ask Copernicus](https://ask.copernicus.eu/).  \n\n*  ](https://www.atlassian.com/software/confluence)', 'Document: Copernicus Programme\nSection: Copernicus Programme > **Europe’s eyes on Earth: the EU’s Copernicus Programme**\nContent:\n**Figure 1: Earth observation missions developed by ESA. [Credits: ESA]**\nTo meet the operational needs of the Copernicus programme, ESA developed the family of Sentinel satellites.\nThese missions are underpinned by ESA’s Earth Observation Framework - Copernicus Space Component (EOF-CSC), which oversees satellite operations, as well as data acquisition, production and dissemination. At present, three complete two-satellite constellations are in orbit, along with one additional single satellite —Sentinel-5P.\nThe Sentinels provide a unique set of observations, starting with the all-weather, day and night radar images from the Sentinel-1 mission, launched in 2014, 2016, 2024, and 2025 respectively.\nSentinel-2, launched in 2015, 2017, and 2024 respectively, is designed to deliver high-resolution optical images for land services.\nThe two Sentinel-3 satellites, launched on 16 February 2016 and 25 April 2018, provide data for services relevant to the ocean and land. Sentinel-3 marine is operated by EUMETSAT and Sentinel-3 land operated by ESA.\nIn addition, a Sentinel-5 Precursor mission (also known as Sentinel-5P) was developed to reduce data gaps between Envisat, in particular the SCIAMACHY instrument, and the launch of Sentinel-5.\nLaunched on 13 October 2017, Sentinel-5P is the first Copernicus mission in orbit dedicated to...\nThe Space Component is managed by ESA and serves users with satellite data available through the Sentinels and the Copernicus Contributing Missions at national, European and international levels.\nThe Copernicus Operations, facilitating access to Sentinel and Contributing Mission data, completes the Copernicus Space Component. [Copernicus Operations](https://sentiwiki.copernicus.eu/web/copernicus-operations)\nThe Space Component forms the European contribution to the worldwide Global Earth Observation System of Systems (GEOSS).', 'Document: S1 Mission\nSection: S1 Mission > The Sentinel-1 mission is the European Radar Observatory for the Copernicus joint initiative of the European Commission (EC) and the European Space Agency (ESA). Copernicus is a European initiative for the implementation of information services dealing with environment and security. It is based on observation data received from Earth Observation satellites and ground-based information.\nContent:\nThe Sentinel-1 mission comprises a constellation of two sun-synchronous polar-orbiting satellites, sharing the same orbital plane with 180° orbital phasing difference, operating day and night performing C-band synthetic aperture radar imaging, enabling them to acquire imagery regardless of the weather. It operates in four exclusive imaging modes with different resolution (down to 5 m) and coverage (up to 400 km). It provides dual polarisation capability, very short revisit times and rapid product delivery. For each observation, precise measurements of spacecraft position and attitude are available.\nSentinel-1 works in a pre-programmed operation mode to avoid conflicts and to produce a consistent long-term data archive built for applications based on long time series.\nSentinel-1 is the first of the five missions that ESA developed for the Copernicus initiative. Its measurement domain covers landscape topography, multi-purpose imagery (land), multi-purpose imagery (ocean), ocean surface winds, ocean topography/currents, ocean wave height and spectrum, sea ice cover, edge and thickness, snow cover, edge and depth, soil moisture and vegetation.\nSentinel-1 main [**Mission Objectives and Applications**](https://sentiwiki.copernicus.eu/web/s1-applications) are:  \n**Media 1: Sentinel-1 Radar Mission [Credits: ESA]**\nFor mission planning information, see the [Observation and Production Scenario](https://sentiwiki.copernicus.eu/web/s1-mission#S1-Mission-Observation-and-Production-Scenarios).\n**Launch timeline**\nSentinel-1A was launched on 3 April 2014.\nSentinel-1B was launched on 25 April 2016. The spacecraft experienced an anomaly related to the...\nSentinel-1C was launched on 5 December 2024. Sentinel-1D launch was launched on 4 November 2025.', ""Document: S5P Mission\nSection: S5P Mission > Overview of Sentinel-5P Mission\nContent:\n**Figure 1: An artist´s impression of Sentinel-5P. [Credits:**[CMEMS](https://marine.copernicus.eu/services/use-cases/sustainable-monitoring-transparent-coastal-waters-high-resolution-satellites)**]**\nThe Copernicus Sentinel-5 Precursor mission is the first Copernicus mission dedicated to monitoring our atmosphere. Copernicus Sentinel-5P is the result of close collaboration between ESA, the European Commission, the Netherlands Space Office, industry, data users and scientists.\nThe mission consists of one satellite carrying the TROPOspheric Monitoring Instrument (TROPOMI) instrument. The TROPOMI instrument was co-funded by ESA and The Netherlands.\nThe **main objective** of the Copernicus Sentinel-5P mission is to perform atmospheric measurements with high spatio-temporal resolution, to be used for air quality, ozone & UV radiation, and climate monitoring & forecasting.\nThe satellite was successfully launched on 13 October 2017 from the Plesetsk cosmodrome in Russia.\nThe satellite's local time of ascending node crossing of 13.30 h has been chosen to facilitate the so-called loose formation operation with NASA's Suomi-NPP...\nThe Copernicus Sentinel-5 Precursor mission reduces gaps in the availability of global atmospheric data products between SCIAMACHY/Envisat (which ended in April 2012), the OMI/AURA mission and the future Copernicus Sentinel-4 and Sentinel-5 missions."", 'Document: S1 Mission\nSection: S1 Mission > The Sentinel-1 mission is the European Radar Observatory for the Copernicus joint initiative of the European Commission (EC) and the European Space Agency (ESA). Copernicus is a European initiative for the implementation of information services dealing with environment and security. It is based on observation data received from Earth Observation satellites and ground-based information. > Satellite Description\nContent:\nThe satellite has been created by an industrial consortium led by Thales Alenia Space Italy as prime contractor, with Astrium Germany being responsible for the CSAR payload, incorporating the central radar electronics sub-system developed by Astrium UK.\n\n**Figure 1: Schematic View of the Deployed Sentinel-1 Spacecraft. [Credits: TAS-I]**\nThe spacecraft is a three-axis, stabilised satellite, yaw/pitch/roll steering (zero Doppler), characterised by sun, star, gyro and magnetic field sensors, a set of four reaction wheels dedicated to orbit and attitude control and three torque rods as actuators to provide steering capabilities on each axis. The satellite is equipped with two solar array wings capable of producing 5 900 W (at end of life) to be stored in a modular battery, the battery capacity is 324 Ah.\nThe satellite is based on the PRIMA (Piattaforma Italiana Multi Applicativa) bus, building on the experience gained from RADARSAT-2 and COSMO-SkyMed, which use the same bus. The bus provides highly accurate pointing knowledge (better than 0.004°) on each axis, high attitude accuracy (about 0.01° on each axis) and real-time orbit...\nThe reference orbit will be maintained within an Earth-fixed orbital tube of a diameter of 120 m (RMS) during normal operation.\nThe satellite platform provides features for the management of the attitude and orbit control systems, science data handling with storage capability of 1,410 Gb, propulsion, power, thermal control, spacecraft autonomy and failure detection identification and recovery, and communication with the ground via X-band data downlink and optical data link through EDRS for payload data at 520 Mbit/s; S-band 64 kbps uplink and 128 kbps / 2 Mbps downlink for TM/TC.\nThe total mass of the spacecraft at launch is approximately 2 300 kg (including 130 kg fuel).', 'Document: S3 Mission\nSection: S3 Mission > Overview of Sentinel-3 Mission > Satellite Description\nContent:\nSentinel-3 is a low Earth-orbit moderate size satellite compatible with small launchers including VEGA and ROCKOT. Sentinel-3 is designed for a 7 year operational lifetime with 120 kg of hydrazine propellant allowing up to 12 years of continuous operations, including de-orbiting at the end of mission. The satellite layout is driven by the need to provide a large face viewing cold-space for thermal control, a modular design for payload accommodation and simplified management of all on-board interfaces. The satellite mechanical configuration and its flight attitude have been optimised through intensive mission analysis studies and system trade-offs performed during the mission definition, resulting in significant improvements in comparison to ENVISAT.\nThe main subsystems of the satellite are:\n* Electrical Power System (EPS), comprising one solar array wing providing power to the spacecraft and payload.\n* Attitude and Orbit Control System (AOCS) composed of a coarse sun sensor, magnetometers, coarse rate sensors, star trackers, a GNSS receiver and control actuators including thrusters, magneto-torquers and reaction wheels.\n* Satellite management unit for satellite commanding and monitoring.\n* Data handling and mass memory unit for payload data handling.\n* Mass memory units for the satellite and its payload.\n* Satellite telecommunication subsystems including an S-band subsystem for both telecommand (TC) uplink and telemetry (TM) downlink, and a dedicated high volume X-band subsystem for mission data downlink.  \nThe main satellite platform characteristics are:\n* Gyroless, three-axis stabilised platform with three star tracker heads, four reaction wheels and magnetic off-loading.\n* Geodetic pointing and yaw steering.\n* Eight 1 N hydrazine thrusters for in-plane and out-plane manoeuvres.\n* Real-time on-board orbit accuracy determination of 3 m based on GPS and Kalman filtering.\n* Launch Mass: 1 250 kg (with maturity and system margins, and fuel).', ""Document: S3 Mission\nSection: S3 Mission > Overview of Sentinel-3 Mission\nContent:\n**Figure 1: Sentinel-3 over land and ocean. [Credits:**[**ESA**](https://www.esa.int/)**]**\nThe main objective of [Sentinel-3](http://www.esa.int/Our_Activities/Observing_the_Earth/GMES/Sentinel-3) is to measure sea surface topography, sea and land surface temperature, and ocean and land surface colour with high accuracy and reliability to support ocean forecasting systems, environmental monitoring and climate monitoring. Sentinel-3 observations also support applications based on vegetation as well as fire, inland waters (river and lake water surface height), the cryosphere (i.e., land ice and sea-ice thickness) and atmosphere. The mission definition is driven by the need for continuity in provision of ERS, ENVISAT and SPOT vegetation data, with improvements in instrument performance and coverage.\nSentinel-3A was launched on 16 February 2016 and Sentinel-3B was launched on 25 April 2018.\nSentinel-3 builds directly on the proven heritage of [ERS - Earth Online](https://earth.esa...\n* A**_Sea and Land Surface Temperature Radiometer (_**[**_SLSTR_**](https://sentiwiki.copernicus.eu/web/s3-slstr-instrument)** _)_** , based on ENVISAT's Advanced Along Track Scanning Radiometer (AATSR), to determine global Sea Surface Temperatures to an accuracy of better than 0.3 K. The SLSTR improves the along track scanning dual-view technique of AATSR and provides advanced...\n* An **_Ocean and Land Colour Instrument (_**[**_OLCI_**](https://sentiwiki.copernicus.eu/web/s3-olci-instrument)** _)_** , based on ENVISAT's Medium Resolution Imaging Spectrometer (MERIS). With 21 bands, compared to 15 bands on MERIS, a design optimised to minimise sun-glint and a resolution of 300 m over all surfaces, OLCI marks a new generation of measurements over the ocean and land. The swath of OLCI and nadir SLSTR fully overlap."", 'Document: S3 Mission\nSection: S3 Mission > Overview of Sentinel-3 Mission\nContent:\nSentinel-3 is an European Earth Observation satellite mission developed to support Copernicus ocean, land, atmospheric, emergency, security and cryospheric applications.\nIt is jointly operated by ESA and EUMETSAT to deliver operational ocean and land observation services.']","Based on the information provided in the context, the Sentinel-4 mission has not been launched yet. The context does not mention any details about the Sentinel-4 mission being launched.

The context focuses on providing information about the other Sentinel missions that have been launched, such as:

- Sentinel-1 (launched in 2014, 2016, 2024, 2025)
- Sentinel-2 (launched in 2015, 2017, 2024) 
- Sentinel-3 (launched in 2016 and 2018)
- Sentinel-5P (launched in 2017)

However, the context does not contain any information about the Sentinel-4 mission being launched. The only reference to Sentinel-4 is that it is mentioned as a future mission that the Copernicus Sentinel-5 Precursor (Sentinel-5P) mission is intended to bridge the gap until.

So in summary, the available context does not indicate that the Sentinel-4 mission has been launched. The context does not provide any information about the platform or launch details for the Sentinel-4 mission.","Yes, Sentinel-4 launched on July 1, 2025, onboard the MTG-S1 (Meteosat Third Generation Sounder-1) satellite.",0.0,0.0,1.0,0.9721361094298168
"What is the default acquisition mode for Sentinel-1 over land, and what are its swath width and spatial resolution?","['Document: S1 Mission\nSection: S1 Mission > Acquisition Modes > Interferometric Wide Swath\nContent:\nThe Interferometric Wide (IW) swath mode is the main acquisition mode over land and satisfies the majority of service requirements. It acquires data with a 250 km swath at 5 m by 20 m spatial resolution (single look). IW mode captures three sub-swaths using Terrain Observation with Progressive Scans SAR (TOPSAR _)_. With the TOPSAR technique, in addition to steering the beam in range as in ScanSAR, the beam is also electronically steered from backward to forward in the azimuth direction for each burst, avoiding scalloping and resulting in homogeneous image quality throughout the swath [[1](https://sentiwiki.copernicus.eu/web/s1-mission#1_TOPSAR)].\nTOPSAR mode replaces the conventional ScanSAR mode, achieving the same coverage and resolution as ScanSAR, but with a nearly uniform Signal-to-Noise Ratio and Distributed Target Ambiguity Ratio.', ""Document: S1 Mission\nSection: S1 Mission > Acquisition Modes > Wave\nContent:\nCopernicus Sentinel-1 Wave mode is similar to ERS and Evnisat wave mode imaging but with improved spatial resolution, larger vignettes and a 'leap frog' acquisition pattern as illustrated in the figure below. WV acquisitions consist of several vignettes exclusively in either VV or HH polarisation, with each vignette processed as a separate image. WV mode products can contain any number of vignettes, potentially amounting to an entire data-take. Each vignette is contained in an independent image within the product.\nWave mode acquires data in 20 km by 20 km vignettes, at 5 m by 5 m spatial resolution, every 100 km along the orbit, acquired alternately on two different incidence angles. Vignettes on the same incidence angle are separated by 200 km. Swaths alternate incident angles between near range and far range (approximately 23° and 36° respectively)."", 'Document: S1 Mission\nSection: S1 Mission > Acquisition Modes\nContent:\nCopernicus Sentinel-1 operates in four exclusive acquisition modes:  \nThe SM, IW and EW imaging modes can operate for a maximum duty cycle of 30 min per orbit. The WV mode operates for up to a maximum duty cycle of 75 min per orbit.\nThe Copernicus Sentinel-1C-band SAR instruments supports operation in single polarisation (HH or VV) and dual polarisation (HH+HV or VV+VH), implemented through one transmit chain (switchable to H or V) and two parallel receive chains for H and V polarisation.\nSM, IW and EW products are available in single (HH or VV) or dual polarisation (HH+HV or VV+VH). WV is single polarisation only (HH or VV).\nThe primary mode over land is IW, with VV+VH polarisation: having the Interferometric Wide swath as the one main operational mode satisfies most current service requirements, avoids conflicts and preserves revisit performance, simplifies mission planning, decreases operational costs and builds up a consistent long-term archive.\nOver open ocean, the WV mode, with VV polarisation, is the main operational acquisition mode acquiring vignettes at regular intervals.\nEW mode is used primarily over selected European seas, Arctic and Southern Ocean areas, mainly for sea-ice monitoring services and maritime surveillance, with the capability to cover 400 km wide area at each data-take. SM mode is only used for small islands and on request for extraordinary events such as emergency management.\nFor each mode, it is possible to produce products at SAR Level-0, Level-1 SLC, Level-1 GRD and Level-2 OCN.\n\n**Figure 12: Sentinel-1 Acquisitions Swath Coverage. [Credits: ESA]**\nRead more about the Copernicus Sentinel-1[Observation and Production Scenario](https://sentiwiki.copernicus.eu/web/s1-mission#S1-Mission-Observation-and-Production-Scenarios).', ""Document: S1 Products\nSection: S1 Products > SAR Products Overview\nContent:\n* Extra Wide swath (EW). Data is acquired in five swaths using the TOPSAR imaging technique. EW mode provides very large swath coverage at the expense of spatial resolution.\n* Wave (WV). Data is acquired in small stripmap scenes called 'vignettes', situated at regular intervals of 100 km along track. The vignettes are acquired by alternating; acquiring one vignette at a near range incidence angle while the next vignette is acquired at a far range incidence angle  \nThe Sentinel-1 SAR acquisition is called “datatake” . The datatake for SM, IW and EW Level-0 products are generated into slices of defined length along a track and systematically processed to Level-1 and Level-2 slice products. This makes the data more manageable for users."", 'Document: S1 Applications\nSection: S1 Applications > Sentinel-1 delivers radar imagery for numerous applications. SAR images are the best way of tracking land subsidence and structural damage: systematic observations and enhanced interferometric capabilities make ground movement barely noticeable in everyday life detectable and closely monitorable. As well as being a valuable resource for urban planners, this kind of information is essential for monitoring shifts from earthquakes, landslides and volcanic uplift. Moreover it helps geohazard monitoring, mining, geology and city planning through subsidence risk assessment.\nContent:\nThe mission’s dual polarimetric products benefit users interested in agriculture, forestry and land cover classification.\nThe SAR ability to provide observation in all weather, and in day or night time conditions, makes it ideal for maritime and Arctic monitoring. Images acquired over the ocean are essential for generating timely maps of sea ice for safe passage, for detecting and tracking oil spills and offer key information on wind and waves in the open sea for shipping and wave-energy applications.\nFinally, Sentinel-1 is designed specifically to provide images for rapid response to disasters such as floods and earthquakes.\nThrough the products provided, security users can monitor major shipping routes to detect illegal activities, gather prosecution evidence in case of illegal discharges, detect unexpected building in remote areas, monitor deforestation and support search and rescue activities.\nThe mission’s main characteristics such as short revisit time and rapid data dissemination benefit emergency response users, such as the United Nations [The International Charter Space and Major Disasters](http://www.disasterscharter.org/), in emergency situations such as floods, earthquakes, volcanic eruptions and landslides.\nEach application can be better served by specific acquisition modes and product types as shown in the table below. The Interferometric Wide swath mode is the primary operation mode for most applications over land. Description of each product type and format is available: [Products](https://sentiwiki.copernicus.eu/web/s1-products).\nRefer to the [High-Level Operation Plan](https://sentiwiki.copernicus.eu/__attachments/1673407/COPE-S1OP-EOPG-PL-15-0020%20-%20Sentinel%20HLOP%202021%20-%203.1.pdf?inst-v=0b38ac37-4dd6-44ba-865b-d9854aa106d8) (HLOP) for a description of the acquisition...\n_Table 1: Mapping of most common mode and application type used based on the processing baseline_\n**Applications** | **Acquisition Mode** | **Product Type**\n---|---|---', 'Document: S1 Mission\nSection: S1 Mission > Acquisition Modes > Extra Wide Swath\nContent:\nSimilar to the IW mode, the Extra Wide (EW) swath mode employs the TOPSAR technique to acquire data over a wider area than for IW mode using five sub-swaths. EW mode acquires data over a 400 km swath at 20 m by 40 m spatial resolution.\nEW SLC products contain one image per sub-swath and one per polarisation channel, for a total of five (single polarisation) or 10 (dual polarisation) images in an EW product.\nThe EW mode is aimed primarily for use over sea-ice, polar zones and certain maritime areas, in particular for ice, oil spill monitoring and security services. Like IW, EW mode can also be used for interferometry since it shares the same characteristics for burst synchronisation, baseline and Doppler stability.\nThe table below shows the main characteristics of the Extra Wide swath mode.\n_Table 7: Characteristics of Extra Wide swath mode_\n**Characteristics** | **Value**\n---|---\nSwath width | 410 km\nIncidence angle range | 18.9° - 47.0°\nSub-swaths | 5\nAzimuth steering angle | ± 0.8°\nPolarisation options | Dual HH+HV, VV+VH\nSingle HH, VV\nMaximum Noise Equivalent Sigma Zero (NESZ) | -22 dB\nThe table below shows the incidence and off-nadir angles for Extra Wide swath mode beams.\n_Table 8: Angles for Extra Wide sub-swaths_\n**Beam** | **EW1** | **EW2** | **EW3** | **EW4** | **EW5**\n---|---|---|---|---|---\nOff-nadir angles at\nmin orbit altitude [°] | 17.94-26.07 | 26.02-30.66 | 30.61-35.10 | 35.06-38.66 | 38.63-41.20\nIncident angles at\nmin orbit altitude [°] | 20.00-29.20 | 29.15-34.47 | 34.41-39.66 | 39.60-43.89 | 43.86-46.97\nOff-nadir angles at\nmax orbit altitude [°] | 16.36-24.49 | 24.44-29.08 | 29.03-33.52 | 33.48-37.08 | 37.05-39.62\nIncident angles at\nmax orbit altitude [°] | 18.22-27.57 | 27.38-33.42 | 32.65-38.05 | 37.84-42.53 | 42.08-45.16', 'Document: S1 Mission\nSection: S1 Mission > Acquisition Modes > Interferometric Wide Swath\nContent:\n**Figure 13: TOPSAR Sub-Swath Acquisition. [Credits: ESA]**\nThe azimuth resolution is reduced compared to SM due to the shorter target illumination time of the burst. Using the sweeping azimuth pattern, each target is seen under the same antenna pattern, independently from its azimuth position in the burst image. By shrinking the azimuth antenna pattern, as seen by a target on the ground, scalloping effects on the image can be reduced.\nThe Sentinel-1 C-SAR system is designed to enable TOPS burst synchronization of repeat-pass data-takes supporting the generation of TOPS interferograms and coherence maps. Specifically, for the IW and EW modes, the TOPS burst duration is 0.82 s and 0.54 s (worst case) respectively, with a requirement for achieving a synchronization of...\nIW SLC products contain one image per sub-swath and one per polarisation channel, for a total of three (single polarisation) or six (dual polarisation) images in an IW product.\nEach sub-swath image consists of a series of bursts, where each burst has been processed as a separate SLC image. The individually focused complex burst images are included, in azimuth-time order, into a single sub-swath image with black-fill demarcation in between. There is sufficient overlap between adjacent bursts and between sub-swaths to ensure continuous coverage of the ground as provided in GRD products. The images for all bursts in all sub-swaths are resampled to a common pixel spacing grid in range and azimuth while preserving the phase information.\n\n**Figure 14: IW SLC Bursts and Sub-Swaths**\nAfter burst and sub-swath merging, the full product can be created, as is the case for the GRDH products shown in **Figure 15**. The TOPSAR technique greatly reduces scalloping effects over conventional ScanSAR.', ""Document: S1 Mission\nSection: S1 Mission > Acquisition Modes > Stripmap\nContent:\nStripmap (SM) mode acquires data with an 80 km swath at slightly better than 5 m by 5 m spatial resolution (single look). _Six overlapping swaths cover a range of 375 km._ The ground swath is illuminated by a continuous sequence of pulses while the antenna beam is pointing to a fixed azimuth angle and an approximately fixed off-nadir angle (this is subject to small variations because of roll steering). SM images have continuous along track image quality at an approximately constant incidence angle.\n_Table 3: Main characteristics of Stripmap mode_\n**Characteristics** | **Value**\n---|---\nSwath width | 80 km\nIncidence angle range | 18.3° - 46.8°\nElevation beams | 6\nPolarisation options | Dual HH+HV, VV+VH\nSingle HH, VV\nMaximum Noise Equivalent Sigma Zero (NESZ) | -22 dB\nStripmap imaging mode operates with one of six predefined elevation beams, each at a different incidence angle.**Table 4** shows the incidence and off-nadir angles for Stripmap beams.\nThe incidence angle is the angle between the incident SAR beam and the axis perpendicular to the local geodetic ground surface.\nThe off-nadir angle is the look angle between the satellite's nadir position and the SAR beam.\n_Table 4: Angles for Stripmap mode beams_\n**Beam** | **S1** | **S2** | **S3** | **S4** | **S5** | **S6**\n---|---|---|---|---|---|---\nOff-nadir angles at\nmin orbit altitude [°] | 17.93-23.53 | 21.00-26.33 | 26.18-30.99 | 30.87-35.15 | 35.07-38.85 | 37.53-41.01\nIncident angles at min\norbit altitude [°] | 19.99-26.31 | 23.45-29.50 | 29.33-34.85 | 34.71-39.72 | 39.62-44.12 | 42.53-46.73\nOff-nadir angles at\nmax orbit altitude [°] | 16.45-21.96 | 19.51-24.77 | 24.67-29.45 | 29.34-33.63 | 33.53-37.34 | 35.98-39.51\nIncident angles at max\norbit altitude [°] | 18.32-24.55 | 21.78-27.76 | 27.64-33.13 | 33.00-38.02 | 37.89-42.43 | 40.79-45.04\nStripmap mode is used to image small islands and in exceptional cases only, to support emergency management actions."", 'Document: S1 Products\nSection: S1 Products > SAR Products Overview\nContent:\nThe Sentinel-1 C-band radar antenna beam illuminates the ground to the right side of the satellite. Due to satellite motion and the along track (azimuth) beam width of the antenna, each target element only stays inside the illumination beam for a short time. As part of the on-ground processing, the complex echo signals received during this time are added coherently. In this way a long antenna is synthesized, with the synthetic aperture length being equal to the distance the satellite traveled during the integration time. In principle, the along track resolution obtainable with SAR is approximately half the real antenna length. To enhance the radiometric resolution, multi-look azimuth processing can be employed and consequently, the along track resolution will be reduced by a factor equal to the look number. The across track or range resolution is a function of the transmitted radar bandwidth.\nThe fact that the system works coherently from end-to-end means that both the amplitude and the phase relationships between the complex transmitted and received signals are maintained throughout the instruments and the processing chain. This facilitates aperture synthesis as well as multi-pass radar interferometry using pairs of images taken over the same area at different times.\nThe Sentinel-1 Synthetic Aperture Radar (SAR) instrument may acquire data in four exclusive modes:\n* Stripmap (SM). This is a standard SAR stripmap imaging mode where the ground swath is illuminated with a continuous sequence of pulses and with the antenna beam pointing to a fixed azimuth and elevation angle.\n* Interferometric Wide swath (IW). Data is acquired in three swaths using the Terrain Observation with Progressive Scanning SAR (TOPSAR) imaging technique. In IW mode, bursts are synchronised from pass to pass to ensure alignment of interferometric pairs.', 'Document: S1 Mission\nSection: S1 Mission > Acquisition Modes > Calibration Modes\nContent:\nThe Sentinel-1 SAR instrument also operates in the Calibration Modes: RF Characterisation mode, Azimuth Notch mode and Elevation Notch mode. However, products from these modes are only used internally and not distributed to the users. Please refer to [Copernicus Sentinel-1 Calibration and Validation](https://sentiwiki.copernicus.eu/web/mission-performance-cluster#Copernicus-Sentinel-1-Calibration-and-Validation) for further details.']","According to the documentation, the default acquisition mode for Sentinel-1 over land is the Interferometric Wide (IW) swath mode.

The key details about the Sentinel-1 IW mode are:

- Swath Width: 250 km
- Spatial Resolution: 5 m x 20 m (single look)

The IW mode captures data using the Terrain Observation with Progressive Scans SAR (TOPSAR) technique. This involves electronically steering the radar beam in the azimuth direction during each burst, in addition to the range steering, to achieve a more uniform image quality across the swath.

The IW mode is described as the ""main acquisition mode over land and satisfies the majority of service requirements."" It provides a good balance of wide swath coverage and reasonably high spatial resolution, making it suitable for a variety of land applications such as forestry, agriculture, and land cover monitoring.

In summary, the default Sentinel-1 acquisition mode over land is the Interferometric Wide (IW) swath mode, which has a 250 km swath width and 5 m x 20 m spatial resolution, achieved through the TOPSAR imaging technique.",The default mode is Interferometric Wide (IW). It has a swath width of 250 km and a spatial resolution of 5 m x 20 m.,0.7662698412570702,1.0,1.0,0.9517514797518859
Why does Sentinel-1 Wave Mode (WV) not provide a continuous image strip?,"[""Document: S1 Mission\nSection: S1 Mission > Acquisition Modes > Wave\nContent:\nCopernicus Sentinel-1 Wave mode is similar to ERS and Evnisat wave mode imaging but with improved spatial resolution, larger vignettes and a 'leap frog' acquisition pattern as illustrated in the figure below. WV acquisitions consist of several vignettes exclusively in either VV or HH polarisation, with each vignette processed as a separate image. WV mode products can contain any number of vignettes, potentially amounting to an entire data-take. Each vignette is contained in an independent image within the product.\nWave mode acquires data in 20 km by 20 km vignettes, at 5 m by 5 m spatial resolution, every 100 km along the orbit, acquired alternately on two different incidence angles. Vignettes on the same incidence angle are separated by 200 km. Swaths alternate incident angles between near range and far range (approximately 23° and 36° respectively)."", ""Document: S1 Products\nSection: S1 Products > SAR Products Overview\nContent:\n* Extra Wide swath (EW). Data is acquired in five swaths using the TOPSAR imaging technique. EW mode provides very large swath coverage at the expense of spatial resolution.\n* Wave (WV). Data is acquired in small stripmap scenes called 'vignettes', situated at regular intervals of 100 km along track. The vignettes are acquired by alternating; acquiring one vignette at a near range incidence angle while the next vignette is acquired at a far range incidence angle  \nThe Sentinel-1 SAR acquisition is called “datatake” . The datatake for SM, IW and EW Level-0 products are generated into slices of defined length along a track and systematically processed to Level-1 and Level-2 slice products. This makes the data more manageable for users."", 'Document: S1 Mission\nSection: S1 Mission > Acquisition Modes\nContent:\nCopernicus Sentinel-1 operates in four exclusive acquisition modes:  \nThe SM, IW and EW imaging modes can operate for a maximum duty cycle of 30 min per orbit. The WV mode operates for up to a maximum duty cycle of 75 min per orbit.\nThe Copernicus Sentinel-1C-band SAR instruments supports operation in single polarisation (HH or VV) and dual polarisation (HH+HV or VV+VH), implemented through one transmit chain (switchable to H or V) and two parallel receive chains for H and V polarisation.\nSM, IW and EW products are available in single (HH or VV) or dual polarisation (HH+HV or VV+VH). WV is single polarisation only (HH or VV).\nThe primary mode over land is IW, with VV+VH polarisation: having the Interferometric Wide swath as the one main operational mode satisfies most current service requirements, avoids conflicts and preserves revisit performance, simplifies mission planning, decreases operational costs and builds up a consistent long-term archive.\nOver open ocean, the WV mode, with VV polarisation, is the main operational acquisition mode acquiring vignettes at regular intervals.\nEW mode is used primarily over selected European seas, Arctic and Southern Ocean areas, mainly for sea-ice monitoring services and maritime surveillance, with the capability to cover 400 km wide area at each data-take. SM mode is only used for small islands and on request for extraordinary events such as emergency management.\nFor each mode, it is possible to produce products at SAR Level-0, Level-1 SLC, Level-1 GRD and Level-2 OCN.\n\n**Figure 12: Sentinel-1 Acquisitions Swath Coverage. [Credits: ESA]**\nRead more about the Copernicus Sentinel-1[Observation and Production Scenario](https://sentiwiki.copernicus.eu/web/s1-mission#S1-Mission-Observation-and-Production-Scenarios).', 'Document: S1 Applications\nSection: S1 Applications > Sentinel-1 delivers radar imagery for numerous applications. SAR images are the best way of tracking land subsidence and structural damage: systematic observations and enhanced interferometric capabilities make ground movement barely noticeable in everyday life detectable and closely monitorable. As well as being a valuable resource for urban planners, this kind of information is essential for monitoring shifts from earthquakes, landslides and volcanic uplift. Moreover it helps geohazard monitoring, mining, geology and city planning through subsidence risk assessment.\nContent:\nThe mission’s dual polarimetric products benefit users interested in agriculture, forestry and land cover classification.\nThe SAR ability to provide observation in all weather, and in day or night time conditions, makes it ideal for maritime and Arctic monitoring. Images acquired over the ocean are essential for generating timely maps of sea ice for safe passage, for detecting and tracking oil spills and offer key information on wind and waves in the open sea for shipping and wave-energy applications.\nFinally, Sentinel-1 is designed specifically to provide images for rapid response to disasters such as floods and earthquakes.\nThrough the products provided, security users can monitor major shipping routes to detect illegal activities, gather prosecution evidence in case of illegal discharges, detect unexpected building in remote areas, monitor deforestation and support search and rescue activities.\nThe mission’s main characteristics such as short revisit time and rapid data dissemination benefit emergency response users, such as the United Nations [The International Charter Space and Major Disasters](http://www.disasterscharter.org/), in emergency situations such as floods, earthquakes, volcanic eruptions and landslides.\nEach application can be better served by specific acquisition modes and product types as shown in the table below. The Interferometric Wide swath mode is the primary operation mode for most applications over land. Description of each product type and format is available: [Products](https://sentiwiki.copernicus.eu/web/s1-products).\nRefer to the [High-Level Operation Plan](https://sentiwiki.copernicus.eu/__attachments/1673407/COPE-S1OP-EOPG-PL-15-0020%20-%20Sentinel%20HLOP%202021%20-%203.1.pdf?inst-v=0b38ac37-4dd6-44ba-865b-d9854aa106d8) (HLOP) for a description of the acquisition...\n_Table 1: Mapping of most common mode and application type used based on the processing baseline_\n**Applications** | **Acquisition Mode** | **Product Type**\n---|---|---', 'Document: S1 Applications\nSection: S1 Applications > Sentinel-1 delivers radar imagery for numerous applications. SAR images are the best way of tracking land subsidence and structural damage: systematic observations and enhanced interferometric capabilities make ground movement barely noticeable in everyday life detectable and closely monitorable. As well as being a valuable resource for urban planners, this kind of information is essential for monitoring shifts from earthquakes, landslides and volcanic uplift. Moreover it helps geohazard monitoring, mining, geology and city planning through subsidence risk assessment.\nContent:\n_Table 1: Mapping of most common mode and application type used based on the processing baseline_\n**Applications** | **Acquisition Mode** | **Product Type**\n---|---|---\n**SM** | **IW** | **EW** | **WV** | **SLC** | **GRD** | **OCN**\n| **SH** | **SV** | **DH** | **DV** | **SH** | **SV** | **DH** | **DV** | **SH** | **SV** | **DH** | **DV** | **SH** | **SV**\n**Arctic Environment and Sea-Ice Zones Monitoring** |  |  |  |  | ✔️ |  | ✔️ |  | ✔️ |  | ✔️ |  |  |  | ✔️ | ✔️ |\n**Open Ocean Ship Surveillance** | ✔️ |  |  |  |  |  | ✔️ | ✔️ |  |  | ✔️ | ✔️ |  |  |  | ✔️ |\n**Oil Pollution Monitoring** |  |  |  |  |  |  | ✔️ | ✔️ |  |  | ✔️ | ✔️ |  |  |  | ✔️ |\n**Marine winds** |  |  |  |  | ✔️ | ✔️ |  |  | ✔️ | ✔️ |  |  |  | ✔️ |  | ✔️ | ✔️\n**Forestry** |  |  | ✔️ | ✔️ |  |  | ✔️ | ✔️ |  |  |  |  |  |  | ✔️ | ✔️ |\n**Agriculture** |  |  | ✔️ | ✔️ |  |  | ✔️ | ✔️ |  |  |  |  |  |  | ✔️ | ✔️ |\n**Urban deformation mapping** |  | ✔️ | ✔️ | ✔️ |  |  |  |  |  |  |  |  |  |  | ✔️ | ✔️ |\n**Flood monitoring** | ✔️ |  |  |  |  | ✔️ | ✔️ | ✔️ |  |  |  |  |  |  | ✔️ | ✔️ |\n**Earthquake analysis** | ✔️ |  |  | ✔️ |  |  |  |  |  |  |  |  |  |  | ✔️ |  |\n**Landslide and volcano monitoring** |  | ✔️ | ✔️ | ✔️ |  | ✔️ | ✔️ | ✔️ |  |  |  |  |  |  | ✔️ |  |\n_Note: for a number of small volcanic islands worldwide, from May 2015 onwards, the Stripmap mode (SM) is used for the regular coverage. This is implemented in the case a SM swath fully covers the island in one pass, and no maritime surveillance activities take place around the island. The SM mode features (at a comparable system resource consumption) a smaller swath w.r.t the IW mode (in the order of 80 km vs 250 km) but ensures a higher spatial resolution, of particular interest for volcano monitoring._', 'Document: S1 Products\nSection: S1 Products > SAR Products Overview\nContent:\nThe Sentinel-1 C-band radar antenna beam illuminates the ground to the right side of the satellite. Due to satellite motion and the along track (azimuth) beam width of the antenna, each target element only stays inside the illumination beam for a short time. As part of the on-ground processing, the complex echo signals received during this time are added coherently. In this way a long antenna is synthesized, with the synthetic aperture length being equal to the distance the satellite traveled during the integration time. In principle, the along track resolution obtainable with SAR is approximately half the real antenna length. To enhance the radiometric resolution, multi-look azimuth processing can be employed and consequently, the along track resolution will be reduced by a factor equal to the look number. The across track or range resolution is a function of the transmitted radar bandwidth.\nThe fact that the system works coherently from end-to-end means that both the amplitude and the phase relationships between the complex transmitted and received signals are maintained throughout the instruments and the processing chain. This facilitates aperture synthesis as well as multi-pass radar interferometry using pairs of images taken over the same area at different times.\nThe Sentinel-1 Synthetic Aperture Radar (SAR) instrument may acquire data in four exclusive modes:\n* Stripmap (SM). This is a standard SAR stripmap imaging mode where the ground swath is illuminated with a continuous sequence of pulses and with the antenna beam pointing to a fixed azimuth and elevation angle.\n* Interferometric Wide swath (IW). Data is acquired in three swaths using the Terrain Observation with Progressive Scanning SAR (TOPSAR) imaging technique. In IW mode, bursts are synchronised from pass to pass to ensure alignment of interferometric pairs.', 'Document: S1 Processing\nSection: S1 Processing > L2 Algorithms > Ocean Swell Spectra Processing\nContent:\nThe OSW products are two-dimensional ocean surface wave spectra estimated from a Level-1 SLC by inversion of the corresponding image cross-spectra. The cross-spectra are computed by performing multi-looking in azimuth followed by co- and cross-spectra estimation among the detected individual look images. A single OSW can be computed from an Wave mode SLC imagette or from a sub-image extracted from a Stripmap mode SLC image.\nThe OSW product cannot be generated from the TOPSAR mode, since individual looks with sufficient time separation are required. The obtained inter-look time separation within one burst is too short due to the progressive scanning (i.e. short dwell time). Individual looks from neighbouring bursts require significant spatial overlap.\nThe Sentinel-1 wave processing system consists of:\n* a spectral estimation unit\n* a spectral inversion unit', 'Document: S1 Mission\nSection: S1 Mission > Acquisition Modes > Interferometric Wide Swath\nContent:\n**Figure 13: TOPSAR Sub-Swath Acquisition. [Credits: ESA]**\nThe azimuth resolution is reduced compared to SM due to the shorter target illumination time of the burst. Using the sweeping azimuth pattern, each target is seen under the same antenna pattern, independently from its azimuth position in the burst image. By shrinking the azimuth antenna pattern, as seen by a target on the ground, scalloping effects on the image can be reduced.\nThe Sentinel-1 C-SAR system is designed to enable TOPS burst synchronization of repeat-pass data-takes supporting the generation of TOPS interferograms and coherence maps. Specifically, for the IW and EW modes, the TOPS burst duration is 0.82 s and 0.54 s (worst case) respectively, with a requirement for achieving a synchronization of...\nIW SLC products contain one image per sub-swath and one per polarisation channel, for a total of three (single polarisation) or six (dual polarisation) images in an IW product.\nEach sub-swath image consists of a series of bursts, where each burst has been processed as a separate SLC image. The individually focused complex burst images are included, in azimuth-time order, into a single sub-swath image with black-fill demarcation in between. There is sufficient overlap between adjacent bursts and between sub-swaths to ensure continuous coverage of the ground as provided in GRD products. The images for all bursts in all sub-swaths are resampled to a common pixel spacing grid in range and azimuth while preserving the phase information.\n\n**Figure 14: IW SLC Bursts and Sub-Swaths**\nAfter burst and sub-swath merging, the full product can be created, as is the case for the GRDH products shown in **Figure 15**. The TOPSAR technique greatly reduces scalloping effects over conventional ScanSAR.', ""Document: S1 Mission\nSection: S1 Mission > SAR Instrument\nContent:\n**Figure 6: Sentinel-1 Spacecraft**\nThe C-SAR instrument is an active phased array antenna providing fast scanning in elevation (to cover the large range of incidence angle and to support ScanSAR operation) and in azimuth (to allow use of TOPS technique to meet the required image performance) with dual-pol capacity.\nIt has an internal calibration scheme, where transmit signals are routed into the receiver to allow monitoring of amplitude/phase to facilitate high radiometric stability.\nSentinel-1's metallised carbon-fibre-reinforced-plastic radiating waveguides ensure good radiometric stability even though these elements are not covered by the internal calibration scheme. The digital chirp generator and selectable receive filter bandwidths allow efficient use of on-board storage considering the ground range resolution dependence on incidence angle.\n_Table 2: The key parameters of the Sentinel-1 C-SAR instrument include:_\n**Characteristics** | **Value**\n---|---\nCentre frequency | 5.405 GHz (corresponding to a wavelength of ~5.55 cm)\nBandwidth | 0-100 MHz (programmable)\nPolarisation | HH+HV, VV+VH, VV, HH\nAntenna size | 12.3 m x 0.821 m\nRF Peak power (sum od all TRMs, at TRM o/p) | 4.368 kW, - 4.075 kW (IW, dual polarisations)\nPulse width | 5-100 µs (programmable)\nTransmit duty cycle | Max 12%, SM 8.5%, IW 9%, EW 5%, WV 0.8%\nReceiver noise figure at module input | 3.2 dB\nPRF (Pulse Repetition Frequency) | 1 000 - 3 000 Hz (programmable)\nADC sampling frequency | 300 MHz (real sampling) (digital down-sampling after A/D conversion)\nSampling | 10 bits\nData compression | FDBAQ (Flexible Dynamic Block Adaptive Quantization)\nInstrument Operation | Up to 25 min per orbit continuously in any of the imaging modes and for the rest of the orbit in Wave mode\nTotal instrument mass (including antenna) | 945 kg\nCSAR DC power | 3870 W (Interferometric Wide-swath Mode, two polarisations)\nCSAR data storage capacity | 1410 Gb (End-of-Life)"", 'Document: S1 Mission\nSection: S1 Mission > The Sentinel-1 mission is the European Radar Observatory for the Copernicus joint initiative of the European Commission (EC) and the European Space Agency (ESA). Copernicus is a European initiative for the implementation of information services dealing with environment and security. It is based on observation data received from Earth Observation satellites and ground-based information.\nContent:\nThe Sentinel-1 mission comprises a constellation of two sun-synchronous polar-orbiting satellites, sharing the same orbital plane with 180° orbital phasing difference, operating day and night performing C-band synthetic aperture radar imaging, enabling them to acquire imagery regardless of the weather. It operates in four exclusive imaging modes with different resolution (down to 5 m) and coverage (up to 400 km). It provides dual polarisation capability, very short revisit times and rapid product delivery. For each observation, precise measurements of spacecraft position and attitude are available.\nSentinel-1 works in a pre-programmed operation mode to avoid conflicts and to produce a consistent long-term data archive built for applications based on long time series.\nSentinel-1 is the first of the five missions that ESA developed for the Copernicus initiative. Its measurement domain covers landscape topography, multi-purpose imagery (land), multi-purpose imagery (ocean), ocean surface winds, ocean topography/currents, ocean wave height and spectrum, sea ice cover, edge and thickness, snow cover, edge and depth, soil moisture and vegetation.\nSentinel-1 main [**Mission Objectives and Applications**](https://sentiwiki.copernicus.eu/web/s1-applications) are:  \n**Media 1: Sentinel-1 Radar Mission [Credits: ESA]**\nFor mission planning information, see the [Observation and Production Scenario](https://sentiwiki.copernicus.eu/web/s1-mission#S1-Mission-Observation-and-Production-Scenarios).\n**Launch timeline**\nSentinel-1A was launched on 3 April 2014.\nSentinel-1B was launched on 25 April 2016. The spacecraft experienced an anomaly related to the...\nSentinel-1C was launched on 5 December 2024. Sentinel-1D launch was launched on 4 November 2025.']","According to the information provided in the context, Sentinel-1 Wave Mode (WV) does not provide a continuous image strip for the following reasons:

1. Acquisition Pattern:
   - The Wave mode acquires data in small 20 km x 20 km ""vignettes"" at regular intervals of 100 km along the orbit.
   - The vignettes are acquired by alternating between near range (approximately 23° incidence angle) and far range (approximately 36° incidence angle) positions.
   - Vignettes on the same incidence angle are separated by 200 km.

2. Discontinuous Coverage:
   - The Wave mode acquisitions consist of these discrete vignettes, rather than a continuous swath.
   - Each vignette is processed as a separate image within the Wave mode product.
   - There are gaps between the individual vignettes, resulting in discontinuous ground coverage.

3. Limitations of the TOPSAR Technique:
   - The Interferometric Wide Swath (IW) and Extra Wide Swath (EW) modes use the TOPSAR technique to acquire data in a continuous strip.
   - However, the Wave mode does not use TOPSAR, as it requires individual looks with sufficient time separation, which cannot be achieved within the short dwell time of the Wave mode bursts.
   - The progressive scanning of TOPSAR results in too short of an inter-look time separation, preventing the generation of a continuous Wave mode image strip.

In summary, the Wave mode's acquisition pattern of discrete vignettes, separated by gaps, combined with the limitations of the TOPSAR technique, result in Sentinel-1 Wave mode products not providing a continuous image strip, but rather a series of individual vignette images within the product.","WV mode acquires data in small 'vignettes' of 20 km x 20 km spaced at 100 km intervals along the track to sample ocean waves, rather than a continuous strip.",0.9467813051041186,1.0,1.0,0.9999999999999997
What is the exact naming convention for the Sentinel-1 Precise Orbit Ephemerides (POE) auxiliary file?,"['Document: S1 Mission\nSection: S1 Mission > Precise Orbit Determination Service\nContent:\nThe **Copernicus POD (Precise Orbit Determination) Service** for the Sentinel-1 mission provides Precise Orbital products and auxiliary data generated that can be divided up into four categories depending on the associated timeliness.\n1. Near Real-Time (NRT): AUX_RESORB Restituted Orbit products are generated based on immediate GPS L0...\n2. Near Real Time predicted: (PRE) AUX_PREORB Predicted Orbit products are computed a certain time...\n3. Short Time Critical (STC): AUX_MOEORB Medium Orbit Ephemerides products make use of the STC...\n4. Non Time Critical (NTC): AUX_POEORB Precise Orbit Ephemerides products are computed after a number...  \nAdditionally GNSS L1B RINEX files contain the decoded GPS observations (pseudorange and carrier phase) following the International GNSS Service (IGS) RINEX ICD.\nPerforming POD requires making use of the satellite attitude Quaternions files and validating the results obtained against an external reference solution. Quaternions files and the NRT, STC and NTC products generated by the CPOD Service are made available to the user community through the ESA [Copernicus Data Space Ecosystem](https://dataspace.copernicus.eu/data-collections/sentinel-data/sentinel-1).\nDetails on the official POD products are available in the File Format Specification [File Format Specification](https://sentiwiki.copernicus.eu/__attachments/1673407/GMV-CPOD3-FFS-0001-Copernicus-POD-Service-File-Format-Specification.pdf?inst-v=0b38ac37-4dd6-44ba-865b-d9854aa106d8) document. A brief description of the POD products is included in [POD Products Specification](https://sentiwiki.copernicus.eu/web/s1-processing#S1-Processing-POD-Sentinel-1-Products-Specification).  \n\n*  ](https://www.atlassian.com/software/confluence)', 'Document: S1 Processing\nSection: S1 Processing > POD Sentinel-1 Products Specification\nContent:\nGeneric introduction to POD products is available in [overview of POD](https://sentiwiki.copernicus.eu/web/precise-orbit-determination) and in [Sentinel-1 POD service](https://sentiwiki.copernicus.eu/web/s1-mission#Precise-Orbit-Determination-Service).\nRegarding access to Copernicus Sentinel-1 orbit files users are kindly invited to note that:\n* The reference for accessing the Sentinel-1 orbit files is on the [Copernicus Data Space Ecosystem](https://dataspace.copernicus.eu)  \nPrecise orbits are determined based on the dual-frequency GPS (Global Positioning System) data delivered by dedicated geodetic-grade GPS receivers on-board the satellites. Several updates in the operational orbit determination were done during the years including an update of the GPS antenna reference point coordinates.', 'Document: S1 Products\nSection: S1 Products > SAR Products Overview > SAR Naming Convention\nContent:\nAs described in Table 1, the product name indicates the absolute orbit number elapsed since the first ascending node crossing after launch.\nThe relative orbit number is a count of orbits from 1 to the number of orbits contained in a repeat cycle (175 orbits per cycle of 12 days, in the case of Sentinel-1). The relative orbit number is not annotated in the product name, but it is annotated in the product manifest as described in the [product specification document](https://sentiwiki.copernicus.eu/web/document-library#Library-S1-PDS).\nThe relationship between relative and absolute orbit depends on the unit and is given by:\nS1-A: Relative Orbit Number = mod (Absolute Orbit Number orbit - 73, 175) + 1\nS1-B: Relative Orbit Number = mod (Absolute Orbit Number orbit - 27, 175) + 1\nS1-C: Relative Orbit Number = mod (Absolute Orbit Number orbit - 172, 175) + 5\nwhere ""mod"" refers to the modulo operation.\nThe formulas can be used for ascending and descending geometries, and are valid from the moment the satellite reaches its final orbit with the 12-day repeat. This final orbit is achieved few months after the launches and before the end of In Orbit Commissioning of the sensors. The formula is then applicable to all products made available to the users.\nThe formula for S1-D will be defined during S1-D commissioning phase.\n**Naming standard for data set files**\nWithin a product folder, measurement datasets and annotation datasets follow a similar naming convention, with lower case alphanumeric characters separated by a hyphen “-”.\n**Level-0 products**', 'Document: S1 Products\nSection: S1 Products > SAR Products Overview > SAR Naming Convention\nContent:\n**Figure 4: Sentinel-1 Naming standard for all data set files in the Level-0 products**\nFor further details regarding the naming elements refer to the [Level-0 Product Format Specification](https://sentiwiki.copernicus.eu/__attachments/1673968/S1PD.SP.00110.ATSR%20-%20Sentinel-1%20Level-0%20Product%20Format%20Specifications%202023%20-%203.1...\n**Level-1 and Level-2 products**\n\n**Figure 5: Sentinel-1 Naming standard for all data set files in the Level-1 and Level-2 products**\nFor further details regarding the naming elements refer to the [Product Specification](https://sentiwiki.copernicus.eu/__attachments/1673968/S1-RS-MDA-52-7441%20-%20Sentinel-1%20Product%20Specification%202023%20-%203.14.1.pdf?inst-v=0b38ac37-4dd6-44ba-865b-d9854aa106d8) document.\n**ETAD products**\nThere is only one NetCDF file in the ETAD product, which shares the same name as the ETAD SAFE product with the appropriate extension “.nc” but without the product unique ID. The same naming scheme is applied to the XML annotation file with the file extension “.xml”.\nFor further details regarding the naming elements refer to the [ETAD Product Format Specification](https://sentiwiki.copernicus.eu/__attachments/1673968/ETAD-DLR-PS-0014%20-%20Sentinel-1%20Extended%20Timing%20Annotation%20\\(ETAD\\)%20-%20Product%20Specification%20Document%20-%201.8.pdf?inst-v=0b38ac37-4dd6-44ba-865b-d9854aa106d8) document.', 'Document: S1 Processing\nSection: S1 Processing > POD Sentinel-1 Products Specification > Products Description\nContent:\n**Category** | **Latency** | **Orbit Accuracy**\n**NRT Predicted (AUX_PREORB)** | 30 minutes | 1 m (2D RMS 1-sigma)\n**NRT (AUX_RESORB)** | 45 minutes | 10 cm (2D RMS 1-sigma)\n**STC (AUX_MOEORB)** | 31 hours | 5 cm (3D RMS 1-sigma)\n**NTC (AUX_POEORB)** | 20 days | 5 cm (3D RMS 1-sigma)\nThe timeliness and performance results of the precise orbital products are provided in the [Metrics](https://sentiwiki.copernicus.eu/web/s1-processing#S1Processing-MetricsS1-Processing-Metrics) and [Orbit Comparisons](https://sentiwiki.copernicus.eu/web/s1-processing#S1Processing-OrbitComparisonsS1-Processing-Orbit-Comparisons) section.\nAdditionally, the GNSS L1B RINEX files for Sentinel-1 are delivered on a daily basis to the CGS with a latency of 7 days. These files contain the decoded GPS observations (pseudorange and carrier phase) following the International GNSS Service (IGS) RINEX ICD. The Sentinel-1 GNSS L1B RINEX data products are made available to the user community through the ESA CDSE.\nMoreover, performing POD requires making use of the satellite attitude Quaternions files and validating the results obtained against an external reference solution. The Quaternions files and the NRT and NTC products generated by the CPOD Service are available to the user community through the ESA CDSE. It must be remarked that, at the beginning of year 2021, a Full Mission Reprocessing (FMR) was carried out on Sentinel-1 AUX_POEORB products, FMR 2021, in order to take into account the correction on the GPS antenna reference point location operationally performed on 29 to 30 July 2020 ([see this document for detailed information](https://sentiwiki.copernicus.eu/__attachments/1673968/GMV-CPOD-MEM-0052%20-%20Sentinel-1%20Full%20Mission%20Reprocessing%202021%20-%201.1.pdf?inst-v=0b38ac37-4dd6-44ba-865b-d9854aa106d8)).\nThe following table summarises the availability of all Sentinel-1 CPOD Service products routinely delivered to the CDSE:\n_Table 5: Sentinel-1 Copernicus POD Products in ESA CDSE_', 'Document: S1 Processing\nSection: S1 Processing > POD Sentinel-1 Products Specification > Products Description > Satellite Parameters for POD\nContent:\nThe Sentinel-1 mission is supported by two spacecraft, flying in the same orbital plane with a phase shift of 180º. An overall [description of the satellite](https://sentiwiki.copernicus.eu/web/s1-mission#S1-Mission-Satellite-Description) is available, showing the main instruments and the geometry of the satellites. Additionally, they are equipped with two dual frequency RUAG GPS receivers to allow POD in order to meet the stringent accuracy requirements of the mission.\n\n**Figure 14: Drawing of Sentinel-1A showing the GPS receivers [Credits: ESA]**\nFor Precise Orbit Determination processing it is of paramount importance to know in great detail the mass history of the satellite, the evolution of its centre of gravity, the manoeuvre history and the attitude information. Moreover, for GNSS based processing, the location and orientation of the antennae are required. In the case of the manoeuvre and mass history file (including the CoG position), available hereafter, a historical record is kept since the launch of the satellite:  \nFor the convenience of users, another file combining information on manoeuvres and GNSS outages for the mission is provided below:  \nPlease note that all of the files provided above contain a header that explains the format of their content.\nThe GPS Antenna absolute phase centre offset and variations (PCO/PCV) of both GPS receivers is located in this [**ANTEX file**](https://sentiwiki.copernicus.eu/__attachments/1673407/sen20_2389.atx?inst-v=0b38ac37-4dd6-44ba-865b-d9854aa106d8).', 'Document: S1 Products\nSection: S1 Products > SAR Products Overview > SAR Naming Convention\nContent:\nThe data delivered is packaged as a [SAFE folder](https://sentiwiki.copernicus.eu/web/safe-format) containing a manifest file in XML format listing general product metadata and subfolders for measurement data, annotations, previews and support files. The content is not the same for each Level product, details are available in each level’s session.\nThis section defines the naming standard for the top-level Sentinel-1 product folder. The top-level Sentinel-1 product folder name is composed of upper-case alphanumeric characters separated by an underscore “_”.\n![](https://sentiwiki.copernicus.eu/__attachments/1678045/Figure-3-Sentinel-1-Product-SAFE-Folder-N...\n_Note: ** The partial polarization products (VV, HH, HV, VH) were only processed on a limited period. Since they are not qualified, they are not expected._\nThe next table defines the naming elements and their range and is used throughout the remainder of this page as the standard for naming Sentinel-1 product folders\nFor assembled products, the product name is updated as follows:\nThe value of each naming element is included in the product, except for:\n* Start date/time which is merged by using the value from the first slice;\n* Stop date/time which is merged by using the value from the last slice; and,\n* Product unique identifier which is merged by recalculating the CRC-16 checksum on the assembled manifest file.  \n_Table 1:_\n**Name Element String** | **Name Element Description** | **Name Element Range**\n---|---|---\nMMM |  Mission Identifier.  The S1A, S1B or S1C options are used for products produced for the Sentinel-1A, the Sentinel-1B or the Sentinel-1C instrument respectively. |  Denotes the satellite and can be “S1A” “S1B” “S1C”', 'Document: S1 Processing\nSection: S1 Processing > POD Sentinel-1 Products Specification > Products Description > Orbit Comparisons\nContent:\n**Threshold** | **Percentage Fulfilment**\n**Sentinel-1A**\n1 cm | 0.21%\n2 cm | 25.95%\n3 cm | 77.23%\n5 cm | 97.46%\n10 cm | 99.70%\n##### [AUX_POEORB](https://sentiwiki.copernicus.eu/web/s1-processing#S1Processing-AUX_POEORB)\n_Sentinel-1 AUX_POEORB products – Orbit comparisons against COMB solution [3D RMS; cm] (the accuracy requirement is shown with a blue line; vertical lines indicate periods of manoeuvres or data gaps)_\n![](https://sentiwiki.copernicus.eu/__attachments/1673372/image-20240410-142601...\n**Figure 20: Sentinel-1 AUX_POEORB products – Accuracy percentiles (they are calculated from the orbit comparisons against COMB solution [3D RMS])**\n_Table 9:_\n**Product Accuracy**\n\n**Threshold** | **Percentage Fulfilment**\n**Sentinel-1A**\n3 cm | 100.00%\n5 cm | 100.00%\n10 cm | 100.00%\n20 cm | 100.00%  \n\n*  ](https://www.atlassian.com/software/confluence)', 'Document: S1 Processing\nSection: S1 Processing > POD Sentinel-1 Products Specification > Products Description > Orbit Comparisons\nContent:\nThe operational Sentinel-1 AUX_PREORB, AUX_RESORB and AUX_POEORB solutions from the CPOD Service are compared here against the combined solution (which is computed as a weighted mean of several external solutions provided by the CPOD QWG). The AUX_PREORB solution is divided into its two orbits in order to analyse the difference between the first and the second prediction.\nIn the following figures, the position accuracy of each orbit solution is shown (in 2D or 3D RMS depending on the requirement). Each figure is presented along with the distribution of the obtained accuracy metrics, where the percentiles of these metrics are calculated for different thresholds.\nThe period of time for AUX_PREORB and AUX_RESORB products correspond to the latest [Regular Service Review](https://sentiwiki.copernicus.eu/web/document-library#Library-common-docs-POD-SR). The period of the AUX_POEORB includes from the beginning of the mission. Orbit comparisons considered as outliers (i.e., those mostly generated from periods of time with manoeuvres or data gaps) have been filtered-out from the statistics shown below.\nFor AUX_PREORB and AUX_POEORB products some dispersion is quite visible due to the increased solar activity that we have suffered during the last years (see [Analysis of Solar Activity Effects on POD 2024](https://sentiwiki.copernicus.eu/__attachments/1673407/GMV-CPOD3-MEM-0013%20-%20Analysis%20of%20Solar%20Activity%20Effects%20on%20POD%202024%20-%201.1.pdf?inst-v=0b38ac37-4dd6-44ba-865b-d9854aa106d8) document for further information).\n##### AUX_PREORB (first orbit)\n_Sentinel-1 AUX_PREORB (1st orbit) products – Orbit comparisons against COMB solution [2D RMS; cm] (the accuracy requirement is shown with a blue line; vertical lines indicate periods of manoeuvres or data gaps)_\n![](https://sentiwiki.copernicus.eu/__attachments/1673372/image-20240806-142323...', 'Document: S1 Processing\nSection: S1 Processing > L1 Algorithms > ETAD processing\nContent:\n**Timing corrections for SAR imagery**\nThe raw Sentinel-1 range and azimuth timings as annotated to the Level 1 SLC products require additional corrections to deliver consistent results in repeat pass geolocation and feature analysis at the sub-pixel level. The corrections comprise the delays stemming from the Earth’s atmosphere, the direct tidal deformation of Earth’s crust caused by Sun and Moon, and the Sentinel-1 system corrections associated with the methods of the Sentinel-1 SAR-IPF when annotating the level 1 products. The corrections are summarised and distributed by the Extended Timing Annotation Dataset for Sentinel-1 (S1-ETAD). In the [Sentinel-1 ETAD Algorithm Technical Baseline Document](https://sentiwiki.copernicus.eu/__attachments/1673968/ETAD-DLR-DD-0008%20-%20Sentinel-1%20Extended%20Timing%20Annotation%20\\(ETAD\\)%20ATBD%202023%20-%202.3.pdf?inst-v=0b38ac37-4dd6-44ba-865b-d9854aa106d8) methods defining the algorithmic cores of the...\n**Overview on Processing Steps**\nThe SETAP computations are based on the sliced Sentinel-1 L1 SLC products forming a data take, which are provided to the processor along with the precise orbit ephemeris product, see Figure 8 below. Moreover, the different computational algorithms have access to their respective model data. These data are either provided by the external management layer to the processor (ECMWF numerical weather model data, TEC map data) or are part of the processor itself (global DEM, planetary ephemerides data, geoid data).']","According to the documentation, the naming convention for the Sentinel-1 Precise Orbit Ephemerides (POE) auxiliary file is as follows:

The Sentinel-1 Precise Orbit Ephemerides (POE) product is named AUX_POEORB. The ""AUX_"" prefix denotes that this is an auxiliary data product, and ""POEORB"" stands for Precise Orbit Ephemerides.

The full naming convention for the AUX_POEORB product is:

MMM_OPER_AUX_POEORB_VYYYYMMDD_YYYYMMDDTHHMMSS_YYYYMMDDTHHMMSS_0001.EOF

Where:

- MMM: Mission Identifier (S1A, S1B, or S1C)
- OPER: Indicates the product is from the operational processing
- AUX_POEORB: Product type identifier
- VYYYYMMDD: Version identifier with the product generation date
- YYYYMMDDTHHMMSS: Start date and time of the product
- YYYYMMDDTHHMMSS: Stop date and time of the product
- 0001: Product unique identifier (a CRC-16 checksum calculated on the manifest file)
- .EOF: File extension

The AUX_POEORB product contains the Precise Orbit Ephemerides for the Sentinel-1 mission, which are generated by the Copernicus Precise Orbit Determination (CPOD) Service. These products have an accuracy of around 5 cm (3D RMS 1-sigma) and are made available to users through the Copernicus Data Space Ecosystem.",The file type is AUX_POEORB. It is generated with a latency of 20 days (Non-Time Critical).,0.870138888878012,1.0,1.0,0.9989347534753206
Explain the difference between Level-1 SLC and Level-1 GRD products for Sentinel-1.,"[""Document: S1 Products\nSection: S1 Products > Level-1 Products\nContent:\nSentinel-1 Level-1 products are the baseline products for the majority of users from which higher levels are derived. From data in each acquisition mode, the Instrument Processing Facility (IPF) generates focused Level-1 Single Look Complex (SLC) products and Level-1 Ground Range Detected (GRD) products.\nSAR parameters that vary with the satellite position in orbit, such as azimuth FM rate, Doppler centroid frequency and terrain height, are periodically updated to ensure the homogeneity of the scene when processing a complete data take. Similarly, products generated from WV data can contain any number of vignettes, potentially up to an entire orbit's worth.\nAll Level-1 products are geo-referenced and time tagged with zero Doppler time at the centre of the swath. Geo-referencing is corrected for the azimuth bi-static bias by taking into account the pulse travel time delta between the centre of the swath and the range of each geo-referenced point.\nA Level-1 product can be one of the following two types:  \nGRD products are further classified by resolution (Full, High or Medium). Note that FR is only available for Stripmap mode.\n_Table 6:_\n**Acq.**\n**Mode** | **Product**\n**Type** | **Resolution**\n**Class** | **Resolution**\n**Rng x Azi [m]** | **Pixel Spacing**\n**Rng x Azi [m]** | **Num Looks**\n**Rng x Azi** | **ENL**\n---|---|---|---|---|---|---\nSM | SLC | - | 1.7x4.3 to\n3.6x4.9 | 1.5x3.6 to\n3.1x4.1 | 1x1 | 1\nGRD | FR | 9x9 | 3.5x3.5 | 2x2 | 3.7\nHR | 23x23 | 10x10 | 6x6 | 29.7\nMR | 84x84 | 40x40 | 22x22 | 398.4\nIW | SLC | - | 2.7x22 to\n3.5x22 | 2.3x14.1 | 1x1 | 1\nGRD | HR | 20x22 | 10x10 | 5x1 | 4.4\nMR | 88x87 | 40x40 | 22x5 | 81.8\nEW | SLC | - | 7.9x43 to\n15x43 | 5.9x19.9 | 1x1 | 1\nGRD | HR | 50x50 | 25x25 | 3x1 | 2.8\nMR | 93x87 | 40x40 | 6x2 | 10.7\nWV | SLC | - | 2.0x4.8\n3.1x4.8 | 1.7x4.1\n2.7x4.1 | 1x1 | 1\nGRD | MR | 52x51 | 25x25 | 13x13 | 123.7"", 'Document: S1 Mission\nSection: S1 Mission > Observation and Production Scenarios > SAR Observation Scenario\nContent:\n**Figure 22 : L2 OCN mask.**\nThe geographical areas where Sentinel-1A Level-1 SLC products are systematically generated have gradually evolved since the opening of the online data access on 3 October 2014 and have been gradually increased.\nA summary of the Sentinel-1 systematic IW production and online data access is provided hereafter:\n* For Sentinel-1A\n* Since 28.07.2015: All IW data over Land and Ice masses are available systematically as SLC\n* Since 14.04.2016: All IW data is available systematically as SLC\n* For Sentinel-1B:\n* Since 26.09.2016 (S1B data access opening): All IW data is available systematically as SLC  \nIn addition, all Sentinel-1A data acquired before 28 July 2015 and not originally processed to SLC (i.e. data acquired outside the pre-defined SLC regional areas) has been backwards processed during 2016 and made available for online data access. As a result, Level-1 SLC products are available for all Sentinel-1 data acquired in IW mode.\nThey follow the evolution maps for the TOPSAR modes SLC production scenarios from 2014.\nIW SLC EVOLUTION MAP\nThe map represents the evolution of the IW SLC production scenario with start sensing from 2014 to 2015. The IW CLS processing scenario is stabilised and can be considered fixed, unless the nominal...\n\nEW SLC evolution map.\nThe map represents the evolution of the EW SLC production scenario from 2014 to 2023.\n\nThe geographical areas where Sentinel-1 IW and EW data is systematically processed to Level-2 OCN products and made available for online data access have also evolved over time. This evolution is summarised in a series of time-tagged maps:\nIW OCN evolution map\nThe map represents the evolution of the IW OCN production scenario from 2015 to 2023.\n\nEW OCN evolution map\nThe map represents the evolution of the EW OCN production scenario from 2015 to 2023.', 'Document: S1 Products\nSection: S1 Products > Level-1 Products > ETAD Products\nContent:\n**Figure 11: ETAD NetCDF structure. Each product covers a complete Sentinel-1 data-take following the SLC product structure. The correction layers are regularly sampled 2-D grids with approximately 200 m resolution that are grouped at burst level.**\nThe product content, its rationale as well as the application to the SAR products, is detailed in the Product Definition Document. In the Product Format Specification document, only the format, the structure and the naming of the provided data files are specified.\nWith the Sentinel-1 ETAD product that contains the correction data set, any user may thus achieve precise geo-location from a Sentinel-1 standard SLC product. For details and examples on applications see the dedicated ETAD Product Definition Document.\nA [GitHub | Reader for Sentinel-1 Extended Timing Annotation Dataset](https://github.com/s1tools/s1-etad) is available to access the ETAD corrections for the Sentinel-1 SLC product.', ""Document: S1 Processing\nSection: S1 Processing > L1 Algorithms\nContent:\nThe processing steps involved to produce Level-1 data products include pre-processing, Doppler centroid estimation, single look complex focusing, and image and post-processing for generation of the SLC and GRD products as well as mode specific processing for assembling of multiple sub-swath products.\n\n**Figure 2: Level-1 Processing Flow**\nFor converting digital pixel values to radiometrically calibrated backscatter, all the required information can be found in the product. A calibration vector is included as an annotation in the product allowing simple conversion of image intensity values into sigma or gamma nought values. Further details of how to calibrate Sentinel-1 Level 1 products can be found in the '[Radiometric Calibration of S-1 Level-1 Products Generated by the S-1 IPF](https://sentiwiki.copernicus.eu/__attachments/1673968/ESA-EOPG-CSCOP-TN-0002%20-%20Sentienl-1%20Radiometric%20Calibration%20of%20Products%202015%20-%201.0.pdf?inst-v=0b38ac37-4dd6-44ba-865b-d9854aa106d8)' document."", 'Document: S1 Products\nSection: S1 Products > SAR Products Overview\nContent:\n**Figure 1: Product Slicing**\nEach product slice is a stand-alone product that can be processed independently. Slices are approximately 25 seconds in length for SM and IW and approximately 60 seconds in length for EW. Each GeoTIFF band within a product slice will be no larger than 2 GB. Since a product could contain several bands for swaths and polarisations, the overall product size could be much larger.\nMore details are available in the [Product Slicing Handling](https://sentiwiki.copernicus.eu/web/s1-processing#S1-Processing-Product-Slicing-Handling) section.\nCopernicus Sentinel -1 data products are distributed at three levels of processing:\n* [ETAD](https://sentiwiki.copernicus.eu/web/s1-products#S1-Products-ETAD-Products) - ancillary processing level  \nAll products, with the exception of Extended Timing Annotation Dataset (ETAD), are currently processed directly from the Level-0 product.\nEach mode can potentially generate Level-1 SLC, Level-1 GRD and Level-2 Ocean products. For WV mode, Level-0 products are not currently disseminated to the community. Products are designated based on their acquisition mode, product type and in the case of Level-1 GRD also its resolution. **Figure 2** shows the product family per acquisition mode.\nLevel-1 products can be one of two product types: either Single Look Complex (SLC) or Ground Range Detected (GRD), with latter being available at different resolution levels for different acquisition modes. While the Instrument Processing Facility (IPF) has the capacity to generate various GRD per mode, the current production is limited to:\n* SM: High resolution (with IPF being able to generate Full, High and Medium resolution products)\n* IW: High resolution (with IPF being able to generate High and Medium resolution products)\n* EW: Medium resolution (with IPF being able to generate High and Medium resolution products)\n* WV: No GRD is produced (with IPF being able to generate High and Medium resolution products)', 'Document: S1 Mission\nSection: S1 Mission > Observation and Production Scenarios > SAR Observation Scenario\nContent:\n* _Level-1 SLC products for all acquired Wave Mode data (active since October 2016 for Sentinel-1B and since May 2017 for Sentinel-1A)_\n* _Level-1 SLC products for all data acquired in IW mode over specific regional areas, which has evolved during the operations to cover all data acquired in IW mode_\n* _Level-1 SLC products for all data acquired in EW mode over specific regional areas (active since July 2017 for both Sentinel-1A and Sentinel-1B)_\n* _Level-2 Ocean products for all acquired Wave Mode data (active since July 2015 for Sentinel-1A and since October 2016 for Sentinel-1B)_\n* _Level-2 Ocean products for all data acquired in IW and EW mode over the area that intersects at least, 20% the Ocean Mask shown below_', 'Document: S1 Products\nSection: S1 Products > Related Production > **Sentinel-1 ARD Normalised Radar Backscatter (NRB) Product**\nContent:\n**Figure 16: Example of four Normalised Radar Backscatter (NRB) products over the MGRS grid (red) and original SLC footprint (white)**\n**Overview**\nThe Normalised Radar Backscatter (NRB) for Copernicus Sentinel-1 is a potential new S-1 core product whose protype was developed developed by ESA (with University of Jena and ACRI-ST as contractors). It is designed to be high-quality Analysis Ready Data (ARD) compliant with the CEOS ARD for Land (CARD4L) NRB specification.\nThe product aims to complement the existing family of Copernicus Sentinel-1 products, which currently contains Level-1 Single Look Complex (SLC) and Ground Range Detected (GRD) products [[1](https://sentiwiki.copernicus.eu/web/s1-products#Ref_NRB_1)], by providing a flexible and easy to use data source particularly suited for non-expert users and easily exploitable for automated time series analysis in the context of modern cloud-based analysis platforms.\nAccording to the CARD4L definition [[2](https://sentiwiki.copernicus.eu/web/s1-products#Ref_NRB_2)], the products are _“processed to a minimum set of requirements and organized into a form that allows immediate analysis with a minimum of additional user effort. These products would be resampled onto a common geometric grid (for a given product) and would provide baseline data for further interoperability both through time and with other datasets.”_\n**Description**\nThe S1-NRB product contains radiometrically terrain corrected (RTC) gamma nought backscatter (γ0) processed from Single Look Complex (SLC) Level-1A data acquired in Stripmap (SM), Interferometric Wide Swath (IW) or Extra Wide Swath (EW) mode. Each acquired polarization is stored in an individual binary image file. In addition to the actual backscatter data, annotation image datasets (e.g., local incidence angle) are included to enable better interpretation of the backscatter data as well as to convert it to sigma-nought RTC.', 'Document: S1 Mission\nSection: S1 Mission > SAR Instrument > Polarimetry\nContent:\nCopernicus Sentinel-1 can collect several different images from the same series of pulses by using its antenna to receive specific polarisations simultaneously. Copernicus Sentinel-1 is a phase-preserving dual polarisation SAR system. It can transmit a signal in either horizontal (H) or vertical (V) polarisation, and then receive in both H and V polarisations. Dual polarisation Level-1 Single Look Complex (SLC) products contain complex values. In addition to the backscatter intensity that can be measured from each single polarisation, the inter-channel phase information allows to perform enhanced analysis of backscattering properties.\nTargets on the ground have distinctive polarisation signatures reflecting different polarisations with different intensities and converting one polarisation into another. For example, volume scatterers (e.g. forest canopy) have different polarisation properties than surface scatterers (e.g. sea surface). Polarimetric techniques such as polarimetric target decomposition (eigenvector-based, model-based, ...) allow the separation of different scattering contributions and can be used to extract information about the scattering process. Dedicated dual-Pol SAR classification techniques allow improved classification of point targets and distributed target areas.\nThe following RADARSAT-2 image of Flevoland in the Netherlands shows the difference in intensities from VH (left) and VV (centre). The composite RGB (colour) image on the right was created using the VV channel for red, VH channel for green and the ratio |VV| / |VH| for blue.\n\n**Figure 8: Intensities from different polarimetric channels [Credits: MDA and CSA]**', 'Document: S1 Products\nSection: S1 Products > Level-2 Products\nContent:\n**Figure 14: Surface Radial Velocity (RVL): Doppler anomaly over Irma Hurricane (7 September 2017) - Copernicus Sentinel data (2017)**\n_Table 8: Components available from each Sentinel-1 acquisition mode. Note that inputs of L2 algorithms are internal SLC and GRD products, which can be processed with dedicated configuration, and are called SL2 and GR2, respectively._\n**Acquisition Mode** | **L2 OCN Product Component** | **Input (internal) L1 Product**\n---|---|---\nSM | OSW | SL2\nOWI | GR2\nRVL | SL2\nIW | OSW | SL2\nOWI | GR2\nRVL | SL2\nEW | OSW | SL2\nOWI | GR2\nRVL | SL2\nWV | OSW | SL2\nOWI | SL2\nRVL | SL2\nDescription of the single algorithms are available in the [S1 Level-2 Algorithms](https://sentiwiki.copernicus.eu/web/s1-processing#S1-Processing-L2-Algorithms) page.', 'Document: S1 Products\nSection: S1 Products > SAR Products Overview\nContent:\n* EW: Medium resolution (with IPF being able to generate High and Medium resolution products)\n* WV: No GRD is produced (with IPF being able to generate High and Medium resolution products)  \nThe Extended Timing Annotation Dataset (ETAD) is an auxiliary layered product which provides users with corrections to improve geometric accuracy of Sentinel-1 SLC images to centimeter levels.\nLevel-2 Ocean (OCN) products can have different components available (OSW, OWI and RVL) depending on the acquisition mode.\n![Figure ](https://sentiwiki.copernicus.eu/__attachments/1678045/Figure%202-Products-Levels-from-Modes-202...\n**Figure 2: Products Levels from Modes**\n_**Note**_**: the products marked with * are not generated in the actual operational baseline,**\n**the ones marked with ** are generated but not qualified. *** Products disseminated to expert users only**']","The key differences between Sentinel-1 Level-1 SLC and Level-1 GRD products are:

**Level-1 SLC (Single Look Complex):**
- Provides the full complex-valued radar signal, including both amplitude and phase information
- Maintains the original resolution and geometry of the SAR data
- Allows for advanced processing techniques like interferometry, polarimetry, and coherent change detection
- Has a higher spatial resolution compared to GRD products
- The resolution varies by acquisition mode:
  - Stripmap (SM): 1.7 x 4.3 m to 3.6 x 4.9 m
  - Interferometric Wide Swath (IW): 2.7 x 22 m to 3.5 x 22 m 
  - Extra Wide Swath (EW): 7.9 x 43 m to 15 x 43 m
  - Wave (WV): 2.0 x 4.8 m to 3.1 x 4.8 m

**Level-1 GRD (Ground Range Detected):**
- Provides the detected magnitude of the radar signal, without the phase information
- The data is projected to a ground range geometry, removing the inherent distortions of the SAR imaging process
- Has a lower spatial resolution compared to SLC products
- Available in different resolution classes:
  - Stripmap (SM): Full Resolution (FR, 9 x 9 m), High Resolution (HR, 23 x 23 m), Medium Resolution (MR, 84 x 84 m)
  - Interferometric Wide Swath (IW): HR (20 x 22 m), MR (88 x 87 m) 
  - Extra Wide Swath (EW): HR (50 x 50 m), MR (93 x 87 m)
  - Wave (WV): MR (52 x 51 m)
- Suitable for applications that do not require the full phase information, such as land cover mapping, change detection, and ocean monitoring

In summary, the SLC products preserve the full radar signal and are better suited for advanced SAR techniques, while the GRD products offer a lower resolution but more readily usable data for a wide range of Earth observation applications.",SLC (Single Look Complex) contains phase and amplitude information in slant range geometry. GRD (Ground Range Detected) contains only detected amplitude projected to ground range with phase information lost.,0.9626543209769582,1.0,1.0,0.9804074348155231
"List the central wavelengths and spatial resolutions for Sentinel-2 Band 2, Band 3, and Band 4.","['Document: S2 Mission\nSection: S2 Mission > Acquisition Resolutions > Spatial Resolution\nContent:\nThe spatial resolution of Sentinel-2 is dependent on the particular spectral band:\n**10 metre spatial resolution:**\n\n**Figure 14: Sentinel-2 10 m spatial resolution bands: B2 (490 nm), B3 (560 nm), B4 (665 nm) and B8 (842 nm)**\n**20 metre spatial resolution:**\n\n**Figure 15: Sentinel-2 20 m spatial resolution bands: B5 (705 nm), B6 (740 nm), B7 (783 nm), B8a (865 nm), B11 (1610 nm) and B12 (2190 nm)**\n**60 metre spatial resolution:**\n\n**Figure 16: Sentinel-2 60 m spatial resolution bands: B1 (443 nm), B9 (940 nm) and B10 (1375 nm)**', 'Document: S2 Mission\nSection: S2 Mission > Acquisition Resolutions > Spectral Resolution\nContent:\nSpectral resolution is defined as a measure of the ability of the instrument to distinguish features in the electromagnetic spectrum.\nThe 13 spectral bands of Sentinel-2 range from the Visible and Near Infra-Red (VNIR) to the Short-Wave Infra-Red (SWIR):\n* 4 x 10 metre Bands: the three classical RGB bands (Blue (~493nm), Green (560nm), and Red (~665nm)) and a Near Infra-Red (~833nm) band;\n* 6 x 20 metre Bands: 4 narrow Bands in the VNIR vegetation red edge spectral domain (~704nm,~740nm, ~783nm and ~865nm) and 2 wider SWIR bands (~1610nm and ~2190nm) for applications such as snow/ice/cloud detection, or vegetation moisture stress assessment;\n* 3 x 60 metre Bands mainly focused on cloud screening and atmospheric correction (~443nm for aerosols and ~945nm for water vapour) and cirrus detection (~1374nm).  \n**NOTE:** The Bandwidth (nm) in the Tables below is the values measured at Full Width Half Maximum (FWHM). The equivalent wavelength is the barycentre of the spectral response function, not considering the solar irradiance:', 'Document: S2 Mission\nSection: S2 Mission > Overview of Sentinel-2 Mission\nContent:\nSentinel-2 is a European wide-swath, high-resolution, multi-spectral imaging mission. The full mission specification of the twin satellites flying in the same orbit but phased at 180°, is designed to give a high revisit frequency of 5 days at the Equator.\nEach of the satellites in the Sentinel-2 mission carries a single payload: the optical [Multi-Spectral Instrument](https://sentiwiki.copernicus.eu/web/s2-mission#S2-Mission-MSI-Instrument) (MSI) that samples 13 spectral bands: four bands at 10 m, six bands at 20 m and three bands at 60 m spatial resolution. The orbital swath width is 290 km.\n\n**Figure 1: The Twin-Satellite Sentinel-2 Orbital Configuration [Credits: Astrium GmbH]**\nThe Sentinel-2 twin satellites carry on the legacy of [SPOT](https://earth.esa.int/eogateway/missions/spot) and [LANDSAT](https://landsat.gsfc.nasa.gov/) by continuing to provide similar types of image data and contributing to ongoing multispectral observations. These satellites are used to support a variety of services and applications offered by [Copernicus](https://www.copernicus.eu/en), including land management, agriculture, forestry, disaster control, humanitarian relief operations, risk mapping, and security concerns.', 'Document: S2 Mission\nSection: S2 Mission > Acquisition Resolutions\nContent:\nThe resolutions of the Sentinel-2 Mission and its payload MSI instrument are:\n1. The **temporal resolution** of a satellite in orbit is the revisit frequency of the satellite to a...\n2. The **spatial resolution** of an instrument is the _at-ground_ representation of an individual...\n3. The [**spectral resolution**](https://sentiwiki.copernicus...\n4. The **radiometric resolution** of an instrument is a determination of the incremental level of...\n5. The **swath width** of Sentinel-2 is 290 km. In comparison, the swath width of Landsat 5 TM and...', 'Document: S2 Mission\nSection: S2 Mission > Acquisition Resolutions > Spectral Resolution\nContent:\n**Figure 17: Spectral Response for the Sentinel-2 VNIR Bands**\n\n**Figure 18: Spectral Response for the Sentinel-2 SWIR Bands**', 'Document: Sentinel-2\nSection: Sentinel-2 > S2 Mission\nContent:\nThis section gives a brief description of the mission, as well as introducing the product formats available, the geophysical parameters measured, temporal, radiometric and spatial [resolutions](https://sentiwiki.copernicus.eu/web/s2-mission#S2-Mission-Acquisition-Resolutions), the frequency of [Revisit and Coverage](https://sentiwiki.copernicus.eu/web/s2-mission#S2-Mission-Geographical-Coverage) of land surfaces that forms the core of the Sentinel-2 mission, and the latitudinal limits of the coverage.', 'Document: S2 Applications\nSection: S2 Applications > Overview of Sentinel-2 Applications > Sentinel-2 band combinations for specific applications\nContent:\nThe table below reports the most common band combinations of Sentinel-2 products, which are used based on the different applications discussed above. Other possible bands combinations can be used in specific study cases. More information about the spectral characteristics and resolution of the Sentinel-2 Multispectral Instrument (MSI) is available on the [S2 Mission webpage](https://sentiwiki.copernicus.eu/web/s2-mission).\n**Table 1: Sentinel-2 band combinations**\n**Application** |  **Layers** **Band combination** | **Product type**\n---|---|---\n**True Colour** **(B4, B3, B2)** |  **False colour** (B8, B4, B3) |  **NDVI** (B8-B4) / (B8+B4) |  **False colour (urban)** (B12, B11, B4) |  **Moisture index** (B8A-B11) / (B8A+B11) |  **SWIR** (B12, B8A, B4) |  **NDWI** (B3-B8) / (B3+B8) |  **NDSI** (B3-B11) / (B3+B11) | **Scene classification (L2A only)** | **L1C** | **L2A**\nGeophysical  |  |  | ✔️ | ✔️ | ✔️ | ✔️ | ✔️ |  | ✔️ | ✔️ | ✔️\nLand Monitoring  | ✔️ | ✔️ | ✔️ | ✔️ |  |  |  |  | ✔️ | ✔️ | ✔️\nMaritime Monitoring | ✔️ |  |  | ✔️ | ✔️ |  | ✔️ |  |  | ✔️ | ✔️\nEmergency Management  | ✔️ | ✔️ | ✔️ | ✔️ | ✔️ | ✔️ |  | ✔️ |  | ✔️ | ✔️\nSecurity - SESA | ✔️ | ✔️ | ✔️ | ✔️ | ✔️ |  | ✔️ | ✔️ |  | ✔️ | ✔️\n* **True colour:** Product with natural colours that represents Earth as humans would naturally see it\n* **False colour:** The false colour composite is most commonly used to assess plant density and health, since plants reflect near infrared and green light, while they absorb red. Cities and exposed ground are grey or tan, and water appears blue or black.\n* **NDVI:** The Normalised Difference Vegetation Index (NDVI) is a simple, but effective index for quantifying green vegetation. It is a measure of the state of vegetation health based on how plants reflect light at certain wavelengths.', 'Document: S2 Applications\nSection: S2 Applications > Overview of Sentinel-2 Applications > CLMS: Copernicus Land Monitoring Service > Sentinel-2 Global Mosaic\nContent:\nThe [Sentinel-2 Global Mosaic](https://land.copernicus.eu/en/products/global-image-mosaic) (S2GM) provides Sentinel-2 surface reflectance time series composites in three spatial resolutions and from different compositing periods ranging from one day to one year. Users can tailor mosaics to their specific requirements in terms of area of interest, compositing period, included bands, file format, and metadata content.', ""Document: S2 Mission\nSection: S2 Mission > MSI Instrument\nContent:\n**Figure 9: VNIR Flight Focal Plane [Credits: Astrium SAS (France) and e2v Technologies (UK)]**\nThe design of the MSI on-board Sentinel-2 has been driven by the requirement for large swath high geometrical and spectral performance of the measurements.\nThe MSI measures the Earth's reflected radiance in 13 spectral bands from VNIR to SWIR (**Table 2**). All the details about the measured spectral responses for each band are given in the [Sentinel-2 Spectral Response Functions (S2-SRF)](https://sentiwiki.copernicus.eu/__attachments/1692737/COPE-GSEG-EOPG-TN-15-0007%20-%20Sentinel-2%20Spectral%20Response%20Functions%202024%20-%204.0.xlsx?inst-v=0b38ac37-4dd6-44ba-865b-d9854aa106d8) document.\nMore in details, the MSI consists of the following components:\n* A Three-Mirror Anastigmat (TMA) telescope with a pupil diameter equivalent to 150 mm, isostatically mounted on the platform to minimise thermo-elastic distortions. The optical design has been optimised to achieve state-of-the-art imaging quality across its very wide field of view. Its 290 km swath width is a larger swath than previous multi-spectral optical missions such as SPOT and LANDSAT. The telescope structure and the mirrors are made of silicon carbide, which provides a very high optical stability to mass ratio and minimises thermal deformation.\n* Two focal planes based on:\n* monolithic Complementary Metal Oxide Semiconductor (CMOS) detectors for VNIR\n* mercury-cadmium-telluride (MCT) detectors hybridised on a CMOS read-out circuit for SWIR (the SWIR focal plane is passively thermo-controlled at temperatures below 195 K).\n* A dichroic VNIR/SWIR beam splitter. Spectral separation in the various bands is provided by stripe filters mounted on top of the detectors.\n* Two distinct arrays of 12 detectors mounted on each focal plane covering VNIR and SWIR channels respectively. The 12 detectors on each focal plane are in a staggered configuration to cover the entire field of view."", 'Document: S2 Applications\nSection: S2 Applications > Overview of Sentinel-2 Applications > Sentinel-2 band combinations for specific applications\nContent:\n* **False Colour (urban):** This composite is used to visualise urbanized areas more clearly. Vegetation is visible in shades of green, while urbanised areas are represented by white, grey, or purple. Soils, sand, and minerals are shown in a variety of colours. Snow and ice appear as dark blue, and water as black or blue. Flooded areas are very dark blue and almost black. The composite is useful for detecting wildfires and calderas of volcanoes, as they are displayed in shades of red and yellow.\n* **Moisture Index:** The Normalised Difference Moisture Index (NDMI) is used to determine vegetation water content and monitor droughts\n* **SWIR:** Short Wave Infrared (SWIR) measurements can help scientists estimate how much water is present in plants and soil, as water absorbs SWIR wavelengths\n* **NDWI:** The Normalised Difference Water Index (NDWI) is most appropriate for water body mapping\n* **NDSI:** The Sentinel-2 Normalised Difference Snow Index (NDSI) can be used to differentiate between cloud and snow cover as snow absorbs in the short-wave infrared light, but reflects the visible light, whereas cloud is generally reflective in both wavelengths. Snow cover is represented in bright vivid blue.\n* **Scene classification:** Scene classification was developed to distinguish between cloudy pixels, clear pixels and water pixels of Sentinel-2 data and is a result of ESA’s Scene classification algorithm for Level-2A products only.']","Based on the information provided in the Sentinel-2 mission documentation, the central wavelengths and spatial resolutions for Sentinel-2 Bands 2, 3, and 4 are:

| Band | Central Wavelength (nm) | Spatial Resolution (m) |
|------|------------------------|------------------------|
| B2 (Blue) | ~493 | 10 |
| B3 (Green) | 560 | 10 |
| B4 (Red) | ~665 | 10 |

Specifically, the documentation states:

""The spatial resolution of Sentinel-2 is dependent on the particular spectral band:

**10 metre spatial resolution:**
Figure 14: Sentinel-2 10 m spatial resolution bands: B2 (490 nm), B3 (560 nm), B4 (665 nm) and B8 (842 nm)""

So Sentinel-2 Bands 2, 3, and 4 all have a 10 meter spatial resolution, with central wavelengths of approximately 493 nm (B2 Blue), 560 nm (B3 Green), and 665 nm (B4 Red).","Band 2 (Blue): ~490 nm, 10 m. Band 3 (Green): ~560 nm, 10 m. Band 4 (Red): ~665 nm, 10 m.",0.9861111110987848,1.0,1.0,0.9377422113388157
What is the revisit time of the Sentinel-2 constellation at the Equator with two satellites?,"['Document: S2 Mission\nSection: S2 Mission > Overview of Sentinel-2 Mission\nContent:\nSentinel-2 is a European wide-swath, high-resolution, multi-spectral imaging mission. The full mission specification of the twin satellites flying in the same orbit but phased at 180°, is designed to give a high revisit frequency of 5 days at the Equator.\nEach of the satellites in the Sentinel-2 mission carries a single payload: the optical [Multi-Spectral Instrument](https://sentiwiki.copernicus.eu/web/s2-mission#S2-Mission-MSI-Instrument) (MSI) that samples 13 spectral bands: four bands at 10 m, six bands at 20 m and three bands at 60 m spatial resolution. The orbital swath width is 290 km.\n\n**Figure 1: The Twin-Satellite Sentinel-2 Orbital Configuration [Credits: Astrium GmbH]**\nThe Sentinel-2 twin satellites carry on the legacy of [SPOT](https://earth.esa.int/eogateway/missions/spot) and [LANDSAT](https://landsat.gsfc.nasa.gov/) by continuing to provide similar types of image data and contributing to ongoing multispectral observations. These satellites are used to support a variety of services and applications offered by [Copernicus](https://www.copernicus.eu/en), including land management, agriculture, forestry, disaster control, humanitarian relief operations, risk mapping, and security concerns.', 'Document: S2 Mission\nSection: S2 Mission > Overview of Sentinel-2 Mission > Geographical Coverage\nContent:\nThe Sentinel-2 mission will provide systematic coverage over the following areas:\n* all continental land surfaces (including inland waters) between latitudes 56° South and 82.8° North\n* all coastal waters up to 20 km from the shore\n* all islands greater than 100 km2\n* all EU islands\n* the Mediterranean Sea\n* all closed seas (e.g. Caspian Sea).  \nIn addition, the Sentinel-2 observation scenario includes observations following member states or Copernicus Services requests (e.g. Antarctica, Baffin Bay).\n**Figures 4** illustrates the coverage foreseen for the baseline scenario of MSI acquisitions (two satellites in orbit).\n![Revisit scenario ](https://sentiwiki.copernicus.eu/__attachments/1687033/Revisit%20scenario%202025...\n**Figure 4: Coverage and revisit time for the baseline scenario of Sentinel-2 MSI acquisitions.**\nIn addition, the [Sentinel-2 extension campaign](https://sentinels.copernicus.eu/web/sentinel/-/sentinel-2a-extended-campaign-starting-march-13-2025) complements the nominal constellation operations, enhancing the revisit frequency over Europe and tropical regions of Africa and South America, frequently impacted by high cloud cover (**Figure 5**).\n![](https://sentiwiki.copernicus.eu/__attachments/1687033/figure-5...\n**Figure 5: Number of revisits for Sentinel-2A/B/C MSI in 20 days period**\nWith nominal two-satellites (Sentinel-2B/2C) operations configuration, all regular areas, indicated in green in **Figure 4** , will be revisited every five days under the same viewing conditions (i.e. viewing angles). The [Sentinel-2A extension campaign](https://sentinels.copernicus.eu/web/sentinel/-/sentinel-2a-extended-campaign-starting-march-13-2025) brings an improved revisit frequency for some areas. However, due to overlap between swaths from adjacent orbits, the revisit frequency is increased with different viewing conditions, as shown in **Figure 6**.\n![](https://sentiwiki.copernicus.eu/__attachments/1687033/figure-6...', 'Document: S2 Mission\nSection: S2 Mission > Overview of Sentinel-2 Mission > Satellite Description\nContent:\nThe Sentinel-2 mission baseline consists of two identical satellites operating together, today Sentinel-2B (launched in 2017) and Sentinel-2C (launched in 2024) that were launched using the European VEGA launcher. Each of these satellites weighs approximately 1.2 tonnes.\nAs Sentinel-2A (launched in 2015) nears the end of its operational life after a decade, the launch of Sentinel-2C was critical for continuing the Copernicus Sentinel-2 mission. Sentinel-2C was launched on September 5th, 2024, and joined the other two satellites, starting to operate alongside Sentinel-2A to ensure seamless calibration and uninterrupted data collection.\nSentinel-2C has replaced Sentinel-2A in operation on January 21st, 2025, as announced [here](https://sentinels.copernicus.eu/web/sentinel/-/precise-timing-of-transfer-of-duty-from-sentinel-2a-to-sentinel-2c-on-21-january), and Sentinel-2D will succeed Sentinel-2B. The mission will continue evolving with Sentinel-2 Next Generation, promising enhanced global measurements and continuity beyond 2035, securing essential Earth observation services.\nStarting in March 2025, Sentinel-2A is performing an [extension campaign](https://sentinels.copernicus.eu/web/sentinel/-/sentinel-2a-extended-campaign-starting-march-13-2025), exceptionally complementing the nominal two-satellites (Sentinel-2B/2C) mission constellation operations configuration. The campaign foresees the implementation of a tailored Sentinel-2A [operations scenario](https://sentiwiki.copernicus.eu/web/s2-mission#S2-Mission-Observation-Scenario).', 'Document: S2 Mission\nSection: S2 Mission > Overview of Sentinel-2 Mission > Satellite Description\nContent:\nThe two Sentinel-2 satellites in the nominal configuration operate simultaneously, phased at 180° to each other, in a sun-synchronous orbit at a mean altitude of 786 km. During the extension campaign, Sentinel-2A is located 36° away from Sentinel-2B. The position of each Sentinel-2 satellite in its orbit is measured by a dual-frequency Global Navigation Satellite System (GNSS) receiver. Orbital accuracy is maintained by a dedicated propulsion system.\nThe satellite lifespan is 7.25 years, which includes a 3 month in-orbit commissioning phase. Batteries and propellants have...\nThe Sentinel-2 satellite system was developed by an industrial consortium led by Astrium GmbH (Germany). Astrium SAS (France) is responsible for the MultiSpectral Instrument (MSI).\nThe [MSI](https://sentiwiki.copernicus.eu/web/s2-mission#S2-Mission-MSI-Instrument) works passively, by collecting sunlight reflected from the Earth. New data is acquired by the instrument as the satellite moves along its orbital path. The incoming light beam is split via a beam-splitter and focused onto two separate focal plane assemblies within the instrument; one for Visible and Near-Infra-Red (VNIR) bands and the other one for Short Wave Infra-Red (SWIR) bands. The spectral separation of each band into individual wavelengths is accomplished by stripe filters mounted on top of the detectors.', 'Document: S2 Mission\nSection: S2 Mission > Acquisition Resolutions\nContent:\nThe resolutions of the Sentinel-2 Mission and its payload MSI instrument are:\n1. The **temporal resolution** of a satellite in orbit is the revisit frequency of the satellite to a...\n2. The **spatial resolution** of an instrument is the _at-ground_ representation of an individual...\n3. The [**spectral resolution**](https://sentiwiki.copernicus...\n4. The **radiometric resolution** of an instrument is a determination of the incremental level of...\n5. The **swath width** of Sentinel-2 is 290 km. In comparison, the swath width of Landsat 5 TM and...', ""Document: S2 Mission\nSection: S2 Mission > Overview of Sentinel-2 Mission > Orbit\nContent:\nThe Sentinel-2 mission orbit is sun-synchronous. Sun-synchronous orbits are used to ensure the angle of sunlight upon the Earth's surface is consistently maintained. Apart from small seasonal variations, anchoring of the satellites orbit to the angle of the sun minimises the potential impact of shadows and levels of illumination on the ground. This ensures consistency over time and is critical in assessing time-series data.\nSentinel-2 satellites occupy the same 10-days cycle, sun-synchronous orbit, having a 786 km mean altitude, a 98.62° inclination, and a 10:30 (am) Mean Local Solar Time (MLST) at the descending node (nominal...\n_Table 1: Summary of useful orbital information for Sentinel-2 satellites:_\n**Altitude** | **Inclination** | **Period** | **Cycle** | **Ground-track deviation** | **Local Time at Descending Node**\n---|---|---|---|---|---\n786 km | 98.62 deg | 100.6 min | 10 days | +- 2 km | 10:30 hours\nOn this orbit, Sentinel-2B and Sentinel-2C are separated by 180°. During the extension campaign, Sentinel-2A is located 36° away from Sentinel-2B, as shown in **Figure 3**.\n\n**Figure 3: Distribution of Sentinel-2 satellites over the mission orbit**\nThe KML data file informing on the position of the Sentinel-2 satellites Relative Orbits for a full Cycle (143 Orbits) with a time step of 10 seconds is available:"", 'Document: S2 Mission\nSection: S2 Mission > Observation and Production Scenarios > Observation Scenario\nContent:\nThe Sentinel-2 MSI observation scenario implements a pre-defined Sentinel High Level Observation Plan (HLOP), and it is focused on delivering the observation requirements for the Copernicus services. The Sentinel HLOP can be found [here](https://sentiwiki.copernicus.eu/__attachments/1673407/COPE-S1OP-EOPG-PL-15-0020%20-%20Sentinel%20HLOP%202021%20-%203.1.pdf?inst-v=0b38ac37-4dd6-44ba-865b-d9854aa106d8).\nIn addition, the [Sentinel-2A extension campaign](https://sentinels.copernicus.eu/web/sentinel/-/sentinel-2a-extended-campaign-starting-march-13-2025) complements the nominal constellation operations, enhancing the global revisit frequency of the Sentinel-2 constellation while optimising the use of critical satellite resources. Notably, it features a consistent observation scenario over Europe for all three Sentinel-2 units and optimises the revisit frequency over the tropical regions of Africa and South America, frequently impacted by high cloud cover.\nFor more information on the mission coverage please visit the [Geographical Coverage](https://sentiwiki.copernicus.eu/web/s2-mission#S2-Mission-Geographical-Coverage) section.\nAcquisitions plans from previous years and the current ones that are implemented are available [here](https://sentiwiki.copernicus.eu/web/document-library#DocumentLibrary-AcquisitionPlansLibrary-S2-Acquisition-Plans).', 'Document: S2 Processing\nSection: S2 Processing > POD Sentinel-2 Products Specification > Satellite Parameters for POD\nContent:\nThe Sentinel-2 mission is supported by two identical spacecraft, Sentinel-2B and Sentinel-2C (previously Sentinel-2A), flying in the same orbital plane with a phase shift of 180º. An overall [description of the satellite](https://sentiwiki.copernicus.eu/web/s2-mission#Satellite-Description) is available, showing the geometry of the satellite. Additionally, they are equipped with two dual frequency RUAG GPS receivers to allow Precise Orbit Determination (POD) in order to meet the accuracy requirements of the mission.\n\n**Figure 21: Drawing of Sentinel-2A satellite showing the GPS receivers [Credits: ESA]**\nFor Precise Orbit Determination processing it is of paramount importance to know in great detail the mass history of the satellite, the evolution of its centre of gravity, the manoeuvre history and the attitude information. Moreover, for GNSS based processing, the location and orientation of the antennae are required. In the case of the manoeuvre and mass history file (including the Centre of Gravity position), available hereafter, a historical record is kept since the launch of the satellite:  \nFor the convenience of users, another file combining information on manoeuvres and GNSS outages for the mission is provided below:  \nPlease note that all of the files provided above contain a header that explains the format of their content.\nThe GPS Antenna absolute Phase Centre Offset and Variations (PCO/PCV) of both GPS receivers is located in this [**ANTEX file**](https://sentiwiki.copernicus.eu/__attachments/1673407/sen20_2389.atx?inst-v=0b38ac37-4dd6-44ba-865b-d9854aa106d8)', 'Document: S2 Applications\nSection: S2 Applications > Overview of Sentinel-2 Applications\nContent:\n[Sentinel-2](https://sentiwiki.copernicus.eu/web/sentinel-2) is a European mission equipped with a wide-swath Multispectral Instrument (MSI) to ensure a high-revisit frequency and provide high-resolution imagery to support the Copernicus programme.\nSentinel-2 data products are made available systematically and free of charge to all users, providing data for the following priority service areas.\nTo start using the data visit [CDSE browser ](https://browser.dataspace.copernicus.eu/?zoom=5&lat=50.16282&lng=20.78613&themeId=DEFAULT-THEME&visualizationUrl=U2FsdGVkX1%2B4%2BV%2FOaiXMG%2FrmYxraCDY%2F...', ""Document: S2 Mission\nSection: S2 Mission > Overview of Sentinel-2 Mission > Geographical Coverage\nContent:\n![](https://sentiwiki.copernicus.eu/__attachments/1687033/figure-6...\n**Figure 6: Number of acquisitions for Sentinel-2A/B/C MSI in 20 days period**\nDuring the [Sentinel-2A extension campaign](https://sentinels.copernicus.eu/web/sentinel/-/sentinel-2a-extended-campaign-starting-march-13-2025), Sentinel-2A is located 36° away from Sentinel-2B, ensuring that Sentinel-2A and Sentinel-2B are acquiring neighbouring relative orbits, with a 10 min time difference, generating a 'virtual' extended swath (**Figure 7**).\n![](https://sentiwiki.copernicus.eu/__attachments/1687033/image-20250425-102415...\n**Figure 7: The generated pseudo ‘extended’ swath acquisition (A and B with a 10 min acquisition gap)**\nPlease refer to the [Sentinel-2 descending orbits](https://sentiwiki.copernicus.eu/__attachments/1673423/Sentinel-2%20Descending%20Orbits%20shape%20file.zip?inst-v=0b38ac37-4dd6-44ba-865b-d9854aa106d8).""]","According to the information provided in the context:

The Sentinel-2 mission consists of a twin-satellite configuration, with the two satellites (Sentinel-2B and Sentinel-2C) flying in the same sun-synchronous orbit but phased 180° apart.

The context states that ""the full mission specification of the twin satellites flying in the same orbit but phased at 180°, is designed to give a high revisit frequency of 5 days at the Equator.""

Therefore, with the nominal two-satellite (Sentinel-2B and Sentinel-2C) configuration, the revisit time of the Sentinel-2 constellation at the Equator is 5 days.

The context also mentions that the Sentinel-2A extension campaign, which has Sentinel-2A located 36° away from Sentinel-2B, can further enhance the revisit frequency over some areas. However, the baseline revisit time at the Equator with the two-satellite nominal configuration is 5 days.",The revisit time at the Equator is 5 days with two satellites.,0.99999999999,1.0,1.0,0.9416282082372748
"For Sentinel-2 Processing Baseline 04.00, what is the value of the radiometric offset added to the Digital Numbers?","['Document: S2 Processing\nSection: S2 Processing > L1B Algorithms > Radiometric Corrections > Radiometric Offset\nContent:\nTo avoid truncation of negative values, the dynamic range of both Sentinel-2A and Sentinel-2B is shifted by a band-dependent constant radiometric offset called RADIO_ADD_OFFSET and defined in a configuration file. The new pixel value is computed as following:\nNewDN= CurrentDN - RADIO_ADD_OFFSET\nNote that in the convention used, the offset is a negative value.\nIt is important to note that:\n* the radiometric offset will have no impact on the generation of the numerical saturation value, as it will be added up after. Moreover, there will be no saturation due to this offset as the measured levels are far from the numerical saturation for Level-1B data. Indeed, for a 12-bit integer, numerical saturation is reached for a value of 4095.\n* adding an offset for Level-1B would imply that this offset should be handled by the refining and...', 'Document: S2 Processing\nSection: S2 Processing > Processing Baseline > Collection-1 Processing Baseline\nContent:\nThe Copernicus Sentinel-2 Collection-1 was generated using the Sentinel-2 historical archive to ensure consistent time series from Sentinel-2A and Sentinel-2B, with uniform PB and enhanced calibration. This process particularly focuses on improving the geometric performance of the products and their radiometry.\nAll historical data, from the launch of Sentinel-2A in 2015 until 13 December 2023 (when PB 05.10, used for the Collection-1 reprocessing, was deployed for nominal sensing operations), has been...\n**Processing baseline version** | **Acquisition dates of corresponding products** | **Content**\n---|---|---\n05.00 |  4 July 2015 – 31 December 2021 |  The improvements introduced in processing baselines up to...\n* Geometric refining using the high-quality Copernicus Digital Elevation Model (introduced in PB 03.00)\n* Harmonized radiometry after alignment of S2B on S2A (introduced with PB 04.00)\n* Most recent product format for L1C and L2A with radiometric offset, quality masks in raster format, L2A quality indicators, DOI (introduced in PB 04.00)\n* Improved L2A processing algorithms for scene classification and surface reflectance (PB 04.00 feature)\n* Compliance with the [_CEOS Analysis Ready Data_](https://ceos.org/ard/index.html) standard of the Level-2A surface reflectance product (PB 04.00 feature).  \nAdditional improvements were introduced over the baseline 04.00:\n* Use of the 30 m Copernicus Digital Elevation Model (DEM), with corresponding improvement of the geolocation performance over mountainous areas in particular. More details about the last DEM versions and how to access the data is available at <https://spacedata.copernicus.eu/collections/copernicus-digital-elevation-model> .\n* Optimization of the applicability along-time of the successive radiometric and geometric calibrations\n* Corrected quality mask for radiometric saturation\n* Identification of defective pixels from missing instrument source packets in the L2A Scene Classification layer.', 'Document: S2 Processing\nSection: S2 Processing > L1C Algorithms > Top Of Atmosphere (TOA) Reflectance Computation\nContent:\n**Equation 8: Top of Atmosphere conversion**\nWhere:\n* _CN k,NTDI_ is the equalised numeric digital count of the pixel (i,j) with NTDI, the number of Sentinel-2 TDI lines, after removing the Level-1B offset (RADIO _ADD_OFFSET) added during the Level-1B generation\n* _A k;NTDI_ is the absolute calibration coefficient\n* _E s_ is the equivalent extra-terrestrial solar spectrum and depends on the spectral response of the Sentinel-2 bands\n* _d(t)_ is the Sun-Earth distance variation and is computed based on [Orekit](https://www.researchgate.net/publication/310250345_OREKIT_AN_OPEN_SOURCE_LIBRARY_FOR_OPERATIONAL_FLIGHT_DYNAMICS_APPLICATIONS) flight dynamics library, using the Planetary and Lunar Ephemerides DE430 ([Read the full report](https://ipnpr.jpl.nasa.gov/progress_report/42-196/196C.pdf))\n* _θ s_ is the Sun zenith angle, determined at this level too. Read more in the [Computation of Sun and viewing angles](https://sentiwiki.copernicus.eu/web/s2-processing#S2Processing-ComputationofSunandviewingangles) section.  \nThe parameters _A k_ and _E s_ are provided in a [GIPP](https://sentiwiki.copernicus.eu/web/s2-processing#S2Processing-GroundImageProcessingParameters) and are also included in the metadata of the Level-1 products.\nThe solar irradiance used as reference for Sentinel-2 comes from [Thuillier 2003](https://link.springer.com/article/10.1023/A:1024048429145). Please note that Level-1C products are TOA reflectance and independent of...\n_Table 1: Sentinel 2 solar irradiance values computed from Thuillier and TSIS models for Sentinel-2A (top) and Sentinel-2B (bottom) bands._\n**S2A** | Thuillier 2003 | TSIS 2021 | (TSIS-T)/T\n---|---|---|---\nSOLAR_IRR\n(W/m2/mic) | SOLAR_IRR\n(W/m2/mic) | SOLAR_IRR\n(%)\nB01 | 1884,69 | 1906,09 | 1,14%\nB02 | 1959,66 | 1981,81 | 1,13%\nB03 | 1823,24 | 1871,03 | 2,62%\nB04 | 1512,06 | 1532,47 | 1,35%\nB05 | 1424,64 | 1412,01 | -0,89%\nB06 | 1287,61 | 1288,58 | 0,08%\nB07 | 1162,08 | 1178,38 | 1,40%\nB08 | 1041,63 | 1044,63 | 0,29%', 'Document: S2 Products\nSection: S2 Products > Level-2A Products\nContent:\n* Digital Number DN=0 remains the “NO_DATA” value\n* For a given DN in [1; 1;215-1], the L2A SR reflectance value will be:  \n**L2A_SR i = (L2A_DNi + BOA_ADD_OFFSETi) / QUANTIFICATION_VALUE**\nThe offset per spectral band and quantification values are reported in the General_Info/Product_Image_Characteristics section of the product metadata.\nLevel-2A products additionally include quality information like [Cloud Masks](https://sentiwiki.copernicus.eu/web/s2-processing#S2-Processing-Masks), Detector Footprint Masks and Quality Masks, and auxiliary [ECMWF](https://sentiwiki.copernicus.eu/web/s2-processing#S2-Processing-Auxiliary-Data-Files) and [CAMS](https://sentiwiki.copernicus.eu/web/s2-processing#S2-Processing-Auxiliary-Data-Files) data, inherited from [Level-1C products](https://sentiwiki.copernicus.eu/web/s2-products#S2-Products-L1C). Cloud and snow probabilities at 20 and 60 m resolutions from Level-2A processing are also provided.\nLevel-2A can also be generated by the User from the Level-1C product using the [Sentinel-Toolbox](https://sentiwiki.copernicus.eu/web/sentinels-toolboxes) or the [Sen2Cor](http://step.esa.int/main/third-party-plugins-2/sen2cor/) .\n_CEOS has officially assessed Sentinel-2 Level-2A Surface Reflectance (SR) products as compliant with_ [__CEOS Analysis Ready Data__](https://ceos.org/ard/index.html) _(ARD) requirements at the Threshold level. These CEOS-ARD requirements are designed to make Earth-observation data easier to use. The assessment was conducted using version 5.0 of the Product Family Specification (PFS) for Surface Reflectance._', 'Document: S2 Products\nSection: S2 Products > Level-1C Products\nContent:\nThe radiometric offset per spectral band and quantification value are reported in the General_Info/Product_Image_Characteristics section of the product metadata.\nMoreover, independent validation analysis highlighted that Sentinel-2A shows brighter TOA-reflectance than Sentinel-2B, with an average bias of 1.1% over the VNIR bands. As the Sentinel-2A reflectance is known to be close to those of other...\nLevel-1C products additionally include quality information like [Cloud Masks](https://sentiwiki.copernicus.eu/web/s2-processing#S2-Processing-Masks), Detector Footprint Masks and Quality Masks and auxiliary data like [ECMWF](https://sentiwiki.copernicus.eu/web/s2-processing#S2-Processing-Auxiliary-Data-Files) data (total column of ozone, total column of water vapour and mean sea level pressure) and [CAMS](https://sentiwiki.copernicus.eu/web/s2-processing#S2-Processing-Auxiliary-Data-Files) (Copernicus Atmosphere Monitoring Service) aerosols content information.', 'Document: S2 Processing\nSection: S2 Processing > L1B Algorithms > Radiometric Corrections > Equalisation\nContent:\n**Equation 3: Sentinel-2 dark signal uniformity**\nWhere _N m_ is the number of lines being summed, and _j_ is an index within the range `[1,6]` corresponding to the chronogram sub-cycle line number (_j_ is within `[1,6]` range for 10 m bands, `[1,3]` for 20 m bands and `[1,1]` for 60 m bands).\n_DS(p,j,b,d)_ is determined as an average of the dark signal along the columns and therefore is independent of the line variable.\n###### [Dark Signal Offset](https://sentiwiki.copernicus.eu/web/s2-processing#S2Processing-DarkSignalOffset)\nThe offset variation of dark signal is due to voltage fluctuations. To compensate for this signal, an offset for each line is computed using blind pixels located at the extremity of each detector module. The number of blind pixels depends on the band (32 blind pixels for 10 m bands, and 16 blind pixels for 20 m and 60 m bands). For each band, each detector module, each pixel _p_ and each line _l_ of the image, the offset computation is provided in **Equation 4** :', 'Document: S2 Processing\nSection: S2 Processing > Auxiliary Data Files > Digital Elevation Model\nContent:\nFor geolocation of Sentinel-2 acquisitions, and other processing steps mentioned above, a DEM is necessary. For the current Sentinel-2 processing baseline, the [Copernicus DEM - Global and European Digital Elevation Model (COP-DEM)](https://doi.org/10.5270/ESA-c5d3d65) at 30 m resolution is used.', 'Document: S2 Processing\nSection: S2 Processing > L1B Algorithms > Radiometric Corrections > Equalisation\nContent:\n**Equation 4: Sentinel-2 dark offset computation**\nWith _Nl_ and _Nr_ are the number of valid blind pixels on left and right part of the detector module for a given spectral band, _M_ is the number of useful pixels of the detector module, _λ_ is a normalisation coefficient and _Inter_Image_ is the raw image corrected from the application of the non-uniformity dark signal. _Nl_ , _Nr_ and _λ_ are provided in a [GIPP](https://sentiwiki.copernicus.eu/web/s2-processing#S2Processing-GroundImageProcessingParameters).\n##### [Blind Pixel Removal](https://sentiwiki.copernicus.eu/web/s2-processing#S2Processing-BlindPixelRemoval)\nFor each band and each detector module, blind pixels are removed from the image product.\n##### [Crosstalk Correction](https://sentiwiki.copernicus.eu/web/s2-processing#S2Processing-CrosstalkCorrection)\nCrosstalk correction, applied just after the dark signal correction, involves correcting parasitic signal at pixel level from two distinct sources: electronic and optical crosstalk.\nIn both cases, the parasitic signal of a pixel in a given band is modelled as a linear function of the signal from the other bands acquired simultaneously and at the same position across track (**Equation 5**).', 'Document: S2 Processing\nSection: S2 Processing > L1B Algorithms > Radiometric Corrections > Equalisation\nContent:\n**Equation 1: Sentinel-2 radiometric model**\nWhere:\n* _Y(p,l,b,d)_ is the raw signal of pixel _p_ , line _l_ , spectral band _b_ and detector _d_ corrected from the dark signal and from the pixel contextual offset (expressed in Least Significant Bit (LSB))\n* _X(p,l,b,d)_ is the raw signal of pixel _p_ , line _l_ , spectral band _b_ and detector _d_\n* _DS(p,j,b,d)_ , is the dark signal of the pixel _p,_ spectral band _b_ and detector _d,_ for chronogram sub-cycle line number _j_ (j is within 1 to 6)\n* _PC masked(p,l,b,d)_ is the pixel contextual offset, compensating the dark signal variation due to voltages fluctuations with temperature\n* _Z(p,l,b,d)_ is the equalised signal also corrected from non-linearity (expressed in LSB)\n* _γ(p,b,d,Y(p,l,b,d))_ is a function that compensates the non-linearity of the global response of the pixel _p_ and its relative behaviour with respect to other pixels  \nTwo different functions are required for modelling _γ (p,b,d,Y(p,l,b,d))_ :\n* a piece-wise linear (two parts: bilinear) for SWIR channels\n* a cubic (polynomial of degree 3) for VNIR channels, to have a best fit of the detector response  \nMore details on equalisation steps\n##### [Inversion of the On-board Equalisation](https://sentiwiki.copernicus.eu/web/s2-processing#S2Processing-InversionoftheOn-boardEqualisation)\nA bilinear equalisation is performed on-board for both the VNIR and SWIR channels, applied per detection line before the compression, to minimise the impact of detector photo-response non-uniformity on the compression process.\nBefore applying more reliable equalisation and further radiometric corrections, an inversion of the on-board equalisation is performed to retrieve the raw radiometry _X_ for each pixel. This is done by using the same bilinear model coefficients as used for the on-board equalisation, then adding a mean dark signal per pixel. A reverse equalised image _X_ is obtained as output.', ""Document: S2 Processing\nSection: S2 Processing > L1B Algorithms > Radiometric Corrections > Equalisation\nContent:\n**Equation 5: Sentinel-2 crosstalk correction**\nWhere _d talk_[opt|elec](b,b')_ is the coefficient of optical/electrical crosstalk generated by spectral band _b_ on band _b'_ , provided in a [GIPP](https://sentiwiki.copernicus.eu/web/s2-processing#S2Processing-GroundImageProcessingParameters).\n##### [Relative Response Correction](https://sentiwiki.copernicus.eu/web/s2-processing#S2Processing-RelativeResponseCorrection)\nRelative response correction involves correcting the pixel values for each functioning (non-defective or non-blind) pixel, to account for variations in relative response, after the dark signal has been removed. The correction applies respectively a bilinear and a three-degree polynomial function to the SWIR and VNIR channels (i.e. _γ_ in **Equation 1**).\nThe coefficients of the polynomial function are made from sun diffuser observations during calibration mode; the BRDF of the diffuser being characterised before launch. An estimation of the coefficients for each instrument is performed at the same time as the estimation of the absolute radiometric calibration, i.e. every three repeat cycles (30 days). Assuming that the response of the instrument is a cubic function (e.g. VNIR channels) of the radiance, **Equation 1** can be written as follows, to compute the equalised signal _Z_ from the raw image corrected from dark signal _Y_ :\n\n**Equation 6: Sentinel-2 equalisation correction for VNIR bands**\nIn case of the SWIR band, **Equation 1** becomes:\n\n**Equation 7: Sentinel-2 equalisation correction for SWIR bands**\nWhere _G3, G2, G1_ and _G0_ are the parameters of the cubic model and _A1, A2, Zc_ and _Zs_ are the parameters of the bilinear model.""]","According to the information provided in the context, for Sentinel-2 Processing Baseline 04.00:

The radiometric offset added to the Digital Numbers (DN) is called the RADIO_ADD_OFFSET. This offset is a band-dependent constant value that is defined in a configuration file.

Specifically, the context states:

""To avoid truncation of negative values, the dynamic range of both Sentinel-2A and Sentinel-2B is shifted by a band-dependent constant radiometric offset called RADIO_ADD_OFFSET and defined in a configuration file. The new pixel value is computed as following:
NewDN= CurrentDN - RADIO_ADD_OFFSET
Note that in the convention used, the offset is a negative value.""

So the RADIO_ADD_OFFSET is a negative value that is subtracted from the current Digital Number (CurrentDN) to obtain the new pixel value (NewDN). The exact value of this offset is defined in a configuration file and is specific to each spectral band.

The context does not provide the specific numerical values of the RADIO_ADD_OFFSET for each Sentinel-2 band. However, it clearly states that this radiometric offset is a band-dependent constant value that is used to avoid truncation of negative pixel values in the Level-1B products.",The offset is -1000 DN (Digital Numbers). It is added to allow recording of negative radiometric values without truncation.,0.9626543209769582,1.0,1.0,0.9054981212230414
Which Sentinel-2 bands are dedicated to atmospheric correction (Cirrus and Water Vapour)?,"['Document: S2 Processing\nSection: S2 Processing > L2A Algorithms > Atmospheric Correction (AC)\nContent:\nThis algorithm allows calculation of atmospherically corrected Surface Reflectance (SR) from Top Of Atmosphere (TOA) reflectance images available in Level-1C products.\nDefective, non-existent and saturated pixels are excluded from this Level-2A processing step.\nSentinel-2 Atmospheric Correction (S2AC) is based on an algorithm proposed in [Atmospheric/Topographic Correction for Satellite Imagery](https://www.rese-apps.com/pdf/atcor3_manual.pdf). The method performs atmospheric correction based on the [LIBRADTRAN radiative transfer model](https://doi.org/10.5194/acp-5-1855-2005).\nThe model is run once to generate a large LUT of sensor-specific functions (required for the AC: path radiance, direct and diffuse transmittances, direct and diffuse solar fluxes, and spherical albedo) that accounts for a wide variety of atmospheric conditions, solar geometries and ground elevations. This database is generated with a high spectral resolution (0.6 nm) and then resampled with Sentinel-2 spectral responses. This LUT is used as a simplified model...\nAll gaseous and aerosol properties of the atmosphere are either derived by the algorithm itself or fixed to an _a priori_ value.\nThe Aerosol Optical Thickness (AOT) can be derived from the images themselves above reference areas of known reflectance behaviour, preferably Dark Dense Vegetation (DDV) targets and water bodies. If no sufficiently dark reference areas can be found in the scene, an incremental threshold in the 2.2 µm band is applied (from 0.05 to 0.1 and 0.12) to identify reference areas with medium brightness...\nWater vapour retrieval over land is performed using the [Atmospheric Pre-corrected Differential Absorption (ADPA) algorithm](https://doi.org/10.1016/S0034-4257\\(98\\)00044-3), which is applied to band 8a and band 9. Band 8a is the reference...', 'Document: S2 Mission\nSection: S2 Mission > Acquisition Resolutions > Spectral Resolution\nContent:\nSpectral resolution is defined as a measure of the ability of the instrument to distinguish features in the electromagnetic spectrum.\nThe 13 spectral bands of Sentinel-2 range from the Visible and Near Infra-Red (VNIR) to the Short-Wave Infra-Red (SWIR):\n* 4 x 10 metre Bands: the three classical RGB bands (Blue (~493nm), Green (560nm), and Red (~665nm)) and a Near Infra-Red (~833nm) band;\n* 6 x 20 metre Bands: 4 narrow Bands in the VNIR vegetation red edge spectral domain (~704nm,~740nm, ~783nm and ~865nm) and 2 wider SWIR bands (~1610nm and ~2190nm) for applications such as snow/ice/cloud detection, or vegetation moisture stress assessment;\n* 3 x 60 metre Bands mainly focused on cloud screening and atmospheric correction (~443nm for aerosols and ~945nm for water vapour) and cirrus detection (~1374nm).  \n**NOTE:** The Bandwidth (nm) in the Tables below is the values measured at Full Width Half Maximum (FWHM). The equivalent wavelength is the barycentre of the spectral response function, not considering the solar irradiance:', 'Document: S2 Processing\nSection: S2 Processing > L1C Algorithms > Computation of the Masks > Cloud mask\nContent:\n**Figure 16: Absorption spectrum of water vapour with Sentinel-2 band B10**\nThis modification is applied on cirrus cloud mask and opaque cloud mask.\n##### [Snow index calculation](https://sentiwiki.copernicus.eu/web/s2-processing#S2Processing-Snowindexcalculation)\nWith the spectral criteria used for opaque cloud detection algorithm, snow is most of the time identified as opaque clouds. Snow, on mountain, is as bright as opaque clouds in bands B1 and B10. To avert these false detections, a snow index can be derived from bands B4 (665 nm) and B11 (1610...', 'Document: S2 Products\nSection: S2 Products > Level-2A Products\nContent:\nThe Level-2A product provides atmospherically corrected Surface Reflectance (SR) products from Level-1C products.\nPlease be aware that ""Surface Reflectance (SR)"" is a new term that has been introduced to replace the former one: ""Bottom of Atmosphere (BOA) reflectance.""\nEach Level-2A product is composed of 110 km x 110 km tiles in cartographic geometry (UTM/WGS84 projection). Earth is subdivided on a predefined set of tiles, defined in UTM/WGS84 projection and using a 100 km step. However, each tile has a surface of 110 km x 110 km in order to provide large overlap with the neighbouring.\nAdditional Level-2A output image products are an Aerosol Optical Thickness (AOT) map, a Water Vapour (WV) map and a Scene Classification (SCL) map. These image products, as well as the Surface Reflectance for the different spectral bands, are resampled at different spatial resolutions (10 m, 20 m or 60 m), and provided in three distinct folders:\n* 10 m: containing spectral bands 2, 3, 4 , 8, a True Colour Image (TCI) and an AOT and WVP maps resampled from 20 m.\n* 20 m: containing spectral bands 1 - 7, the bands 8A, 11 and 12, a True Colour Image (TCI), a Scene Classification (SCL) map and an AOT and WVP maps. The band B8 is omitted as B8A provides more precise spectral information.\n* 60 m: containing all the spectral bands provided in the 20 m folder, plus the band 9, a True Colour Image (TCI), a Scene Classification (SCL) map and an AOT and WVP maps. The cirrus band 10 is omitted, as it does not contain surface information.  \nL2A products were initially released as L2Ap (Pilot) products using L2A Baseline 02.07 from March 28th, 2017, onward. From mid-March 2018, the Level-2A became an operational product,...\nPlease note that starting with the Processing Baseline (PB) 04.00 (25th January 2022), the dynamic range of the Level-2A products is shifted by a band-dependent...\n* Digital Number DN=0 remains the “NO_DATA” value', ""Document: S2 Processing\nSection: S2 Processing > L2A Algorithms > Atmospheric Correction (AC)\nContent:\nCirrus detection and removal is the baseline process. Haze removal can be selected instead of cirrus removal. The cirrus detection and removal is based on the exploitation of the band 10 (1.38 µm) measurements and potential correlation of the cirrus signal at this wavelength and other...\nS2AC employs Lambert's reflectance law. Topographic effects can be corrected during the surface retrieval process using an accurate [DEM](https://sentiwiki.copernicus.eu/web/s2-processing#S2Processing-DigitalElevationModel). S2AC accounts for and assumes a constant viewing angle per tile (sub-scene). The solar zenith and azimuth angles can either be treated as constant per tile or can be specified for the tile corners with a subsequent bilinear interpolation across the scene."", 'Document: S2 Products\nSection: S2 Products > Level-1C Products\nContent:\nThe radiometric offset per spectral band and quantification value are reported in the General_Info/Product_Image_Characteristics section of the product metadata.\nMoreover, independent validation analysis highlighted that Sentinel-2A shows brighter TOA-reflectance than Sentinel-2B, with an average bias of 1.1% over the VNIR bands. As the Sentinel-2A reflectance is known to be close to those of other...\nLevel-1C products additionally include quality information like [Cloud Masks](https://sentiwiki.copernicus.eu/web/s2-processing#S2-Processing-Masks), Detector Footprint Masks and Quality Masks and auxiliary data like [ECMWF](https://sentiwiki.copernicus.eu/web/s2-processing#S2-Processing-Auxiliary-Data-Files) data (total column of ozone, total column of water vapour and mean sea level pressure) and [CAMS](https://sentiwiki.copernicus.eu/web/s2-processing#S2-Processing-Auxiliary-Data-Files) (Copernicus Atmosphere Monitoring Service) aerosols content information.', 'Document: S2 Mission\nSection: S2 Mission > Overview of Sentinel-2 Mission\nContent:\nSentinel-2 is a European wide-swath, high-resolution, multi-spectral imaging mission. The full mission specification of the twin satellites flying in the same orbit but phased at 180°, is designed to give a high revisit frequency of 5 days at the Equator.\nEach of the satellites in the Sentinel-2 mission carries a single payload: the optical [Multi-Spectral Instrument](https://sentiwiki.copernicus.eu/web/s2-mission#S2-Mission-MSI-Instrument) (MSI) that samples 13 spectral bands: four bands at 10 m, six bands at 20 m and three bands at 60 m spatial resolution. The orbital swath width is 290 km.\n\n**Figure 1: The Twin-Satellite Sentinel-2 Orbital Configuration [Credits: Astrium GmbH]**\nThe Sentinel-2 twin satellites carry on the legacy of [SPOT](https://earth.esa.int/eogateway/missions/spot) and [LANDSAT](https://landsat.gsfc.nasa.gov/) by continuing to provide similar types of image data and contributing to ongoing multispectral observations. These satellites are used to support a variety of services and applications offered by [Copernicus](https://www.copernicus.eu/en), including land management, agriculture, forestry, disaster control, humanitarian relief operations, risk mapping, and security concerns.', ""Document: S2 Mission\nSection: S2 Mission > MSI Instrument\nContent:\n**Figure 9: VNIR Flight Focal Plane [Credits: Astrium SAS (France) and e2v Technologies (UK)]**\nThe design of the MSI on-board Sentinel-2 has been driven by the requirement for large swath high geometrical and spectral performance of the measurements.\nThe MSI measures the Earth's reflected radiance in 13 spectral bands from VNIR to SWIR (**Table 2**). All the details about the measured spectral responses for each band are given in the [Sentinel-2 Spectral Response Functions (S2-SRF)](https://sentiwiki.copernicus.eu/__attachments/1692737/COPE-GSEG-EOPG-TN-15-0007%20-%20Sentinel-2%20Spectral%20Response%20Functions%202024%20-%204.0.xlsx?inst-v=0b38ac37-4dd6-44ba-865b-d9854aa106d8) document.\nMore in details, the MSI consists of the following components:\n* A Three-Mirror Anastigmat (TMA) telescope with a pupil diameter equivalent to 150 mm, isostatically mounted on the platform to minimise thermo-elastic distortions. The optical design has been optimised to achieve state-of-the-art imaging quality across its very wide field of view. Its 290 km swath width is a larger swath than previous multi-spectral optical missions such as SPOT and LANDSAT. The telescope structure and the mirrors are made of silicon carbide, which provides a very high optical stability to mass ratio and minimises thermal deformation.\n* Two focal planes based on:\n* monolithic Complementary Metal Oxide Semiconductor (CMOS) detectors for VNIR\n* mercury-cadmium-telluride (MCT) detectors hybridised on a CMOS read-out circuit for SWIR (the SWIR focal plane is passively thermo-controlled at temperatures below 195 K).\n* A dichroic VNIR/SWIR beam splitter. Spectral separation in the various bands is provided by stripe filters mounted on top of the detectors.\n* Two distinct arrays of 12 detectors mounted on each focal plane covering VNIR and SWIR channels respectively. The 12 detectors on each focal plane are in a staggered configuration to cover the entire field of view."", 'Document: S2 Applications\nSection: S2 Applications > Overview of Sentinel-2 Applications > Sentinel-2 band combinations for specific applications\nContent:\nThe table below reports the most common band combinations of Sentinel-2 products, which are used based on the different applications discussed above. Other possible bands combinations can be used in specific study cases. More information about the spectral characteristics and resolution of the Sentinel-2 Multispectral Instrument (MSI) is available on the [S2 Mission webpage](https://sentiwiki.copernicus.eu/web/s2-mission).\n**Table 1: Sentinel-2 band combinations**\n**Application** |  **Layers** **Band combination** | **Product type**\n---|---|---\n**True Colour** **(B4, B3, B2)** |  **False colour** (B8, B4, B3) |  **NDVI** (B8-B4) / (B8+B4) |  **False colour (urban)** (B12, B11, B4) |  **Moisture index** (B8A-B11) / (B8A+B11) |  **SWIR** (B12, B8A, B4) |  **NDWI** (B3-B8) / (B3+B8) |  **NDSI** (B3-B11) / (B3+B11) | **Scene classification (L2A only)** | **L1C** | **L2A**\nGeophysical  |  |  | ✔️ | ✔️ | ✔️ | ✔️ | ✔️ |  | ✔️ | ✔️ | ✔️\nLand Monitoring  | ✔️ | ✔️ | ✔️ | ✔️ |  |  |  |  | ✔️ | ✔️ | ✔️\nMaritime Monitoring | ✔️ |  |  | ✔️ | ✔️ |  | ✔️ |  |  | ✔️ | ✔️\nEmergency Management  | ✔️ | ✔️ | ✔️ | ✔️ | ✔️ | ✔️ |  | ✔️ |  | ✔️ | ✔️\nSecurity - SESA | ✔️ | ✔️ | ✔️ | ✔️ | ✔️ |  | ✔️ | ✔️ |  | ✔️ | ✔️\n* **True colour:** Product with natural colours that represents Earth as humans would naturally see it\n* **False colour:** The false colour composite is most commonly used to assess plant density and health, since plants reflect near infrared and green light, while they absorb red. Cities and exposed ground are grey or tan, and water appears blue or black.\n* **NDVI:** The Normalised Difference Vegetation Index (NDVI) is a simple, but effective index for quantifying green vegetation. It is a measure of the state of vegetation health based on how plants reflect light at certain wavelengths.', 'Document: S2 Mission\nSection: S2 Mission > Overview of Sentinel-2 Mission > Satellite Description\nContent:\nThe two Sentinel-2 satellites in the nominal configuration operate simultaneously, phased at 180° to each other, in a sun-synchronous orbit at a mean altitude of 786 km. During the extension campaign, Sentinel-2A is located 36° away from Sentinel-2B. The position of each Sentinel-2 satellite in its orbit is measured by a dual-frequency Global Navigation Satellite System (GNSS) receiver. Orbital accuracy is maintained by a dedicated propulsion system.\nThe satellite lifespan is 7.25 years, which includes a 3 month in-orbit commissioning phase. Batteries and propellants have...\nThe Sentinel-2 satellite system was developed by an industrial consortium led by Astrium GmbH (Germany). Astrium SAS (France) is responsible for the MultiSpectral Instrument (MSI).\nThe [MSI](https://sentiwiki.copernicus.eu/web/s2-mission#S2-Mission-MSI-Instrument) works passively, by collecting sunlight reflected from the Earth. New data is acquired by the instrument as the satellite moves along its orbital path. The incoming light beam is split via a beam-splitter and focused onto two separate focal plane assemblies within the instrument; one for Visible and Near-Infra-Red (VNIR) bands and the other one for Short Wave Infra-Red (SWIR) bands. The spectral separation of each band into individual wavelengths is accomplished by stripe filters mounted on top of the detectors.']","According to the information provided in the context, the Sentinel-2 mission has the following bands dedicated to atmospheric correction and cirrus detection:

Atmospheric Correction Bands:
- Band 1 (443 nm): For aerosol correction
- Band 9 (945 nm): For water vapor correction

Cirrus Detection Band:
- Band 10 (1374 nm): For cirrus cloud detection and removal

Specifically:

1. Atmospheric Correction Bands:
   - Band 1 (443 nm): This band is used for aerosol correction during the atmospheric correction process.
   - Band 9 (945 nm): This band is used for water vapor correction during the atmospheric correction process.

2. Cirrus Detection Band:
   - Band 10 (1374 nm): This band is used for the detection and removal of cirrus clouds during the atmospheric correction process.

The context states that the Sentinel-2 Atmospheric Correction (S2AC) algorithm uses Band 10 measurements to detect and remove cirrus clouds. It also mentions that the water vapor retrieval over land is performed using the Atmospheric Pre-corrected Differential Absorption (ADPA) algorithm, which is applied to Band 8a and Band 9.

So in summary, Bands 1, 9, and 10 are the dedicated atmospheric correction and cirrus detection bands for the Sentinel-2 mission, as per the information provided in the documentation.","Band 9 (945 nm) is for Water Vapour, and Band 10 (1375 nm) is for Cirrus detection. Both have 60 m resolution.",0.99999999999,1.0,1.0,0.9349086022872374
"Which Sentinel-3 instrument is responsible for measuring sea and land surface temperatures, and what is its nadir spatial resolution?","['Document: S3 SLSTR Instrument\nSection: S3 SLSTR Instrument > Instrument Specifications\nContent:\n_Table 2: Technical Characteristics of the Sentinel-3 Sea and Land Surface Temperature Radiometer Instrument_\n| **Capability** | **SLSTR Specifications**\n---|---|---\n**Swath** | Nadir view | > 1,400 km\nOblique view | > 740 km\n**Global Coverage Revisit Times** | 1 satellite (dual view) | 1.9 days (mean)\n2 satellites (dual view) | 0.9 days (mean)\n1 satellite (nadir view) | 1 day (mean)\n2 satellites (nadir view) | 0.5 day (mean)\n**Spatial Sampling interval at Sub-satellite point (km)** | VIS-SWIR | 0.5 km\nIR-Fire | 1 km\n**Spectral channel centre (µm)** | VIS | 0.554 (S1); 0.659 (S2); 0.868 (S3)\nSWIR | 1.374 (S4); 1.613 (S5); 2.25 (S6)\nMWIR/TIR | 3.742 (S7); 10.85 (S8); 12.02 (S9)\nFire 1/2 | 3.742 (F1); 10.85 (F2)\n**Radiometric Resolution** | VIS (Albedo =0.5%) | Signal-to-Noise Ratio (SNR) > 20\nSWIR (Albedo =0.5%) | Signal-to-Noise Ratio (SNR) > 20\nMWIR (T =270K) | NEΔT < 80 mK<\nTIR (T=270K) | NEΔT < 50 mK\nFire 1 (<500 K) | NEΔT < 1 K\nFire 2 (<400 K) | NEΔT < 0.5 K\n| NEΔT = Noise-Equivalent Temperature Difference\n**Radiometric Accuracy** | VIS-SWIR (Albedo = 2-100%) | < 2% (Beginning of Life)\n<5% (End of Life)\nMWIR –TIR\n(265 – 310 K) | < 0.2 K (0.1 K goal)\nFire (< 500 K) | < 3 K\n**Design Lifetime** |  | 7.5 years', ""Document: S3 SLSTR Instrument\nSection: S3 SLSTR Instrument > Overview\nContent:\nThe Sea and Land Surface Temperature Radiometer (SLSTR) is a dual-view scanning temperature radiometer, which flies in low Earth orbit (800 - 830 km altitude). There are currently two instruments in orbit, on board the Sentinel-3A and Sentinel-3B satellites. Sentinel-3 is an operational mission that is part of the Copernicus programme.\n\n**Figure 1: Artist's impression of Sentinel-3 satellite. The two curved baffles which form part of**\n**the SLSTR instrument can be seen on the underside of the satellite.**\nThe principal aim of the SLSTR instrument mission on-board Sentinel-3 is to provide a reference Land Surface Temperature and Sea Surface Temperature dataset for climate data records. SLSTR has been developed to retrieve global coverage sea surface skin temperatures with zero bias and an uncertainty of ± 0.3 K for a 5° by 5° latitude–longitude area, having a temporal stability of 0.1 K/decade. The...\nThe image below shows the major components of SLSTR, including the oblique and nadir earth views that provide it's unique dual-view capability, the on-board black body sources for in-orbit calibration of the infrared channels, and the VISCAL unit to allow on-orbit calibration at the visible-short wave infrared wavelengths."", ""Document: S3 Mission\nSection: S3 Mission > Overview of Sentinel-3 Mission\nContent:\n**Figure 1: Sentinel-3 over land and ocean. [Credits:**[**ESA**](https://www.esa.int/)**]**\nThe main objective of [Sentinel-3](http://www.esa.int/Our_Activities/Observing_the_Earth/GMES/Sentinel-3) is to measure sea surface topography, sea and land surface temperature, and ocean and land surface colour with high accuracy and reliability to support ocean forecasting systems, environmental monitoring and climate monitoring. Sentinel-3 observations also support applications based on vegetation as well as fire, inland waters (river and lake water surface height), the cryosphere (i.e., land ice and sea-ice thickness) and atmosphere. The mission definition is driven by the need for continuity in provision of ERS, ENVISAT and SPOT vegetation data, with improvements in instrument performance and coverage.\nSentinel-3A was launched on 16 February 2016 and Sentinel-3B was launched on 25 April 2018.\nSentinel-3 builds directly on the proven heritage of [ERS - Earth Online](https://earth.esa...\n* A**_Sea and Land Surface Temperature Radiometer (_**[**_SLSTR_**](https://sentiwiki.copernicus.eu/web/s3-slstr-instrument)** _)_** , based on ENVISAT's Advanced Along Track Scanning Radiometer (AATSR), to determine global Sea Surface Temperatures to an accuracy of better than 0.3 K. The SLSTR improves the along track scanning dual-view technique of AATSR and provides advanced...\n* An **_Ocean and Land Colour Instrument (_**[**_OLCI_**](https://sentiwiki.copernicus.eu/web/s3-olci-instrument)** _)_** , based on ENVISAT's Medium Resolution Imaging Spectrometer (MERIS). With 21 bands, compared to 15 bands on MERIS, a design optimised to minimise sun-glint and a resolution of 300 m over all surfaces, OLCI marks a new generation of measurements over the ocean and land. The swath of OLCI and nadir SLSTR fully overlap."", ""Document: S3 SLSTR Instrument\nSection: S3 SLSTR Instrument > Geophysical Measurements > Sea Surface Temperature\nContent:\nThe Sea Surface Temperature (SST) measurement is obtained by means of a highly accurate calibration of the three infra-red channels at 3.74, 10.85 and 12 µm (S7-S8-S9) used for correction of the water vapour atmospheric absorption...\nSST varies between -1.8°C, the temperature at which sea water freezes, and +30°C near/below the Equator, as seen in the...\n\n**Figure 14: Global SST map (September 2016) derived from Sentinel-3A/SLSTR data. Sentinel-3 maintains and extends the high-quality SST measurements of the (A)ATSR series required by Copernicus and other climate services. [Credits: EUMETSAT]**\nIt is important to note that SLSTR returns SST measurements for the ocean 'skin'. Due to the limited penetration of thermal infra-red radiation through the water column, the infra-red radiometric temperature is that of only the top few tens of micrometres. The temperature of the sea skin surface is typically a few tenths of a degree cooler than the temperature a few centimetres below. The oceanographically understood SST is a measure of the temperature in the top 10 cm.\nNote also that the primary SLSTR Level-2 product provides SST following the Group for High Resolution Sea Surface Temperature (<http://www.ghrsst.org/> ) data processing specification. As a consequence, SST is given as a single field, derived from the best performing single-coefficient SST field in any given part of the swath."", 'Document: S3 Mission\nSection: S3 Mission > Overview of Sentinel-3 Mission\nContent:\n**Figure 2: Sentinel-3 Satellite and Payloads [Credits: ESA]**\nMoreover, in order to provide continuity with SPOT VEGETATION, the [SYNERGY](https://sentiwiki.copernicus.eu/web/s3-synergy#Product-Overview) surface vegetation products, derived from synergistic and co-located measurements of [OLCI](https://sentiwiki.copernicus.eu/web/s3-olci-instrument) and [SLSTR](https://sentiwiki.copernicus.eu/web/s3-slstr-instrument) optical instruments, have been developed.\n**Mission Primary Objectives**\nSentinel-3 provides continuity of an ENVISAT-type ocean measurement capability with consistent quality, very high level of availability (>95%), high accuracy and reliability, and in a sustained operational manner including:\n* ocean, inland sea and coastal zone colour measurements to at least the level of quality of the MERIS instrument on ENVISAT\n* sea surface temperature measurements to at least the level of quality of the AATSR instrument on ENVISAT\n* sea surface topography measurements to at least the level of quality of the ENVISAT altimetry system, including an along track SAR capability of CryoSat heritage for improved measurement quality in coastal zones and over the cryosphere (i.e., sea ice and land ice) and inland water.  \nSentinel-3 provides continuity of medium resolution ENVISAT-type land measurement capability in Europe to determine land surface temperature and land surface colour.\nSentinel-3 provides, in a\nSentinel-3 provides, in a near real-time operational and timely manner, a generalised suite of high level primary geophysical products such as:\n* global coverage Sea Surface Height (SSH) for ocean and coastal areas\n* enhanced resolution SSH products in coastal zones and sea-ice regions\n* global coverage Sea Surface Temperature (SST) and sea-Ice Surface Temperature (IST)\n* global coverage ocean colour and water quality products\n* global coverage ocean surface wind speed measurements\n* global coverage significant wave height measurement', ""Document: S3 Mission\nSection: S3 Mission > Overview of Sentinel-3 Mission > Geographical Coverage > OLCI Coverage\nContent:\nOLCI scans the Earth's surface using a push-broom method. CCD arrays provide spatial sampling in the across track direction, while the satellite's motion provides scanning in the along track direction. The instrument's 68.5° field of view, nadir pointing, covers a swath width of 1 270 km at altitude from Sentinel-3...\nThe Sentinel-3 OLCI instrument has a 100% overlap with the [SLSTR](https://sentiwiki.copernicus.eu/web/s3-slstr-instrument) instrument swath.\n\n**Figure 4: Basic geometry of the OLCI, showing the fan arrangement of the five cameras that will view Earth through the calibration assembly and the off-nadir pointing of the instrument swath. The Observation Zenith Angle (OZA) is limited to a maximum of 55°. The swath is 1 270 km. The Local Solar Time (LST) of observations is indicated in the lower part of the figure.**\nOLCI's field of view allows global coverage to be provided in 2-3 days, as required by oceanographic, land and atmospheric investigations.\n_Table 2: Global coverage revisit times for OLCI optical measurements_\n| **Constellation configuration** | **Revisit at equator** | **Revisit for latitude > 30°** | **Specification**\n---|---|---|---|---\nOcean colour\n(sun-glint free, day only) | One satellite | < 3.8 days | < 2.8 days | < 2 days\nTwo satellites | < 1.9 days | < 1.4 days\nLand colour\n(day only) | One satellite | < 2.2 days | < 1.8 days | < 2 days\n\n**Figure 5: OLCI mean revisit time with a two-satellite configuration, in red 2 days are required to have revisit at equator, in blue less than 0.5 days at high latitude.**"", 'Document: S3 Altimetry Instruments\nSection: S3 Altimetry Instruments > Land and Marine responsibilities between ESA and EUMETSAT\nContent:\nThe Sentinel-3 Surface Topography Mission is jointly operated by ESA and EUMETSAT to deliver operational observation services over land and ocean surfaces. **ESA is responsible for the generation of Level-2 products covering the continental surfaces and the cryosphere, while EUMETSAT is responsible for the generation of Level-2 products covering the marine surfaces, including coastal areas**.\nIn agreement with the European Commission, a geographical “Marine/Land Mask” (MLM) has been defined to determine the coverage of the Hydro-Cryo (ESA) and Marine (EUMETSAT) products, as displayed in **Figure 1** :\n\n**Figure 1: Marine/Land mask used in operation since July 2020**\nIn all coastal zones, there is a 50 km common and shared area, where Hydro-Cryo and Marine products are both available (25 km on each side of the coastline). Hydro-Cryo and Marine products are also both available over the sea ice surface, as EUMETSAT is responsible for the polar sea level, and ESA for the sea ice freeboard. The Marine/Land Mask remains static over the time, with adjustments that can be made from one Processing Baseline to another.\n**For inland waters or cryosphere applications, ESA Hydro-Cryo Level-2 Thematic Products are recommended, whereas for any global ocean and coastal applications, the EUMETSAT MARINE Level-2 products are recommended.**\nSince September 2023 (Baseline Collection 005), ESA is generating **Level-2 Thematic Products** over Inland Waters, Sea Ice and Land Ice, to address the specific needs of the user communities. More information related to the Sentinel-3 STM Thematic Products can be found in the dedicated “products” and “processing” pages, a dedicated [**User Handbook**](https://sentiwiki.copernicus.eu/__attachments/1672112/S3MPC-STM_RP_0038%20-%20Sentinel-3%20SRAL%20Land%20User%20Handbook%202024%20-%201.2.pdf?inst-v=0b38ac37-4dd6-44ba-865b-d9854aa106d8) is also available on-line.', 'Document: S3 Altimetry Instruments\nSection: S3 Altimetry Instruments > Sentinel-3 Topography Mission Overview\nContent:\nThe main objectives of the joint ESA and EUMETSAT Sentinel-3 Topography Mission (STM) are:\n* **ESA** : The estimation of surface topography over inland waters, sea ice and land ice to support hydrological investigations (water level data assimilation in hydrological models), freeboard & sea-ice thickness determination, and the monitoring of ice sheet surface topography, respectively.\n* **EUMETSAT** : The study of ocean and coastal processes & topography including mean sea level, wave height, wind speed over the surface, sea-ice, ocean currents, Kelvin and Rossby waves, eddies and tides.  \n**The STM payload is composed of:**\n* The dual-frequency _Sentinel-3 Radar ALtimeter (SRAL)_ , an altimeter with delay-Doppler capabilities to improve the along-track resolution compared to conventional Low Resolution Mode (LRM) altimeters.\n* A _Microwave Radiometer (MWR)_ instrument, supporting SRAL in correcting the altimeter range for the excess path delay resulting from the presence of water vapour in the troposphere.\n* A _Precise Orbit Determination package_ including a Global Navigation Satellite Systems (GNSS) instrument, a Doppler Orbit determination and Radio-positioning Integrated on Satellite (DORIS) instrument and a Laser Retro-Reflector (LRR).  \n**Over continental surfaces,** the main geophysical parameters estimated are:\n* Surface topography estimations of lakes and rivers\n* Estimations of the radar freeboard over the Arctic and Antarctic sea ice. The Sea Ice Thickness derived from the freeboard estimates will be available in a near future.\n* Surface topography estimations of the Greenland and Antarctic ice sheets  \n**Over sea surfaces,** the main geophysical parameters estimated are:\n* Sea Surface Height (SSH)\n* Significant Wave Height\n* Wind Speed (calculated with the SWH and backscatter coefficient parameters)  \n**The STM payload is composed of:**', ""Document: S3 SLSTR Instrument\nSection: S3 SLSTR Instrument > Geophysical Measurements > Land Surface Temperature\nContent:\n**Figure 15: Global LST map (September 2016) derived from Sentinel-3A/SLSTR daytime data. [Credits: University of Leicester]**\nLST is a basic determinant of the terrestrial thermal behaviour, as it controls the effective radiating temperature of the Earth's surface. However, because of the extreme heterogeneity of most natural land surface, this parameter is difficult to estimate and validate. Several factors can fundamentally influence the derivation of LST including:\n* temperature variations with viewing angles\n* sub-pixel in-homogeneities in temperature and cover\n* surface spectral emissivity at the channel wavelengths\n* atmospheric temperature and humidity variations\n* clouds and large aerosol particles such as dust.  \nThe SLSTR thermal bands used for SST retrieval (the three infra-red channels S7, S8 and S9 at 3.74 µm, 10.85 µm and 12 µm) are also used to retrieve LST in the SLSTR Level-2 products. Algorithms...\nSLSTR also includes two low-gain, wide-dynamic range IR (fire and high temperature) channels (F1 and F2) designed to deliver the radiometric data necessary for the generation of quantitative active fire products ([FRP products](https://sentiwiki.copernicus.eu/web/slstr-products#S3-SLSTR-Products-L2-FRP-Products)). This prevents saturation of the thermal channels and applies to targets with an upper limit of 500°C."", 'Document: S3 Altimetry Instruments\nSection: S3 Altimetry Instruments > Land and Marine responsibilities between ESA and EUMETSAT > MWR Instrument Description\nContent:\nThe design and specifications of the Sentinel-3 MWR have been based on those of the Envisat MWR.\nThe instrument will measure brightness temperature at 23.8 GHz and 36.5 GHz covering a bandwidth of 200 MHz in each channel. The lower frequency channel is...\nConceptually, it is a balanced Dicke radiometer for brightness temperatures below the Dicke load temperature. Balancing is achieved by means of a noise injection circuit. For brightness temperatures higher than the Dicke load temperature, a conventional Dicke mode is used.\nThe radiometer employs a single offset reflector of 60 cm diameter and two separate feeds for the two channels. Calibration is achieved through a dedicated horn antenna pointing at the cold sky and the highly stable and precisely monitored internal Dicke load.\nThere are three main operational states: observation, monitoring, and calibration.\nDuring _observation_ , the radiometer is looking through the main antenna towards the Earth and, in case of a brightness temperature lower than the reference temperature, the noise injection pulse is used to retrieve this brightness temperature.\nDuring _monitoring_ , the MWR L1b monitoring parameters are computed from Level 0 monitoring parameters. The monitoring operation consists of looking through the deep sky through the sky horn, whose brightness temperature is well known. This processing is needed to monitor the level of injected noise and its stability.\nDuring _calibration_ , the level of noise injection temperature in balanced mode and the receiver gain in non-balanced mode are retrieved. In both cases, the deep sky is used as target with fixed known brightness temperatures.']","According to the provided documentation, the Sentinel-3 instrument responsible for measuring sea and land surface temperatures is the Sea and Land Surface Temperature Radiometer (SLSTR).

Specifically:

1. Instrument Responsible for Surface Temperature Measurements:
   - The SLSTR instrument on board the Sentinel-3 satellites is responsible for measuring both sea surface temperature (SST) and land surface temperature (LST).

2. SLSTR Nadir Spatial Resolution:
   - According to Table 2 in Document 1, the SLSTR instrument has a spatial sampling interval of 0.5 km at the sub-satellite point for the VIS-SWIR spectral bands.
   - For the infrared (IR) and fire channels, the spatial sampling interval is 1 km at the sub-satellite point.

In summary, the Sentinel-3 Sea and Land Surface Temperature Radiometer (SLSTR) is the instrument responsible for measuring both sea surface temperature and land surface temperature. The nadir spatial resolution of the SLSTR instrument is 0.5 km for the visible and shortwave infrared (VIS-SWIR) spectral bands, and 1 km for the infrared (IR) and fire channels.",The SLSTR (Sea and Land Surface Temperature Radiometer). Its thermal channels have a spatial resolution of 1 km at nadir.,0.9478458049751214,1.0,1.0,0.9445722305049665
"How many spectral bands does the Sentinel-3 OLCI instrument have, and what is its spectral range?","[""Document: S3 OLCI Instrument\nSection: S3 OLCI Instrument > Spectral Characterisation Data\nContent:\nIn the frame of pre-launch activities for Sentinel-3's OLCI-A&B instruments, a first version of the instrument Spectral Response Functions (SRFs) based on on-ground characterisation measurements was derived. The spectral characterisation information is provided in the following files for both A&B units with three different levels of detail:\n* **The full dataset -**[**OLCI-A**](https://sentiwiki.atlassian.net/wiki/download/attachments/295993432/S3A_OL_SRF_20160713.nc4?api=v2)**/**[**OLCI-B**](https://sentiwiki.atlassian...\nIncludes for each of the 21 OLCI-A or B spectral bands, the centre wavelength, the bandwidth and the in-band solar irradiance at individual OLCI CCD columns (corresponding to the across track dimension of the instrument swath)\n* **A subset of the dataset -**[**OLCI-A**](https://sentiwiki.copernicus.eu/__attachments/1672112/S3A_OL_SRF_20160713_subset.nc4?inst-v=0b38ac37-4dd6-44ba-865b-d9854aa106d8)**/**[**OLCI-B**](https://sentiwiki.copernicus.eu/__attachments/1672112/S3B_OL_SRF_0_20180109_subset.nc4?inst-v=0b38ac37-4dd6-44ba-865b-d9854aa106d8)\nThe same as the full file, but reduced to the spectral response functions at only three CCD columns (located at Eastern, centre, and Western part) for each module and each one of the 21 spectral bands\n* **The mean dataset -**[**OLCI-A**](https://sentiwiki.copernicus.eu/__attachments/1672112/S3A_OL_SRF_20160713_mean_rsr.nc4?inst-v=0b38ac37-4dd6-44ba-865b-d9854aa106d8)**/**[**OLCI-B**](https://sentiwiki.copernicus.eu/__attachments/1672112/S3B_OL_SRF_0_20180109_mean_rsr.nc4?inst-v=0b38ac37-4dd6-44ba-865b-d9854aa106d8)\nThe same as the full file, but reduced to a single representative (mean) spectral response function, in-band solar irradiance, bandwidth and centre wavelength per band."", 'Document: S3 OLCI Instrument\nSection: S3 OLCI Instrument > Instrument Specifications\nContent:\nThe table below shows the engineering requirements of the instrument, which have been derived from the Sentinel-3 [mission requirements](http://esamultimedia.esa.int/docs/GMES/GMES_Sentinel3_MRD_V2.0_update.pdf).\n_Table 2: Technical Characteristics of the Sentinel-3 Ocean and Land Colour Imager Instrument_\n**Swath** | 1 440 km\n---|---\n**SSI at SSP (km)** | 300 m\n**Calibration** | MERIS type calibration arrangement with spectral calibration using a doped Erbium diffuser plate, PTFE diffuser plate and dark current plate viewed approximately every 2 weeks at the South Pole ecliptic. Spare diffuser plate viewed periodically for calibration degradation monitoring\n**Detectors** | Envisat MERIS heritage back-illuminated CCD55-20 frame-transfer imaging device (780 columns by 576 row array of 22.5 µm square active elements).\n**Optical scanning design** | Push-broom sensor. Five cameras recurrent from MERIS dedicated Scrambling Window Assembly (SWA) supporting five Video Acquisition Modules (VAM) for analogue to digital conversion\n**Spectral resolution** | 1.25 nm (MERIS heritage), 21 bands.\n**Radiometric accuracy** | < 2% with reference to the sun for the 400-900 nm waveband and < 5% with reference to the sun for wavebands > 900 nm. 0.1% stability for radiometric accuracy over each orbit and 0.5% relative accuracy for the...\n**Radiometric resolution** | < 0.03 W m-2 sr-1 mm-1 (MERIS baseline)\n**Mass** | 153 kg\n**Size** | 1.3 m3\n**Design lifetime** | 7.5 years', ""Document: S3 OLCI Instrument\nSection: S3 OLCI Instrument > Spectral Characterisation Data\nContent:\nThe S3 Mission Performance Center have assessed the evolution of the spectral characteristics for both OLCI-A & B and have generated two [**Look-Up-Tables**](https://sentiwiki.copernicus.eu/__attachments/1672112/LUT.zip?inst-v=0b38ac37-4dd6-44ba-865b-d9854aa106d8) (LUTs) for enabling the calculation of the best estimate of centre wavelength, bandwidth and in-band solar irradiance for all bands and all pixels at a given absolute orbit number. Users making use of the OLCI bands 13, 14 and 15 around 760 nm, surrounding the O2-A absorption are strongly advised to apply these. It may also be important for the water vapour absorption bands 19 and 20, for the very blue Rayleigh bands 1 and 2 at 400 & 412 nm, for the chlorophyll fluorescence bands and the red-edge bands around 750 nm. The LUT's will be updated in line with the evolution and currently it is not foreseen to apply these in the operational Level-1 processing. As a consequence, only the in-band solar irradiance provided in the Level 1b data shall be used to convert L1b radiance into TOA reflectance. Please be aware that the provided LUTs are not of the same format or content as the SRFs and only replace the corresponding parameters central wavelength, FWHM and in-band irradiance. The [**Spectral Characterisation Technical Note**](https://sentiwiki.copernicus.eu/__attachments/1672112/S3MPC.SE.TN.020%20-%20OLCI%20spectral%20characterisation%202021%20-%201.1.pdf?inst-v=0b38ac37-4dd6-44ba-865b-d9854aa106d8) gives guidelines on how to use the LUTs....\n**Note:** The spectral characteristics of both OLCI-A and OLCI-B will be monitored throughout the entire mission duration and this might again lead to updates of the instrument SRFs at a later stage in the mission lifetime."", ""Document: S3 OLCI Instrument\nSection: S3 OLCI Instrument > Heritage\nContent:\nRemote sensing of ocean colour from space began in 1978 with the launch of NASA's Coastal Zone Colour Scanner (CZCS). A number of other missions have been launched and more are planned by various space agencies. The International Ocean-Colour Coordinating Group (<https://ioccg.org/resources/missions-instruments/current-ocean-colour-sensors/> ) coordinates information relating to the various missions and instruments.\nThe key mission driver for the Sentinel-3 OLCI instrument is continuity of the ENVISAT MERIS instrument capability.\nThe Sentinel-3 [OLCI instrument](https://sentiwiki.copernicus.eu/web/s3-olci-instrument#S3-OLCI-Instrument-Description) is based on the opto-mechanical and imaging design of ENVISAT MERIS. The instrument is a quasi-autonomous, self-contained, visible push-broom imaging spectrometer and incorporates the following significant improvements when compared to MERIS:\n* an increase in the number of spectral bands (from 15 to 21)\n* improved SNR and a 14-bit analogue to digital converter\n* improved long-term radiometric stability\n* mitigation of sun-glint contamination by tilting cameras in a westerly direction\n* complete coverage over both land and ocean at 300 m full resolution (for MERIS the reduced resolution was on-board computed)\n* improved instrument characterisation including stray light, camera overlap and calibration diffusers\n* improved coverage of the global ocean (<4 days), land (<3 days with one satellite, ignoring the effect of clouds), where MERIS is approximately 15 days\n* improved data delivery time of 3 hours for Level-1B and Level-2 products\n* 100% overlap with [SLSTR](https://sentiwiki.copernicus.eu/web/s3-slstr-instrument#S3-SLSTR-Instrument-Description) instrument swath and simultaneous acquisitions facilitating the use of OLCI and SLSTR in synergy."", ""Document: S3 OLCI Instrument\nSection: S3 OLCI Instrument > Geophysical Measurements\nContent:\nOcean colour sensors are designed to retrieve the spectral distribution of up-welling radiance just above the sea surface (the water-leaving radiance) that is used to estimate a number of geophysical parameters through the application of specific bio-optical algorithms. Atmospheric correction for ocean colour data is challenging, as only about 4% of the radiation measured by a satellite instrument originates from the water surface, and sensors require high Signal to Noise Ratios (SNR), particularly for the ‘blue' bands (approximately 400 nm). Ocean colour instrument design must therefore incorporate extremely sensitive and stable radiometry, dedicated on-board calibration and a large number of spectral channels.\nThe [OLCI instrument](https://sentiwiki.copernicus.eu/web/s3-olci-instrument#S3-OLCI-Instrument-Description) is a programmable, medium-spectral resolution, imaging spectrometer operating in the solar reflective spectral range (400 nm to 1 040nm).\nThe instrument scans the Earth's surface using the push-broom method. CCD arrays provide spatial sampling in the across track direction, while the satellite's motion provides scanning in the along track direction. The OLCI swath is tilted 12.6° westwards to mitigate the negative impact of sun glint contamination. OLCI is designed to...\nThe scene is imaged simultaneously across the entire spectral range, through a dispersing system, onto the CCD array. Signals from the CCD pass through several processing steps to achieve the required image quality. These CCD processing steps include dumping of spectral information from unwanted bands and spectral integration to obtain the required bandwidth. On-board analogue electronics perform pre-amplification of the signal, correlated double sampling and gain adjustment before digitalisation. The on-board digital electronics system has two major functions: it completes the spectral integration and it performs offset and gain corrections in full processed mode."", ""Document: S3 Mission\nSection: S3 Mission > Overview of Sentinel-3 Mission > Geographical Coverage\nContent:\nFollowing ENVISAT's AATSR instrument, the SLSTR instrument is a conical scanning imaging radiometer employing the along track scanning dual view technique. SLSTR provides data continuity with respect to these previous missions but with a substantial improvement due to its higher swaths (740 km in dual view and 1400 km in single view).\nThe OLCI push-broom instrument swath is 1270 km. The OLCI swath is not centred at nadir (as in the MERIS design) but is tilted 12.6° westwards to mitigate the negative impact of sun-glint contamination. Fully overlapping with...\nThe altimeter instrument (SRAL) does not have a swath like the Sentinel-3 OLCI and SLTSR instruments. Across-track, it receives a single measurement of the range (no image) every time a pulse is emitted.\nData is acquired systematically based on a pre-set nominal mission scenario, as defined in the Sentinel High Level Operations Plan (HLOP):\n* Operations for OLCI and the visible channels of the SLSTR are based on specific solar illumination conditions (SZA < 80 deg)\n* MWR acquires data over the whole orbit\n* SRAL operates in 100% SAR mode  \n\n**Figure 3: Sentinel-3 Ground Track Resolution [Credits: ESA]**"", ""Document: S3 Mission\nSection: S3 Mission > Overview of Sentinel-3 Mission > Geographical Coverage > OLCI Coverage\nContent:\nOLCI scans the Earth's surface using a push-broom method. CCD arrays provide spatial sampling in the across track direction, while the satellite's motion provides scanning in the along track direction. The instrument's 68.5° field of view, nadir pointing, covers a swath width of 1 270 km at altitude from Sentinel-3...\nThe Sentinel-3 OLCI instrument has a 100% overlap with the [SLSTR](https://sentiwiki.copernicus.eu/web/s3-slstr-instrument) instrument swath.\n\n**Figure 4: Basic geometry of the OLCI, showing the fan arrangement of the five cameras that will view Earth through the calibration assembly and the off-nadir pointing of the instrument swath. The Observation Zenith Angle (OZA) is limited to a maximum of 55°. The swath is 1 270 km. The Local Solar Time (LST) of observations is indicated in the lower part of the figure.**\nOLCI's field of view allows global coverage to be provided in 2-3 days, as required by oceanographic, land and atmospheric investigations.\n_Table 2: Global coverage revisit times for OLCI optical measurements_\n| **Constellation configuration** | **Revisit at equator** | **Revisit for latitude > 30°** | **Specification**\n---|---|---|---|---\nOcean colour\n(sun-glint free, day only) | One satellite | < 3.8 days | < 2.8 days | < 2 days\nTwo satellites | < 1.9 days | < 1.4 days\nLand colour\n(day only) | One satellite | < 2.2 days | < 1.8 days | < 2 days\n\n**Figure 5: OLCI mean revisit time with a two-satellite configuration, in red 2 days are required to have revisit at equator, in blue less than 0.5 days at high latitude.**"", ""Document: S3 Mission\nSection: S3 Mission > Overview of Sentinel-3 Mission\nContent:\n**Figure 1: Sentinel-3 over land and ocean. [Credits:**[**ESA**](https://www.esa.int/)**]**\nThe main objective of [Sentinel-3](http://www.esa.int/Our_Activities/Observing_the_Earth/GMES/Sentinel-3) is to measure sea surface topography, sea and land surface temperature, and ocean and land surface colour with high accuracy and reliability to support ocean forecasting systems, environmental monitoring and climate monitoring. Sentinel-3 observations also support applications based on vegetation as well as fire, inland waters (river and lake water surface height), the cryosphere (i.e., land ice and sea-ice thickness) and atmosphere. The mission definition is driven by the need for continuity in provision of ERS, ENVISAT and SPOT vegetation data, with improvements in instrument performance and coverage.\nSentinel-3A was launched on 16 February 2016 and Sentinel-3B was launched on 25 April 2018.\nSentinel-3 builds directly on the proven heritage of [ERS - Earth Online](https://earth.esa...\n* A**_Sea and Land Surface Temperature Radiometer (_**[**_SLSTR_**](https://sentiwiki.copernicus.eu/web/s3-slstr-instrument)** _)_** , based on ENVISAT's Advanced Along Track Scanning Radiometer (AATSR), to determine global Sea Surface Temperatures to an accuracy of better than 0.3 K. The SLSTR improves the along track scanning dual-view technique of AATSR and provides advanced...\n* An **_Ocean and Land Colour Instrument (_**[**_OLCI_**](https://sentiwiki.copernicus.eu/web/s3-olci-instrument)** _)_** , based on ENVISAT's Medium Resolution Imaging Spectrometer (MERIS). With 21 bands, compared to 15 bands on MERIS, a design optimised to minimise sun-glint and a resolution of 300 m over all surfaces, OLCI marks a new generation of measurements over the ocean and land. The swath of OLCI and nadir SLSTR fully overlap."", 'Document: S3 OLCI Instrument\nSection: S3 OLCI Instrument > Heritage\nContent:\nOLCI bands are optimised to measure ocean colour over open ocean and coastal zones. A new channel at 1.02 μm has been included to improve atmospheric and aerosol correction capabilities. Two additional...\nThe OLCI swath is not centred at nadir (as in the MERIS design) but the whole field-of-view is shifted across track by 12.6° away from the sun to minimise the impact of sun glint (sun glint contamination affects more than...\n_Table 1: OLCI specification bands, Meris heritage in cyan, additional bands in yellow_\n**Band #** | **λ center** | **Width** | **Lmin** | **Lref** | **Lsat** | **SNR @ Lref**\n---|---|---|---|---|---|---\n**nm** | **nm** | **W/(m 2.sr.μm)** | **W/(m 2.sr.μm)** | **W/(m 2.sr.μm)**\nOa1 | 400 | 15 | 21.60 | 62.95 | 413.5 | 2188\nOa2 | 412.5 | 10 | 25.93 | 74.14 | 501.3 | 2061\nOa3 | 442.5 | 10 | 23.96 | 65.61 | 466.1 | 1811\nOa4 | 490 | 10 | 19.78 | 51.21 | 483.3 | 1541\nOa5 | 510 | 10 | 17.45 | 44.39 | 449.6 | 1488\nOa6 | 560 | 10 | 12.73 | 31.49 | 524.5 | 1280\nOa7 | 620 | 10 | 8.86 | 21.14 | 397.9 | 997\nOa8 | 665 | 10 | 7.12 | 16.38 | 364.9 | 883\nOa9 | 673.25 | 7.5 | 6.87 | 15.70 | 443.1 | 707\nOa10 | 681.25 | 7.5 | 6.65 | 15.11 | 350.3 | 745\nOa11 | 708.75 | 10 | 5.66 | 12.73 | 332.4 | 785\nOa12 | 753.75 | 7.5 | 4.70 | 10.33 | 377.7 | 605\nOa13 | 761.25 | 2.5 | 2.53 | 6.09 | 369.5 | 232\nOa14 | 764.375 | 3.75 | 3.00 | 7.13 | 373.4 | 305\nOa15 | 767.5 | 2.5 | 3.27 | 7.58 | 250.0 | 330\nOa16 | 778.85 | 15 | 4.22 | 9.18 | 277.5 | 812\nOa17 | 865 | 20 | 2.88 | 6.17 | 229.5 | 666\nOa18 | 885 | 10 | 2.80 | 6.00 | 281.0 | 395\nOa19 | 900 | 10 | 2.05 | 4.73 | 237.6 | 308\nOa20 | 940 | 20 | 0.94 | 2.39 | 171.7 | 203\nOa21 | 1020 | 40 | 1.81 | 3.86 | 163.7 | 152\nSource, Credit: <http://www.sciencedirect.com/science/article/pii/S0034425712000685> , C.Donlon et al.', 'Document: S3 SLSTR Instrument\nSection: S3 SLSTR Instrument > Spectral Response Function Data\nContent:\nThe spectral response function of each SLSTR band was measured in the lab pre-launch. The files accessed by the links below contain the measured spectral responses of the nine standard channels S1 - S9 in the focal plane of the SLSTR FM02 instrument on board the Sentinel-3A satellite, and the SLSTR PFM instrument on board the Sentinel-3B satellite.  \nThe responses of the fire channels F1 and F2 are identical to the responses of standard channels S7 and S8. The responses are derived from measurements taken during spectral calibration campaigns conducted...\nThe results of those measurements are described in these technical notes:\n* [SLSTR A FPA Spectral Calibration](https://sentinels.copernicus.eu/documents/247904/322305/SLSTR+Spectral+Calibration+Function) (Please note that while this document is titled as ""SLSTR B"" it does cover the instrument aboard Sentinel-3A)  \n\n*  ](https://www.atlassian.com/software/confluence)']","According to the documentation, the Sentinel-3 OLCI (Ocean and Land Colour Instrument) has the following spectral characteristics:

Number of Spectral Bands:
- OLCI has 21 spectral bands.

Spectral Range:
- The OLCI instrument operates in the solar reflective spectral range from 400 nm to 1040 nm.

Detailed Spectral Band Information:
The OLCI instrument has the following 21 spectral bands:

| Band # | Center Wavelength (nm) | Bandwidth (nm) |
|--------|------------------------|----------------|
| Oa1    | 400                    | 15             |
| Oa2    | 412.5                  | 10             |
| Oa3    | 442.5                  | 10             |
| Oa4    | 490                    | 10             |
| Oa5    | 510                    | 10             |
| Oa6    | 560                    | 10             |
| Oa7    | 620                    | 10             |
| Oa8    | 665                    | 10             |
| Oa9    | 673.25                 | 7.5            |
| Oa10   | 681.25                 | 7.5            |
| Oa11   | 708.75                 | 10             |
| Oa12   | 753.75                 | 7.5            |
| Oa13   | 761.25                 | 2.5            |
| Oa14   | 764.375                | 3.75           |
| Oa15   | 767.5                  | 2.5            |
| Oa16   | 778.85                 | 15             |
| Oa17   | 865                    | 20             |
| Oa18   | 885                    | 10             |
| Oa19   | 900                    | 10             |
| Oa20   | 940                    | 20             |
| Oa21   | 1020                   | 40             |

So in summary, the Sentinel-3 OLCI instrument has 21 spectral bands covering the wavelength range from 400 nm to 1040 nm.",OLCI has 21 spectral bands covering the spectral range from 400 nm to 1020 nm.,0.9999999999888889,1.0,1.0,0.9485885328870384
Does the Sentinel-3 SLSTR instrument have a wider or narrower swath than the OLCI instrument?,"[""Document: S3 Mission\nSection: S3 Mission > Overview of Sentinel-3 Mission > Geographical Coverage\nContent:\nFollowing ENVISAT's AATSR instrument, the SLSTR instrument is a conical scanning imaging radiometer employing the along track scanning dual view technique. SLSTR provides data continuity with respect to these previous missions but with a substantial improvement due to its higher swaths (740 km in dual view and 1400 km in single view).\nThe OLCI push-broom instrument swath is 1270 km. The OLCI swath is not centred at nadir (as in the MERIS design) but is tilted 12.6° westwards to mitigate the negative impact of sun-glint contamination. Fully overlapping with...\nThe altimeter instrument (SRAL) does not have a swath like the Sentinel-3 OLCI and SLTSR instruments. Across-track, it receives a single measurement of the range (no image) every time a pulse is emitted.\nData is acquired systematically based on a pre-set nominal mission scenario, as defined in the Sentinel High Level Operations Plan (HLOP):\n* Operations for OLCI and the visible channels of the SLSTR are based on specific solar illumination conditions (SZA < 80 deg)\n* MWR acquires data over the whole orbit\n* SRAL operates in 100% SAR mode  \n\n**Figure 3: Sentinel-3 Ground Track Resolution [Credits: ESA]**"", 'Document: S3 Mission\nSection: S3 Mission > Overview of Sentinel-3 Mission > Geographical Coverage > SLSTR Coverage\nContent:\nThe SLSTR uses two independent scan chains each including a separate scan mirror. While more complex than the single scan system employed by the ATSR instrument, this configuration especially increases instrument swath coverage.\n* Oblique view swath: ~ 740 km\n* Nadir view swath: ~ 1 400 km.  \nThe nadir swath is asymmetrical with respect to the nadir point to provide identical and contemporaneous coverage with [OLCI](https://sentiwiki.copernicus.eu/web/s3-olci-instrument) ocean/land colour measurements.\n\n**Figure 6: Outline sketch of the Sentinel-3 SLSTR instrument viewing geometry highlighting the asymmetric nadir swath with respect to the nadir point**\nFollowing a trade-off analysis between topography and optical mission requirements, the choice of orbit for Sentinel-3 is a sun-synchronous orbit at 814.5 km altitude (14 + 7/27 revolutions per day) with a local equatorial crossing time of 10:00 am....\nThe mean global coverage revisit time for dual view SLSTR observations is 1.9 days at the equator (one operational spacecraft) or 0.9 days (in constellation with a 180°...\n_Table 3: Global coverage revisit times for SLSTR optical measurements_\n| **Constellation configuration** | **Revisit at equator** | **Revisit for latitude > 30°** | **Specification**\n---|---|---|---|---\nSLSTR dual view (day and night) | One satellite | < 1.8 days | < 1.5 days | < 4 days\nTwo satellites | < 0.9 days | < 0.8 days |\n\n**Figure 7: SLSTR Mean Revisit Time with Two-Satellite Configuration**', ""Document: S3 Mission\nSection: S3 Mission > Overview of Sentinel-3 Mission > Geographical Coverage > OLCI Coverage\nContent:\nOLCI scans the Earth's surface using a push-broom method. CCD arrays provide spatial sampling in the across track direction, while the satellite's motion provides scanning in the along track direction. The instrument's 68.5° field of view, nadir pointing, covers a swath width of 1 270 km at altitude from Sentinel-3...\nThe Sentinel-3 OLCI instrument has a 100% overlap with the [SLSTR](https://sentiwiki.copernicus.eu/web/s3-slstr-instrument) instrument swath.\n\n**Figure 4: Basic geometry of the OLCI, showing the fan arrangement of the five cameras that will view Earth through the calibration assembly and the off-nadir pointing of the instrument swath. The Observation Zenith Angle (OZA) is limited to a maximum of 55°. The swath is 1 270 km. The Local Solar Time (LST) of observations is indicated in the lower part of the figure.**\nOLCI's field of view allows global coverage to be provided in 2-3 days, as required by oceanographic, land and atmospheric investigations.\n_Table 2: Global coverage revisit times for OLCI optical measurements_\n| **Constellation configuration** | **Revisit at equator** | **Revisit for latitude > 30°** | **Specification**\n---|---|---|---|---\nOcean colour\n(sun-glint free, day only) | One satellite | < 3.8 days | < 2.8 days | < 2 days\nTwo satellites | < 1.9 days | < 1.4 days\nLand colour\n(day only) | One satellite | < 2.2 days | < 1.8 days | < 2 days\n\n**Figure 5: OLCI mean revisit time with a two-satellite configuration, in red 2 days are required to have revisit at equator, in blue less than 0.5 days at high latitude.**"", 'Document: S3 Mission\nSection: S3 Mission > Overview of Sentinel-3 Mission > Geographical Coverage > SYNERGY Coverage\nContent:\nGiven that SYNERGY products are computed from [OLCI](https://sentiwiki.copernicus.eu/web/s3-olci-instrument) Level-1B and [SLSTR](https://sentiwiki.copernicus.eu/web/s3-slstr-instrument) Level-1B data (including nadir and oblique views), SYNERGY swath coverage corresponds to the common part of the OLCI and SLSTR nadir view swaths for the daylight part of the Sentinel-3 orbit, i.e. the entire OLCI swath: ~1 270 km (see figure below).\n\n**Figure 12: View of OLCI and SLSTR swath coverage and sampling geometry, in blue SLSTR oblique view (740 km) and nadir view (1 400 km), in red OLCI (1 270 km) [Credits: ESA]**\nAs a result, areas of the SLSTR nadir and oblique view Level-1B images not covered by the OLCI image, are rejected by cutting the images in the along-track and across-track directions. The daylight part of the orbit is defined for OLCI as the part of the orbit, where the sun zenith angle at satellite ground track is lower than 80°.\nThe VGP products cover latitude ranging from 56°S to 75°N (to be VEGETATION-like product).\nThe mean global coverage revisit time is based on the longest revisit time of the two instruments, OLCI and SLSTR. It is less than 2 days at the equator with two operational satellites.', 'Document: S3 SLSTR Instrument\nSection: S3 SLSTR Instrument > Heritage\nContent:\n**Figure 13:**\nFollowing AATSR/Envisat, the [SLSTR instrument](https://sentiwiki.copernicus.eu/web/s3-slstr-instrument) is a conical scanning imaging radiometer employing the along track scanning dual view technique to provide robust atmospheric correction over a dual-view swath. The instrument includes channels in the visible (VIS), thermal (TIR) and short wave (SWIR) infra-red spectrum.\nThe SLSTR design incorporates the basic functionality of AATSR, with the addition of some new, more advanced, features. These include wider swath coverage which completely overlaps the OLCI swath, more spectral bands, and a spatial resolution of 0.5 km for visible and SWIR bands. Unlike AATSR which had a forward and nadir viewing configuration,...\nSLSTR provides equivalent or better performance (see comparative table below) when compared to its predecessors in the following ways:\n* Increase of the dual view swath width from 500 to 740 km centred on the sub-satellite track to give a mean global coverage revisit time at the equator of 1.9 days (one spacecraft) or 0.9 days (two spacecraft).\n* Enlarged single view swath width of 1470 km providing a mean global coverage revisit time at the equator of 1 day (one spacecraft) or half a day (two spacecraft).\n* An on-ground resolution of 0.5 km at nadir (instead of 1 km) for all VIS and SWIR channels. Radiance measurements from these...\n* Two added channels (at wavelengths of 2.25 and 1.375 microns) in the SWIR band to allow improved cloud and aerosol detection to give more...\n* Two dedicated channels for fire and high temperature event monitoring at 1 km resolution (by extending the dynamic range of the 3.7 μm channel and including dedicated detectors at 10.8 μm that are capable of detecting fires at...\n* A mission design lifetime of 7.5 years which is higher that of earlier instruments.  \n_Table 1: Comparison of SLSTR specification with respect to previous AATSR and ATSR-1/2 instrument performance_', 'Document: S3 OLCI Instrument\nSection: S3 OLCI Instrument > Instrument Specifications\nContent:\nThe table below shows the engineering requirements of the instrument, which have been derived from the Sentinel-3 [mission requirements](http://esamultimedia.esa.int/docs/GMES/GMES_Sentinel3_MRD_V2.0_update.pdf).\n_Table 2: Technical Characteristics of the Sentinel-3 Ocean and Land Colour Imager Instrument_\n**Swath** | 1 440 km\n---|---\n**SSI at SSP (km)** | 300 m\n**Calibration** | MERIS type calibration arrangement with spectral calibration using a doped Erbium diffuser plate, PTFE diffuser plate and dark current plate viewed approximately every 2 weeks at the South Pole ecliptic. Spare diffuser plate viewed periodically for calibration degradation monitoring\n**Detectors** | Envisat MERIS heritage back-illuminated CCD55-20 frame-transfer imaging device (780 columns by 576 row array of 22.5 µm square active elements).\n**Optical scanning design** | Push-broom sensor. Five cameras recurrent from MERIS dedicated Scrambling Window Assembly (SWA) supporting five Video Acquisition Modules (VAM) for analogue to digital conversion\n**Spectral resolution** | 1.25 nm (MERIS heritage), 21 bands.\n**Radiometric accuracy** | < 2% with reference to the sun for the 400-900 nm waveband and < 5% with reference to the sun for wavebands > 900 nm. 0.1% stability for radiometric accuracy over each orbit and 0.5% relative accuracy for the...\n**Radiometric resolution** | < 0.03 W m-2 sr-1 mm-1 (MERIS baseline)\n**Mass** | 153 kg\n**Size** | 1.3 m3\n**Design lifetime** | 7.5 years', ""Document: S3 OLCI Instrument\nSection: S3 OLCI Instrument > Heritage\nContent:\nRemote sensing of ocean colour from space began in 1978 with the launch of NASA's Coastal Zone Colour Scanner (CZCS). A number of other missions have been launched and more are planned by various space agencies. The International Ocean-Colour Coordinating Group (<https://ioccg.org/resources/missions-instruments/current-ocean-colour-sensors/> ) coordinates information relating to the various missions and instruments.\nThe key mission driver for the Sentinel-3 OLCI instrument is continuity of the ENVISAT MERIS instrument capability.\nThe Sentinel-3 [OLCI instrument](https://sentiwiki.copernicus.eu/web/s3-olci-instrument#S3-OLCI-Instrument-Description) is based on the opto-mechanical and imaging design of ENVISAT MERIS. The instrument is a quasi-autonomous, self-contained, visible push-broom imaging spectrometer and incorporates the following significant improvements when compared to MERIS:\n* an increase in the number of spectral bands (from 15 to 21)\n* improved SNR and a 14-bit analogue to digital converter\n* improved long-term radiometric stability\n* mitigation of sun-glint contamination by tilting cameras in a westerly direction\n* complete coverage over both land and ocean at 300 m full resolution (for MERIS the reduced resolution was on-board computed)\n* improved instrument characterisation including stray light, camera overlap and calibration diffusers\n* improved coverage of the global ocean (<4 days), land (<3 days with one satellite, ignoring the effect of clouds), where MERIS is approximately 15 days\n* improved data delivery time of 3 hours for Level-1B and Level-2 products\n* 100% overlap with [SLSTR](https://sentiwiki.copernicus.eu/web/s3-slstr-instrument#S3-SLSTR-Instrument-Description) instrument swath and simultaneous acquisitions facilitating the use of OLCI and SLSTR in synergy."", 'Document: S3 SYNERGY\nSection: S3 SYNERGY > Heritage\nContent:\nA requirement of the Sentinel-3 mission is to provide surface vegetation products derived from synergistic and co-located measurements of [OLCI](https://sentiwiki.copernicus.eu/web/s3-olci-instrument#Description) and [SLSTR](https://sentiwiki.copernicus.eu/web/s3-slstr-instrument#Instrument) optical instruments, similar to those obtained from the VEGETATION instrument on SPOT, and with complete Earth coverage in 1-2 days.\nFor 10 years, the SPOT VEGETATION mission has played an important role in meeting this need for information by offering high quality global data of the entire terrestrial surface on a daily basis to operational users.\nThe VEGETATION system relies on two observation instruments in orbit. The first of the two instruments (VEGETATION1) is aboard the SPOT 4 satellite, launched on March 24th 1998. The second (VEGETATION2) is aboard SPOT 5, which was placed into orbit on May 4th 2002. Having...', 'Document: S3 Mission\nSection: S3 Mission > Observation Scenario\nContent:\nThe Sentinel-3 observation scenario implements a pre-defined SENTINEL High Level Observation Plan (HLOP), and is focused on delivering the observation requirements for the Copernicus services. The Sentinel HLOP can be found [here](https://sentiwiki.copernicus.eu/__attachments/1673407/COPE-S1OP-EOPG-PL-15-0020%20-%20Sentinel%20HLOP%202021%20-%203.1.pdf?inst-v=0b38ac37-4dd6-44ba-865b-d9854aa106d8).\nThe Sentinel-3 instruments provide the sensing of the data autonomously on-board the spacecraft on the basis of predefined geographic data and selection of observation mode depending on the surface over which the spacecraft is flying. This mode of operation does not require any specific request from users, and ground-based routine operations planning of the spacecraft is extremely simple. The Sentinel-3 instruments autonomously perform systematic and continuous sensing as follows:\n* The OLCI instrument, in observation mode, acquires data over daylight part of the orbit (i.e. for a sun zenith angle below 80 deg). In addition, and in order to maintain the performance of the instrument during the mission lifetime, at regular intervals throughout the Mission, the instrument is placed in [calibration mode](https://sentiwiki.copernicus.eu/web/olci-processing#S3-OLCI-Processing-L1-RC).\n* The SLSTR instrument, in observation mode, operates the infra-red and SWIR channels over the whole orbit, and the visible channels out of eclipse only. In addition to maintain the performance of the instrument, a [calibration mode](https://sentiwiki.copernicus.eu/web/slstr-processing#S3-SLSTR-Processing-L1-Calibration) is also used.\n* The SRAL instrument acquires data over the whole orbit in 100% SAR mode. LRM mode is also available and used mainly during commissioning phase.\n* The MWR instrument operates over the whole orbit.  \nMore information on each instrument geographical coverage can be found [here](https://sentiwiki.copernicus.eu/web/s3-mission#S3-Mission-Geographical-Coverage).', 'Document: S3 SLSTR Instrument\nSection: S3 SLSTR Instrument > Instrument Specifications\nContent:\n_Table 2: Technical Characteristics of the Sentinel-3 Sea and Land Surface Temperature Radiometer Instrument_\n| **Capability** | **SLSTR Specifications**\n---|---|---\n**Swath** | Nadir view | > 1,400 km\nOblique view | > 740 km\n**Global Coverage Revisit Times** | 1 satellite (dual view) | 1.9 days (mean)\n2 satellites (dual view) | 0.9 days (mean)\n1 satellite (nadir view) | 1 day (mean)\n2 satellites (nadir view) | 0.5 day (mean)\n**Spatial Sampling interval at Sub-satellite point (km)** | VIS-SWIR | 0.5 km\nIR-Fire | 1 km\n**Spectral channel centre (µm)** | VIS | 0.554 (S1); 0.659 (S2); 0.868 (S3)\nSWIR | 1.374 (S4); 1.613 (S5); 2.25 (S6)\nMWIR/TIR | 3.742 (S7); 10.85 (S8); 12.02 (S9)\nFire 1/2 | 3.742 (F1); 10.85 (F2)\n**Radiometric Resolution** | VIS (Albedo =0.5%) | Signal-to-Noise Ratio (SNR) > 20\nSWIR (Albedo =0.5%) | Signal-to-Noise Ratio (SNR) > 20\nMWIR (T =270K) | NEΔT < 80 mK<\nTIR (T=270K) | NEΔT < 50 mK\nFire 1 (<500 K) | NEΔT < 1 K\nFire 2 (<400 K) | NEΔT < 0.5 K\n| NEΔT = Noise-Equivalent Temperature Difference\n**Radiometric Accuracy** | VIS-SWIR (Albedo = 2-100%) | < 2% (Beginning of Life)\n<5% (End of Life)\nMWIR –TIR\n(265 – 310 K) | < 0.2 K (0.1 K goal)\nFire (< 500 K) | < 3 K\n**Design Lifetime** |  | 7.5 years']","According to the information provided in the context, the Sentinel-3 SLSTR instrument has a wider swath coverage compared to the OLCI instrument:

1. SLSTR Swath Coverage:
   - Oblique view swath: ~740 km
   - Nadir view swath: ~1,400 km

2. OLCI Swath Coverage:
   - The OLCI instrument has a swath width of 1,270 km.

3. Comparison:
   - The SLSTR instrument has a wider swath coverage than the OLCI instrument, with the nadir view swath being over 1,400 km compared to OLCI's 1,270 km swath.
   - The SLSTR oblique view swath of 740 km is also wider than the OLCI swath.
   - The SLSTR instrument's wider swath coverage, especially in the nadir view, allows for better global coverage and shorter revisit times compared to the OLCI instrument.

In summary, the Sentinel-3 SLSTR instrument has a significantly wider swath coverage than the OLCI instrument, with the SLSTR nadir view swath being over 1,400 km compared to OLCI's 1,270 km swath.","The SLSTR Dual View swath (740 km) is narrower than OLCI (1270 km). However, the SLSTR Single View (Nadir) swath is 1400 km, which is wider than OLCI.",0.9159722222107726,1.0,1.0,0.9302558573166717
What is the Sentinel-3 'Synergy' (SYN) product?,"['Document: Sentinel-3\nSection: Sentinel-3 > SYNERGY\nContent:\nIt is dedicated to the SYNERGY [Products ](https://sentiwiki.copernicus.eu/web/synergy-products)description, providing information on the processing levels, Product Types, naming convention and data format, and the related [applications](https://sentiwiki.copernicus.eu/web/synergy-applications) (land monitoring and security and climate change monitoring).', 'Document: S3 SYNERGY\nSection: S3 SYNERGY > Heritage\nContent:\nA requirement of the Sentinel-3 mission is to provide surface vegetation products derived from synergistic and co-located measurements of [OLCI](https://sentiwiki.copernicus.eu/web/s3-olci-instrument#Description) and [SLSTR](https://sentiwiki.copernicus.eu/web/s3-slstr-instrument#Instrument) optical instruments, similar to those obtained from the VEGETATION instrument on SPOT, and with complete Earth coverage in 1-2 days.\nFor 10 years, the SPOT VEGETATION mission has played an important role in meeting this need for information by offering high quality global data of the entire terrestrial surface on a daily basis to operational users.\nThe VEGETATION system relies on two observation instruments in orbit. The first of the two instruments (VEGETATION1) is aboard the SPOT 4 satellite, launched on March 24th 1998. The second (VEGETATION2) is aboard SPOT 5, which was placed into orbit on May 4th 2002. Having...', ""Document: S3 SYNERGY\nSection: S3 SYNERGY > Heritage\nContent:\n**Figure 1: Vegetation Product [Credits: SPOT-VEGETATION project]**\nThe series of SPOT VGT products to be replicated within the SYN branch of Sentinel-3 processing (synergy of OLCI and SLSTR) consists of the physical (VGT P), daily synthesis (VGT S1) and 10 day synthesis (VGT S10)\nThe product names P, S1 and S10 correspond to the standard SPOT VGT product names.\nThe VGP products (corresponding to VGT-P SPOT products) are adapted for scientific applications requiring highly accurate physical measurements. The data is corrected for systematic errors (error registration of the different channels, calibration of all the detectors along the line-array detectors for each spectral band) and re-sampled to predefined geographic projections. The pixel brightness count is the ground area's apparent reflectance as seen at the top of atmosphere for all spectral bands.\nThe VG1 and V10 products (respectively VGT-S1 and VGT-S10 SPOT products) are a maximum NDVI value composite of ground reflectance measurements of all segments received during 1 day and 10 days, respectively, for the entire surface of the Earth. These products provide surface reflectance for all spectral bands, the NDVI and ancillary data on image acquisition parameters.  \n\n*  ](https://www.atlassian.com/software/confluence)"", 'Document: S3 Mission\nSection: S3 Mission > Overview of Sentinel-3 Mission\nContent:\n**Figure 2: Sentinel-3 Satellite and Payloads [Credits: ESA]**\nMoreover, in order to provide continuity with SPOT VEGETATION, the [SYNERGY](https://sentiwiki.copernicus.eu/web/s3-synergy#Product-Overview) surface vegetation products, derived from synergistic and co-located measurements of [OLCI](https://sentiwiki.copernicus.eu/web/s3-olci-instrument) and [SLSTR](https://sentiwiki.copernicus.eu/web/s3-slstr-instrument) optical instruments, have been developed.\n**Mission Primary Objectives**\nSentinel-3 provides continuity of an ENVISAT-type ocean measurement capability with consistent quality, very high level of availability (>95%), high accuracy and reliability, and in a sustained operational manner including:\n* ocean, inland sea and coastal zone colour measurements to at least the level of quality of the MERIS instrument on ENVISAT\n* sea surface temperature measurements to at least the level of quality of the AATSR instrument on ENVISAT\n* sea surface topography measurements to at least the level of quality of the ENVISAT altimetry system, including an along track SAR capability of CryoSat heritage for improved measurement quality in coastal zones and over the cryosphere (i.e., sea ice and land ice) and inland water.  \nSentinel-3 provides continuity of medium resolution ENVISAT-type land measurement capability in Europe to determine land surface temperature and land surface colour.\nSentinel-3 provides, in a\nSentinel-3 provides, in a near real-time operational and timely manner, a generalised suite of high level primary geophysical products such as:\n* global coverage Sea Surface Height (SSH) for ocean and coastal areas\n* enhanced resolution SSH products in coastal zones and sea-ice regions\n* global coverage Sea Surface Temperature (SST) and sea-Ice Surface Temperature (IST)\n* global coverage ocean colour and water quality products\n* global coverage ocean surface wind speed measurements\n* global coverage significant wave height measurement', 'Document: S3 Mission\nSection: S3 Mission > Overview of Sentinel-3 Mission > Geographical Coverage > SYNERGY Coverage\nContent:\nGiven that SYNERGY products are computed from [OLCI](https://sentiwiki.copernicus.eu/web/s3-olci-instrument) Level-1B and [SLSTR](https://sentiwiki.copernicus.eu/web/s3-slstr-instrument) Level-1B data (including nadir and oblique views), SYNERGY swath coverage corresponds to the common part of the OLCI and SLSTR nadir view swaths for the daylight part of the Sentinel-3 orbit, i.e. the entire OLCI swath: ~1 270 km (see figure below).\n\n**Figure 12: View of OLCI and SLSTR swath coverage and sampling geometry, in blue SLSTR oblique view (740 km) and nadir view (1 400 km), in red OLCI (1 270 km) [Credits: ESA]**\nAs a result, areas of the SLSTR nadir and oblique view Level-1B images not covered by the OLCI image, are rejected by cutting the images in the along-track and across-track directions. The daylight part of the orbit is defined for OLCI as the part of the orbit, where the sun zenith angle at satellite ground track is lower than 80°.\nThe VGP products cover latitude ranging from 56°S to 75°N (to be VEGETATION-like product).\nThe mean global coverage revisit time is based on the longest revisit time of the two instruments, OLCI and SLSTR. It is less than 2 days at the equator with two operational satellites.', 'Document: S3 SYNERGY\nSection: S3 SYNERGY > Product Overview\nContent:\nBased on the combination of SLSTR and OLCI products, SYN is composed of mainly three Level-2 product types:\n* Surface reflectances and aerosol parameters over land projected on OLCI 300 m grid for all SLSTR and OLCI channels (except SLSTR thermal bands; SLSTR 1374 nm band dedicated to Cloud detection and OLCI O2 and Water Vapour absorption bands)\n* SPOT continuity products reproducing similar characteristics of the VEGETATION instrument observation. Ensuring the continuity of SPOT VEGETATION missions, its main aim is monitoring [land use](https://sentiwiki.copernicus.eu/web/synergy-applications#S3-Synergy-Applications-Land-Monitoring), its evolution and impact of weather and climate on agricultural activities. SYN is also an essential information source for worldwide [food security](https://sentiwiki.copernicus.eu/web/synergy-applications#S3-Synergy-Applications-Land-Monitoring). It would also be able to add to[ climate](https://sentiwiki.copernicus.eu/web/synergy-applications#S3-Synergy-Applications-Climate-Change-Monitoring) studies by supplying a continuous NDVI time series initiated by AVHRR and VEGETATION.\n* Aerosol characteristics over land and sea projected on a 4.5 km resolution grid.', 'Document: S3 Mission\nSection: S3 Mission > Overview of Sentinel-3 Mission > Geographical Coverage > SRAL Coverage\nContent:\nThe choice of orbit for Sentinel-3 is a compromise between the requirements of the topography mission and those of the optical mission. The Sentinel-3 topography mission, as a single altimeter mission, cannot address these requirements alone and must consider other altimeter systems ""in constellation"" where synergy provides optimum spatial sampling, cross-calibration and reference altimetry. An example of synergy missions with the Sentinel-3 mission is the entire JASON series of missions (JASON-2, JASON-3, JASON-CS) with a reference orbit in a low-inclination (66°).\nIt is appropriate for Sentinel-3 to maintain an ENVISAT-type high-inclination polar orbit. This choice provides optimal SRAL coverage of the ocean, ice surfaces in high latitudes and of the European shelf seas that is fully in line with GMES recommendations.\n\n**Figure 8: Sentinel-3 Mission North Pole Coverage [Credits: isardSAT]**\n\n**Figure 9: Sentinel-3 Mission South Pole Coverage [Credits: isardSAT]**\nSentinel-3B has been launched into an orbit with the same characteristics including repeat cycle. The two satellites in constellation provides a 140° in-plane separation between the two spacecraft, driven by optical ocean and land coverage requirements. With the launch of Sentinel-3B, the repeat cycle will be the same but the SRAL coverage will be increased.\n\n**Figure 10: Sentinel-3A Satellite Coverage Over the Balearic Islands in the Mediterranean Sea [Credits: isardSAT]**\n\n**Figure 11: Sentinel-3A (red) and Sentinel-3B (green) Constellation Satellite Coverage [Credits: isardSAT]**\nIn a\nFor further information about orbit coverage, visit the [ESOV](http://eop-cfi.esa.int/index.php/applications/esov) website.', 'Document: S3 Mission\nSection: S3 Mission > Overview of Sentinel-3 Mission\nContent:\nSentinel-3 is an European Earth Observation satellite mission developed to support Copernicus ocean, land, atmospheric, emergency, security and cryospheric applications.\nIt is jointly operated by ESA and EUMETSAT to deliver operational ocean and land observation services.', 'Document: S3 Mission\nSection: S3 Mission > Overview of Sentinel-3 Mission > Satellite Description\nContent:\nSentinel-3 is a low Earth-orbit moderate size satellite compatible with small launchers including VEGA and ROCKOT. Sentinel-3 is designed for a 7 year operational lifetime with 120 kg of hydrazine propellant allowing up to 12 years of continuous operations, including de-orbiting at the end of mission. The satellite layout is driven by the need to provide a large face viewing cold-space for thermal control, a modular design for payload accommodation and simplified management of all on-board interfaces. The satellite mechanical configuration and its flight attitude have been optimised through intensive mission analysis studies and system trade-offs performed during the mission definition, resulting in significant improvements in comparison to ENVISAT.\nThe main subsystems of the satellite are:\n* Electrical Power System (EPS), comprising one solar array wing providing power to the spacecraft and payload.\n* Attitude and Orbit Control System (AOCS) composed of a coarse sun sensor, magnetometers, coarse rate sensors, star trackers, a GNSS receiver and control actuators including thrusters, magneto-torquers and reaction wheels.\n* Satellite management unit for satellite commanding and monitoring.\n* Data handling and mass memory unit for payload data handling.\n* Mass memory units for the satellite and its payload.\n* Satellite telecommunication subsystems including an S-band subsystem for both telecommand (TC) uplink and telemetry (TM) downlink, and a dedicated high volume X-band subsystem for mission data downlink.  \nThe main satellite platform characteristics are:\n* Gyroless, three-axis stabilised platform with three star tracker heads, four reaction wheels and magnetic off-loading.\n* Geodetic pointing and yaw steering.\n* Eight 1 N hydrazine thrusters for in-plane and out-plane manoeuvres.\n* Real-time on-board orbit accuracy determination of 3 m based on GPS and Kalman filtering.\n* Launch Mass: 1 250 kg (with maturity and system margins, and fuel).', 'Document: S3 Altimetry Instruments\nSection: S3 Altimetry Instruments > Land and Marine responsibilities between ESA and EUMETSAT > Precise Orbit Determination (POD) Instruments Description > LRR\nContent:\nThe Sentinel-3 Laser Retro Reflector (LRR) is a passive device that acts as a target for laser tracking measurements performed by dedicated ground stations. It is mounted on the Earth panel of the satellite and consists of a hemispherical array of seven corner cubes, each reflecting back, and in the same direction, any incoming laser pulse from the stations. The hemispherical arrangement ensures that at least one cube is visible from any station that has the satellite in view. In this way, each ground station is able to determine the range to the satellite with an accuracy of the order of a few millimetres, by measuring the propagation delay of a laser pulse from the station to the LRR and back.']","The Sentinel-3 'Synergy' (SYN) product is a set of Level-2 products derived from the synergistic and co-located measurements of the OLCI and SLSTR optical instruments on the Sentinel-3 satellite. The key aspects of the SYN product are:

**Product Overview**
- SYN products are composed of three main types:
  1. Surface reflectances and aerosol parameters over land, projected on the OLCI 300 m grid, for all SLSTR and OLCI channels (except thermal bands, 1374 nm SLSTR band, and OLCI O2/water vapor bands)
  2. SPOT VEGETATION-like continuity products, ensuring the continuation of the SPOT VEGETATION mission's land monitoring capabilities
  3. Aerosol characteristics over land and sea, projected on a 4.5 km resolution grid

**Heritage and Objectives**
- The SYN products are designed to provide surface vegetation products similar to those obtained from the SPOT VEGETATION instrument, with complete global coverage in 1-2 days
- The main aims are to monitor land use and its evolution, the impact of weather and climate on agriculture, and to contribute to climate studies by providing a continuous NDVI time series

**Geographical Coverage and Revisit**
- The SYN swath coverage corresponds to the common part of the OLCI and SLSTR nadir view swaths during the daylight part of the Sentinel-3 orbit, which is approximately 1,270 km wide
- The mean global coverage revisit time is less than 2 days at the equator with two operational Sentinel-3 satellites
- The VGP products cover a latitude range from 56°S to 75°N, similar to the SPOT VEGETATION products

In summary, the Sentinel-3 SYN products provide continuity with the SPOT VEGETATION mission, delivering high-quality global land surface reflectance, vegetation, and aerosol data products to support a wide range of land monitoring, food security, and climate change applications.",The SYN product combines information from both the OLCI and SLSTR instruments to provide improved surface reflectance and aerosol retrieval.,0.9861111110987848,1.0,1.0,0.9677635673739161
What is the spectral bandwidth and ground resolution of the CHIME mission?,"['Document: CHIME\nSection: CHIME > Mission\nContent:\n**Figure 2: CHIME observation map**\n_Table 1: CHIME key mission requirements._\n**Parameter** | **Requirement**\n---|---\nObservation area |  All land and inland water bodies between 56° S and 84° N Islands greater than 100 km2 Coastal zones within 50 km from land Open water with the depth < 50 m\nRevisit | 12.5 days\nSpectral range | 400 – 2500 nm\nBandwidth | ≤ 10nm\nGround Resolution | 30 m\nRadiometric accuracy | < 5%\nSpatial co-registration | < 0.1 SSD\nSpectral co-registration | < 0.1 SSI\n\n**Figure 3: CHIME spacecraft in nominal flight configuration.**', 'Document: CHIME\nSection: CHIME > Mission\nContent:\n**Instrument**\nThe HyperSpectral Imager (HSI) will be carried on board each CHIME satellite. This will be a pushbroom-type grating Imaging Spectrometer with high Signal-to-noise ratio and data uniformity. The purpose of HSI is to support monitoring, implementation, and improvement of various policies related to raw material, food security, agriculture, and soil properties. Apart from this, HSI will also have secondary applications in areas such as biodiversity and ecosystem sustainability, forestry management, environmental degradation, lake/coastal ecosystems, water quality, and snow characteristic\nThe HSI has the ability to measure at a ground resolution of 30 m for a swath width of 130 km with high radiometric accuracy for Level-1B data. It is an advanced hyperspectral imager that can capture images in over 200 bands over a wavelength range of 400 nm - 2500 nm in the Visible (VIS), Near Infrared (NIR), and Short-Wave Infrared (SWIR) spectrum at a spectral bandwidth less than 10 nm.\n**Observations**\nCHIME observations will take place whenever the sun zenith angle is lower than 84 degrees, meaning that, with the local time at the descending node being fixed at 10:45 AM, the vast majority of observations will take place during the descending part of the orbit.\nThe combination of the above characteristics with the wide swath width of 130 km provided by the HSI payload will allow CHIME to provide global hyperspectral coverage of land surfaces, inland and coastal waters with a high revisit time, under cloud-free conditions, of 22 days at the equator with one satellite, and 11 days with two satellites.\n**Observation map**', 'Document: CHIME\nSection: CHIME > Mission\nContent:\nThe Copernicus Hyperspectral Imaging Mission (CHIME) is a part of the six new missions aimed at broadening the current range of Sentinel missions. CHIME comprises of two satellites, namely CHIME-A and CHIME-B. These satellites are designed to provide systematic hyperspectral images that can be used to map changes in land cover and support sustainable agricultural practices.\nCHIME is designed for 7 years of operational lifetime, following 6 months (max) of LEOP and in-orbit commissioning. The satellite embarks consumables sufficient to extend its lifetime up to 12 years. A controlled re-entry is envisaged at end of life (EOL). In addition to this EOL re-entry capability the CHIME spacecraft provides passive interfaces for the docking of an Active Debris Removal service to remove the spacecraft from the LEO protected region, in case of loss of mission or inability to perform a safe disposal.\nThe two identical satellites flying will be separated by 180 degrees, in a sun-synchronous orbit at an average altitude of 632 km. Each satellite will complete 14+17/22 orbits per day, making observations of all land areas between the latitudes 84 degrees North and 56 degrees South, including islands greater than 100 km2 and open water wherever the depth does not exceed 50 meters. In addition, thanks to the ample on-board storage and downlink on-board resources, the coastal areas coverage is guaranteed up to 370 km from land, well beyond the 50 km specified in the mission requirements.\nCHIME satellites will be in a sun-synchronous orbit at an altitude of 632 km with an orbital inclination of 97.9°. The orbital period of these satellites will be 97.5 minutes with a 25-day repeat cycle.\n**Instrument**', ""Document: CHIME\nSection: CHIME > Applications\nContent:\nThe CHIME mission will respond to the user need for applications related to sustainable agriculture and food security, as well as raw materials exploration and management, as primary drivers. Additionally, CHIME products have been acknowledged for their relevance in other areas such as biodiversity, forestry, coastal/inland waters, and cryosphere monitoring by the respective user communities.\nThe CHIME mission's primary objective is to support the development of new and improved operational applications and services that are related to food security, sustainable agriculture, and raw materials.\nAs a secondary objective, CHIME will support operational applications and services related to inland and coastal waters quality, biodiversity, snow and ice properties, environmental degradation, and hazards.\nIn addition to serving operational users such as the Copernicus Services, CHIME data will also significantly contribute to a wide range of scientific research activities that support the development and quality of downstream applications. A recent analysis has highlighted that this is already the case for existing Sentinels.\n* Land-cover mapping\n* Sustainable agricultural and biodiversity management\n* Soil property characterisation"", 'Document: CHIME\nSection: CHIME > Timeline\nContent:\nCHIME-A working launch date is in 2028 while CHIME-B is planned to be launched in 2030 with both satellites having a design life of eight years.\n**References**\n[1] The Copernicus Hyperspectral Imaging Mission for the Environment (CHIME) – An overview of its mission, system and planning status  \n\n*  ](https://www.atlassian.com/software/confluence)', 'Document: CHIME\nSection: CHIME\nContent:\n!!\n**Figure 1: Artist’s impression of CHIME mission. [Credits: Thales Alenia Space]**\n**Media 1: How will space transform the global food system? [Credits: ESA]**']","According to the information provided in the CHIME mission documentation:

**Spectral Bandwidth:**
- The CHIME HyperSpectral Imager (HSI) can capture images in over 200 spectral bands.
- The spectral bandwidth of the HSI is less than 10 nm across the wavelength range of 400 nm to 2500 nm, covering the Visible (VIS), Near Infrared (NIR), and Short-Wave Infrared (SWIR) spectrum.

**Ground Resolution:**
- The CHIME HSI has the ability to measure at a ground resolution of 30 meters for a swath width of 130 km.

In summary, the CHIME mission has the following key spectral and spatial characteristics:

- Spectral Bandwidth: Less than 10 nm across 400 - 2500 nm wavelength range
- Ground Resolution: 30 meters
- Swath Width: 130 km

This high spectral and spatial resolution allows CHIME to provide detailed hyperspectral imaging data to support applications such as sustainable agriculture, food security, raw materials exploration, and environmental monitoring.",CHIME has a spectral bandwidth of ≤10 nm and a ground resolution of 30 m.,0.9999999999666667,1.0,1.0,0.9159814236519074
What is the unique operation mode of the Poseidon-4 altimeter on Sentinel-6?,"['Document: CRISTAL\nSection: CRISTAL > Mission\nContent:\nDue to be launched in 2028, the Copernicus Polar Ice and Snow Topography Altimeter (CRISTAL) mission, is being developed by the European Space Agency (ESA) with the objective to measure and monitor sea-ice thickness, overlying snow depth and ice-sheet elevations. Also referred to as Sentinel-9, CRISTAL is the successor to CryoSat-2 and will feature two identical altimetry satellites built by Airbus Defense and Space (Airbus DS).\nSee presentation: [_Quick guide to Sentinel Expansion Missions core applications - CRISTAL_](https://eur05.safelinks.protection.outlook.com/?url=https%3A%2F%2Findd.adobe...\nCRISTAL will feature a payload that comprises an Interferometric Radar altimeter for Ice and Snow (IRIS) and a Microwave Radiometer (MWR). IRIS will be used to measure the thickness of sea ice and the snow that covers it, as well as the height of the world’s ice sheets and glaciers. The dual-frequency operation will enable more accurate measurements than earlier ice-monitoring altimeters. These datasets will support maritime operations in polar oceans and contribute to a better understanding of climate processes through monitoring the cryosphere to fully assess, predict and adapt to climate variability and change.\nIRIS follows on from the CryoSat SIRAL instrument, with improved characteristics including a dual band frequency. The dual-frequency radar altimeter operates in the Ku-band at a frequency of approximately 13.5 GHz and Ka-band at approximately 35.75 GHz, each having a bandwidth of 500 MHz. It features a 10...\nIt is set to undergo a drifting polar orbit with an altitude of approximately 699 km.\nCRISTAL is being developed by Airbus DS with a mass of 1700 kg. The robust and proven satellite design builds upon the ocean topography mission, Sentinel-6, and the forerunning operational mission CryoSat-2. It includes six fixed and two deployable solar arrays spanning a total of 18.6 m2 and onboard...', 'Document: S3 Altimetry Instruments\nSection: S3 Altimetry Instruments > Sentinel-3 Open-Loop Tracking Command (OLTC) > OLTC Tables principle > SRAL acquisition mode mask\nContent:\nAs previously mentioned, SRAL can operate with two on-board tracking modes: open loop or closed loop. The selection of the on-board tracking mode is based on a dedicated geographical mask, called the Zone DataBase (ZDB). Since the launch of Sentinel-3A in 2016, the ZDB evolved over the time. The main changes are summarised below.\nSince Sentinel-3A beginning of life until 9 March 2019, the on-board tracking modes were defined according to the acquisition mode mask displayed in **Figure 18**. It is worth noting that a modification of this mask occurred on 6 December 2016 to stop acquiring the Greenland and Antarctica ice sheet margins in Open-Loop mode as the OLTC commands over these steepest areas were not precise enough. This modification is illustrated in **Figure 19**.\n\n**Figure 18: Acquisition mode mask defined for Sentinel-3A from 6 December 2016 to 9 March 2019. Green areas are acquired in Close Loop mode; grey areas are acquired in Open Loop mode.**\n\n**Figure 19: Modification, on 6 December 2016, of the Sentinel-3A SRAL acquisition mode mask over Antarctica and Greenland margins.**\nIn 2018/2019, the ZDB was modified to increase the open loop mask over continental areas, as illustrated in **Figure 20**. All regions within +/- 60° are monitored using open loop on-board tracking. For Sentinel-3A, this mask was in operation from 9 March 2019 to 7 November 2020. For Sentinel-3B, this mask was in operation from beginning of mission to 10 October 2020 .', 'Document: S1 Mission\nSection: S1 Mission > Acquisition Modes\nContent:\nCopernicus Sentinel-1 operates in four exclusive acquisition modes:  \nThe SM, IW and EW imaging modes can operate for a maximum duty cycle of 30 min per orbit. The WV mode operates for up to a maximum duty cycle of 75 min per orbit.\nThe Copernicus Sentinel-1C-band SAR instruments supports operation in single polarisation (HH or VV) and dual polarisation (HH+HV or VV+VH), implemented through one transmit chain (switchable to H or V) and two parallel receive chains for H and V polarisation.\nSM, IW and EW products are available in single (HH or VV) or dual polarisation (HH+HV or VV+VH). WV is single polarisation only (HH or VV).\nThe primary mode over land is IW, with VV+VH polarisation: having the Interferometric Wide swath as the one main operational mode satisfies most current service requirements, avoids conflicts and preserves revisit performance, simplifies mission planning, decreases operational costs and builds up a consistent long-term archive.\nOver open ocean, the WV mode, with VV polarisation, is the main operational acquisition mode acquiring vignettes at regular intervals.\nEW mode is used primarily over selected European seas, Arctic and Southern Ocean areas, mainly for sea-ice monitoring services and maritime surveillance, with the capability to cover 400 km wide area at each data-take. SM mode is only used for small islands and on request for extraordinary events such as emergency management.\nFor each mode, it is possible to produce products at SAR Level-0, Level-1 SLC, Level-1 GRD and Level-2 OCN.\n\n**Figure 12: Sentinel-1 Acquisitions Swath Coverage. [Credits: ESA]**\nRead more about the Copernicus Sentinel-1[Observation and Production Scenario](https://sentiwiki.copernicus.eu/web/s1-mission#S1-Mission-Observation-and-Production-Scenarios).', 'Document: S3 Mission\nSection: S3 Mission > Overview of Sentinel-3 Mission\nContent:\n* The [**_Altimetry Surface Topography Mission (STM)_**](https://sentiwiki.copernicus.eu/web/s3-altimetry-instruments#Sentinel-3-Topography-Mission-Overview) payload composed of:\n* A dual-frequency (Ku and C-band) advanced **S _ynthetic Aperture Radar Altimeter (_**[**_SRAL_**](https://sentiwiki.copernicus.eu/web/s3-altimetry-instruments#S3-Altimetry-Instrument-SRAL-Description)**)** , derived from ENVISAT RA-2, [CRYOSAT](https://earth.esa.int/web/guest/missions/esa-operational-eo-missions/cryosat) SIRAL and JASON-2/POSEIDON-3, providing measurements at a resolution of approximately 300 m in SAR mode along track.\n* a **_MicroWave Radiometer (_**[**_MWR_**](https://sentiwiki.copernicus.eu/web/s3-altimetry-instruments#S3-Altimetry-Instrument-MWR-Description)**)** , derived from ENVISAT MWR for atmospheric correction\n* a **_Precise Orbit Determination (POD)_ **package, including:\n* [**DORIS**](https://sentiwiki.copernicus.eu/web/s3-altimetry-instruments#S3-Altimetry-Instrument-POD-DORIS): a Doppler Orbit Radio positioning system\n* [**GNSS**](https://sentiwiki.copernicus.eu/web/s3-altimetry-instruments#S3-Altimetry-Instrument-POD-GNSS): a GPS receiver, providing precise orbit determination and tracking multiple satellites simultaneously\n* [**LRR**](https://sentiwiki.copernicus.eu/web/s3-altimetry-instruments#S3-Altimetry-Instrument-POD-LRR): to accurately locate the satellite in orbit using a Laser Retro-Reflector system.', 'Document: S3 Altimetry Instruments\nSection: S3 Altimetry Instruments > Land and Marine responsibilities between ESA and EUMETSAT > SRAL Instrument Description\nContent:\nIn addition, there are also two routine calibration modes (CAL1 and CAL2) that allow measurement of the internal instrument impulse response (by looping back a fraction of the transmit signal) and determination of the transfer function of the receive chain. The calibration sequences of SRAL are mostly performed over desert regions such as Sahara, Australia, or south of Africa, to avoid disruption of the key Earth observation goals of the Sentinel-3 mission.\n![](https://sentiwiki.copernicus.eu/__attachments/1690846/2271d5bb-b8c3-495b-aeaf-7e36ae954d52...\n**Figure 2: S3A and S3B timeseries of LRM and SAR operational modes**\nSRAL can operate with two on-board tracking modes:\n* _closed-loop mode_ : autonomous range window positioning, determined using the previous (P-)LRM measurements build on-board\n* _open-loop mode_ : range window position based on _a priori_ knowledge of terrain altitude derived from a Digital Elevation Model (DEM). More information related to open loop is available below in this page.  \nTable below presents the main technical parameters of SRAL, along with the on-ground footprints:\n_Table 1: Main technical parameters of the Sentinel-3 Radar altimeter (SRAL)_\n**Parameter** | **Value**\n---|---\nFrequency  | 13.575 GHz (Ku) / 5.41 (C)\nEffective Bandwidth (MHz)  | 320 MHz (Ku) / 290 MHz (C)\nPulse Repetition Frequency in a burst  | 17.825 kHz (Ku) / 2 pulses per burst (C)\nBurst Repetition Frequency  | 78.5 Hz\nPulse duration  | 48.95 μs\nAntenna size  | 1.2 m diameter, focal length 0.43 mm\nAntenna aperture at -3dB |  1.35°\nRadar footprint diameter (LRM/P-LRM)  | ~ 15 km\nAlong-track footprint (SAR mode)  | ~ 300 m\nFirst cell resolution: diameter in LRM/P-LRM, across-track length in SAR  | 1.6 km (Ku) / 1.7 km (C)', ""Document: S3 Altimetry Instruments\nSection: S3 Altimetry Instruments > Land and Marine responsibilities between ESA and EUMETSAT > SRAL Instrument Description\nContent:\nThe SRAL instrument comprises one nadir-looking antenna, externally mounted on the satellite's +Zs Earth panel, and a central electronic chain composed of a Digital Processing Unit (DPU) and a Radio Frequency Unit (RFU). The central electronic chain is mounted inside the satellite on the -Ys panel in a cold redundant configuration. The main frequency used for range measurements is the Ku-band (13.575 GHz, bandwidth 320 MHz), while the C-band frequency (5.41 GHz, bandwidth 290 MHz) is used to...\nThe two radar operating modes are:\n* _Low-Resolution Mode (LRM)_ : conventional altimeter pulse-limited mode based on a 3 Ku / 1 C / 3 Ku pulse pattern. Pulses are emitted at ~2 kHz Pulse Repetition Frequency (PRF). **The LRM is only used during the commissioning phase, at the early stage of the missions,** as indicated in **Figure 2** below**.**\n* _Synthetic Aperture Radar (SAR) mode_ : the chronogram is composed of bursts of 64 Ku-band pulses surrounded by two C-band pulses. Bursts are emitted at ~80 Hz rate, so that 4 bursts are emitted (and received) within a 20 Hz radar cycle. Within a burst, the pulses are emitted at high ~18 kHz PRF. SAR mode provides a significantly enhanced along track (azimuth) resolution compared to LRM. **Sentinel-3A is operating on stable SAR mode since 12 April 2016 onwards. Sentinel-3B is operating on stable SAR mode since 11 July 2018 onwards.** The 256 (64x4) pulses emitted during a 20 Hz radar cycle can also be processed disregarding the Doppler information, through a pseudo LRM processing. This processing mode is called Pseudo-LRM (P-LRM)"", 'Document: S3 Mission\nSection: S3 Mission > Observation Scenario\nContent:\nThe Sentinel-3 observation scenario implements a pre-defined SENTINEL High Level Observation Plan (HLOP), and is focused on delivering the observation requirements for the Copernicus services. The Sentinel HLOP can be found [here](https://sentiwiki.copernicus.eu/__attachments/1673407/COPE-S1OP-EOPG-PL-15-0020%20-%20Sentinel%20HLOP%202021%20-%203.1.pdf?inst-v=0b38ac37-4dd6-44ba-865b-d9854aa106d8).\nThe Sentinel-3 instruments provide the sensing of the data autonomously on-board the spacecraft on the basis of predefined geographic data and selection of observation mode depending on the surface over which the spacecraft is flying. This mode of operation does not require any specific request from users, and ground-based routine operations planning of the spacecraft is extremely simple. The Sentinel-3 instruments autonomously perform systematic and continuous sensing as follows:\n* The OLCI instrument, in observation mode, acquires data over daylight part of the orbit (i.e. for a sun zenith angle below 80 deg). In addition, and in order to maintain the performance of the instrument during the mission lifetime, at regular intervals throughout the Mission, the instrument is placed in [calibration mode](https://sentiwiki.copernicus.eu/web/olci-processing#S3-OLCI-Processing-L1-RC).\n* The SLSTR instrument, in observation mode, operates the infra-red and SWIR channels over the whole orbit, and the visible channels out of eclipse only. In addition to maintain the performance of the instrument, a [calibration mode](https://sentiwiki.copernicus.eu/web/slstr-processing#S3-SLSTR-Processing-L1-Calibration) is also used.\n* The SRAL instrument acquires data over the whole orbit in 100% SAR mode. LRM mode is also available and used mainly during commissioning phase.\n* The MWR instrument operates over the whole orbit.  \nMore information on each instrument geographical coverage can be found [here](https://sentiwiki.copernicus.eu/web/s3-mission#S3-Mission-Geographical-Coverage).', 'Document: Copernicus Programme\nSection: Copernicus Programme > **Europe’s eyes on Earth: the EU’s Copernicus Programme**\nContent:\n**Figure 1: Earth observation missions developed by ESA. [Credits: ESA]**\nTo meet the operational needs of the Copernicus programme, ESA developed the family of Sentinel satellites.\nThese missions are underpinned by ESA’s Earth Observation Framework - Copernicus Space Component (EOF-CSC), which oversees satellite operations, as well as data acquisition, production and dissemination. At present, three complete two-satellite constellations are in orbit, along with one additional single satellite —Sentinel-5P.\nThe Sentinels provide a unique set of observations, starting with the all-weather, day and night radar images from the Sentinel-1 mission, launched in 2014, 2016, 2024, and 2025 respectively.\nSentinel-2, launched in 2015, 2017, and 2024 respectively, is designed to deliver high-resolution optical images for land services.\nThe two Sentinel-3 satellites, launched on 16 February 2016 and 25 April 2018, provide data for services relevant to the ocean and land. Sentinel-3 marine is operated by EUMETSAT and Sentinel-3 land operated by ESA.\nIn addition, a Sentinel-5 Precursor mission (also known as Sentinel-5P) was developed to reduce data gaps between Envisat, in particular the SCIAMACHY instrument, and the launch of Sentinel-5.\nLaunched on 13 October 2017, Sentinel-5P is the first Copernicus mission in orbit dedicated to...\nThe Space Component is managed by ESA and serves users with satellite data available through the Sentinels and the Copernicus Contributing Missions at national, European and international levels.\nThe Copernicus Operations, facilitating access to Sentinel and Contributing Mission data, completes the Copernicus Space Component. [Copernicus Operations](https://sentiwiki.copernicus.eu/web/copernicus-operations)\nThe Space Component forms the European contribution to the worldwide Global Earth Observation System of Systems (GEOSS).', 'Document: S3 Altimetry Instruments\nSection: S3 Altimetry Instruments > Land and Marine responsibilities between ESA and EUMETSAT > Precise Orbit Determination (POD) Instruments Description > GNSS\nContent:\nThe Sentinel-3 GPS receiver contributes to satellite control, provides accurate on-board timing, controls the open-loop mode of the altimeter by providing real-time radial position data and provides the measurements for the final POD analysis.\nThe receiver on-board Sentinel-3A is capable of receiving the L1 C/A, L1P(Y) and the L2P(Y) signals of the GPS constellation. The receiver on-board Sentinel-3B is also capable of receiving the L2C signal of the GPS constellation. They can track up to eight satellites and two signal bands in parallel.\nThe receiver on-board Sentinel-3 C&D satellites will be able to track L1 C/A, L1P(Y), L2P(Y), L2C-M and L2C-L, and L5 I/Q signals of the GPS constellation, and the E1 B/C and E5a I/Q of Galileo constellation. It can track up to 18th satellites in two signals bands in parallel.\nThe receiver is capable of providing real-time positions with accuracies of 1-2 m (3D RMS) for position, and 2-3 mm/s (3D RMS) for velocity.\nThe Sentinel-3 GNSS receiver consists of the antenna, the harness and the receiver unit itself.\n\n**Figure 9: GNSS Instrument [Credits: ESA]**\n\n**Figure 10: GNSS Antenna [Credits: ESA]**', 'Document: Altimetry Applications\nSection: Altimetry Applications > Cryosphere > Land Ice\nContent:\nOver **Land Ice,** Sentinel-3 main application is the estimation of the polar ice sheets topography, to monitor the ice sheet mass balance over the time. Compared to conventional altimetry, the enhanced along-track resolution (~300 m) of Sentinel-3 brings several improvements. They can be summarized as follow (<https://doi.org/10.5194/tc-13-709-2019>and [_https://doi.org/10.1016/j.asr.2018.06.043_](https://doi.org/10.1016/j.asr...\n* The SAR mode measure is not, or very weakly, sensitive to the along-track surface slope. This facilitates the measurement relocation, currently the largest source of error for land ice altimetry\n* Because the on-ground footprints of the successive 20 Hz measurements are discriminated (no overlap), there is a constant posting rate of ~300 meters along the satellite track. This gives access to fine scales of the along-track surface topography. In contrast (P)LRM measurements tend to oversample the surface peaks and undersample the surface troughs.\n* The SAR waveform leading edge is less sensitive to volume scattering compared to P-LRM. The measurements are theoretically less impacted by spatial-temporal variations of snow parameters  \nIn addition to the level-2 Sentinel-3 Land Ice Thematic Products generated by the ground segment, ESA is supporting the development and generation of the so-called level-2 **AMPLI products** generated by CNES/CLS. This processing chain relies on radar signal simulation over HR-DEM to estimate the ground location of the radar impact point (i.e. POCA estimation), which is the most important source of error in Sentinel-3 measurements over land ice. The method and results is described in Aublanc et al. (2025, <https://doi.org/10.5194/tc-19-1937-2025> ).\nFor example, the 2019-2022 Surface Elevation Change (SEC) of the Antarctic ice sheet derived from Sentinel-3A and Sentinel-3B altimeters with the AMPLI software is presented in Figure 4.\n![](https://sentiwiki.copernicus...']","The provided context does not contain any information about the Poseidon-4 altimeter or the Sentinel-6 mission. The context is focused on the Copernicus Sentinel missions, including Sentinel-1, Sentinel-2, Sentinel-3, Sentinel-5P, and the upcoming CRISTAL mission, but does not mention Sentinel-6 or the Poseidon-4 altimeter.

Since the context does not cover the Sentinel-6 mission or the Poseidon-4 altimeter, I do not have enough information to provide a comprehensive answer about the unique operation mode of the Poseidon-4 altimeter on Sentinel-6. The context simply does not contain the necessary details to answer this question.","Poseidon-4 uses an 'interleaved' mode (Open Burst), allowing it to simultaneously provide low-resolution mode (LRM) and SAR mode measurements.",0.0,0.0,1.0,0.0
Compare the bandwidth of the water vapour absorption band in Sentinel-2 (Band 9) vs Sentinel-3 OLCI (Band 19). Which is narrower?,"['Document: S2 Mission\nSection: S2 Mission > Acquisition Resolutions > Spectral Resolution\nContent:\nSpectral resolution is defined as a measure of the ability of the instrument to distinguish features in the electromagnetic spectrum.\nThe 13 spectral bands of Sentinel-2 range from the Visible and Near Infra-Red (VNIR) to the Short-Wave Infra-Red (SWIR):\n* 4 x 10 metre Bands: the three classical RGB bands (Blue (~493nm), Green (560nm), and Red (~665nm)) and a Near Infra-Red (~833nm) band;\n* 6 x 20 metre Bands: 4 narrow Bands in the VNIR vegetation red edge spectral domain (~704nm,~740nm, ~783nm and ~865nm) and 2 wider SWIR bands (~1610nm and ~2190nm) for applications such as snow/ice/cloud detection, or vegetation moisture stress assessment;\n* 3 x 60 metre Bands mainly focused on cloud screening and atmospheric correction (~443nm for aerosols and ~945nm for water vapour) and cirrus detection (~1374nm).  \n**NOTE:** The Bandwidth (nm) in the Tables below is the values measured at Full Width Half Maximum (FWHM). The equivalent wavelength is the barycentre of the spectral response function, not considering the solar irradiance:', 'Document: S2 Processing\nSection: S2 Processing > L1C Algorithms > Computation of the Masks > Cloud mask\nContent:\n**Figure 16: Absorption spectrum of water vapour with Sentinel-2 band B10**\nThis modification is applied on cirrus cloud mask and opaque cloud mask.\n##### [Snow index calculation](https://sentiwiki.copernicus.eu/web/s2-processing#S2Processing-Snowindexcalculation)\nWith the spectral criteria used for opaque cloud detection algorithm, snow is most of the time identified as opaque clouds. Snow, on mountain, is as bright as opaque clouds in bands B1 and B10. To avert these false detections, a snow index can be derived from bands B4 (665 nm) and B11 (1610...', 'Document: S2 Products\nSection: S2 Products > Level-1C Products\nContent:\nThe radiometric offset per spectral band and quantification value are reported in the General_Info/Product_Image_Characteristics section of the product metadata.\nMoreover, independent validation analysis highlighted that Sentinel-2A shows brighter TOA-reflectance than Sentinel-2B, with an average bias of 1.1% over the VNIR bands. As the Sentinel-2A reflectance is known to be close to those of other...\nLevel-1C products additionally include quality information like [Cloud Masks](https://sentiwiki.copernicus.eu/web/s2-processing#S2-Processing-Masks), Detector Footprint Masks and Quality Masks and auxiliary data like [ECMWF](https://sentiwiki.copernicus.eu/web/s2-processing#S2-Processing-Auxiliary-Data-Files) data (total column of ozone, total column of water vapour and mean sea level pressure) and [CAMS](https://sentiwiki.copernicus.eu/web/s2-processing#S2-Processing-Auxiliary-Data-Files) (Copernicus Atmosphere Monitoring Service) aerosols content information.', 'Document: S2 Applications\nSection: S2 Applications > Overview of Sentinel-2 Applications > Sentinel-2 band combinations for specific applications\nContent:\n* **False Colour (urban):** This composite is used to visualise urbanized areas more clearly. Vegetation is visible in shades of green, while urbanised areas are represented by white, grey, or purple. Soils, sand, and minerals are shown in a variety of colours. Snow and ice appear as dark blue, and water as black or blue. Flooded areas are very dark blue and almost black. The composite is useful for detecting wildfires and calderas of volcanoes, as they are displayed in shades of red and yellow.\n* **Moisture Index:** The Normalised Difference Moisture Index (NDMI) is used to determine vegetation water content and monitor droughts\n* **SWIR:** Short Wave Infrared (SWIR) measurements can help scientists estimate how much water is present in plants and soil, as water absorbs SWIR wavelengths\n* **NDWI:** The Normalised Difference Water Index (NDWI) is most appropriate for water body mapping\n* **NDSI:** The Sentinel-2 Normalised Difference Snow Index (NDSI) can be used to differentiate between cloud and snow cover as snow absorbs in the short-wave infrared light, but reflects the visible light, whereas cloud is generally reflective in both wavelengths. Snow cover is represented in bright vivid blue.\n* **Scene classification:** Scene classification was developed to distinguish between cloudy pixels, clear pixels and water pixels of Sentinel-2 data and is a result of ESA’s Scene classification algorithm for Level-2A products only.', 'Document: S2 Mission\nSection: S2 Mission > Overview of Sentinel-2 Mission\nContent:\nSentinel-2 is a European wide-swath, high-resolution, multi-spectral imaging mission. The full mission specification of the twin satellites flying in the same orbit but phased at 180°, is designed to give a high revisit frequency of 5 days at the Equator.\nEach of the satellites in the Sentinel-2 mission carries a single payload: the optical [Multi-Spectral Instrument](https://sentiwiki.copernicus.eu/web/s2-mission#S2-Mission-MSI-Instrument) (MSI) that samples 13 spectral bands: four bands at 10 m, six bands at 20 m and three bands at 60 m spatial resolution. The orbital swath width is 290 km.\n\n**Figure 1: The Twin-Satellite Sentinel-2 Orbital Configuration [Credits: Astrium GmbH]**\nThe Sentinel-2 twin satellites carry on the legacy of [SPOT](https://earth.esa.int/eogateway/missions/spot) and [LANDSAT](https://landsat.gsfc.nasa.gov/) by continuing to provide similar types of image data and contributing to ongoing multispectral observations. These satellites are used to support a variety of services and applications offered by [Copernicus](https://www.copernicus.eu/en), including land management, agriculture, forestry, disaster control, humanitarian relief operations, risk mapping, and security concerns.', 'Document: S2 Applications\nSection: S2 Applications > Overview of Sentinel-2 Applications > Sentinel-2 band combinations for specific applications\nContent:\nThe table below reports the most common band combinations of Sentinel-2 products, which are used based on the different applications discussed above. Other possible bands combinations can be used in specific study cases. More information about the spectral characteristics and resolution of the Sentinel-2 Multispectral Instrument (MSI) is available on the [S2 Mission webpage](https://sentiwiki.copernicus.eu/web/s2-mission).\n**Table 1: Sentinel-2 band combinations**\n**Application** |  **Layers** **Band combination** | **Product type**\n---|---|---\n**True Colour** **(B4, B3, B2)** |  **False colour** (B8, B4, B3) |  **NDVI** (B8-B4) / (B8+B4) |  **False colour (urban)** (B12, B11, B4) |  **Moisture index** (B8A-B11) / (B8A+B11) |  **SWIR** (B12, B8A, B4) |  **NDWI** (B3-B8) / (B3+B8) |  **NDSI** (B3-B11) / (B3+B11) | **Scene classification (L2A only)** | **L1C** | **L2A**\nGeophysical  |  |  | ✔️ | ✔️ | ✔️ | ✔️ | ✔️ |  | ✔️ | ✔️ | ✔️\nLand Monitoring  | ✔️ | ✔️ | ✔️ | ✔️ |  |  |  |  | ✔️ | ✔️ | ✔️\nMaritime Monitoring | ✔️ |  |  | ✔️ | ✔️ |  | ✔️ |  |  | ✔️ | ✔️\nEmergency Management  | ✔️ | ✔️ | ✔️ | ✔️ | ✔️ | ✔️ |  | ✔️ |  | ✔️ | ✔️\nSecurity - SESA | ✔️ | ✔️ | ✔️ | ✔️ | ✔️ |  | ✔️ | ✔️ |  | ✔️ | ✔️\n* **True colour:** Product with natural colours that represents Earth as humans would naturally see it\n* **False colour:** The false colour composite is most commonly used to assess plant density and health, since plants reflect near infrared and green light, while they absorb red. Cities and exposed ground are grey or tan, and water appears blue or black.\n* **NDVI:** The Normalised Difference Vegetation Index (NDVI) is a simple, but effective index for quantifying green vegetation. It is a measure of the state of vegetation health based on how plants reflect light at certain wavelengths.', ""Document: S2 Mission\nSection: S2 Mission > MSI Instrument\nContent:\n**Figure 9: VNIR Flight Focal Plane [Credits: Astrium SAS (France) and e2v Technologies (UK)]**\nThe design of the MSI on-board Sentinel-2 has been driven by the requirement for large swath high geometrical and spectral performance of the measurements.\nThe MSI measures the Earth's reflected radiance in 13 spectral bands from VNIR to SWIR (**Table 2**). All the details about the measured spectral responses for each band are given in the [Sentinel-2 Spectral Response Functions (S2-SRF)](https://sentiwiki.copernicus.eu/__attachments/1692737/COPE-GSEG-EOPG-TN-15-0007%20-%20Sentinel-2%20Spectral%20Response%20Functions%202024%20-%204.0.xlsx?inst-v=0b38ac37-4dd6-44ba-865b-d9854aa106d8) document.\nMore in details, the MSI consists of the following components:\n* A Three-Mirror Anastigmat (TMA) telescope with a pupil diameter equivalent to 150 mm, isostatically mounted on the platform to minimise thermo-elastic distortions. The optical design has been optimised to achieve state-of-the-art imaging quality across its very wide field of view. Its 290 km swath width is a larger swath than previous multi-spectral optical missions such as SPOT and LANDSAT. The telescope structure and the mirrors are made of silicon carbide, which provides a very high optical stability to mass ratio and minimises thermal deformation.\n* Two focal planes based on:\n* monolithic Complementary Metal Oxide Semiconductor (CMOS) detectors for VNIR\n* mercury-cadmium-telluride (MCT) detectors hybridised on a CMOS read-out circuit for SWIR (the SWIR focal plane is passively thermo-controlled at temperatures below 195 K).\n* A dichroic VNIR/SWIR beam splitter. Spectral separation in the various bands is provided by stripe filters mounted on top of the detectors.\n* Two distinct arrays of 12 detectors mounted on each focal plane covering VNIR and SWIR channels respectively. The 12 detectors on each focal plane are in a staggered configuration to cover the entire field of view."", 'Document: S2 Mission\nSection: S2 Mission > Acquisition Resolutions > Spatial Resolution\nContent:\nThe spatial resolution of Sentinel-2 is dependent on the particular spectral band:\n**10 metre spatial resolution:**\n\n**Figure 14: Sentinel-2 10 m spatial resolution bands: B2 (490 nm), B3 (560 nm), B4 (665 nm) and B8 (842 nm)**\n**20 metre spatial resolution:**\n\n**Figure 15: Sentinel-2 20 m spatial resolution bands: B5 (705 nm), B6 (740 nm), B7 (783 nm), B8a (865 nm), B11 (1610 nm) and B12 (2190 nm)**\n**60 metre spatial resolution:**\n\n**Figure 16: Sentinel-2 60 m spatial resolution bands: B1 (443 nm), B9 (940 nm) and B10 (1375 nm)**', 'Document: S2 Mission\nSection: S2 Mission > Acquisition Resolutions\nContent:\nThe resolutions of the Sentinel-2 Mission and its payload MSI instrument are:\n1. The **temporal resolution** of a satellite in orbit is the revisit frequency of the satellite to a...\n2. The **spatial resolution** of an instrument is the _at-ground_ representation of an individual...\n3. The [**spectral resolution**](https://sentiwiki.copernicus...\n4. The **radiometric resolution** of an instrument is a determination of the incremental level of...\n5. The **swath width** of Sentinel-2 is 290 km. In comparison, the swath width of Landsat 5 TM and...', 'Document: S2 Mission\nSection: S2 Mission > Overview of Sentinel-2 Mission > Satellite Description\nContent:\nThe two Sentinel-2 satellites in the nominal configuration operate simultaneously, phased at 180° to each other, in a sun-synchronous orbit at a mean altitude of 786 km. During the extension campaign, Sentinel-2A is located 36° away from Sentinel-2B. The position of each Sentinel-2 satellite in its orbit is measured by a dual-frequency Global Navigation Satellite System (GNSS) receiver. Orbital accuracy is maintained by a dedicated propulsion system.\nThe satellite lifespan is 7.25 years, which includes a 3 month in-orbit commissioning phase. Batteries and propellants have...\nThe Sentinel-2 satellite system was developed by an industrial consortium led by Astrium GmbH (Germany). Astrium SAS (France) is responsible for the MultiSpectral Instrument (MSI).\nThe [MSI](https://sentiwiki.copernicus.eu/web/s2-mission#S2-Mission-MSI-Instrument) works passively, by collecting sunlight reflected from the Earth. New data is acquired by the instrument as the satellite moves along its orbital path. The incoming light beam is split via a beam-splitter and focused onto two separate focal plane assemblies within the instrument; one for Visible and Near-Infra-Red (VNIR) bands and the other one for Short Wave Infra-Red (SWIR) bands. The spectral separation of each band into individual wavelengths is accomplished by stripe filters mounted on top of the detectors.']","To compare the bandwidth of the water vapour absorption band between Sentinel-2 and Sentinel-3 OLCI, I will extract the relevant details from the provided context:

Sentinel-2:
- Document 1 states that Sentinel-2 has a 60 m spatial resolution band (Band 9) centered at ~945 nm for water vapour absorption.
- The document notes that the bandwidth (FWHM) for this band is measured, but does not provide the specific value.

Sentinel-3 OLCI:
- The context provided does not contain any information about the Sentinel-3 OLCI instrument or its spectral bands.

Since the context does not provide the bandwidth specification for the Sentinel-2 water vapour absorption band (Band 9), I cannot make a direct comparison to the Sentinel-3 OLCI instrument. 

The available information is incomplete to determine which instrument has the narrower bandwidth for the water vapour absorption band. Without the specific bandwidth values for both instruments, I cannot provide a comprehensive answer to this question based solely on the given context.

In summary, the context does not contain enough information to compare the bandwidth of the water vapour absorption bands between Sentinel-2 and Sentinel-3 OLCI. The bandwidth of the Sentinel-2 Band 9 is not specified, so I cannot determine which instrument has the narrower bandwidth.",Sentinel-3 OLCI Band 19 (10 nm width) is narrower than Sentinel-2 Band 9 (20 nm width).,0.642857142825,1.0,1.0,0.0
What are the differences between Sentinel-1 and Sentinel-2 resolution capabilities?,"['Document: S1 Mission\nSection: S1 Mission > The Sentinel-1 mission is the European Radar Observatory for the Copernicus joint initiative of the European Commission (EC) and the European Space Agency (ESA). Copernicus is a European initiative for the implementation of information services dealing with environment and security. It is based on observation data received from Earth Observation satellites and ground-based information.\nContent:\nThe Sentinel-1 mission comprises a constellation of two sun-synchronous polar-orbiting satellites, sharing the same orbital plane with 180° orbital phasing difference, operating day and night performing C-band synthetic aperture radar imaging, enabling them to acquire imagery regardless of the weather. It operates in four exclusive imaging modes with different resolution (down to 5 m) and coverage (up to 400 km). It provides dual polarisation capability, very short revisit times and rapid product delivery. For each observation, precise measurements of spacecraft position and attitude are available.\nSentinel-1 works in a pre-programmed operation mode to avoid conflicts and to produce a consistent long-term data archive built for applications based on long time series.\nSentinel-1 is the first of the five missions that ESA developed for the Copernicus initiative. Its measurement domain covers landscape topography, multi-purpose imagery (land), multi-purpose imagery (ocean), ocean surface winds, ocean topography/currents, ocean wave height and spectrum, sea ice cover, edge and thickness, snow cover, edge and depth, soil moisture and vegetation.\nSentinel-1 main [**Mission Objectives and Applications**](https://sentiwiki.copernicus.eu/web/s1-applications) are:  \n**Media 1: Sentinel-1 Radar Mission [Credits: ESA]**\nFor mission planning information, see the [Observation and Production Scenario](https://sentiwiki.copernicus.eu/web/s1-mission#S1-Mission-Observation-and-Production-Scenarios).\n**Launch timeline**\nSentinel-1A was launched on 3 April 2014.\nSentinel-1B was launched on 25 April 2016. The spacecraft experienced an anomaly related to the...\nSentinel-1C was launched on 5 December 2024. Sentinel-1D launch was launched on 4 November 2025.', 'Document: S1 Mission\nSection: S1 Mission > The Sentinel-1 mission is the European Radar Observatory for the Copernicus joint initiative of the European Commission (EC) and the European Space Agency (ESA). Copernicus is a European initiative for the implementation of information services dealing with environment and security. It is based on observation data received from Earth Observation satellites and ground-based information. > Orbit\nContent:\nSentinel-1 is in a near-polar, sun-synchronous orbit with a 12 day repeat cycle and 175 orbits per cycle for a single satellite. Both Sentinel-1A and Sentinel-1B share the same orbit plane with a 180° orbital phasing difference. With both satellites operating, the repeat cycle is six days.\n\n**Figure 2: Sentinel-1 Constellation [Credits: ESA/ATG medialab]**\nIn particular for interferometry, Sentinel-1 requires stringent orbit control. Satellite positioning along the orbit must be accurate, with pointing and timing/synchronisation between interferometric pairs. Orbit positioning control for Sentinel-1 is defined using an orbital Earth fixed ""tube"", 60 m (RMS) wide in radius, around a nominal operational path. The satellite is kept inside this ""tube"" for most of its operational lifetime.\n\n**Figure 3: Sentinel-1 Orbit Tube [Credits: credit: ESA, TAS]**\nThe following table contains a summary of useful orbital information for Sentinel-1A and –1B.\n_Table 1: Orbital information for Sentinel-1A and –1B:_\n**Altitude** | **Inclination** | **Period** | **Cycle** | **Ref. tube deviation** | **Local Time at Ascending Node**\n---|---|---|---|---|---\n693 km | 98.18° | 98.6 minutes | 12 days | +- 120 m | 18:00 hours', ""Document: S1 Mission\nSection: S1 Mission > SAR Instrument\nContent:\n**Figure 6: Sentinel-1 Spacecraft**\nThe C-SAR instrument is an active phased array antenna providing fast scanning in elevation (to cover the large range of incidence angle and to support ScanSAR operation) and in azimuth (to allow use of TOPS technique to meet the required image performance) with dual-pol capacity.\nIt has an internal calibration scheme, where transmit signals are routed into the receiver to allow monitoring of amplitude/phase to facilitate high radiometric stability.\nSentinel-1's metallised carbon-fibre-reinforced-plastic radiating waveguides ensure good radiometric stability even though these elements are not covered by the internal calibration scheme. The digital chirp generator and selectable receive filter bandwidths allow efficient use of on-board storage considering the ground range resolution dependence on incidence angle.\n_Table 2: The key parameters of the Sentinel-1 C-SAR instrument include:_\n**Characteristics** | **Value**\n---|---\nCentre frequency | 5.405 GHz (corresponding to a wavelength of ~5.55 cm)\nBandwidth | 0-100 MHz (programmable)\nPolarisation | HH+HV, VV+VH, VV, HH\nAntenna size | 12.3 m x 0.821 m\nRF Peak power (sum od all TRMs, at TRM o/p) | 4.368 kW, - 4.075 kW (IW, dual polarisations)\nPulse width | 5-100 µs (programmable)\nTransmit duty cycle | Max 12%, SM 8.5%, IW 9%, EW 5%, WV 0.8%\nReceiver noise figure at module input | 3.2 dB\nPRF (Pulse Repetition Frequency) | 1 000 - 3 000 Hz (programmable)\nADC sampling frequency | 300 MHz (real sampling) (digital down-sampling after A/D conversion)\nSampling | 10 bits\nData compression | FDBAQ (Flexible Dynamic Block Adaptive Quantization)\nInstrument Operation | Up to 25 min per orbit continuously in any of the imaging modes and for the rest of the orbit in Wave mode\nTotal instrument mass (including antenna) | 945 kg\nCSAR DC power | 3870 W (Interferometric Wide-swath Mode, two polarisations)\nCSAR data storage capacity | 1410 Gb (End-of-Life)"", 'Document: S1 Mission\nSection: S1 Mission > The Sentinel-1 mission is the European Radar Observatory for the Copernicus joint initiative of the European Commission (EC) and the European Space Agency (ESA). Copernicus is a European initiative for the implementation of information services dealing with environment and security. It is based on observation data received from Earth Observation satellites and ground-based information. > Geographical Coverage\nContent:\nThe Copernicus Sentinel-1 constellation offers an improvement in revisit time over ERS-1/2 and Envisat ASAR, and a continuity of wide area coverage with Envisat ASAR, but achieving higher resolution and potentially global dual polarisation coverage over landmasses.\nA single Sentinel-1 satellite is potentially able to map the entire world in the Interferometric Wide swath mode once every 12 days, with 175 orbits per cycle. The two-satellite constellation offers a 6 day exact repeat cycle.\n\n**Figure 4: Sentinel-1 IW potential world coverage.**\n**Note that this not reflect the operational baseline**\nSince the orbit track spacing varies with latitude, the revisit rate (ascending/descending) is significantly greater at higher latitudes than at the equator: less than 1 day at the Arctic and provides coverage over Europe and Canada, main shipping routes in 1-3 days and in 3 days at the equator. Radar data are delivered to Copernicus services within an hour of acquisition.\n\n**Figure 5: Revisit time for S-1A and S-1B in Days per Revisit**', 'Document: S1 Applications\nSection: S1 Applications > Sentinel-1 delivers radar imagery for numerous applications. SAR images are the best way of tracking land subsidence and structural damage: systematic observations and enhanced interferometric capabilities make ground movement barely noticeable in everyday life detectable and closely monitorable. As well as being a valuable resource for urban planners, this kind of information is essential for monitoring shifts from earthquakes, landslides and volcanic uplift. Moreover it helps geohazard monitoring, mining, geology and city planning through subsidence risk assessment.\nContent:\nThe mission’s dual polarimetric products benefit users interested in agriculture, forestry and land cover classification.\nThe SAR ability to provide observation in all weather, and in day or night time conditions, makes it ideal for maritime and Arctic monitoring. Images acquired over the ocean are essential for generating timely maps of sea ice for safe passage, for detecting and tracking oil spills and offer key information on wind and waves in the open sea for shipping and wave-energy applications.\nFinally, Sentinel-1 is designed specifically to provide images for rapid response to disasters such as floods and earthquakes.\nThrough the products provided, security users can monitor major shipping routes to detect illegal activities, gather prosecution evidence in case of illegal discharges, detect unexpected building in remote areas, monitor deforestation and support search and rescue activities.\nThe mission’s main characteristics such as short revisit time and rapid data dissemination benefit emergency response users, such as the United Nations [The International Charter Space and Major Disasters](http://www.disasterscharter.org/), in emergency situations such as floods, earthquakes, volcanic eruptions and landslides.\nEach application can be better served by specific acquisition modes and product types as shown in the table below. The Interferometric Wide swath mode is the primary operation mode for most applications over land. Description of each product type and format is available: [Products](https://sentiwiki.copernicus.eu/web/s1-products).\nRefer to the [High-Level Operation Plan](https://sentiwiki.copernicus.eu/__attachments/1673407/COPE-S1OP-EOPG-PL-15-0020%20-%20Sentinel%20HLOP%202021%20-%203.1.pdf?inst-v=0b38ac37-4dd6-44ba-865b-d9854aa106d8) (HLOP) for a description of the acquisition...\n_Table 1: Mapping of most common mode and application type used based on the processing baseline_\n**Applications** | **Acquisition Mode** | **Product Type**\n---|---|---', 'Document: S1 Applications\nSection: S1 Applications > Sentinel-1 delivers radar imagery for numerous applications. SAR images are the best way of tracking land subsidence and structural damage: systematic observations and enhanced interferometric capabilities make ground movement barely noticeable in everyday life detectable and closely monitorable. As well as being a valuable resource for urban planners, this kind of information is essential for monitoring shifts from earthquakes, landslides and volcanic uplift. Moreover it helps geohazard monitoring, mining, geology and city planning through subsidence risk assessment.\nContent:\nTo start using the data visit [CDSE browser ](https://browser.dataspace.copernicus.eu/?zoom=5&lat=50.16282&lng=20.78613&themeId=DEFAULT-THEME&visualizationUrl=U2FsdGVkX18q4LSvU%2Fo1%2FQ3Ki07yzwkfXSn2SQ...\nThe user is addressed to the page [Sentinels Toolboxes](https://sentiwiki.copernicus.eu/web/sentinels-toolboxes#Sentinel-1-Toolbox) to verify the available processing tools for the Sentinel 1 mission.', 'Document: S1 Mission\nSection: S1 Mission > SAR Instrument > Polarimetry\nContent:\nCopernicus Sentinel-1 can collect several different images from the same series of pulses by using its antenna to receive specific polarisations simultaneously. Copernicus Sentinel-1 is a phase-preserving dual polarisation SAR system. It can transmit a signal in either horizontal (H) or vertical (V) polarisation, and then receive in both H and V polarisations. Dual polarisation Level-1 Single Look Complex (SLC) products contain complex values. In addition to the backscatter intensity that can be measured from each single polarisation, the inter-channel phase information allows to perform enhanced analysis of backscattering properties.\nTargets on the ground have distinctive polarisation signatures reflecting different polarisations with different intensities and converting one polarisation into another. For example, volume scatterers (e.g. forest canopy) have different polarisation properties than surface scatterers (e.g. sea surface). Polarimetric techniques such as polarimetric target decomposition (eigenvector-based, model-based, ...) allow the separation of different scattering contributions and can be used to extract information about the scattering process. Dedicated dual-Pol SAR classification techniques allow improved classification of point targets and distributed target areas.\nThe following RADARSAT-2 image of Flevoland in the Netherlands shows the difference in intensities from VH (left) and VV (centre). The composite RGB (colour) image on the right was created using the VV channel for red, VH channel for green and the ratio |VV| / |VH| for blue.\n\n**Figure 8: Intensities from different polarimetric channels [Credits: MDA and CSA]**', 'Document: S1 Applications\nSection: S1 Applications > Land Monitoring > Agriculture\nContent:\nMonitoring of crop conditions, soil properties and mapping tillage activities, help to assess land use, predict harvests, monitor seasonal changes and assist in implementing policy for sustainable development. Sentinel-1 can also be used for monitoring the changes of agricultural production and productivity of pastures caused by drought and monitoring the decline of land productivity and soil degradation due to excessive cultivation and pasturage and improper irrigation.\nAgricultural maps enable provision of independent and objective estimates of the extent of cultivation in a given country or growing season, which can be used to support efforts to ensure food security in vulnerable areas.\nBoth SLC and GRD products can be used for crop monitoring, depending on the parameter of interest. Typically, if the SAR intensity is preferred, then the GRD is the only product needed. However, if more information are necessary, polarimetric parameters are requested so SLC product should be selected.\nFor both product types, double polarisation shall be selected as cross-polarised VH backscatter is highly sensitive to changes in vegetation densities and structure and polarisation ratio VH/VV is sensitive to vegetation phenology or water content.\n\n**Figure 2: Monitoring of expansion of rubber plantation with Sentinel-2 / Sentinel-1. Contains modified Copernicus data [2015-2017], processed by SIRS.**\n\n**Figure 3: Land cover view, North East of Guyana, 2017. The image was acquired in IW mode, GRD level, VH poalrisation.[Credits:**[Mundialis | Ecosystem...\n\n**Figure 4: Rice fields in Mekong Delta, Vietnam (2020). Multi-temporal image combining three radar acquisitions taken around one month apart to show changes in crop and land conditions over time. [Credits: ESA**[Rice fields, Vietnam](https://www.esa.int/ESA_Multimedia/Images/2020/03/Rice_fields_Vietnam)**]**', 'Document: S1 Products\nSection: S1 Products > Related Production > **Sentinel-1 Global Backscatter Model (S1GBM)**\nContent:\n**Figure 15: Mapping Earth\'s land surface with C-band Synthetic Aperture Radar (SAR)**\n**Description**\nThe Sentinel-1 Global Backscatter Model (S1GBM) describes the C-band radar cross section of the Earth\'s land surface for the period between 2016 and 2017, generated from 460,000 Copernicus Sentinel-1 IW GRDH (Ground-Range Detected High Resolution) backscatter measurements normalised to the reference incidence angle of 38°. This release of the S1GBM comprises two global mosaics describing the temporal mean of sigma nought backscatter s0(38, t) in VV- and VH-polarisation respectively.\nThe S1GBM supports the testing, design, and verification of upcoming radar sensors, related SAR-processor performance simulations, raw data compression optimisation, and visualisation purposes. It also presents a valuable environmental record for investigating the C-band VV/VH backscatter response over different land covers, and documenting the state of the land surface in 2016 and 2017.\n**Data Set Specifications**\nThe S1GBM VV and VH mosaics are georeferenced to the Equi7Grid and divided into six continental zones (Africa, Asia, Europe, North America, Oceania, South America), which are further divided into square tiles of 100 km extent (""T1""-tiles). The dataset is organised in 12 collections, one for each of the 6 continents and the 2 polarisations. In addition to the original data images, downsampled quicklook-files of same geographic extent are available for all tiles, allowing for a convenient preview of the data. With this setup, the S1GBM consists of 16,071 tiles over 6 continents, for VV and VH each, totalling to a data volume of 2.67 TB.\nThe tiles\' file-format is a LZW-compressed GeoTIFF holding 16-bit integer values, with tagged metadata on encoding and georeference. Compatibility with common geographic information systems, such as QGIS or ArcGIS, and geodata libraries, such as GDAL, is given.', 'Document: S1 Applications\nSection: S1 Applications > Sentinel-1 delivers radar imagery for numerous applications. SAR images are the best way of tracking land subsidence and structural damage: systematic observations and enhanced interferometric capabilities make ground movement barely noticeable in everyday life detectable and closely monitorable. As well as being a valuable resource for urban planners, this kind of information is essential for monitoring shifts from earthquakes, landslides and volcanic uplift. Moreover it helps geohazard monitoring, mining, geology and city planning through subsidence risk assessment.\nContent:\n_Table 1: Mapping of most common mode and application type used based on the processing baseline_\n**Applications** | **Acquisition Mode** | **Product Type**\n---|---|---\n**SM** | **IW** | **EW** | **WV** | **SLC** | **GRD** | **OCN**\n| **SH** | **SV** | **DH** | **DV** | **SH** | **SV** | **DH** | **DV** | **SH** | **SV** | **DH** | **DV** | **SH** | **SV**\n**Arctic Environment and Sea-Ice Zones Monitoring** |  |  |  |  | ✔️ |  | ✔️ |  | ✔️ |  | ✔️ |  |  |  | ✔️ | ✔️ |\n**Open Ocean Ship Surveillance** | ✔️ |  |  |  |  |  | ✔️ | ✔️ |  |  | ✔️ | ✔️ |  |  |  | ✔️ |\n**Oil Pollution Monitoring** |  |  |  |  |  |  | ✔️ | ✔️ |  |  | ✔️ | ✔️ |  |  |  | ✔️ |\n**Marine winds** |  |  |  |  | ✔️ | ✔️ |  |  | ✔️ | ✔️ |  |  |  | ✔️ |  | ✔️ | ✔️\n**Forestry** |  |  | ✔️ | ✔️ |  |  | ✔️ | ✔️ |  |  |  |  |  |  | ✔️ | ✔️ |\n**Agriculture** |  |  | ✔️ | ✔️ |  |  | ✔️ | ✔️ |  |  |  |  |  |  | ✔️ | ✔️ |\n**Urban deformation mapping** |  | ✔️ | ✔️ | ✔️ |  |  |  |  |  |  |  |  |  |  | ✔️ | ✔️ |\n**Flood monitoring** | ✔️ |  |  |  |  | ✔️ | ✔️ | ✔️ |  |  |  |  |  |  | ✔️ | ✔️ |\n**Earthquake analysis** | ✔️ |  |  | ✔️ |  |  |  |  |  |  |  |  |  |  | ✔️ |  |\n**Landslide and volcano monitoring** |  | ✔️ | ✔️ | ✔️ |  | ✔️ | ✔️ | ✔️ |  |  |  |  |  |  | ✔️ |  |\n_Note: for a number of small volcanic islands worldwide, from May 2015 onwards, the Stripmap mode (SM) is used for the regular coverage. This is implemented in the case a SM swath fully covers the island in one pass, and no maritime surveillance activities take place around the island. The SM mode features (at a comparable system resource consumption) a smaller swath w.r.t the IW mode (in the order of 80 km vs 250 km) but ensures a higher spatial resolution, of particular interest for volcano monitoring._']","Based on the information provided in the Sentinel-1 mission documentation, the key differences between the resolution capabilities of Sentinel-1 and Sentinel-2 are:

Sentinel-1 Resolution:
- Sentinel-1 operates in C-band Synthetic Aperture Radar (SAR) imaging mode
- It has multiple acquisition modes with different resolutions:
  - Stripmap (SM) mode: Down to 5 m resolution
  - Interferometric Wide-swath (IW) mode: Down to 5 m resolution
  - Extra-Wide (EW) swath mode: Down to 20 m resolution
  - Wave (WV) mode: 20 m resolution

Sentinel-2 Resolution:
- Sentinel-2 is a multi-spectral optical imaging mission
- It has 13 spectral bands with the following spatial resolutions:
  - 10 m resolution for the Blue, Green, Red and Near-Infrared bands
  - 20 m resolution for the Red Edge and Shortwave Infrared bands
  - 60 m resolution for the Coastal/Aerosol, Water Vapor and Cirrus bands

In summary, the key differences are:

1. Sensor Type:
   - Sentinel-1 uses Synthetic Aperture Radar (SAR) imaging
   - Sentinel-2 uses multi-spectral optical imaging

2. Spatial Resolution:
   - Sentinel-1 can achieve higher spatial resolutions down to 5 m in its various imaging modes
   - Sentinel-2 has a maximum spatial resolution of 10 m for its highest resolution bands

3. Spectral Resolution:
   - Sentinel-1 is a single C-band radar instrument
   - Sentinel-2 has 13 spectral bands covering the visible, near-infrared and shortwave infrared regions

So in general, Sentinel-1 provides higher spatial resolution imaging capabilities compared to Sentinel-2, but Sentinel-2 offers more detailed spectral information across a wider range of the electromagnetic spectrum.","Sentinel-1 (Radar) resolutions range from 5-40 m depending on mode. Sentinel-2 (Optical) has fixed resolutions of 10 m, 20 m, and 60 m depending on the band.",0.6111111110958334,0.5,,0.9614114990994058
Which has a higher revisit frequency at the equator: the Sentinel-1 constellation or the Sentinel-2 constellation?,"['Document: S1 Mission\nSection: S1 Mission > The Sentinel-1 mission is the European Radar Observatory for the Copernicus joint initiative of the European Commission (EC) and the European Space Agency (ESA). Copernicus is a European initiative for the implementation of information services dealing with environment and security. It is based on observation data received from Earth Observation satellites and ground-based information. > Geographical Coverage\nContent:\nThe Copernicus Sentinel-1 constellation offers an improvement in revisit time over ERS-1/2 and Envisat ASAR, and a continuity of wide area coverage with Envisat ASAR, but achieving higher resolution and potentially global dual polarisation coverage over landmasses.\nA single Sentinel-1 satellite is potentially able to map the entire world in the Interferometric Wide swath mode once every 12 days, with 175 orbits per cycle. The two-satellite constellation offers a 6 day exact repeat cycle.\n\n**Figure 4: Sentinel-1 IW potential world coverage.**\n**Note that this not reflect the operational baseline**\nSince the orbit track spacing varies with latitude, the revisit rate (ascending/descending) is significantly greater at higher latitudes than at the equator: less than 1 day at the Arctic and provides coverage over Europe and Canada, main shipping routes in 1-3 days and in 3 days at the equator. Radar data are delivered to Copernicus services within an hour of acquisition.\n\n**Figure 5: Revisit time for S-1A and S-1B in Days per Revisit**', 'Document: S1 Mission\nSection: S1 Mission > The Sentinel-1 mission is the European Radar Observatory for the Copernicus joint initiative of the European Commission (EC) and the European Space Agency (ESA). Copernicus is a European initiative for the implementation of information services dealing with environment and security. It is based on observation data received from Earth Observation satellites and ground-based information.\nContent:\nThe Sentinel-1 mission comprises a constellation of two sun-synchronous polar-orbiting satellites, sharing the same orbital plane with 180° orbital phasing difference, operating day and night performing C-band synthetic aperture radar imaging, enabling them to acquire imagery regardless of the weather. It operates in four exclusive imaging modes with different resolution (down to 5 m) and coverage (up to 400 km). It provides dual polarisation capability, very short revisit times and rapid product delivery. For each observation, precise measurements of spacecraft position and attitude are available.\nSentinel-1 works in a pre-programmed operation mode to avoid conflicts and to produce a consistent long-term data archive built for applications based on long time series.\nSentinel-1 is the first of the five missions that ESA developed for the Copernicus initiative. Its measurement domain covers landscape topography, multi-purpose imagery (land), multi-purpose imagery (ocean), ocean surface winds, ocean topography/currents, ocean wave height and spectrum, sea ice cover, edge and thickness, snow cover, edge and depth, soil moisture and vegetation.\nSentinel-1 main [**Mission Objectives and Applications**](https://sentiwiki.copernicus.eu/web/s1-applications) are:  \n**Media 1: Sentinel-1 Radar Mission [Credits: ESA]**\nFor mission planning information, see the [Observation and Production Scenario](https://sentiwiki.copernicus.eu/web/s1-mission#S1-Mission-Observation-and-Production-Scenarios).\n**Launch timeline**\nSentinel-1A was launched on 3 April 2014.\nSentinel-1B was launched on 25 April 2016. The spacecraft experienced an anomaly related to the...\nSentinel-1C was launched on 5 December 2024. Sentinel-1D launch was launched on 4 November 2025.', 'Document: S1 Mission\nSection: S1 Mission > Observation and Production Scenarios > SAR Observation Scenario\nContent:\nAs a general principle, the polarisation scheme uses the following logic:\n* HH-HV or HH polarization for the monitoring of polar environments, sea-ice zones\n* VV-VH or VV polarization for all other observation zones (with an exception for the Baltic Sea observed partially in HH-HV with Sentinel-1B during northern winter)  \nPlease see the [Sentinel High Level Operations Plan (HLOP) ](https://omcs.atlassian.net/wiki/download/attachments/283246733/COPE-S1OP-EOPG-PL-15-0020%20-%20Sentinel%20HLOP%202021%20-%203.1.pdf?api=v2)document providing the top-level operations plan of the Sentinel missions, including...\nDetailed information on the planned Sentinel-1 observations in terms of Sentinel-1 acquisitions (SAR mode, date, start-stop times, polarization, etc.) are provided with KML files available [here](https://sentinels.copernicus.eu/web/sentinel/copernicus/sentinel-1/acquisition-plans).\n**Sentinel-1C was successfully launched on December 2024 and, it is fully operational since early May 2025 (end of the commissioning phase). Sentinel-1C allowed to re-establish the 2-satellite constellation configuration: Sentinel-1A and Sentinel-1C.**\n**The two maps below show an overview of the current observation plan in terms SAR mode, polarisation, observation geometry, revisit and coverage frequency. The Wave mode, continuously operated by default over open oceans, is not shown on these maps.**\n![Sentinel-1-Repeat-Coverage-Frequency-Geometry-2025_1.](https://sentiwiki.copernicus.eu/__attachments/1672913/Sentinel-1-Repeat-Coverage-Frequency-Ge...\n**Figure 18: Sentinel-1A Mission Observation Scenario: Repeat & Coverage Frequency**\n![Sentinel-1-Mode-Polarisation-Observation-Geometry-2025_1.](https://sentiwiki.copernicus.eu/__attachments/1672913/Sentinel-1-Mode-Polarisation-Observatio...\n**Figure 19: Sentinel-1A Mission Observation Scenario: Mode - Polarisation- Geometry**', 'Document: S1 Mission\nSection: S1 Mission > The Sentinel-1 mission is the European Radar Observatory for the Copernicus joint initiative of the European Commission (EC) and the European Space Agency (ESA). Copernicus is a European initiative for the implementation of information services dealing with environment and security. It is based on observation data received from Earth Observation satellites and ground-based information. > Orbit\nContent:\nSentinel-1 is in a near-polar, sun-synchronous orbit with a 12 day repeat cycle and 175 orbits per cycle for a single satellite. Both Sentinel-1A and Sentinel-1B share the same orbit plane with a 180° orbital phasing difference. With both satellites operating, the repeat cycle is six days.\n\n**Figure 2: Sentinel-1 Constellation [Credits: ESA/ATG medialab]**\nIn particular for interferometry, Sentinel-1 requires stringent orbit control. Satellite positioning along the orbit must be accurate, with pointing and timing/synchronisation between interferometric pairs. Orbit positioning control for Sentinel-1 is defined using an orbital Earth fixed ""tube"", 60 m (RMS) wide in radius, around a nominal operational path. The satellite is kept inside this ""tube"" for most of its operational lifetime.\n\n**Figure 3: Sentinel-1 Orbit Tube [Credits: credit: ESA, TAS]**\nThe following table contains a summary of useful orbital information for Sentinel-1A and –1B.\n_Table 1: Orbital information for Sentinel-1A and –1B:_\n**Altitude** | **Inclination** | **Period** | **Cycle** | **Ref. tube deviation** | **Local Time at Ascending Node**\n---|---|---|---|---|---\n693 km | 98.18° | 98.6 minutes | 12 days | +- 120 m | 18:00 hours', 'Document: S1 Mission\nSection: S1 Mission > Observation and Production Scenarios > SAR Observation Scenario\nContent:\n**Figure 19: Sentinel-1A Mission Observation Scenario: Mode - Polarisation- Geometry**\n**Following an anomaly to the instrument electronics power supply on December 2021, the Sentinel-1B satellite was unable to deliver radar data.**\n**The end of mission was declared in July 2022 while disposal activities have been completed on September 2024. During the time frame September 2022 – April 2025, the Sentinel-1A observation scenario was...\nPlease see maps below.\n![](https://sentiwiki.copernicus.eu/__attachments/1672913/Sentinel-1-Repeat-Coverage-Frequency-Geom...\n**Figure 20: Sentinel-1 Constellation Observation Scenario: Repeat and Coverage Frequency**\n![](https://sentiwiki.copernicus.eu/__attachments/1672913/Sentinel-1-Mode-Polarisation-Geometry-202...\n**Figure 21: Sentinel-1 Constellation (Sentinel-1A + Sentinel-1B ) Observation Scenario: Mode - Polarisation- Geometry**\n**Past Sentinel-1 Mission acquisition plans (including operations ramp up phase) in KML format are available**[**here**](https://sentiwiki.copernicus.eu/web/document-library#DocumentLibrary-AcquisitionPlansLibrary-S1-Acquisition-Plans)\n**The Sentinel-1 ground segment operations implement a baseline pre-defined mission production scenario.**\nThis scenario foresees the systematic processing and online dissemination of all Sentinel-1 data acquired in **IW, EW and SM modes into Level-0 and Level-1 GRD products**.\nGRD products are generated in High Resolution (HR) and Medium Resolution (MR).\nThe resolution is dependent upon the amount of multi-looking performed. Level-1 GRD products are available in HR for IW and SM modes and in MR for EW mode.\nThis is complemented by the systematic processing and online dissemination of:\n* _Level-1 SLC products for all acquired Wave Mode data (active since October 2016 for Sentinel-1B and since May 2017 for Sentinel-1A)_', 'Document: S1 Products\nSection: S1 Products > Related Production > **Sentinel-1 Global Backscatter Model (S1GBM)**\nContent:\n**Figure 15: Mapping Earth\'s land surface with C-band Synthetic Aperture Radar (SAR)**\n**Description**\nThe Sentinel-1 Global Backscatter Model (S1GBM) describes the C-band radar cross section of the Earth\'s land surface for the period between 2016 and 2017, generated from 460,000 Copernicus Sentinel-1 IW GRDH (Ground-Range Detected High Resolution) backscatter measurements normalised to the reference incidence angle of 38°. This release of the S1GBM comprises two global mosaics describing the temporal mean of sigma nought backscatter s0(38, t) in VV- and VH-polarisation respectively.\nThe S1GBM supports the testing, design, and verification of upcoming radar sensors, related SAR-processor performance simulations, raw data compression optimisation, and visualisation purposes. It also presents a valuable environmental record for investigating the C-band VV/VH backscatter response over different land covers, and documenting the state of the land surface in 2016 and 2017.\n**Data Set Specifications**\nThe S1GBM VV and VH mosaics are georeferenced to the Equi7Grid and divided into six continental zones (Africa, Asia, Europe, North America, Oceania, South America), which are further divided into square tiles of 100 km extent (""T1""-tiles). The dataset is organised in 12 collections, one for each of the 6 continents and the 2 polarisations. In addition to the original data images, downsampled quicklook-files of same geographic extent are available for all tiles, allowing for a convenient preview of the data. With this setup, the S1GBM consists of 16,071 tiles over 6 continents, for VV and VH each, totalling to a data volume of 2.67 TB.\nThe tiles\' file-format is a LZW-compressed GeoTIFF holding 16-bit integer values, with tagged metadata on encoding and georeference. Compatibility with common geographic information systems, such as QGIS or ArcGIS, and geodata libraries, such as GDAL, is given.', 'Document: S1 Mission\nSection: S1 Mission > The Sentinel-1 mission is the European Radar Observatory for the Copernicus joint initiative of the European Commission (EC) and the European Space Agency (ESA). Copernicus is a European initiative for the implementation of information services dealing with environment and security. It is based on observation data received from Earth Observation satellites and ground-based information. > Satellite Description\nContent:\nThe satellite has been created by an industrial consortium led by Thales Alenia Space Italy as prime contractor, with Astrium Germany being responsible for the CSAR payload, incorporating the central radar electronics sub-system developed by Astrium UK.\n\n**Figure 1: Schematic View of the Deployed Sentinel-1 Spacecraft. [Credits: TAS-I]**\nThe spacecraft is a three-axis, stabilised satellite, yaw/pitch/roll steering (zero Doppler), characterised by sun, star, gyro and magnetic field sensors, a set of four reaction wheels dedicated to orbit and attitude control and three torque rods as actuators to provide steering capabilities on each axis. The satellite is equipped with two solar array wings capable of producing 5 900 W (at end of life) to be stored in a modular battery, the battery capacity is 324 Ah.\nThe satellite is based on the PRIMA (Piattaforma Italiana Multi Applicativa) bus, building on the experience gained from RADARSAT-2 and COSMO-SkyMed, which use the same bus. The bus provides highly accurate pointing knowledge (better than 0.004°) on each axis, high attitude accuracy (about 0.01° on each axis) and real-time orbit...\nThe reference orbit will be maintained within an Earth-fixed orbital tube of a diameter of 120 m (RMS) during normal operation.\nThe satellite platform provides features for the management of the attitude and orbit control systems, science data handling with storage capability of 1,410 Gb, propulsion, power, thermal control, spacecraft autonomy and failure detection identification and recovery, and communication with the ground via X-band data downlink and optical data link through EDRS for payload data at 520 Mbit/s; S-band 64 kbps uplink and 128 kbps / 2 Mbps downlink for TM/TC.\nThe total mass of the spacecraft at launch is approximately 2 300 kg (including 130 kg fuel).', ""Document: S1 Products\nSection: S1 Products > Level-1 Products\nContent:\nSentinel-1 Level-1 products are the baseline products for the majority of users from which higher levels are derived. From data in each acquisition mode, the Instrument Processing Facility (IPF) generates focused Level-1 Single Look Complex (SLC) products and Level-1 Ground Range Detected (GRD) products.\nSAR parameters that vary with the satellite position in orbit, such as azimuth FM rate, Doppler centroid frequency and terrain height, are periodically updated to ensure the homogeneity of the scene when processing a complete data take. Similarly, products generated from WV data can contain any number of vignettes, potentially up to an entire orbit's worth.\nAll Level-1 products are geo-referenced and time tagged with zero Doppler time at the centre of the swath. Geo-referencing is corrected for the azimuth bi-static bias by taking into account the pulse travel time delta between the centre of the swath and the range of each geo-referenced point.\nA Level-1 product can be one of the following two types:  \nGRD products are further classified by resolution (Full, High or Medium). Note that FR is only available for Stripmap mode.\n_Table 6:_\n**Acq.**\n**Mode** | **Product**\n**Type** | **Resolution**\n**Class** | **Resolution**\n**Rng x Azi [m]** | **Pixel Spacing**\n**Rng x Azi [m]** | **Num Looks**\n**Rng x Azi** | **ENL**\n---|---|---|---|---|---|---\nSM | SLC | - | 1.7x4.3 to\n3.6x4.9 | 1.5x3.6 to\n3.1x4.1 | 1x1 | 1\nGRD | FR | 9x9 | 3.5x3.5 | 2x2 | 3.7\nHR | 23x23 | 10x10 | 6x6 | 29.7\nMR | 84x84 | 40x40 | 22x22 | 398.4\nIW | SLC | - | 2.7x22 to\n3.5x22 | 2.3x14.1 | 1x1 | 1\nGRD | HR | 20x22 | 10x10 | 5x1 | 4.4\nMR | 88x87 | 40x40 | 22x5 | 81.8\nEW | SLC | - | 7.9x43 to\n15x43 | 5.9x19.9 | 1x1 | 1\nGRD | HR | 50x50 | 25x25 | 3x1 | 2.8\nMR | 93x87 | 40x40 | 6x2 | 10.7\nWV | SLC | - | 2.0x4.8\n3.1x4.8 | 1.7x4.1\n2.7x4.1 | 1x1 | 1\nGRD | MR | 52x51 | 25x25 | 13x13 | 123.7"", ""Document: S1 Mission\nSection: S1 Mission > SAR Instrument\nContent:\n**Figure 6: Sentinel-1 Spacecraft**\nThe C-SAR instrument is an active phased array antenna providing fast scanning in elevation (to cover the large range of incidence angle and to support ScanSAR operation) and in azimuth (to allow use of TOPS technique to meet the required image performance) with dual-pol capacity.\nIt has an internal calibration scheme, where transmit signals are routed into the receiver to allow monitoring of amplitude/phase to facilitate high radiometric stability.\nSentinel-1's metallised carbon-fibre-reinforced-plastic radiating waveguides ensure good radiometric stability even though these elements are not covered by the internal calibration scheme. The digital chirp generator and selectable receive filter bandwidths allow efficient use of on-board storage considering the ground range resolution dependence on incidence angle.\n_Table 2: The key parameters of the Sentinel-1 C-SAR instrument include:_\n**Characteristics** | **Value**\n---|---\nCentre frequency | 5.405 GHz (corresponding to a wavelength of ~5.55 cm)\nBandwidth | 0-100 MHz (programmable)\nPolarisation | HH+HV, VV+VH, VV, HH\nAntenna size | 12.3 m x 0.821 m\nRF Peak power (sum od all TRMs, at TRM o/p) | 4.368 kW, - 4.075 kW (IW, dual polarisations)\nPulse width | 5-100 µs (programmable)\nTransmit duty cycle | Max 12%, SM 8.5%, IW 9%, EW 5%, WV 0.8%\nReceiver noise figure at module input | 3.2 dB\nPRF (Pulse Repetition Frequency) | 1 000 - 3 000 Hz (programmable)\nADC sampling frequency | 300 MHz (real sampling) (digital down-sampling after A/D conversion)\nSampling | 10 bits\nData compression | FDBAQ (Flexible Dynamic Block Adaptive Quantization)\nInstrument Operation | Up to 25 min per orbit continuously in any of the imaging modes and for the rest of the orbit in Wave mode\nTotal instrument mass (including antenna) | 945 kg\nCSAR DC power | 3870 W (Interferometric Wide-swath Mode, two polarisations)\nCSAR data storage capacity | 1410 Gb (End-of-Life)"", 'Document: S1 Applications\nSection: S1 Applications > Sentinel-1 delivers radar imagery for numerous applications. SAR images are the best way of tracking land subsidence and structural damage: systematic observations and enhanced interferometric capabilities make ground movement barely noticeable in everyday life detectable and closely monitorable. As well as being a valuable resource for urban planners, this kind of information is essential for monitoring shifts from earthquakes, landslides and volcanic uplift. Moreover it helps geohazard monitoring, mining, geology and city planning through subsidence risk assessment.\nContent:\nThe mission’s dual polarimetric products benefit users interested in agriculture, forestry and land cover classification.\nThe SAR ability to provide observation in all weather, and in day or night time conditions, makes it ideal for maritime and Arctic monitoring. Images acquired over the ocean are essential for generating timely maps of sea ice for safe passage, for detecting and tracking oil spills and offer key information on wind and waves in the open sea for shipping and wave-energy applications.\nFinally, Sentinel-1 is designed specifically to provide images for rapid response to disasters such as floods and earthquakes.\nThrough the products provided, security users can monitor major shipping routes to detect illegal activities, gather prosecution evidence in case of illegal discharges, detect unexpected building in remote areas, monitor deforestation and support search and rescue activities.\nThe mission’s main characteristics such as short revisit time and rapid data dissemination benefit emergency response users, such as the United Nations [The International Charter Space and Major Disasters](http://www.disasterscharter.org/), in emergency situations such as floods, earthquakes, volcanic eruptions and landslides.\nEach application can be better served by specific acquisition modes and product types as shown in the table below. The Interferometric Wide swath mode is the primary operation mode for most applications over land. Description of each product type and format is available: [Products](https://sentiwiki.copernicus.eu/web/s1-products).\nRefer to the [High-Level Operation Plan](https://sentiwiki.copernicus.eu/__attachments/1673407/COPE-S1OP-EOPG-PL-15-0020%20-%20Sentinel%20HLOP%202021%20-%203.1.pdf?inst-v=0b38ac37-4dd6-44ba-865b-d9854aa106d8) (HLOP) for a description of the acquisition...\n_Table 1: Mapping of most common mode and application type used based on the processing baseline_\n**Applications** | **Acquisition Mode** | **Product Type**\n---|---|---']","Based on the information provided in the context, the Sentinel-1 constellation has a higher revisit frequency at the equator compared to the Sentinel-2 constellation.

Specifically, the context states:

""Since the orbit track spacing varies with latitude, the revisit rate (ascending/descending) is significantly greater at higher latitudes than at the equator: less than 1 day at the Arctic and provides coverage over Europe and Canada, main shipping routes in 1-3 days and in 3 days at the equator.""

This indicates that the Sentinel-1 constellation, with its two-satellite configuration, can provide coverage over the equator every 3 days.

In contrast, the context does not provide any information about the revisit frequency of the Sentinel-2 constellation at the equator. The Sentinel-2 mission is not discussed in the provided documents.

Therefore, based solely on the information given in the Sentinel-1 mission context, the Sentinel-1 constellation has a higher revisit frequency of 3 days at the equator, while the revisit frequency of the Sentinel-2 constellation at the equator is not specified.",Sentinel-2 has a higher revisit frequency (5 days with 2 satellites) compared to Sentinel-1 (6 days with 2 satellites).,0.7499999999625,1.0,0.8333333333333334,0.0
Compare the main instrument payload of Sentinel-5P versus Sentinel-4.,"['Document: S5P Mission\nSection: S5P Mission > TROPOMI Instrument\nContent:\n**The Sentinel-5P satellite carries a single payload instrument: TROPOMI (TROPOspheric Monitoring Instrument).**\nThe TROPOspheric Monitoring Instrument (TROPOMI) instrument was co-funded by ESA and the Netherlands. Key organisations from the Netherlands include KNMI (Royal Netherlands Meteorological Institute), SRON (Space Research Organization Netherlands), TNO (Netherlands Organization for Applied Scientific Research), and Airbus DS-NL, on behalf of NSO (Netherlands Space Office).\nKNMI and SRON are responsible for the development of the Level 1B and some Level 2 products (e.g. Methane, Nitrogen Dioxide). Airbus DS-NL was the principal contractor for instrument construction and many European industries have contributed to the subsystems. The Belgian Institute for Space Aeronomy (BIRA), the German Aerospace Centre (DLR), and the Rutherford Appleton Laboratory (RAL) are contributing as well to the TROPOMI Level-2 product development. The operational data processing is performed at DLR (on behalf of ESA and the European Commission).\n**The main characteristics of TROPOMI are:**\n* Type: passive grating imaging spectrometer\n* Configuration: Push broom staring (non-scanning) in nadir viewing\n* Swath width: 2,600 km\n* Spatial sampling: 7x7 km2\n* Spectral: 4 spectrometers, each electronically split in two bands (2 in UV, 2 in VIS, 2 in NIR, 2 in SWIR)\n* Radiometric accuracy (absolute): 1.6% (SWIR) to 1.9% (UV) of the measured earth spectral reflectance.\n* Overall mass: 204.3 kg not including ICU (16.7 kg) that is integrated on the platform, separated from the instrument.\n* Dimensions: 1.40 x 0.65 x 0.75 m\n* Design lifetime: 7 years\n* Average power consumption: 155 W\n* Generated data volume: 139 Gbits per full orbit.', ""Document: S5P Mission\nSection: S5P Mission > Overview of Sentinel-5P Mission\nContent:\n**Figure 1: An artist´s impression of Sentinel-5P. [Credits:**[CMEMS](https://marine.copernicus.eu/services/use-cases/sustainable-monitoring-transparent-coastal-waters-high-resolution-satellites)**]**\nThe Copernicus Sentinel-5 Precursor mission is the first Copernicus mission dedicated to monitoring our atmosphere. Copernicus Sentinel-5P is the result of close collaboration between ESA, the European Commission, the Netherlands Space Office, industry, data users and scientists.\nThe mission consists of one satellite carrying the TROPOspheric Monitoring Instrument (TROPOMI) instrument. The TROPOMI instrument was co-funded by ESA and The Netherlands.\nThe **main objective** of the Copernicus Sentinel-5P mission is to perform atmospheric measurements with high spatio-temporal resolution, to be used for air quality, ozone & UV radiation, and climate monitoring & forecasting.\nThe satellite was successfully launched on 13 October 2017 from the Plesetsk cosmodrome in Russia.\nThe satellite's local time of ascending node crossing of 13.30 h has been chosen to facilitate the so-called loose formation operation with NASA's Suomi-NPP...\nThe Copernicus Sentinel-5 Precursor mission reduces gaps in the availability of global atmospheric data products between SCIAMACHY/Envisat (which ended in April 2012), the OMI/AURA mission and the future Copernicus Sentinel-4 and Sentinel-5 missions."", ""Document: S5P Mission\nSection: S5P Mission > Overview of Sentinel-5P Mission > Satellite Description\nContent:\nSentinel-5P is a low Earth-orbit satellite compatible with small launchers, including VEGA and ROCKOT, with ROCKOT being the selected launch vehicle. Sentinel-5P is designed for a seven year operational lifetime with 80 kg of hydrazine propellant.\nThe mechanical platform consists of a hexagonal structure supporting the platform electrical units and the TROPOMI Instrument Control Unit (ICU), and interfacing to a standard launch vehicle interface ring.\n**The main subsystems of the satellite are:**\n* propulsion subsystem (including a hydrazine tank)\n* Electrical Power Subsystem (EPS), comprising three deployable solar arrays providing power to the spacecraft and payload\n* Thermal Control Subsystem (TCS), including heaters needed to maintain the thermal environment on the platform\n* Attitude and Orbit Control System (AOCS) composed of a three-head star tracker, GPS receivers, reaction wheels, magnetotorquers, a coarse Earth sensor and magnetometers\n* Data Handling Subsystem (DHS), comprising the on-board computer with a mass memory of 72 hours for satellite housekeeping data and command storage for at least 7 days of operation\n* S-band communication subsystem (TT&C), providing two redundant S-band transponders for reception of telecommands and transmission of satellite housekeeping data\n* Payload Data Handling and Transmission subsystem (PDHT), providing a mass memory capacity for storage of 'science' telemetry and two redundant X-band transmitters.  \n_Table 1: Main Satellite Platform Characteristics_\n**Characteristic** | **Detail**\n---|---\nBus | AstroBus L 250 M from Airbus Defence & Space\nAttitude control | Three-axis stabilised with optional yaw steering\nLaunch mass | 820 kg. (including 82 kg fuel and TROPOMI instrument 220 kg)\nPower | 1 500 W (EOL), 430 W average power consumption\nBattery capacity | 156 Ah"", 'Document: S5P Mission\nSection: S5P Mission > Overview of Sentinel-5P Mission > Geographical Coverage\nContent:\nDue to its wide swath of 108° (approximately 2 600 km on the ground), the TROPOMI/Sentinel-5P instrument provides a full daily surface coverage of radiance and reflectance measurements for latitudes > 7° and < -7°, and better than 95 % coverage for latitudes in the interval [-7°, 7°].\nThe early afternoon observations of TROPOMI/Sentinel-5P (LTAN: 13h30) will have strong synergy with the morning observation of Global Ozone Monitoring Experiment 2 (GOME-2/Met-OP). Although GOME-2 has a lower spatial resolution and does not have the SWIR spectral range, the combination of TROPOMI/Sentinel-5P and GOME-2/Met-OP allows observation of diurnal variations, as successfully shown with the OMI/SCIAMACHY combination.', ""Document: S5P Mission\nSection: S5P Mission > Overview of Sentinel-5P Mission > Satellite Description\nContent:\nLaunch mass | 820 kg. (including 82 kg fuel and TROPOMI instrument 220 kg)\nPower | 1 500 W (EOL), 430 W average power consumption\nBattery capacity | 156 Ah\nData storage capacity | (Redundant) mass memory capacity of 480 Gbits for storage of 'science' telemetry. The storage capacity shall ensure a loss-free downlink of TROPOMI observational data based on a single X-band station pass per orbit.\n**Communication links:**\n* S-band TT&C with 64 Kbit/s uplink and 128 Kbit/s-1Mbit/s downlink with ranging and coherency\n* X-band science data downlink at 310 Mbps OQPSK"", 'Document: S5P Applications\nSection: S5P Applications > Overview of Sentinel- 5P Applications\nContent:\nTROPOMI is a key data contributor for the two above [Services](http://copernicus.eu/).\n**Media 1: Sentinel-5 Precursor is the first Copernicus mission dedicated to monitoring our atmosphere. With air pollution a major concern, the satellite carries the state-of-the-art Tropomi instrument to map a multitude of trace gases such as nitrogen dioxide, ozone, formaldehyde, sulphur dioxide, methane, carbon monoxide and aerosols – all of which affect the air we breathe and therefore our health, and our climate. [Credits:**[ESA](https://www.esa.int/Applications/Observing_the_Earth/Copernicus/Sentinel-5P/Air_pollution_monitoring_Sentinel_on_show)**]**\n**Application** | **Sentinel - 5P Product type**\n---|---\n**O3** | **O3_TCL** | **03_PR** | **NO2** | **SO2** | **CO** | **CH4** | **HCHO** | **CLOUD/NP_BDx** | **AER_AI** | **AER_LH**\nAir Quality & Pollution | ✔️ | ✔️ |  | ✔️ | ✔️ | ✔️ | ✔️ | ✔️ |  | ✔️ | ✔️\nClimate Change | ✔️ | ✔️ |  | ✔️ | ✔️ | ✔️ | ✔️ | ✔️  | ✔️  |  |\nAviation Safety |  |  |  |  | ✔️  |  |  |  |  | ✔️ | ✔️\nOzone and Ozone Layer Control | ✔️ | ✔️ | ✔️ | ✔️ |  |  |  |  |  |  |\nSupport to other S5P Products |  |  |  |  |  |  |  |  |  ✔️ |  |\nTo start using the data visit [CDSE browser](https://browser.dataspace.copernicus.eu/?zoom=5&lat=50.16282&lng=20.78613&themeId=DEFAULT-THEME&visualizationUrl=U2FsdGVkX195JFQrZHCG%2BeoFSoWOW9RniycE9sCg...', 'Document: S5P Mission\nSection: S5P Mission > Overview of Sentinel-5P Mission > Orbit\nContent:\nSentinel-5P uses a high inclination orbit (approximately 98.7°). The orbit inclination is the angular distance of the orbital plane from the equator.\nThe Sentinel-5P orbit is a near-polar, sun-synchronous orbit with an ascending node equatorial crossing at 13:30 h Mean Local Solar time. In a sun-synchronous orbit, the surface is always illuminated at the same sun angle.\nThe orbital cycle is 16 days (14 orbits per day, 227 orbits per cycle). The orbit cycle is the time taken for the satellite to pass over the same geographical point on the ground.\nThe orbit reference altitude is approximately 824 km.\nAn important feature of the Sentinel-5P mission is the synergistic exploitation of simultaneous measurements of imager data from the Visible/Infra-red Imager and Radiometer Suite (VIIRS), embarked on the Suomi-NPP (National Polar-orbting Partnership) satellite of NASA/NOAA (NPP mission started in 28 October 2011). Indeed, VIIRS will be able to provide co-located cloud mask data with higher spatial resolution than the cloud mask computed from the Sentinel-5P data. The Sentinel-5P orbit is selected such that it trails behind Suomi-NPP by 3.5 minutes in Local Time Ascending Node (LTAN), allowing the Sentinel-5P observation swath to remain...\n\n**Figure 3: Loose Formation Configuration Sentinel-5P and Suomi-NPP (schematic)**', 'Document: Sentinel-5P\nSection: Sentinel-5P > S5p Mission\nContent:\nThis section introduces the mission covering all major aspects, from the [satellite description](https://sentiwiki.copernicus.eu/web/s5p-mission#S5P-Mission-Satellite-Description) to the different [acquisition modes](https://sentiwiki.copernicus.eu/web/s5p-mission#S5P-Mission-TROPOMI-Instrument-Acquisition-Modes) of the [TROPOMI instrument](https://sentiwiki.copernicus.eu/web/s5p-mission#S5P-Mission-TROPOMI-Instrument). The [geographical coverage](https://sentiwiki.copernicus.eu/web/s5p-mission#S5P-Mission-Geographical-Coverage) of the satellite is also reported.\nFurthermore, this section contains an introduction to more specific aspects of the mission, such as the [calibration and validation activities](https://sentiwiki.copernicus.eu/web/s5p-mission#S5P-Mission-Calibration-and-Validation).', 'Document: S5P Processing\nSection: S5P Processing > L2 Algorithms > SWIR Products > Methane CH4 Vertical Column\nContent:\nThe algorithm for retrieval of methane columns from the SENTINEL-5P instrument is based on earlier developments of a CO2 and CH4 retrieval algorithm from GOSAT, called RemoTeC [Butz et al., 2009; 2010; 2011; Schepers et al, 2012; Guerlet et al, 2013a].\nIn order to account for the effect of aerosols and cirrus, the algorithm retrieves the CH4 column simultaneously with the aerosol/cirrus amount (column integrated particle number concentration), a parameter related to the particle size distribution, and a parameter describing the height distribution. Here, the particle size distribution is described by a power-law function [Mishchenko et al, 1999] which only has two free parameters (related to amount and size). The choice of aerosol/cirrus parameters reflects the information content of the measurements as closely as possible. The retrieval algorithm uses the Level-1B reflectance measurements in the SWIR band and additionally in the NIR band between 757-774 nm (O2 A-band). Additional fit parameters are the surface albedo and its first order spectral dependence in the two bands, and the total columns of carbon-monoxide and water vapor, respectively.\nIn order to obtain a proper characterisation of the retrieved CH4 column, it is important to first retrieve a vertical profile (layer averaged number density in different layers of the model atmosphere) and use this retrieved vertical profile to calculate the vertical column. It has been chosen to provide the vertical column as a product, and not the full profile, because the Degrees of Freedom for Signal (DFS) of the retrieved CH4 profile is approximately 1. The inversion is performed using Phillips-Tikhonov regularization in combination with a reduced...', 'Document: S5P Mission\nSection: S5P Mission > Calibration and Validation\nContent:\nSentinel-5P Cal/Val activities are essential to the quality of the mission. Data quality is assessed through determination of the radiometric, spatial, spectral and geometric fidelity of the satellite sensor and the accuracy of geophysical products.\nSentinel-5P Cal/Val activities are essential to the quality of the mission. Data quality is assessed through determination of the radiometric, spatial, spectral and geometric fidelity of the satellite sensor and the accuracy of geophysical products.\n* **Calibration** : calibration approach information and links to web portals used to monitor the Sentinel-5P calibration are available [learn more on the calibration page](https://sentiwiki.copernicus.eu/web/mission-performance-cluster#MPC-in-details-S5P-Cal).\n* **Validation** : Information on the routine validation approach and links to web portals used to monitor the Sentinel-5P validation are available [learn more on the validation page](https://sentiwiki.copernicus.eu/web/mission-performance-cluster#MPC-in-details-S5P-Val)\n* **Validation Campaigns** : Information on Sentinel-5P validation campaigns is available <https://s5pcampaigns.aeronomie.be/>.  \nWhile the routine validation of atmospheric composition products is secured by operational quality control centres such as the Mission Performance Centre supported through independent validation teams, the correlative data used is usually restricted to specific products and observation techniques. These activities, therefore, do not cover insight into the instrument performance, the products quality and potential dependencies for all possible measurement scenarios. Therefore there is a need to provide additional validation of different Sentinel-5P products via dedicated validation campaigns.']","Unfortunately, the provided context does not contain any information about the Sentinel-4 mission or its instrument payload. The documentation focuses solely on the Sentinel-5P mission and its TROPOMI instrument.

Without any details about Sentinel-4 in the given context, I cannot make a meaningful comparison between the main instrument payloads of Sentinel-5P and Sentinel-4. The context is limited to information about the TROPOMI instrument on Sentinel-5P, and does not mention the Sentinel-4 mission or its instrument.

To answer this question, I would need additional context or documentation that provides information about the Sentinel-4 mission and its primary instrument payload. Without that information, I cannot make a comparison as requested. I can only provide details about the TROPOMI instrument on Sentinel-5P based on the context provided.",Sentinel-5P carries TROPOMI (UV-VIS-NIR-SWIR spectrometer). Sentinel-4 carries the UVN (Ultraviolet-Visible-Near-Infrared) Light spectrometer.,0.91666666664375,0.5,1.0,0.0
Do Sentinel-1 and Sentinel-3 both use the same band for their altimetry measurements?,"['Document: S1 Mission\nSection: S1 Mission > SAR Instrument > Polarimetry\nContent:\nCopernicus Sentinel-1 can collect several different images from the same series of pulses by using its antenna to receive specific polarisations simultaneously. Copernicus Sentinel-1 is a phase-preserving dual polarisation SAR system. It can transmit a signal in either horizontal (H) or vertical (V) polarisation, and then receive in both H and V polarisations. Dual polarisation Level-1 Single Look Complex (SLC) products contain complex values. In addition to the backscatter intensity that can be measured from each single polarisation, the inter-channel phase information allows to perform enhanced analysis of backscattering properties.\nTargets on the ground have distinctive polarisation signatures reflecting different polarisations with different intensities and converting one polarisation into another. For example, volume scatterers (e.g. forest canopy) have different polarisation properties than surface scatterers (e.g. sea surface). Polarimetric techniques such as polarimetric target decomposition (eigenvector-based, model-based, ...) allow the separation of different scattering contributions and can be used to extract information about the scattering process. Dedicated dual-Pol SAR classification techniques allow improved classification of point targets and distributed target areas.\nThe following RADARSAT-2 image of Flevoland in the Netherlands shows the difference in intensities from VH (left) and VV (centre). The composite RGB (colour) image on the right was created using the VV channel for red, VH channel for green and the ratio |VV| / |VH| for blue.\n\n**Figure 8: Intensities from different polarimetric channels [Credits: MDA and CSA]**', 'Document: S1 Mission\nSection: S1 Mission > The Sentinel-1 mission is the European Radar Observatory for the Copernicus joint initiative of the European Commission (EC) and the European Space Agency (ESA). Copernicus is a European initiative for the implementation of information services dealing with environment and security. It is based on observation data received from Earth Observation satellites and ground-based information. > Orbit\nContent:\nSentinel-1 is in a near-polar, sun-synchronous orbit with a 12 day repeat cycle and 175 orbits per cycle for a single satellite. Both Sentinel-1A and Sentinel-1B share the same orbit plane with a 180° orbital phasing difference. With both satellites operating, the repeat cycle is six days.\n\n**Figure 2: Sentinel-1 Constellation [Credits: ESA/ATG medialab]**\nIn particular for interferometry, Sentinel-1 requires stringent orbit control. Satellite positioning along the orbit must be accurate, with pointing and timing/synchronisation between interferometric pairs. Orbit positioning control for Sentinel-1 is defined using an orbital Earth fixed ""tube"", 60 m (RMS) wide in radius, around a nominal operational path. The satellite is kept inside this ""tube"" for most of its operational lifetime.\n\n**Figure 3: Sentinel-1 Orbit Tube [Credits: credit: ESA, TAS]**\nThe following table contains a summary of useful orbital information for Sentinel-1A and –1B.\n_Table 1: Orbital information for Sentinel-1A and –1B:_\n**Altitude** | **Inclination** | **Period** | **Cycle** | **Ref. tube deviation** | **Local Time at Ascending Node**\n---|---|---|---|---|---\n693 km | 98.18° | 98.6 minutes | 12 days | +- 120 m | 18:00 hours', 'Document: S1 Mission\nSection: S1 Mission > The Sentinel-1 mission is the European Radar Observatory for the Copernicus joint initiative of the European Commission (EC) and the European Space Agency (ESA). Copernicus is a European initiative for the implementation of information services dealing with environment and security. It is based on observation data received from Earth Observation satellites and ground-based information.\nContent:\nThe Sentinel-1 mission comprises a constellation of two sun-synchronous polar-orbiting satellites, sharing the same orbital plane with 180° orbital phasing difference, operating day and night performing C-band synthetic aperture radar imaging, enabling them to acquire imagery regardless of the weather. It operates in four exclusive imaging modes with different resolution (down to 5 m) and coverage (up to 400 km). It provides dual polarisation capability, very short revisit times and rapid product delivery. For each observation, precise measurements of spacecraft position and attitude are available.\nSentinel-1 works in a pre-programmed operation mode to avoid conflicts and to produce a consistent long-term data archive built for applications based on long time series.\nSentinel-1 is the first of the five missions that ESA developed for the Copernicus initiative. Its measurement domain covers landscape topography, multi-purpose imagery (land), multi-purpose imagery (ocean), ocean surface winds, ocean topography/currents, ocean wave height and spectrum, sea ice cover, edge and thickness, snow cover, edge and depth, soil moisture and vegetation.\nSentinel-1 main [**Mission Objectives and Applications**](https://sentiwiki.copernicus.eu/web/s1-applications) are:  \n**Media 1: Sentinel-1 Radar Mission [Credits: ESA]**\nFor mission planning information, see the [Observation and Production Scenario](https://sentiwiki.copernicus.eu/web/s1-mission#S1-Mission-Observation-and-Production-Scenarios).\n**Launch timeline**\nSentinel-1A was launched on 3 April 2014.\nSentinel-1B was launched on 25 April 2016. The spacecraft experienced an anomaly related to the...\nSentinel-1C was launched on 5 December 2024. Sentinel-1D launch was launched on 4 November 2025.', 'Document: S1 Products\nSection: S1 Products > Related Production > **Sentinel-1 Global Backscatter Model (S1GBM)**\nContent:\n**Figure 15: Mapping Earth\'s land surface with C-band Synthetic Aperture Radar (SAR)**\n**Description**\nThe Sentinel-1 Global Backscatter Model (S1GBM) describes the C-band radar cross section of the Earth\'s land surface for the period between 2016 and 2017, generated from 460,000 Copernicus Sentinel-1 IW GRDH (Ground-Range Detected High Resolution) backscatter measurements normalised to the reference incidence angle of 38°. This release of the S1GBM comprises two global mosaics describing the temporal mean of sigma nought backscatter s0(38, t) in VV- and VH-polarisation respectively.\nThe S1GBM supports the testing, design, and verification of upcoming radar sensors, related SAR-processor performance simulations, raw data compression optimisation, and visualisation purposes. It also presents a valuable environmental record for investigating the C-band VV/VH backscatter response over different land covers, and documenting the state of the land surface in 2016 and 2017.\n**Data Set Specifications**\nThe S1GBM VV and VH mosaics are georeferenced to the Equi7Grid and divided into six continental zones (Africa, Asia, Europe, North America, Oceania, South America), which are further divided into square tiles of 100 km extent (""T1""-tiles). The dataset is organised in 12 collections, one for each of the 6 continents and the 2 polarisations. In addition to the original data images, downsampled quicklook-files of same geographic extent are available for all tiles, allowing for a convenient preview of the data. With this setup, the S1GBM consists of 16,071 tiles over 6 continents, for VV and VH each, totalling to a data volume of 2.67 TB.\nThe tiles\' file-format is a LZW-compressed GeoTIFF holding 16-bit integer values, with tagged metadata on encoding and georeference. Compatibility with common geographic information systems, such as QGIS or ArcGIS, and geodata libraries, such as GDAL, is given.', 'Document: S1 Mission\nSection: S1 Mission > Performance > Radiometric Accuracy\nContent:\nRadiometric accuracy and stability are specified for Sentinel-1 for all measurement modes to be within 1 dB (3σ) and 0.5 dB (3σ) respectively. The accuracy and stability numbers refer to measurement uncertainty of the...', 'Document: S1 Products\nSection: S1 Products > SAR Products Overview\nContent:\nThe Sentinel-1 C-band radar antenna beam illuminates the ground to the right side of the satellite. Due to satellite motion and the along track (azimuth) beam width of the antenna, each target element only stays inside the illumination beam for a short time. As part of the on-ground processing, the complex echo signals received during this time are added coherently. In this way a long antenna is synthesized, with the synthetic aperture length being equal to the distance the satellite traveled during the integration time. In principle, the along track resolution obtainable with SAR is approximately half the real antenna length. To enhance the radiometric resolution, multi-look azimuth processing can be employed and consequently, the along track resolution will be reduced by a factor equal to the look number. The across track or range resolution is a function of the transmitted radar bandwidth.\nThe fact that the system works coherently from end-to-end means that both the amplitude and the phase relationships between the complex transmitted and received signals are maintained throughout the instruments and the processing chain. This facilitates aperture synthesis as well as multi-pass radar interferometry using pairs of images taken over the same area at different times.\nThe Sentinel-1 Synthetic Aperture Radar (SAR) instrument may acquire data in four exclusive modes:\n* Stripmap (SM). This is a standard SAR stripmap imaging mode where the ground swath is illuminated with a continuous sequence of pulses and with the antenna beam pointing to a fixed azimuth and elevation angle.\n* Interferometric Wide swath (IW). Data is acquired in three swaths using the Terrain Observation with Progressive Scanning SAR (TOPSAR) imaging technique. In IW mode, bursts are synchronised from pass to pass to ensure alignment of interferometric pairs.', 'Document: S1 Products\nSection: S1 Products > Related Production > **Sentinel-1 ARD Normalised Radar Backscatter (NRB) Product**\nContent:\nAll images are projected and gridded into the United States Military Grid Reference System (US-MGRS). Hence, the data is projected to Universal Polar Stereographic (UPS) at the poles and to Universal Transverse Mercator (UTM) otherwise. Tiling is applied to structure data into (1) UTM zones and (2) 100 x 100 km granules. The pixel spacing is 10 m for SM and IW, and 20 m for EW.\nThe use of the US-MGRS tile grid ensures a very high level of interoperability with Sentinel-2 Level-2A ARD products making it easy to also set-up complex analysis systems that exploit both SAR and optical data.\nIt should be noted that while speckle is inherent in SAR acquisitions, speckle filtering is not applied to the S1-NRB product in order to preserve spatial resolution. Some applications (or processing methods) may require spatial or temporal filtering for stationary backscatter estimates.\nAccurate Radiometric Terrain Correction (RTC) and Geometric Terrain Correction (GTC) is achieved utilising state-of-the-art algorithms [[3](https://sentiwiki.copernicus.eu/web/s1-products#Ref_NRB_3)]. Their accuracy is further enhanced by using high-resolution data sources like the Copernicus DEM [[4](https://sentiwiki.copernicus.eu/web/s1-products#Ref_NRB_4)]. The processing also includes the removal of background noise to ensure an extremely good quality of the data also in areas with very low backscatter.\nFinally, the product uses modern technologies and standards like Cloud Optimized GeoTIFF (COG) [[5](https://sentiwiki.copernicus.eu/web/s1-products#Ref_NRB_5)], Limited Error Raster Compression (LERC) [[6](https://sentiwiki.copernicus.eu/web/s1-products#Ref_NRB_6)], and the provision of SpatioTemporal Asset Catalogue (STAC) [[7](https://sentiwiki.copernicus.eu/web/s1-products#Ref_NRB_7)] metadata to maximise the accessibility and ease of use of the product, especially in cloud computing infrastructure like data cubes, while keeping the data volume as low as possible.\n**Product characteristics**', ""Document: S1 Mission\nSection: S1 Mission > SAR Instrument\nContent:\n**Figure 6: Sentinel-1 Spacecraft**\nThe C-SAR instrument is an active phased array antenna providing fast scanning in elevation (to cover the large range of incidence angle and to support ScanSAR operation) and in azimuth (to allow use of TOPS technique to meet the required image performance) with dual-pol capacity.\nIt has an internal calibration scheme, where transmit signals are routed into the receiver to allow monitoring of amplitude/phase to facilitate high radiometric stability.\nSentinel-1's metallised carbon-fibre-reinforced-plastic radiating waveguides ensure good radiometric stability even though these elements are not covered by the internal calibration scheme. The digital chirp generator and selectable receive filter bandwidths allow efficient use of on-board storage considering the ground range resolution dependence on incidence angle.\n_Table 2: The key parameters of the Sentinel-1 C-SAR instrument include:_\n**Characteristics** | **Value**\n---|---\nCentre frequency | 5.405 GHz (corresponding to a wavelength of ~5.55 cm)\nBandwidth | 0-100 MHz (programmable)\nPolarisation | HH+HV, VV+VH, VV, HH\nAntenna size | 12.3 m x 0.821 m\nRF Peak power (sum od all TRMs, at TRM o/p) | 4.368 kW, - 4.075 kW (IW, dual polarisations)\nPulse width | 5-100 µs (programmable)\nTransmit duty cycle | Max 12%, SM 8.5%, IW 9%, EW 5%, WV 0.8%\nReceiver noise figure at module input | 3.2 dB\nPRF (Pulse Repetition Frequency) | 1 000 - 3 000 Hz (programmable)\nADC sampling frequency | 300 MHz (real sampling) (digital down-sampling after A/D conversion)\nSampling | 10 bits\nData compression | FDBAQ (Flexible Dynamic Block Adaptive Quantization)\nInstrument Operation | Up to 25 min per orbit continuously in any of the imaging modes and for the rest of the orbit in Wave mode\nTotal instrument mass (including antenna) | 945 kg\nCSAR DC power | 3870 W (Interferometric Wide-swath Mode, two polarisations)\nCSAR data storage capacity | 1410 Gb (End-of-Life)"", 'Document: S1 Mission\nSection: S1 Mission > The Sentinel-1 mission is the European Radar Observatory for the Copernicus joint initiative of the European Commission (EC) and the European Space Agency (ESA). Copernicus is a European initiative for the implementation of information services dealing with environment and security. It is based on observation data received from Earth Observation satellites and ground-based information. > Satellite Description\nContent:\nThe satellite has been created by an industrial consortium led by Thales Alenia Space Italy as prime contractor, with Astrium Germany being responsible for the CSAR payload, incorporating the central radar electronics sub-system developed by Astrium UK.\n\n**Figure 1: Schematic View of the Deployed Sentinel-1 Spacecraft. [Credits: TAS-I]**\nThe spacecraft is a three-axis, stabilised satellite, yaw/pitch/roll steering (zero Doppler), characterised by sun, star, gyro and magnetic field sensors, a set of four reaction wheels dedicated to orbit and attitude control and three torque rods as actuators to provide steering capabilities on each axis. The satellite is equipped with two solar array wings capable of producing 5 900 W (at end of life) to be stored in a modular battery, the battery capacity is 324 Ah.\nThe satellite is based on the PRIMA (Piattaforma Italiana Multi Applicativa) bus, building on the experience gained from RADARSAT-2 and COSMO-SkyMed, which use the same bus. The bus provides highly accurate pointing knowledge (better than 0.004°) on each axis, high attitude accuracy (about 0.01° on each axis) and real-time orbit...\nThe reference orbit will be maintained within an Earth-fixed orbital tube of a diameter of 120 m (RMS) during normal operation.\nThe satellite platform provides features for the management of the attitude and orbit control systems, science data handling with storage capability of 1,410 Gb, propulsion, power, thermal control, spacecraft autonomy and failure detection identification and recovery, and communication with the ground via X-band data downlink and optical data link through EDRS for payload data at 520 Mbit/s; S-band 64 kbps uplink and 128 kbps / 2 Mbps downlink for TM/TC.\nThe total mass of the spacecraft at launch is approximately 2 300 kg (including 130 kg fuel).', 'Document: S1 Processing\nSection: S1 Processing > POD Sentinel-1 Products Specification > Products Description > Satellite Parameters for POD\nContent:\nThe Sentinel-1 mission is supported by two spacecraft, flying in the same orbital plane with a phase shift of 180º. An overall [description of the satellite](https://sentiwiki.copernicus.eu/web/s1-mission#S1-Mission-Satellite-Description) is available, showing the main instruments and the geometry of the satellites. Additionally, they are equipped with two dual frequency RUAG GPS receivers to allow POD in order to meet the stringent accuracy requirements of the mission.\n\n**Figure 14: Drawing of Sentinel-1A showing the GPS receivers [Credits: ESA]**\nFor Precise Orbit Determination processing it is of paramount importance to know in great detail the mass history of the satellite, the evolution of its centre of gravity, the manoeuvre history and the attitude information. Moreover, for GNSS based processing, the location and orientation of the antennae are required. In the case of the manoeuvre and mass history file (including the CoG position), available hereafter, a historical record is kept since the launch of the satellite:  \nFor the convenience of users, another file combining information on manoeuvres and GNSS outages for the mission is provided below:  \nPlease note that all of the files provided above contain a header that explains the format of their content.\nThe GPS Antenna absolute phase centre offset and variations (PCO/PCV) of both GPS receivers is located in this [**ANTEX file**](https://sentiwiki.copernicus.eu/__attachments/1673407/sen20_2389.atx?inst-v=0b38ac37-4dd6-44ba-865b-d9854aa106d8).']","Based on the information provided in the context, Sentinel-1 and Sentinel-3 do not use the same band for their altimetry measurements.

The key points are:

1. Sentinel-1 is a C-band Synthetic Aperture Radar (SAR) mission, operating at a center frequency of 5.405 GHz (corresponding to a wavelength of ~5.55 cm).

2. The context does not mention Sentinel-1 having any altimetry capabilities. Sentinel-1 is focused on SAR imaging applications, not altimetry.

3. In contrast, Sentinel-3 is described as having an altimetry instrument, the Synthetic Aperture Radar Altimeter (SRAL). 

4. The context does not provide any information about the specific frequency band used by the Sentinel-3 SRAL altimeter. Altimetry missions typically use lower microwave frequencies, often in the Ku-band or Ka-band, which are more suitable for measuring sea surface height.

Therefore, based on the information available in the provided context, Sentinel-1 and Sentinel-3 do not use the same frequency band for their respective instruments. Sentinel-1 uses C-band for SAR imaging, while Sentinel-3 uses a different, unspecified frequency band for its SRAL altimeter.","No. Sentinel-3 SRAL operates in Ku-band and C-band. Sentinel-1 is an imaging radar (SAR) operating in C-band, but it is not an altimeter.",0.0,0.5,0.5,0.8618571590309498
Which mission provides higher spatial resolution for vegetation monitoring: Sentinel-2 or Sentinel-3 OLCI?,"['Document: S2 Applications\nSection: S2 Applications > Overview of Sentinel-2 Applications > CLMS: Copernicus Land Monitoring Service\nContent:\nThe [Copernicus Land Monitoring Service](https://www.copernicus.eu/en/copernicus-services/land) (CLMS) became operational in 2012 and provides geographical information on land cover and its changes, land use, ground motion, vegetation state, water cycle, and Earth’s surface energy variables to a broad range of users in Europe and across the world. The CLMS supports policy and decision-making processes in the frame of the European Green Deal and the UN Conventions and Sustainable Development Goals. It comprises:\n* A Pan-European component, coordinated by the European Environment Agency (EEA)\n* A global component coordinated by the European Commission DG Joint Research Centre (JRC)  \nThe Sentinel-2 mission provides accurate radiometric data and a high level of detail, which is fundamental to CLMS and, with its twin-satellite capability, ensures frequent and systematic coverage to support state-of-the-art mapping of land cover and its dynamics, and an accurate assessment of bio- and geophysical parameters. To this end, Sentinel-2 enables CLMS to support a variety of application areas including:\n* Spatial planning and urban studies\n* Agro-environmental and crop monitoring\n* Food security\n* Water management\n* Forest and vegetation monitoring\n* Land carbon and natural resource assessments\n* Ecosystem accounting and assessment\n* Mitigation/adaptation to climate change  \nThe CLMS makes use of Sentinel-2 data in the following activities and and services.', 'Document: S2 Mission\nSection: S2 Mission > Overview of Sentinel-2 Mission\nContent:\nSentinel-2 is a European wide-swath, high-resolution, multi-spectral imaging mission. The full mission specification of the twin satellites flying in the same orbit but phased at 180°, is designed to give a high revisit frequency of 5 days at the Equator.\nEach of the satellites in the Sentinel-2 mission carries a single payload: the optical [Multi-Spectral Instrument](https://sentiwiki.copernicus.eu/web/s2-mission#S2-Mission-MSI-Instrument) (MSI) that samples 13 spectral bands: four bands at 10 m, six bands at 20 m and three bands at 60 m spatial resolution. The orbital swath width is 290 km.\n\n**Figure 1: The Twin-Satellite Sentinel-2 Orbital Configuration [Credits: Astrium GmbH]**\nThe Sentinel-2 twin satellites carry on the legacy of [SPOT](https://earth.esa.int/eogateway/missions/spot) and [LANDSAT](https://landsat.gsfc.nasa.gov/) by continuing to provide similar types of image data and contributing to ongoing multispectral observations. These satellites are used to support a variety of services and applications offered by [Copernicus](https://www.copernicus.eu/en), including land management, agriculture, forestry, disaster control, humanitarian relief operations, risk mapping, and security concerns.', 'Document: S2 Mission\nSection: S2 Mission > Acquisition Resolutions > Spatial Resolution\nContent:\nThe spatial resolution of Sentinel-2 is dependent on the particular spectral band:\n**10 metre spatial resolution:**\n\n**Figure 14: Sentinel-2 10 m spatial resolution bands: B2 (490 nm), B3 (560 nm), B4 (665 nm) and B8 (842 nm)**\n**20 metre spatial resolution:**\n\n**Figure 15: Sentinel-2 20 m spatial resolution bands: B5 (705 nm), B6 (740 nm), B7 (783 nm), B8a (865 nm), B11 (1610 nm) and B12 (2190 nm)**\n**60 metre spatial resolution:**\n\n**Figure 16: Sentinel-2 60 m spatial resolution bands: B1 (443 nm), B9 (940 nm) and B10 (1375 nm)**', 'Document: S2 Mission\nSection: S2 Mission > Overview of Sentinel-2 Mission > Geographical Coverage\nContent:\nThe Sentinel-2 mission will provide systematic coverage over the following areas:\n* all continental land surfaces (including inland waters) between latitudes 56° South and 82.8° North\n* all coastal waters up to 20 km from the shore\n* all islands greater than 100 km2\n* all EU islands\n* the Mediterranean Sea\n* all closed seas (e.g. Caspian Sea).  \nIn addition, the Sentinel-2 observation scenario includes observations following member states or Copernicus Services requests (e.g. Antarctica, Baffin Bay).\n**Figures 4** illustrates the coverage foreseen for the baseline scenario of MSI acquisitions (two satellites in orbit).\n![Revisit scenario ](https://sentiwiki.copernicus.eu/__attachments/1687033/Revisit%20scenario%202025...\n**Figure 4: Coverage and revisit time for the baseline scenario of Sentinel-2 MSI acquisitions.**\nIn addition, the [Sentinel-2 extension campaign](https://sentinels.copernicus.eu/web/sentinel/-/sentinel-2a-extended-campaign-starting-march-13-2025) complements the nominal constellation operations, enhancing the revisit frequency over Europe and tropical regions of Africa and South America, frequently impacted by high cloud cover (**Figure 5**).\n![](https://sentiwiki.copernicus.eu/__attachments/1687033/figure-5...\n**Figure 5: Number of revisits for Sentinel-2A/B/C MSI in 20 days period**\nWith nominal two-satellites (Sentinel-2B/2C) operations configuration, all regular areas, indicated in green in **Figure 4** , will be revisited every five days under the same viewing conditions (i.e. viewing angles). The [Sentinel-2A extension campaign](https://sentinels.copernicus.eu/web/sentinel/-/sentinel-2a-extended-campaign-starting-march-13-2025) brings an improved revisit frequency for some areas. However, due to overlap between swaths from adjacent orbits, the revisit frequency is increased with different viewing conditions, as shown in **Figure 6**.\n![](https://sentiwiki.copernicus.eu/__attachments/1687033/figure-6...', 'Document: S2 Applications\nSection: S2 Applications > Overview of Sentinel-2 Applications\nContent:\n[Sentinel-2](https://sentiwiki.copernicus.eu/web/sentinel-2) is a European mission equipped with a wide-swath Multispectral Instrument (MSI) to ensure a high-revisit frequency and provide high-resolution imagery to support the Copernicus programme.\nSentinel-2 data products are made available systematically and free of charge to all users, providing data for the following priority service areas.\nTo start using the data visit [CDSE browser ](https://browser.dataspace.copernicus.eu/?zoom=5&lat=50.16282&lng=20.78613&themeId=DEFAULT-THEME&visualizationUrl=U2FsdGVkX1%2B4%2BV%2FOaiXMG%2FrmYxraCDY%2F...', 'Document: S2 Applications\nSection: S2 Applications > Overview of Sentinel-2 Applications > CLMS: Copernicus Land Monitoring Service > Sentinel-2 Global Mosaic\nContent:\nThe [Sentinel-2 Global Mosaic](https://land.copernicus.eu/en/products/global-image-mosaic) (S2GM) provides Sentinel-2 surface reflectance time series composites in three spatial resolutions and from different compositing periods ranging from one day to one year. Users can tailor mosaics to their specific requirements in terms of area of interest, compositing period, included bands, file format, and metadata content.', 'Document: S2 Mission\nSection: S2 Mission > Acquisition Resolutions > Spectral Resolution\nContent:\nSpectral resolution is defined as a measure of the ability of the instrument to distinguish features in the electromagnetic spectrum.\nThe 13 spectral bands of Sentinel-2 range from the Visible and Near Infra-Red (VNIR) to the Short-Wave Infra-Red (SWIR):\n* 4 x 10 metre Bands: the three classical RGB bands (Blue (~493nm), Green (560nm), and Red (~665nm)) and a Near Infra-Red (~833nm) band;\n* 6 x 20 metre Bands: 4 narrow Bands in the VNIR vegetation red edge spectral domain (~704nm,~740nm, ~783nm and ~865nm) and 2 wider SWIR bands (~1610nm and ~2190nm) for applications such as snow/ice/cloud detection, or vegetation moisture stress assessment;\n* 3 x 60 metre Bands mainly focused on cloud screening and atmospheric correction (~443nm for aerosols and ~945nm for water vapour) and cirrus detection (~1374nm).  \n**NOTE:** The Bandwidth (nm) in the Tables below is the values measured at Full Width Half Maximum (FWHM). The equivalent wavelength is the barycentre of the spectral response function, not considering the solar irradiance:', 'Document: S2 Mission\nSection: S2 Mission > Acquisition Resolutions\nContent:\nThe resolutions of the Sentinel-2 Mission and its payload MSI instrument are:\n1. The **temporal resolution** of a satellite in orbit is the revisit frequency of the satellite to a...\n2. The **spatial resolution** of an instrument is the _at-ground_ representation of an individual...\n3. The [**spectral resolution**](https://sentiwiki.copernicus...\n4. The **radiometric resolution** of an instrument is a determination of the incremental level of...\n5. The **swath width** of Sentinel-2 is 290 km. In comparison, the swath width of Landsat 5 TM and...', 'Document: Sentinel-2\nSection: Sentinel-2 > S2 Mission\nContent:\nThis section gives a brief description of the mission, as well as introducing the product formats available, the geophysical parameters measured, temporal, radiometric and spatial [resolutions](https://sentiwiki.copernicus.eu/web/s2-mission#S2-Mission-Acquisition-Resolutions), the frequency of [Revisit and Coverage](https://sentiwiki.copernicus.eu/web/s2-mission#S2-Mission-Geographical-Coverage) of land surfaces that forms the core of the Sentinel-2 mission, and the latitudinal limits of the coverage.', 'Document: S2 Mission\nSection: S2 Mission > Observation and Production Scenarios > Observation Scenario\nContent:\nThe Sentinel-2 MSI observation scenario implements a pre-defined Sentinel High Level Observation Plan (HLOP), and it is focused on delivering the observation requirements for the Copernicus services. The Sentinel HLOP can be found [here](https://sentiwiki.copernicus.eu/__attachments/1673407/COPE-S1OP-EOPG-PL-15-0020%20-%20Sentinel%20HLOP%202021%20-%203.1.pdf?inst-v=0b38ac37-4dd6-44ba-865b-d9854aa106d8).\nIn addition, the [Sentinel-2A extension campaign](https://sentinels.copernicus.eu/web/sentinel/-/sentinel-2a-extended-campaign-starting-march-13-2025) complements the nominal constellation operations, enhancing the global revisit frequency of the Sentinel-2 constellation while optimising the use of critical satellite resources. Notably, it features a consistent observation scenario over Europe for all three Sentinel-2 units and optimises the revisit frequency over the tropical regions of Africa and South America, frequently impacted by high cloud cover.\nFor more information on the mission coverage please visit the [Geographical Coverage](https://sentiwiki.copernicus.eu/web/s2-mission#S2-Mission-Geographical-Coverage) section.\nAcquisitions plans from previous years and the current ones that are implemented are available [here](https://sentiwiki.copernicus.eu/web/document-library#DocumentLibrary-AcquisitionPlansLibrary-S2-Acquisition-Plans).']","To determine which Sentinel mission provides higher spatial resolution for vegetation monitoring, I will compare the key specifications of Sentinel-2 and Sentinel-3 OLCI from the provided context.

Sentinel-2 Spatial Resolution:
- According to the context, Sentinel-2 has 13 spectral bands with the following spatial resolutions:
  - 4 bands at 10 m resolution
  - 6 bands at 20 m resolution 
  - 3 bands at 60 m resolution
- The 10 m bands include the Near-Infrared (NIR) band (B8 at 842 nm) which is important for vegetation monitoring.
- The 20 m bands include several vegetation red-edge bands (B5, B6, B7, B8a) that are also useful for vegetation analysis.

Sentinel-3 OLCI Spatial Resolution:
- The context does not provide detailed information about the spatial resolution of the Sentinel-3 OLCI instrument.
- However, the context states that Sentinel-2 is a ""high-resolution, multi-spectral imaging mission"", implying that it has higher spatial resolution compared to other Sentinel missions.

Based on the information provided:

Sentinel-2 provides higher spatial resolution for vegetation monitoring compared to Sentinel-3 OLCI. Specifically, Sentinel-2 has 10 m and 20 m bands that are well-suited for detailed vegetation analysis, while the context does not specify the spatial resolution of Sentinel-3 OLCI.

The key advantages of Sentinel-2 for vegetation monitoring are:
- 4 bands at 10 m resolution, including the critical NIR band
- 6 bands at 20 m resolution, including specialized vegetation red-edge bands
- Higher overall spatial resolution compared to the unspecified resolution of Sentinel-3 OLCI

Therefore, based on the information in the provided context, Sentinel-2 is the mission that provides higher spatial resolution for vegetation monitoring applications.",Sentinel-2 provides higher resolution (10m/20m) compared to Sentinel-3 OLCI (300m).,0.99999999999,1.0,0.5714285714285714,0.9533727953161173
What is the file extension used for the Sentinel-2 granule metadata file?,"['Document: S2 Products\nSection: S2 Products > MSI Products Overview > Data Formats\nContent:\nSentinel-2 Level-1C and Level-2A User products are made available in Sentinel-SAFE format, including image data in JPEG2000 format, quality indicators (e.g. defective pixels mask), auxiliary data and metadata.\nThe SAFE format has been designed to act as a common format for archiving and conveying data within ESA Earth Observation archiving facilities.\nA Sentinel-2 User product refers to a directory folder that contains a collection of information (**Figure 4**). It includes:\n* a product metadata file in XML format that describes the physical organization and the content of the product\n* a _manifest.safe_ file which holds the general product information in XML\n* a GRANULE subfolder, including image data (granules/tiles) in JPEG2000 format as well as quality indicators (quality masks, quality reports, etc.)\n* a DATASTRIP subfolder, containing information at datastrip level\n* an AUX_DATA subfolder, containing the set of auxiliary files that can be embedded in the product\n* a rep-info subfolder, containing the XSD schemas describing the product components\n* an INSPIRE XML file, that is a metadata file based on INSPIRE Metadata regulation\n* a HTML subfolder, containing a product presentation file allowing to display easily the main content of the product.  \n\n**Figure 4: Sentinel-2 SAFE product content**', 'Document: S2 Processing\nSection: S2 Processing > Auxiliary Data Files > Ground Image Processing Parameters\nContent:\nThe GIPP are configuration files used for the processing of Sentinel-2 acquisitions, that evolve over the mission lifetime. This evolution is done to manage the introduction of new product features or processing steps (e.g. introduction of the geometric refinement), and the correction of errors in the processing chain (e.g. following radiometric and geometric calibrations).\nThe list of GIPP is provided in Annex D of the [PSD](https://sentiwiki.copernicus.eu/web/document-library#DocumentLibrary-ProductSpecificationDocumentsLibrary-S2-PDS).', 'Document: S2 Processing\nSection: S2 Processing > Global Reference Image > Copernicus Sentinel-2 GRI Distribution Portal : How To Use > Copernicus Sentinel-2 GRI as Databases of GCPs in L1B and L1C\nContent:\nThe GRI as Database of GCPs in L1B and L1C STAC versions (GCP_L1B and GCP_L1C) are part of the [Copernicus Sentinel-2 Global Reference Image portal](https://s2gri.csgroup.space/#/?.language=en). It contains the items stored in tar.gz archives and split by latitude and then square degrees.\n\n**Figure 30: Example of L1C GCPs GRI Catalog Structure. Similar Catalog Structure is applied as well to the L1B GCPs**\nThe assets for both GRI as Databases of GCPs in L1B and L1C point to:\n* the XNNYNNN.tar.gz archive file, i.e. the actual GRI unitary data (square degree),\n* the XNNYNNN.json file allowing the user to see all information regarding the GCP of square degree without having to download the complete archive file.\n* only for the GRI as Database of GCPs in L1B: a list of .tar.gz files containing the auxiliary data and metadata of the Database from which the GCPs have been extracted.  \nThese data have not been included in the XNNYNNN.tar.gz files because they are heavy, and all the users may not be interested in downloading them (or all of them). As is, the users can choose if they want or not to download these files, knowing that the correspondence between each GCP and the L1B datastrip metadata file is available in XNNYNNN.json. Users can therefore identify the files to download.\nThe metadata for each item contain:\n* The footprint of the square degree tile,\n* The number of GCPs for the square degree.  \nFor both the GRI as Database of GCPs in L1B and L1C, the main webpage displays the latitudes for which the GCPs are available. The examples below focus on GRI as Database of GCPs in L1C but are also valid for the GRI as Database of GCPs in L1B **(Fig.31a)**. Clicking on one latitude opens the page allowing narrowing the selection to the square degrees for this latitude **(Fig.31b).**', 'Document: S2 Applications\nSection: S2 Applications > Overview of Sentinel-2 Applications > CLMS: Copernicus Land Monitoring Service > Sentinel-2 Global Mosaic\nContent:\nThe [Sentinel-2 Global Mosaic](https://land.copernicus.eu/en/products/global-image-mosaic) (S2GM) provides Sentinel-2 surface reflectance time series composites in three spatial resolutions and from different compositing periods ranging from one day to one year. Users can tailor mosaics to their specific requirements in terms of area of interest, compositing period, included bands, file format, and metadata content.', 'Document: Sentinel-2\nSection: Sentinel-2 > S2 Products\nContent:\nThis section describes the granularity of Sentinel-2 products relative to their product level, the [processing levels](https://sentiwiki.copernicus.eu/web/s2-products#S2-Products-Processing-Levels) in which they are provided ([Level-0](https://sentiwiki.copernicus.eu/web/s2-products#S2-Products-L0), [level-1](https://sentiwiki.copernicus.eu/web/s2-products#S2-Products-L1C) and [Level-2](https://sentiwiki.copernicus.eu/web/s2-products#S2-Products-L2A)), the data [naming conventions](https://sentiwiki.copernicus.eu/web/s2-products#S2-Products-Naming-Convention) used for Level-1C and Level-2A products made available to users, the [data format](https://sentiwiki.copernicus.eu/web/s2-products#S2-Products-Data-Formats) in which users will get the Level-1C and Level-2A products and information on the [anomalies](https://s2anomalies.acri.fr/) affecting products quality.', 'Document: S2 Products\nSection: S2 Products > Product anomalies and features > Product-related anomalies\nContent:\nThe [Sentinel-2 anomaly database](https://s2anomalies.acri.fr/) provides a searchable access to the list of known anomalies on Sentinel-2 products. This database includes both on-board anomalies (usually irrecoverable) and processing anomalies (potentially recoverable), and covers image data as well as metadata and format anomalies. For each anomaly, a short description and illustrations are provided and a list of datatakes, datastrips or products can be retrieved.\nIn addition to the search interface, this website provides an API (Application Programming Interface) for machine-to-machine access using scripts.', 'Document: S2 Products\nSection: S2 Products > MSI Products Overview\nContent:\nThe continuous acquisition of Sentinel-2 image data in a given MSI mode is called a ""datatake"". The maximum length of an imaging datatake is 15,000 km (e.g. continuous observation from northern Russia to southern Africa). All products contain granules/tiles from a single datatake. A datatake is presented inside a product as a set of one or more datastrips (corresponding to acquisition segments downlinked to different ground stations, please see **Figure 1** below).\n\n**Figure 1: Sentinel-2 Datatake split in three Datastrips. [Credits: Exprivia]**\nThe products are elementary granules of fixed size, within a single orbit. A granule is the minimum indivisible partition of a product (containing all possible spectral bands).\nFor Level-1B granules are small images in sensor geometry sensed by each of the twelve MSI detectors and are 23 km x 25 Km large.\nFor Level-1C and Level-2A, the granules, also called tiles, are 110 km x 110 km ortho-images projected onto the Universal Transversal Mercator (UTM) spatial reference system, which divides Earth into 60 longitudinal zones. Each UTM zone has a vertical width of 6° of longitude and horizontal width of 8° of latitude (see **Figure 2**). Earth is subdivided on a predefined set of tiles, defined in UTM/WGS84 projection and using a 100 km step. However, each tile has a surface of 110 km x 110 km in order to provide large overlap with the neighbouring.\n\n**Figure 2: Level-1C product tiling**\nTiles can be fully or partially covered by image data. Partially covered tiles correspond to those at the edge or top/bottom of the Datastrip.\nDownload is available here: [Sentinel-2 tiling grid kml](https://sentiwiki.copernicus.eu/__attachments/1692737/S2A_OPER_GIP_TILPAR_MPC__20151209T095117_V20150622T000000_21000101T000000_B00.zip?inst-v=0b38ac37-4dd6-44ba-865b-d9854aa106d8).', 'Document: S2 Products\nSection: S2 Products > MSI Products Overview > XML Schema Definitions (XSD)\nContent:\nThe products metadata within a Sentinel-2 Level-1C and Level-2A [Compact Naming Convention](https://sentiwiki.copernicus.eu/web/s2-products#S2-Products-Compact-Naming-Convention) User product, is contained in the root XML (eXtensible Markup Language) file within the product, as shown below.\n\n**Figure 5: Sentinel-2 L1C and L2A Compact naming Convention product physical structure**\nThis metadata in XML format conforms to the XSD (XML Schema Definition) Schemas (S2_PDI_Level-1C_Tile_Metadata.xsd and S2_User_Product_Level-2A_Metadata.xsd respectively) that accompany the Product Specification Document (PSD) available from the [Sentinel-2 Document Library](https://sentiwiki.copernicus.eu/web/document-library#Library-S2-Documents).\nXSD is a World Wide Web Consortium (W3C) recommendation that specifies how to formally describe the elements in an Extensible Markup Language (XML) document. More information can be found on the [Web Standards](https://www.w3.org/standards/xml/schema).', 'Document: S2 Products\nSection: S2 Products > MSI Products Overview > Naming Convention > Compact Naming Convention\nContent:\n**Figure 3: Product naming convention**\nThe Mission Identifier (MMM) denotes the satellite and will be either S2A for the Sentinel-2A instrument or S2B for the Sentinel-2B instrument.\nThe File Class (CCCC) may be set to ""OPER"" for all products generated during the Operations Phase. During Validation or internal testing, other values can be defined.\nThe File Type (TTTTTTTTTT) consist of the File Category and File Semantic\nTTTTTTTTTT = FFFFDDDDDD where:\nFFFF = File Category and DDDDDD = Semantic Descriptor.\nThe File Category comprises 3 characters and an ending underscore ""_"". This sub-field allows the definition of file groups characterised by related information / configuration information / generated data / usage of the data / etc. The Semantic Descriptor comprises 6 characters. The Semantic Descriptor can be composed of uppercase letters, digits or underscores. The File Type for a product may be ""PRD_MSIL0P"" for Level-0, ""PRD_MSIL1A"" for Level-1A, ""PRD_MSIL1B"" for Level-1B, ""PRD_MSIL1C"" for Level-1C, ""PRD_MSITCI"", or for Level-2A; ""PRD_USER2A""\nThe Instance Identifier contains the Site Centre (ssss) and Creation Date in UTC time (yyyymmddThhmmss). The Site Centre denotes the file originator or processing facility. The Site Centre may be set to ""MTI_"" for Matera CGS, ""SGS_"" for Svalbard CGS, ""MPS_"" for Maspalomas CGS, ""EPA_"" for Madrid PAC, ""MPC_"" for the MPC/CC centre, ""UPA_"", for the UK PAC, ""EDRS"" for the EDRS Exploitation Segment, plus Local Ground Stations ending in ""L"", and ""USER"" for L2 products. A combination of additional fields may be included and are distinguished by the leading character:\nThe Relative Orbit Number (**R** OOO) where OOO represents the relative orbit number.\nThe Applicability Time Period: (**V** yyyymmddThhmmss_YYYYMMDDTHHMMSS) appends the Validity Period Time fields (Start and Stop).\nThe Product Format (SAFE) indicates that the product is in Sentinel [SAFE](https://sentiwiki.copernicus.eu/web/safe-format) format.', 'Document: S2 Applications\nSection: S2 Applications > Overview of Sentinel-2 Applications\nContent:\n[Sentinel-2](https://sentiwiki.copernicus.eu/web/sentinel-2) is a European mission equipped with a wide-swath Multispectral Instrument (MSI) to ensure a high-revisit frequency and provide high-resolution imagery to support the Copernicus programme.\nSentinel-2 data products are made available systematically and free of charge to all users, providing data for the following priority service areas.\nTo start using the data visit [CDSE browser ](https://browser.dataspace.copernicus.eu/?zoom=5&lat=50.16282&lng=20.78613&themeId=DEFAULT-THEME&visualizationUrl=U2FsdGVkX1%2B4%2BV%2FOaiXMG%2FrmYxraCDY%2F...']","According to the information provided in the context, the Sentinel-2 Level-1C and Level-2A user products contain a product metadata file in XML format that describes the physical organization and content of the product.

Specifically, Document 8 states:

""The products metadata within a Sentinel-2 Level-1C and Level-2A [Compact Naming Convention] User product, is contained in the root XML (eXtensible Markup Language) file within the product, as shown below.""

The context also mentions that this metadata in XML format conforms to XSD (XML Schema Definition) Schemas, which are used to formally describe the elements in an XML document.

Therefore, the file extension used for the Sentinel-2 granule metadata file is .xml.",The granule metadata file uses the .xml extension (specifically MTD_TL.xml).,0.8240079364976364,1.0,0.8333333333333334,0.9985208170170868
"In the Sentinel-1 filename convention, what does 'SLC' stand for?","['Document: S1 Processing\nSection: S1 Processing > L1 Algorithms > Single Look Complex (SLC)\nContent:\nThe Swath Timing data set record in SLC products contains information about the bursts including dimensions, timing and location that can be used to merge the bursts and swaths together. Sentinel-1 performs systematic acquisition of bursts in both IW and EW modes. The bursts overlap almost perfectly between different passes and are always located at the same place. With the deployment of the SAR processor S1-IPF 3.4, a new element has been added to the products annotations: the Burst ID, which should help the...', ""Document: S1 Products\nSection: S1 Products > Level-1 Products\nContent:\nSentinel-1 Level-1 products are the baseline products for the majority of users from which higher levels are derived. From data in each acquisition mode, the Instrument Processing Facility (IPF) generates focused Level-1 Single Look Complex (SLC) products and Level-1 Ground Range Detected (GRD) products.\nSAR parameters that vary with the satellite position in orbit, such as azimuth FM rate, Doppler centroid frequency and terrain height, are periodically updated to ensure the homogeneity of the scene when processing a complete data take. Similarly, products generated from WV data can contain any number of vignettes, potentially up to an entire orbit's worth.\nAll Level-1 products are geo-referenced and time tagged with zero Doppler time at the centre of the swath. Geo-referencing is corrected for the azimuth bi-static bias by taking into account the pulse travel time delta between the centre of the swath and the range of each geo-referenced point.\nA Level-1 product can be one of the following two types:  \nGRD products are further classified by resolution (Full, High or Medium). Note that FR is only available for Stripmap mode.\n_Table 6:_\n**Acq.**\n**Mode** | **Product**\n**Type** | **Resolution**\n**Class** | **Resolution**\n**Rng x Azi [m]** | **Pixel Spacing**\n**Rng x Azi [m]** | **Num Looks**\n**Rng x Azi** | **ENL**\n---|---|---|---|---|---|---\nSM | SLC | - | 1.7x4.3 to\n3.6x4.9 | 1.5x3.6 to\n3.1x4.1 | 1x1 | 1\nGRD | FR | 9x9 | 3.5x3.5 | 2x2 | 3.7\nHR | 23x23 | 10x10 | 6x6 | 29.7\nMR | 84x84 | 40x40 | 22x22 | 398.4\nIW | SLC | - | 2.7x22 to\n3.5x22 | 2.3x14.1 | 1x1 | 1\nGRD | HR | 20x22 | 10x10 | 5x1 | 4.4\nMR | 88x87 | 40x40 | 22x5 | 81.8\nEW | SLC | - | 7.9x43 to\n15x43 | 5.9x19.9 | 1x1 | 1\nGRD | HR | 50x50 | 25x25 | 3x1 | 2.8\nMR | 93x87 | 40x40 | 6x2 | 10.7\nWV | SLC | - | 2.0x4.8\n3.1x4.8 | 1.7x4.1\n2.7x4.1 | 1x1 | 1\nGRD | MR | 52x51 | 25x25 | 13x13 | 123.7"", 'Document: S1 Mission\nSection: S1 Mission > Observation and Production Scenarios > SAR Observation Scenario\nContent:\n**Figure 22 : L2 OCN mask.**\nThe geographical areas where Sentinel-1A Level-1 SLC products are systematically generated have gradually evolved since the opening of the online data access on 3 October 2014 and have been gradually increased.\nA summary of the Sentinel-1 systematic IW production and online data access is provided hereafter:\n* For Sentinel-1A\n* Since 28.07.2015: All IW data over Land and Ice masses are available systematically as SLC\n* Since 14.04.2016: All IW data is available systematically as SLC\n* For Sentinel-1B:\n* Since 26.09.2016 (S1B data access opening): All IW data is available systematically as SLC  \nIn addition, all Sentinel-1A data acquired before 28 July 2015 and not originally processed to SLC (i.e. data acquired outside the pre-defined SLC regional areas) has been backwards processed during 2016 and made available for online data access. As a result, Level-1 SLC products are available for all Sentinel-1 data acquired in IW mode.\nThey follow the evolution maps for the TOPSAR modes SLC production scenarios from 2014.\nIW SLC EVOLUTION MAP\nThe map represents the evolution of the IW SLC production scenario with start sensing from 2014 to 2015. The IW CLS processing scenario is stabilised and can be considered fixed, unless the nominal...\n\nEW SLC evolution map.\nThe map represents the evolution of the EW SLC production scenario from 2014 to 2023.\n\nThe geographical areas where Sentinel-1 IW and EW data is systematically processed to Level-2 OCN products and made available for online data access have also evolved over time. This evolution is summarised in a series of time-tagged maps:\nIW OCN evolution map\nThe map represents the evolution of the IW OCN production scenario from 2015 to 2023.\n\nEW OCN evolution map\nThe map represents the evolution of the EW OCN production scenario from 2015 to 2023.', 'Document: S1 Products\nSection: S1 Products > SAR Products Overview > SAR Naming Convention\nContent:\nThe data delivered is packaged as a [SAFE folder](https://sentiwiki.copernicus.eu/web/safe-format) containing a manifest file in XML format listing general product metadata and subfolders for measurement data, annotations, previews and support files. The content is not the same for each Level product, details are available in each level’s session.\nThis section defines the naming standard for the top-level Sentinel-1 product folder. The top-level Sentinel-1 product folder name is composed of upper-case alphanumeric characters separated by an underscore “_”.\n![](https://sentiwiki.copernicus.eu/__attachments/1678045/Figure-3-Sentinel-1-Product-SAFE-Folder-N...\n_Note: ** The partial polarization products (VV, HH, HV, VH) were only processed on a limited period. Since they are not qualified, they are not expected._\nThe next table defines the naming elements and their range and is used throughout the remainder of this page as the standard for naming Sentinel-1 product folders\nFor assembled products, the product name is updated as follows:\nThe value of each naming element is included in the product, except for:\n* Start date/time which is merged by using the value from the first slice;\n* Stop date/time which is merged by using the value from the last slice; and,\n* Product unique identifier which is merged by recalculating the CRC-16 checksum on the assembled manifest file.  \n_Table 1:_\n**Name Element String** | **Name Element Description** | **Name Element Range**\n---|---|---\nMMM |  Mission Identifier.  The S1A, S1B or S1C options are used for products produced for the Sentinel-1A, the Sentinel-1B or the Sentinel-1C instrument respectively. |  Denotes the satellite and can be “S1A” “S1B” “S1C”', 'Document: S1 Products\nSection: S1 Products > Related Production > **Sentinel-1 ARD Normalised Radar Backscatter (NRB) Product**\nContent:\n**Figure 16: Example of four Normalised Radar Backscatter (NRB) products over the MGRS grid (red) and original SLC footprint (white)**\n**Overview**\nThe Normalised Radar Backscatter (NRB) for Copernicus Sentinel-1 is a potential new S-1 core product whose protype was developed developed by ESA (with University of Jena and ACRI-ST as contractors). It is designed to be high-quality Analysis Ready Data (ARD) compliant with the CEOS ARD for Land (CARD4L) NRB specification.\nThe product aims to complement the existing family of Copernicus Sentinel-1 products, which currently contains Level-1 Single Look Complex (SLC) and Ground Range Detected (GRD) products [[1](https://sentiwiki.copernicus.eu/web/s1-products#Ref_NRB_1)], by providing a flexible and easy to use data source particularly suited for non-expert users and easily exploitable for automated time series analysis in the context of modern cloud-based analysis platforms.\nAccording to the CARD4L definition [[2](https://sentiwiki.copernicus.eu/web/s1-products#Ref_NRB_2)], the products are _“processed to a minimum set of requirements and organized into a form that allows immediate analysis with a minimum of additional user effort. These products would be resampled onto a common geometric grid (for a given product) and would provide baseline data for further interoperability both through time and with other datasets.”_\n**Description**\nThe S1-NRB product contains radiometrically terrain corrected (RTC) gamma nought backscatter (γ0) processed from Single Look Complex (SLC) Level-1A data acquired in Stripmap (SM), Interferometric Wide Swath (IW) or Extra Wide Swath (EW) mode. Each acquired polarization is stored in an individual binary image file. In addition to the actual backscatter data, annotation image datasets (e.g., local incidence angle) are included to enable better interpretation of the backscatter data as well as to convert it to sigma-nought RTC.', 'Document: S1 Products\nSection: S1 Products > Level-1 Products > ETAD Products\nContent:\n**Figure 11: ETAD NetCDF structure. Each product covers a complete Sentinel-1 data-take following the SLC product structure. The correction layers are regularly sampled 2-D grids with approximately 200 m resolution that are grouped at burst level.**\nThe product content, its rationale as well as the application to the SAR products, is detailed in the Product Definition Document. In the Product Format Specification document, only the format, the structure and the naming of the provided data files are specified.\nWith the Sentinel-1 ETAD product that contains the correction data set, any user may thus achieve precise geo-location from a Sentinel-1 standard SLC product. For details and examples on applications see the dedicated ETAD Product Definition Document.\nA [GitHub | Reader for Sentinel-1 Extended Timing Annotation Dataset](https://github.com/s1tools/s1-etad) is available to access the ETAD corrections for the Sentinel-1 SLC product.', 'Document: S1 Processing\nSection: S1 Processing > L1 Algorithms > Algorithm Overview\nContent:\nThe ESA Earth Observation Framework - Copernicus Space Component (EOF-CSC) is responsible for:\n* implementing the Sentinel-1 mission observation scenario\n* X-band data reception\n* generating the operational core ground segment products\n* reacting to emergency orders with rush instrument tasking and processing\n* providing access to Sentinel-1 data\n* ensuring long term mission data archiving\n* monitoring the instrument and mission performance\n* ensuring Sentinel-1 core operational user products meet the expected quality, with necessary calibration and validation activities.  \nWithin the EOF-CSC, the Instrument Processing Facility (IPF) is responsible for the generation of Level-1 and Level-2 products. Level-0 data are ingested into the system where different pre-processing steps are performed. The system then applies the Single Look Complex (SLC) image processing for Doppler centroid estimation and focusing, as well as mode-specific processing for assembling of multi-swath products. The Level-1 post-processing then generates the output Level-1 SLC products and the Level-1 Ground Range Detected (GRD) products. From internally generated Level-1 SLC and GRD products, the Level-2 Ocean (OCN) products are produced.\nTo accomplish this, the IPF is composed of several software components as shown in the following figure.', 'Document: S1 Products\nSection: S1 Products > SAR Products Overview > SAR Naming Convention\nContent:\n**Figure 4: Sentinel-1 Naming standard for all data set files in the Level-0 products**\nFor further details regarding the naming elements refer to the [Level-0 Product Format Specification](https://sentiwiki.copernicus.eu/__attachments/1673968/S1PD.SP.00110.ATSR%20-%20Sentinel-1%20Level-0%20Product%20Format%20Specifications%202023%20-%203.1...\n**Level-1 and Level-2 products**\n\n**Figure 5: Sentinel-1 Naming standard for all data set files in the Level-1 and Level-2 products**\nFor further details regarding the naming elements refer to the [Product Specification](https://sentiwiki.copernicus.eu/__attachments/1673968/S1-RS-MDA-52-7441%20-%20Sentinel-1%20Product%20Specification%202023%20-%203.14.1.pdf?inst-v=0b38ac37-4dd6-44ba-865b-d9854aa106d8) document.\n**ETAD products**\nThere is only one NetCDF file in the ETAD product, which shares the same name as the ETAD SAFE product with the appropriate extension “.nc” but without the product unique ID. The same naming scheme is applied to the XML annotation file with the file extension “.xml”.\nFor further details regarding the naming elements refer to the [ETAD Product Format Specification](https://sentiwiki.copernicus.eu/__attachments/1673968/ETAD-DLR-PS-0014%20-%20Sentinel-1%20Extended%20Timing%20Annotation%20\\(ETAD\\)%20-%20Product%20Specification%20Document%20-%201.8.pdf?inst-v=0b38ac37-4dd6-44ba-865b-d9854aa106d8) document.', 'Document: S1 Processing\nSection: S1 Processing > L1 Algorithms > Single Look Complex (SLC)\nContent:\nLevel-1 Single Look Complex (SLC) products consist of focused SAR data, geo-referenced using orbit and attitude data from the satellite, and provided in slant-range geometry. Slant range is the natural radar range observation coordinate, defined as the line-of-sight from the radar to each reflecting object. The products are in zero-Doppler orientation where each row of pixels represents points along a line perpendicular to the sub-satellite track.\nThe products include a single look in each dimension using the full available signal bandwidth and complex samples (real and imaginary) preserving the phase information. The products have been geo-referenced using the orbit and attitude data from the satellite and have been corrected for azimuth bi-static delay, elevation antenna pattern and range spreading loss. Fine timing corrections are available as separate auxiliary product for advanced users see [ETAD products](https://sentiwiki.copernicus.eu/web/s1-products#S1-Products-ETAD-Products).\nSM SLCs contain one image per polarisation for its single swath. IW, having three sub-swaths, has three images in single polarisation and six images for dual polarisation. EW, having five sub-swaths, has five images for single polarisation and ten images for dual polarisation products.\nFor IW and EW, each sub-swath consists of a series of bursts in azimuth. The individually focused complex burst data are included, in azimuth-time order, into a single sub-swath image, with black-fill demarcation in between.\nFor IW, a focused burst has a duration of ~2.75 seconds and a burst overlap of approximately ~0.4 seconds. For EW, a focused burst has a...\nImages for all bursts in all sub-swaths of IW/EW SLC products are re-sampled to a common pixel spacing grid in range and azimuth. Burst synchronisation is maintained for both IW and EW products to ensure that interferometry between pairs of products acquired multiple repeat periods apart can be performed.', 'Document: S1 Applications\nSection: S1 Applications > Land Monitoring > Agriculture\nContent:\nMonitoring of crop conditions, soil properties and mapping tillage activities, help to assess land use, predict harvests, monitor seasonal changes and assist in implementing policy for sustainable development. Sentinel-1 can also be used for monitoring the changes of agricultural production and productivity of pastures caused by drought and monitoring the decline of land productivity and soil degradation due to excessive cultivation and pasturage and improper irrigation.\nAgricultural maps enable provision of independent and objective estimates of the extent of cultivation in a given country or growing season, which can be used to support efforts to ensure food security in vulnerable areas.\nBoth SLC and GRD products can be used for crop monitoring, depending on the parameter of interest. Typically, if the SAR intensity is preferred, then the GRD is the only product needed. However, if more information are necessary, polarimetric parameters are requested so SLC product should be selected.\nFor both product types, double polarisation shall be selected as cross-polarised VH backscatter is highly sensitive to changes in vegetation densities and structure and polarisation ratio VH/VV is sensitive to vegetation phenology or water content.\n\n**Figure 2: Monitoring of expansion of rubber plantation with Sentinel-2 / Sentinel-1. Contains modified Copernicus data [2015-2017], processed by SIRS.**\n\n**Figure 3: Land cover view, North East of Guyana, 2017. The image was acquired in IW mode, GRD level, VH poalrisation.[Credits:**[Mundialis | Ecosystem...\n\n**Figure 4: Rice fields in Mekong Delta, Vietnam (2020). Multi-temporal image combining three radar acquisitions taken around one month apart to show changes in crop and land conditions over time. [Credits: ESA**[Rice fields, Vietnam](https://www.esa.int/ESA_Multimedia/Images/2020/03/Rice_fields_Vietnam)**]**']","According to the context provided in the Sentinel-1 documentation, 'SLC' in the Sentinel-1 filename convention stands for 'Single Look Complex'.

Specifically, the context states:

[Document 2] S1 Products:
""Sentinel-1 Level-1 products are the baseline products for the majority of users from which higher levels are derived. From data in each acquisition mode, the Instrument Processing Facility (IPF) generates focused Level-1 Single Look Complex (SLC) products and Level-1 Ground Range Detected (GRD) products.""

[Document 9] S1 Processing:
""Level-1 Single Look Complex (SLC) products consist of focused SAR data, geo-referenced using orbit and attitude data from the satellite, and provided in slant-range geometry. Slant range is the natural radar range observation coordinate, defined as the line-of-sight from the radar to each reflecting object. The products are in zero-Doppler orientation where each row of pixels represents points along a line perpendicular to the sub-satellite track.

The products include a single look in each dimension using the full available signal bandwidth and complex samples (real and imaginary) preserving the phase information.""

So in summary, Sentinel-1 SLC products are Level-1 SAR data products that contain focused, geo-referenced radar data in slant-range geometry, with a single look in both range and azimuth dimensions, and preserving the complex (real and imaginary) sample values to retain the phase information. SLC products are a key baseline data product from the Sentinel-1 mission.",SLC stands for Single Look Complex.,0.99999999999,1.0,0.875,0.99700381707876
What is the maximum size (in GB) of a standard Sentinel-1 Interferometric Wide (IW) SLC product?,"['Document: S1 Products\nSection: S1 Products > SAR Products Overview\nContent:\n**Figure 1: Product Slicing**\nEach product slice is a stand-alone product that can be processed independently. Slices are approximately 25 seconds in length for SM and IW and approximately 60 seconds in length for EW. Each GeoTIFF band within a product slice will be no larger than 2 GB. Since a product could contain several bands for swaths and polarisations, the overall product size could be much larger.\nMore details are available in the [Product Slicing Handling](https://sentiwiki.copernicus.eu/web/s1-processing#S1-Processing-Product-Slicing-Handling) section.\nCopernicus Sentinel -1 data products are distributed at three levels of processing:\n* [ETAD](https://sentiwiki.copernicus.eu/web/s1-products#S1-Products-ETAD-Products) - ancillary processing level  \nAll products, with the exception of Extended Timing Annotation Dataset (ETAD), are currently processed directly from the Level-0 product.\nEach mode can potentially generate Level-1 SLC, Level-1 GRD and Level-2 Ocean products. For WV mode, Level-0 products are not currently disseminated to the community. Products are designated based on their acquisition mode, product type and in the case of Level-1 GRD also its resolution. **Figure 2** shows the product family per acquisition mode.\nLevel-1 products can be one of two product types: either Single Look Complex (SLC) or Ground Range Detected (GRD), with latter being available at different resolution levels for different acquisition modes. While the Instrument Processing Facility (IPF) has the capacity to generate various GRD per mode, the current production is limited to:\n* SM: High resolution (with IPF being able to generate Full, High and Medium resolution products)\n* IW: High resolution (with IPF being able to generate High and Medium resolution products)\n* EW: Medium resolution (with IPF being able to generate High and Medium resolution products)\n* WV: No GRD is produced (with IPF being able to generate High and Medium resolution products)', 'Document: S1 Mission\nSection: S1 Mission > Acquisition Modes\nContent:\nCopernicus Sentinel-1 operates in four exclusive acquisition modes:  \nThe SM, IW and EW imaging modes can operate for a maximum duty cycle of 30 min per orbit. The WV mode operates for up to a maximum duty cycle of 75 min per orbit.\nThe Copernicus Sentinel-1C-band SAR instruments supports operation in single polarisation (HH or VV) and dual polarisation (HH+HV or VV+VH), implemented through one transmit chain (switchable to H or V) and two parallel receive chains for H and V polarisation.\nSM, IW and EW products are available in single (HH or VV) or dual polarisation (HH+HV or VV+VH). WV is single polarisation only (HH or VV).\nThe primary mode over land is IW, with VV+VH polarisation: having the Interferometric Wide swath as the one main operational mode satisfies most current service requirements, avoids conflicts and preserves revisit performance, simplifies mission planning, decreases operational costs and builds up a consistent long-term archive.\nOver open ocean, the WV mode, with VV polarisation, is the main operational acquisition mode acquiring vignettes at regular intervals.\nEW mode is used primarily over selected European seas, Arctic and Southern Ocean areas, mainly for sea-ice monitoring services and maritime surveillance, with the capability to cover 400 km wide area at each data-take. SM mode is only used for small islands and on request for extraordinary events such as emergency management.\nFor each mode, it is possible to produce products at SAR Level-0, Level-1 SLC, Level-1 GRD and Level-2 OCN.\n\n**Figure 12: Sentinel-1 Acquisitions Swath Coverage. [Credits: ESA]**\nRead more about the Copernicus Sentinel-1[Observation and Production Scenario](https://sentiwiki.copernicus.eu/web/s1-mission#S1-Mission-Observation-and-Production-Scenarios).', 'Document: S1 Mission\nSection: S1 Mission > Acquisition Modes > Extra Wide Swath\nContent:\nSimilar to the IW mode, the Extra Wide (EW) swath mode employs the TOPSAR technique to acquire data over a wider area than for IW mode using five sub-swaths. EW mode acquires data over a 400 km swath at 20 m by 40 m spatial resolution.\nEW SLC products contain one image per sub-swath and one per polarisation channel, for a total of five (single polarisation) or 10 (dual polarisation) images in an EW product.\nThe EW mode is aimed primarily for use over sea-ice, polar zones and certain maritime areas, in particular for ice, oil spill monitoring and security services. Like IW, EW mode can also be used for interferometry since it shares the same characteristics for burst synchronisation, baseline and Doppler stability.\nThe table below shows the main characteristics of the Extra Wide swath mode.\n_Table 7: Characteristics of Extra Wide swath mode_\n**Characteristics** | **Value**\n---|---\nSwath width | 410 km\nIncidence angle range | 18.9° - 47.0°\nSub-swaths | 5\nAzimuth steering angle | ± 0.8°\nPolarisation options | Dual HH+HV, VV+VH\nSingle HH, VV\nMaximum Noise Equivalent Sigma Zero (NESZ) | -22 dB\nThe table below shows the incidence and off-nadir angles for Extra Wide swath mode beams.\n_Table 8: Angles for Extra Wide sub-swaths_\n**Beam** | **EW1** | **EW2** | **EW3** | **EW4** | **EW5**\n---|---|---|---|---|---\nOff-nadir angles at\nmin orbit altitude [°] | 17.94-26.07 | 26.02-30.66 | 30.61-35.10 | 35.06-38.66 | 38.63-41.20\nIncident angles at\nmin orbit altitude [°] | 20.00-29.20 | 29.15-34.47 | 34.41-39.66 | 39.60-43.89 | 43.86-46.97\nOff-nadir angles at\nmax orbit altitude [°] | 16.36-24.49 | 24.44-29.08 | 29.03-33.52 | 33.48-37.08 | 37.05-39.62\nIncident angles at\nmax orbit altitude [°] | 18.22-27.57 | 27.38-33.42 | 32.65-38.05 | 37.84-42.53 | 42.08-45.16', 'Document: S1 Products\nSection: S1 Products > SAR Products Overview\nContent:\nThe Sentinel-1 C-band radar antenna beam illuminates the ground to the right side of the satellite. Due to satellite motion and the along track (azimuth) beam width of the antenna, each target element only stays inside the illumination beam for a short time. As part of the on-ground processing, the complex echo signals received during this time are added coherently. In this way a long antenna is synthesized, with the synthetic aperture length being equal to the distance the satellite traveled during the integration time. In principle, the along track resolution obtainable with SAR is approximately half the real antenna length. To enhance the radiometric resolution, multi-look azimuth processing can be employed and consequently, the along track resolution will be reduced by a factor equal to the look number. The across track or range resolution is a function of the transmitted radar bandwidth.\nThe fact that the system works coherently from end-to-end means that both the amplitude and the phase relationships between the complex transmitted and received signals are maintained throughout the instruments and the processing chain. This facilitates aperture synthesis as well as multi-pass radar interferometry using pairs of images taken over the same area at different times.\nThe Sentinel-1 Synthetic Aperture Radar (SAR) instrument may acquire data in four exclusive modes:\n* Stripmap (SM). This is a standard SAR stripmap imaging mode where the ground swath is illuminated with a continuous sequence of pulses and with the antenna beam pointing to a fixed azimuth and elevation angle.\n* Interferometric Wide swath (IW). Data is acquired in three swaths using the Terrain Observation with Progressive Scanning SAR (TOPSAR) imaging technique. In IW mode, bursts are synchronised from pass to pass to ensure alignment of interferometric pairs.', 'Document: S1 Products\nSection: S1 Products > Level-1 Products > ETAD Products\nContent:\n**Figure 11: ETAD NetCDF structure. Each product covers a complete Sentinel-1 data-take following the SLC product structure. The correction layers are regularly sampled 2-D grids with approximately 200 m resolution that are grouped at burst level.**\nThe product content, its rationale as well as the application to the SAR products, is detailed in the Product Definition Document. In the Product Format Specification document, only the format, the structure and the naming of the provided data files are specified.\nWith the Sentinel-1 ETAD product that contains the correction data set, any user may thus achieve precise geo-location from a Sentinel-1 standard SLC product. For details and examples on applications see the dedicated ETAD Product Definition Document.\nA [GitHub | Reader for Sentinel-1 Extended Timing Annotation Dataset](https://github.com/s1tools/s1-etad) is available to access the ETAD corrections for the Sentinel-1 SLC product.', 'Document: S1 Mission\nSection: S1 Mission > Acquisition Modes > Interferometric Wide Swath\nContent:\n**Figure 13: TOPSAR Sub-Swath Acquisition. [Credits: ESA]**\nThe azimuth resolution is reduced compared to SM due to the shorter target illumination time of the burst. Using the sweeping azimuth pattern, each target is seen under the same antenna pattern, independently from its azimuth position in the burst image. By shrinking the azimuth antenna pattern, as seen by a target on the ground, scalloping effects on the image can be reduced.\nThe Sentinel-1 C-SAR system is designed to enable TOPS burst synchronization of repeat-pass data-takes supporting the generation of TOPS interferograms and coherence maps. Specifically, for the IW and EW modes, the TOPS burst duration is 0.82 s and 0.54 s (worst case) respectively, with a requirement for achieving a synchronization of...\nIW SLC products contain one image per sub-swath and one per polarisation channel, for a total of three (single polarisation) or six (dual polarisation) images in an IW product.\nEach sub-swath image consists of a series of bursts, where each burst has been processed as a separate SLC image. The individually focused complex burst images are included, in azimuth-time order, into a single sub-swath image with black-fill demarcation in between. There is sufficient overlap between adjacent bursts and between sub-swaths to ensure continuous coverage of the ground as provided in GRD products. The images for all bursts in all sub-swaths are resampled to a common pixel spacing grid in range and azimuth while preserving the phase information.\n\n**Figure 14: IW SLC Bursts and Sub-Swaths**\nAfter burst and sub-swath merging, the full product can be created, as is the case for the GRDH products shown in **Figure 15**. The TOPSAR technique greatly reduces scalloping effects over conventional ScanSAR.', ""Document: S1 Products\nSection: S1 Products > Level-1 Products\nContent:\nSentinel-1 Level-1 products are the baseline products for the majority of users from which higher levels are derived. From data in each acquisition mode, the Instrument Processing Facility (IPF) generates focused Level-1 Single Look Complex (SLC) products and Level-1 Ground Range Detected (GRD) products.\nSAR parameters that vary with the satellite position in orbit, such as azimuth FM rate, Doppler centroid frequency and terrain height, are periodically updated to ensure the homogeneity of the scene when processing a complete data take. Similarly, products generated from WV data can contain any number of vignettes, potentially up to an entire orbit's worth.\nAll Level-1 products are geo-referenced and time tagged with zero Doppler time at the centre of the swath. Geo-referencing is corrected for the azimuth bi-static bias by taking into account the pulse travel time delta between the centre of the swath and the range of each geo-referenced point.\nA Level-1 product can be one of the following two types:  \nGRD products are further classified by resolution (Full, High or Medium). Note that FR is only available for Stripmap mode.\n_Table 6:_\n**Acq.**\n**Mode** | **Product**\n**Type** | **Resolution**\n**Class** | **Resolution**\n**Rng x Azi [m]** | **Pixel Spacing**\n**Rng x Azi [m]** | **Num Looks**\n**Rng x Azi** | **ENL**\n---|---|---|---|---|---|---\nSM | SLC | - | 1.7x4.3 to\n3.6x4.9 | 1.5x3.6 to\n3.1x4.1 | 1x1 | 1\nGRD | FR | 9x9 | 3.5x3.5 | 2x2 | 3.7\nHR | 23x23 | 10x10 | 6x6 | 29.7\nMR | 84x84 | 40x40 | 22x22 | 398.4\nIW | SLC | - | 2.7x22 to\n3.5x22 | 2.3x14.1 | 1x1 | 1\nGRD | HR | 20x22 | 10x10 | 5x1 | 4.4\nMR | 88x87 | 40x40 | 22x5 | 81.8\nEW | SLC | - | 7.9x43 to\n15x43 | 5.9x19.9 | 1x1 | 1\nGRD | HR | 50x50 | 25x25 | 3x1 | 2.8\nMR | 93x87 | 40x40 | 6x2 | 10.7\nWV | SLC | - | 2.0x4.8\n3.1x4.8 | 1.7x4.1\n2.7x4.1 | 1x1 | 1\nGRD | MR | 52x51 | 25x25 | 13x13 | 123.7"", 'Document: S1 Products\nSection: S1 Products > Related Production > **Sentinel-1 Global Backscatter Model (S1GBM)**\nContent:\n**Figure 15: Mapping Earth\'s land surface with C-band Synthetic Aperture Radar (SAR)**\n**Description**\nThe Sentinel-1 Global Backscatter Model (S1GBM) describes the C-band radar cross section of the Earth\'s land surface for the period between 2016 and 2017, generated from 460,000 Copernicus Sentinel-1 IW GRDH (Ground-Range Detected High Resolution) backscatter measurements normalised to the reference incidence angle of 38°. This release of the S1GBM comprises two global mosaics describing the temporal mean of sigma nought backscatter s0(38, t) in VV- and VH-polarisation respectively.\nThe S1GBM supports the testing, design, and verification of upcoming radar sensors, related SAR-processor performance simulations, raw data compression optimisation, and visualisation purposes. It also presents a valuable environmental record for investigating the C-band VV/VH backscatter response over different land covers, and documenting the state of the land surface in 2016 and 2017.\n**Data Set Specifications**\nThe S1GBM VV and VH mosaics are georeferenced to the Equi7Grid and divided into six continental zones (Africa, Asia, Europe, North America, Oceania, South America), which are further divided into square tiles of 100 km extent (""T1""-tiles). The dataset is organised in 12 collections, one for each of the 6 continents and the 2 polarisations. In addition to the original data images, downsampled quicklook-files of same geographic extent are available for all tiles, allowing for a convenient preview of the data. With this setup, the S1GBM consists of 16,071 tiles over 6 continents, for VV and VH each, totalling to a data volume of 2.67 TB.\nThe tiles\' file-format is a LZW-compressed GeoTIFF holding 16-bit integer values, with tagged metadata on encoding and georeference. Compatibility with common geographic information systems, such as QGIS or ArcGIS, and geodata libraries, such as GDAL, is given.', ""Document: S1 Mission\nSection: S1 Mission > SAR Instrument\nContent:\n**Figure 6: Sentinel-1 Spacecraft**\nThe C-SAR instrument is an active phased array antenna providing fast scanning in elevation (to cover the large range of incidence angle and to support ScanSAR operation) and in azimuth (to allow use of TOPS technique to meet the required image performance) with dual-pol capacity.\nIt has an internal calibration scheme, where transmit signals are routed into the receiver to allow monitoring of amplitude/phase to facilitate high radiometric stability.\nSentinel-1's metallised carbon-fibre-reinforced-plastic radiating waveguides ensure good radiometric stability even though these elements are not covered by the internal calibration scheme. The digital chirp generator and selectable receive filter bandwidths allow efficient use of on-board storage considering the ground range resolution dependence on incidence angle.\n_Table 2: The key parameters of the Sentinel-1 C-SAR instrument include:_\n**Characteristics** | **Value**\n---|---\nCentre frequency | 5.405 GHz (corresponding to a wavelength of ~5.55 cm)\nBandwidth | 0-100 MHz (programmable)\nPolarisation | HH+HV, VV+VH, VV, HH\nAntenna size | 12.3 m x 0.821 m\nRF Peak power (sum od all TRMs, at TRM o/p) | 4.368 kW, - 4.075 kW (IW, dual polarisations)\nPulse width | 5-100 µs (programmable)\nTransmit duty cycle | Max 12%, SM 8.5%, IW 9%, EW 5%, WV 0.8%\nReceiver noise figure at module input | 3.2 dB\nPRF (Pulse Repetition Frequency) | 1 000 - 3 000 Hz (programmable)\nADC sampling frequency | 300 MHz (real sampling) (digital down-sampling after A/D conversion)\nSampling | 10 bits\nData compression | FDBAQ (Flexible Dynamic Block Adaptive Quantization)\nInstrument Operation | Up to 25 min per orbit continuously in any of the imaging modes and for the rest of the orbit in Wave mode\nTotal instrument mass (including antenna) | 945 kg\nCSAR DC power | 3870 W (Interferometric Wide-swath Mode, two polarisations)\nCSAR data storage capacity | 1410 Gb (End-of-Life)"", 'Document: S1 Mission\nSection: S1 Mission > Observation and Production Scenarios > SAR Observation Scenario\nContent:\n**Figure 22 : L2 OCN mask.**\nThe geographical areas where Sentinel-1A Level-1 SLC products are systematically generated have gradually evolved since the opening of the online data access on 3 October 2014 and have been gradually increased.\nA summary of the Sentinel-1 systematic IW production and online data access is provided hereafter:\n* For Sentinel-1A\n* Since 28.07.2015: All IW data over Land and Ice masses are available systematically as SLC\n* Since 14.04.2016: All IW data is available systematically as SLC\n* For Sentinel-1B:\n* Since 26.09.2016 (S1B data access opening): All IW data is available systematically as SLC  \nIn addition, all Sentinel-1A data acquired before 28 July 2015 and not originally processed to SLC (i.e. data acquired outside the pre-defined SLC regional areas) has been backwards processed during 2016 and made available for online data access. As a result, Level-1 SLC products are available for all Sentinel-1 data acquired in IW mode.\nThey follow the evolution maps for the TOPSAR modes SLC production scenarios from 2014.\nIW SLC EVOLUTION MAP\nThe map represents the evolution of the IW SLC production scenario with start sensing from 2014 to 2015. The IW CLS processing scenario is stabilised and can be considered fixed, unless the nominal...\n\nEW SLC evolution map.\nThe map represents the evolution of the EW SLC production scenario from 2014 to 2023.\n\nThe geographical areas where Sentinel-1 IW and EW data is systematically processed to Level-2 OCN products and made available for online data access have also evolved over time. This evolution is summarised in a series of time-tagged maps:\nIW OCN evolution map\nThe map represents the evolution of the IW OCN production scenario from 2015 to 2023.\n\nEW OCN evolution map\nThe map represents the evolution of the EW OCN production scenario from 2015 to 2023.']","According to the information provided in the context, the maximum size of a standard Sentinel-1 Interferometric Wide (IW) SLC product is as follows:

The Sentinel-1 products are sliced into smaller segments during processing, where each product slice is a stand-alone product that can be processed independently. For the IW mode, these slices are approximately 25 seconds in length.

The context states that ""Each GeoTIFF band within a product slice will be no larger than 2 GB. Since a product could contain several bands for swaths and polarisations, the overall product size could be much larger.""

Therefore, the maximum size of a standard Sentinel-1 IW SLC product is not explicitly stated, but it can be inferred that the size would depend on the number of bands and polarizations included in the product. However, each individual GeoTIFF band within the product slice will not exceed 2 GB in size.

In summary, the maximum size of a Sentinel-1 IW SLC product is not definitively specified, but the individual GeoTIFF bands within the product are limited to 2 GB each. The overall product size could be larger depending on the number of bands and polarizations included.",A standard Sentinel-1 IW SLC product is approximately 7-8 GB.,0.7853741496486443,0.0,1.0,0.0
What is the mean local solar time at the descending node (LTDN) for Sentinel-2?,"[""Document: S2 Mission\nSection: S2 Mission > Overview of Sentinel-2 Mission > Orbit\nContent:\nThe Sentinel-2 mission orbit is sun-synchronous. Sun-synchronous orbits are used to ensure the angle of sunlight upon the Earth's surface is consistently maintained. Apart from small seasonal variations, anchoring of the satellites orbit to the angle of the sun minimises the potential impact of shadows and levels of illumination on the ground. This ensures consistency over time and is critical in assessing time-series data.\nSentinel-2 satellites occupy the same 10-days cycle, sun-synchronous orbit, having a 786 km mean altitude, a 98.62° inclination, and a 10:30 (am) Mean Local Solar Time (MLST) at the descending node (nominal...\n_Table 1: Summary of useful orbital information for Sentinel-2 satellites:_\n**Altitude** | **Inclination** | **Period** | **Cycle** | **Ground-track deviation** | **Local Time at Descending Node**\n---|---|---|---|---|---\n786 km | 98.62 deg | 100.6 min | 10 days | +- 2 km | 10:30 hours\nOn this orbit, Sentinel-2B and Sentinel-2C are separated by 180°. During the extension campaign, Sentinel-2A is located 36° away from Sentinel-2B, as shown in **Figure 3**.\n\n**Figure 3: Distribution of Sentinel-2 satellites over the mission orbit**\nThe KML data file informing on the position of the Sentinel-2 satellites Relative Orbits for a full Cycle (143 Orbits) with a time step of 10 seconds is available:"", 'Document: S2 Mission\nSection: S2 Mission > Overview of Sentinel-2 Mission > Satellite Description\nContent:\nThe two Sentinel-2 satellites in the nominal configuration operate simultaneously, phased at 180° to each other, in a sun-synchronous orbit at a mean altitude of 786 km. During the extension campaign, Sentinel-2A is located 36° away from Sentinel-2B. The position of each Sentinel-2 satellite in its orbit is measured by a dual-frequency Global Navigation Satellite System (GNSS) receiver. Orbital accuracy is maintained by a dedicated propulsion system.\nThe satellite lifespan is 7.25 years, which includes a 3 month in-orbit commissioning phase. Batteries and propellants have...\nThe Sentinel-2 satellite system was developed by an industrial consortium led by Astrium GmbH (Germany). Astrium SAS (France) is responsible for the MultiSpectral Instrument (MSI).\nThe [MSI](https://sentiwiki.copernicus.eu/web/s2-mission#S2-Mission-MSI-Instrument) works passively, by collecting sunlight reflected from the Earth. New data is acquired by the instrument as the satellite moves along its orbital path. The incoming light beam is split via a beam-splitter and focused onto two separate focal plane assemblies within the instrument; one for Visible and Near-Infra-Red (VNIR) bands and the other one for Short Wave Infra-Red (SWIR) bands. The spectral separation of each band into individual wavelengths is accomplished by stripe filters mounted on top of the detectors.', 'Document: S2 Mission\nSection: S2 Mission > Overview of Sentinel-2 Mission > Geographical Coverage\nContent:\nThe Sentinel-2 mission will provide systematic coverage over the following areas:\n* all continental land surfaces (including inland waters) between latitudes 56° South and 82.8° North\n* all coastal waters up to 20 km from the shore\n* all islands greater than 100 km2\n* all EU islands\n* the Mediterranean Sea\n* all closed seas (e.g. Caspian Sea).  \nIn addition, the Sentinel-2 observation scenario includes observations following member states or Copernicus Services requests (e.g. Antarctica, Baffin Bay).\n**Figures 4** illustrates the coverage foreseen for the baseline scenario of MSI acquisitions (two satellites in orbit).\n![Revisit scenario ](https://sentiwiki.copernicus.eu/__attachments/1687033/Revisit%20scenario%202025...\n**Figure 4: Coverage and revisit time for the baseline scenario of Sentinel-2 MSI acquisitions.**\nIn addition, the [Sentinel-2 extension campaign](https://sentinels.copernicus.eu/web/sentinel/-/sentinel-2a-extended-campaign-starting-march-13-2025) complements the nominal constellation operations, enhancing the revisit frequency over Europe and tropical regions of Africa and South America, frequently impacted by high cloud cover (**Figure 5**).\n![](https://sentiwiki.copernicus.eu/__attachments/1687033/figure-5...\n**Figure 5: Number of revisits for Sentinel-2A/B/C MSI in 20 days period**\nWith nominal two-satellites (Sentinel-2B/2C) operations configuration, all regular areas, indicated in green in **Figure 4** , will be revisited every five days under the same viewing conditions (i.e. viewing angles). The [Sentinel-2A extension campaign](https://sentinels.copernicus.eu/web/sentinel/-/sentinel-2a-extended-campaign-starting-march-13-2025) brings an improved revisit frequency for some areas. However, due to overlap between swaths from adjacent orbits, the revisit frequency is increased with different viewing conditions, as shown in **Figure 6**.\n![](https://sentiwiki.copernicus.eu/__attachments/1687033/figure-6...', ""Document: S2 Mission\nSection: S2 Mission > Overview of Sentinel-2 Mission > Geographical Coverage\nContent:\n![](https://sentiwiki.copernicus.eu/__attachments/1687033/figure-6...\n**Figure 6: Number of acquisitions for Sentinel-2A/B/C MSI in 20 days period**\nDuring the [Sentinel-2A extension campaign](https://sentinels.copernicus.eu/web/sentinel/-/sentinel-2a-extended-campaign-starting-march-13-2025), Sentinel-2A is located 36° away from Sentinel-2B, ensuring that Sentinel-2A and Sentinel-2B are acquiring neighbouring relative orbits, with a 10 min time difference, generating a 'virtual' extended swath (**Figure 7**).\n![](https://sentiwiki.copernicus.eu/__attachments/1687033/image-20250425-102415...\n**Figure 7: The generated pseudo ‘extended’ swath acquisition (A and B with a 10 min acquisition gap)**\nPlease refer to the [Sentinel-2 descending orbits](https://sentiwiki.copernicus.eu/__attachments/1673423/Sentinel-2%20Descending%20Orbits%20shape%20file.zip?inst-v=0b38ac37-4dd6-44ba-865b-d9854aa106d8)."", 'Document: S2 Mission\nSection: S2 Mission > Overview of Sentinel-2 Mission\nContent:\nSentinel-2 is a European wide-swath, high-resolution, multi-spectral imaging mission. The full mission specification of the twin satellites flying in the same orbit but phased at 180°, is designed to give a high revisit frequency of 5 days at the Equator.\nEach of the satellites in the Sentinel-2 mission carries a single payload: the optical [Multi-Spectral Instrument](https://sentiwiki.copernicus.eu/web/s2-mission#S2-Mission-MSI-Instrument) (MSI) that samples 13 spectral bands: four bands at 10 m, six bands at 20 m and three bands at 60 m spatial resolution. The orbital swath width is 290 km.\n\n**Figure 1: The Twin-Satellite Sentinel-2 Orbital Configuration [Credits: Astrium GmbH]**\nThe Sentinel-2 twin satellites carry on the legacy of [SPOT](https://earth.esa.int/eogateway/missions/spot) and [LANDSAT](https://landsat.gsfc.nasa.gov/) by continuing to provide similar types of image data and contributing to ongoing multispectral observations. These satellites are used to support a variety of services and applications offered by [Copernicus](https://www.copernicus.eu/en), including land management, agriculture, forestry, disaster control, humanitarian relief operations, risk mapping, and security concerns.', 'Document: S2 Mission\nSection: S2 Mission > Acquisition Resolutions > Spectral Resolution\nContent:\nSpectral resolution is defined as a measure of the ability of the instrument to distinguish features in the electromagnetic spectrum.\nThe 13 spectral bands of Sentinel-2 range from the Visible and Near Infra-Red (VNIR) to the Short-Wave Infra-Red (SWIR):\n* 4 x 10 metre Bands: the three classical RGB bands (Blue (~493nm), Green (560nm), and Red (~665nm)) and a Near Infra-Red (~833nm) band;\n* 6 x 20 metre Bands: 4 narrow Bands in the VNIR vegetation red edge spectral domain (~704nm,~740nm, ~783nm and ~865nm) and 2 wider SWIR bands (~1610nm and ~2190nm) for applications such as snow/ice/cloud detection, or vegetation moisture stress assessment;\n* 3 x 60 metre Bands mainly focused on cloud screening and atmospheric correction (~443nm for aerosols and ~945nm for water vapour) and cirrus detection (~1374nm).  \n**NOTE:** The Bandwidth (nm) in the Tables below is the values measured at Full Width Half Maximum (FWHM). The equivalent wavelength is the barycentre of the spectral response function, not considering the solar irradiance:', 'Document: S2 Products\nSection: S2 Products > MSI Products Overview > Naming Convention > Compact Naming Convention\nContent:\nThe compact naming convention of Sentinel-2 User products is arranged as follows:\nMMM_MSIXXX_YYYYMMDDHHMMSS_Nxxyy_ROOO_Txxxxx_<Product Discriminator>.SAFE\nThe products contain two dates.\n* The first date (YYYYMMDDHHMMSS) is the datatake start sensing time.\n* The second date is the ""<Product Discriminator>"" field, which is 15 characters in length, and is used to distinguish between different end user products from the same datatake. Depending on the instance, the time in this field can be earlier or slightly later than the datatake sensing time.  \nThe other components of the filename are:\n* MMM: is the mission ID(S2A/S2B)\n* MSIXXX: MSIL1C denotes the Level-1C product level/ MSIL2A denotes the Level-2A product level\n* YYYYMMDDHHMMSS: the datatake sensing start time\n* Nxxyy: the Processing Baseline number (e.g. N0204)\n* ROOO: Relative Orbit number (R001 - R143)\n* Txxxxx: Tile Number field\n* SAFE: Product Format (Standard Archive Format for Europe)  \nThus, the following filename:\nS2A_MSIL1C_20170105T013442_N0204_R031_T53NMJ_20170105T013443.SAFE\nIdentifies a Level-1C product acquired by Sentinel-2A on the 5th of January, 2017 at 1:34:42 AM. It was acquired over Tile 53NMJ(1) during Relative Orbit 031, and processed with Processing Baseline 02.04.\nIn addition to the above changes, a TCI (True Colour Image) in JPEG2000 format is included within...\n_(1) The Tile Naming Convention is described in the \'Tiles and UTM Tiled Grid\' section of the [PSD]. Download the_[ _Sentinel-2 tiling grid kml_](https://sentiwiki.copernicus.eu/__attachments/1692737/S2A_OPER_GIP_TILPAR_MPC__20151209T095117_V20150622T000000_21000101T000000_B00.zip?inst-v=0b38ac37-4dd6-44ba-865b-d9854aa106d8) _. (in KML format)._\nOld format Naming Convention for Sentinel-2 Level-1C User products generated before December 6th, 2016\nThe top-level Sentinel-2 product folder name is composed of upper-case alphanumeric characters separated by an underscore (_).', 'Document: S2 Mission\nSection: S2 Mission > Observation and Production Scenarios > Production Scenario\nContent:\nThe observation and downlink strategy for Sentinel-2 relies on 3 types of data downlink:\n* The MSI data may be buffered on-board to allow a repeated downlink by playback at a later stage (nominal First-In First-Out (FIFO) mode);\n* The MSI data recorded on-board may be prioritised as Near-Real-Time (NRT) data into the playback queue so as to ensure it is downlinked as early as possible, rather than following the regular FIFO nominal approach;\n* A Real-Time (RT) downlink may be commanded so as to forward the MSI real-time 490 Mbps data stream directly to the transmission system.  \nThe production strategy is similar as for Sentinel-1. For Sentinel 2 orthorectified products, differences may occur for reprocessing in the following...\n* Availability of new auxiliary data (e.g. reference maps or Digital Elevation Models);\n* Improvements in the processing baseline or format changes (e.g. geometric refinement).  \nAll data acquired by the MSI from the Sentinel-2 constellation are systematically processed up to Level-2A. The systematic and operational global generation of Level-2A products has been implemented since 13 December 2018.', 'Document: S2 Applications\nSection: S2 Applications > Overview of Sentinel-2 Applications\nContent:\n[Sentinel-2](https://sentiwiki.copernicus.eu/web/sentinel-2) is a European mission equipped with a wide-swath Multispectral Instrument (MSI) to ensure a high-revisit frequency and provide high-resolution imagery to support the Copernicus programme.\nSentinel-2 data products are made available systematically and free of charge to all users, providing data for the following priority service areas.\nTo start using the data visit [CDSE browser ](https://browser.dataspace.copernicus.eu/?zoom=5&lat=50.16282&lng=20.78613&themeId=DEFAULT-THEME&visualizationUrl=U2FsdGVkX1%2B4%2BV%2FOaiXMG%2FrmYxraCDY%2F...', 'Document: S2 Products\nSection: S2 Products > MSI Products Overview\nContent:\nThe continuous acquisition of Sentinel-2 image data in a given MSI mode is called a ""datatake"". The maximum length of an imaging datatake is 15,000 km (e.g. continuous observation from northern Russia to southern Africa). All products contain granules/tiles from a single datatake. A datatake is presented inside a product as a set of one or more datastrips (corresponding to acquisition segments downlinked to different ground stations, please see **Figure 1** below).\n\n**Figure 1: Sentinel-2 Datatake split in three Datastrips. [Credits: Exprivia]**\nThe products are elementary granules of fixed size, within a single orbit. A granule is the minimum indivisible partition of a product (containing all possible spectral bands).\nFor Level-1B granules are small images in sensor geometry sensed by each of the twelve MSI detectors and are 23 km x 25 Km large.\nFor Level-1C and Level-2A, the granules, also called tiles, are 110 km x 110 km ortho-images projected onto the Universal Transversal Mercator (UTM) spatial reference system, which divides Earth into 60 longitudinal zones. Each UTM zone has a vertical width of 6° of longitude and horizontal width of 8° of latitude (see **Figure 2**). Earth is subdivided on a predefined set of tiles, defined in UTM/WGS84 projection and using a 100 km step. However, each tile has a surface of 110 km x 110 km in order to provide large overlap with the neighbouring.\n\n**Figure 2: Level-1C product tiling**\nTiles can be fully or partially covered by image data. Partially covered tiles correspond to those at the edge or top/bottom of the Datastrip.\nDownload is available here: [Sentinel-2 tiling grid kml](https://sentiwiki.copernicus.eu/__attachments/1692737/S2A_OPER_GIP_TILPAR_MPC__20151209T095117_V20150622T000000_21000101T000000_B00.zip?inst-v=0b38ac37-4dd6-44ba-865b-d9854aa106d8).']","According to the information provided in [Document 1], the Sentinel-2 satellites occupy a sun-synchronous orbit with a mean local solar time (MLST) of 10:30 hours at the descending node.

Specifically, the context states:

""Sentinel-2 satellites occupy the same 10-days cycle, sun-synchronous orbit, having a 786 km mean altitude, a 98.62° inclination, and a 10:30 (am) Mean Local Solar Time (MLST) at the descending node (nominal...""

So the mean local solar time at the descending node for the Sentinel-2 mission is 10:30 hours.",The LTDN for Sentinel-2 is 10:30 AM.,0.9999999999,1.0,1.0,0.9141779549573039
